"12, thg 9 2010","2010-09-12"
"THÁNG 12 14 1992","1992-12-14"
"8 THG 6 1999","1999-06-08"
"11.03.00","2000-03-11"
"16/06/1979","1979-06-16"
"1 THÁNG 2, 1988","1988-02-01"
"19 thg 6 1991","1991-06-19"
"12 tháng 1, 1981","1981-01-12"
"30 thg 9 2015","2015-09-30"
"8 thg 7, 1996","1996-07-08"
"27 thg 6 2017","2017-06-27"
"THÁNG 3 2, 1998","1998-03-02"
"Thứ Tư, ngày 21 tháng 3 năm 1973","1973-03-21"
"13 01 07","2007-01-13"
"19 tháng 7 1989","1989-07-19"
"18 thg 5, 1971","1971-05-18"
"Ngày 12 tháng 06 năm 2005","2005-06-12"
"31 thg 7, 1988","1988-07-31"
"30 tháng 3, 2017","2017-03-30"
"tháng 3 3 1985","1985-03-03"
"05.09.87","1987-09-05"
"17 thg 7 2005","2005-07-17"
"THỨ HAI, NGÀY 04 THÁNG 1 NĂM 2010","2010-01-04"
"THÁNG 10 27 1972","1972-10-27"
"THỨ BA, NGÀY 02 THÁNG 1 NĂM 1990","1990-01-02"
"9 tháng 8, 2006","2006-08-09"
"22, THG 3 1976","1976-03-22"
"16 tháng 6 1990","1990-06-16"
"THÁNG 5 24, 1988","1988-05-24"
"18 tháng 11, 2005","2005-11-18"
"Thứ Ba, ngày 25 tháng 11 năm 1975","1975-11-25"
"21/05/1999","1999-05-21"
"6 tháng 8 2000","2000-08-06"
"11 thg 10 2000","2000-10-11"
"12/07/2006","2006-07-12"
"thứ ba, ngày 28 tháng 7 năm 1970","1970-07-28"
"NGÀY 09 THÁNG 02 NĂM 1987","1987-02-09"
"26 tháng 9 1996","1996-09-26"
"28.06.02","2002-06-28"
"Thứ Bảy, ngày 28 tháng 12 năm 2013","2013-12-28"
"15/04/2010","2010-04-15"
"Ngày 14 tháng 02 năm 1983","1983-02-14"
"10 THÁNG 4 1980","1980-04-10"
"9 THÁNG 5 1986","1986-05-09"
"tháng 6 6, 2011","2011-06-06"
"10 THÁNG 3 1997","1997-03-10"
"13 tháng 7 1974","1974-07-13"
"29.05.13","2013-05-29"
"12 tháng 7 1988","1988-07-12"
"tháng 10 10 1990","1990-10-10"
"tháng 4 30 1994","1994-04-30"
"7 thg 4, 1982","1982-04-07"
"16 thg 5, 1976","1976-05-16"
"20 tháng 3 1978","1978-03-20"
"13 thg 10 1971","1971-10-13"
"05/04/1994","1994-04-05"
"THÁNG 9 17, 1980","1980-09-17"
"30 THG 7 1986","1986-07-30"
"18 tháng 8, 1974","1974-08-18"
"2 THÁNG 11 1974","1974-11-02"
"Thứ Năm, ngày 08 tháng 9 năm 1988","1988-09-08"
"tháng 7 6 1988","1988-07-06"
"6 tháng 5 2004","2004-05-06"
"26 THG 6, 1983","1983-06-26"
"05.07.93","1993-07-05"
"6 tháng 3 2013","2013-03-06"
"21 THG 10 2015","2015-10-21"
"15 05 04","2004-05-15"
"16/07/1976","1976-07-16"
"19 THG 4 1998","1998-04-19"
"14 THÁNG 7 2018","2018-07-14"
"12 09 12","2012-09-12"
"17 THÁNG 11, 1976","1976-11-17"
"10 thg 6, 1984","1984-06-10"
"13 tháng 2, 1998","1998-02-13"
"14 tháng 7 2007","2007-07-14"
"10/09/2006","2006-09-10"
"31 thg 10, 1999","1999-10-31"
"30.06.76","1976-06-30"
"20 03 84","1984-03-20"
"tháng 11 7, 2012","2012-11-07"
"THỨ NĂM, NGÀY 27 THÁNG 1 NĂM 2011","2011-01-27"
"16, THG 11 1993","1993-11-16"
"8 tháng 1, 1982","1982-01-08"
"02, thg 3 1997","1997-03-02"
"31 tháng 10 1981","1981-10-31"
"29.12.86","1986-12-29"
"12 tháng 2 1981","1981-02-12"
"24/09/1981","1981-09-24"
"17 thg 3 2006","2006-03-17"
"03/04/1982","1982-04-03"
"22 thg 12 2003","2003-12-22"
"tháng 5 5, 2012","2012-05-05"
"7 THÁNG 10, 2007","2007-10-07"
"29 thg 8, 2012","2012-08-29"
"15 tháng 4 1988","1988-04-15"
"5 thg 6 2014","2014-06-05"
"10 tháng 5 1980","1980-05-10"
"20 THÁNG 2 1993","1993-02-20"
"12 tháng 8 2007","2007-08-12"
"31 thg 8, 1998","1998-08-31"
"09.08.01","2001-08-09"
"tháng 11 26 1980","1980-11-26"
"7 tháng 3 2010","2010-03-07"
"15 tháng 12 1978","1978-12-15"
"THỨ SÁU, NGÀY 24 THÁNG 12 NĂM 2004","2004-12-24"
"2 thg 4 1990","1990-04-02"
"23 THÁNG 7, 1971","1971-07-23"
"29, thg 4 1985","1985-04-29"
"08 THG 5 2004","2004-05-08"
"30 07 00","2000-07-30"
"27.10.13","2013-10-27"
"20 THÁNG 1 1978","1978-01-20"
"THỨ HAI, NGÀY 05 THÁNG 6 NĂM 1972","1972-06-05"
"24 tháng 2 1981","1981-02-24"
"22.03.73","1973-03-22"
"27/06/1993","1993-06-27"
"22 07 86","1986-07-22"
"tháng 1 22 1987","1987-01-22"
"01/12/1990","1990-12-01"
"28 thg 9, 2003","2003-09-28"
"20 tháng 11 1997","1997-11-20"
"17.05.71","1971-05-17"
"26 thg 3, 1977","1977-03-26"
"14 thg 3 2015","2015-03-14"
"tháng 1 14, 2008","2008-01-14"
"19 thg 11, 1987","1987-11-19"
"tháng 1 23, 1983","1983-01-23"
"Thứ Hai, ngày 17 tháng 11 năm 2003","2003-11-17"
"Thứ Năm, ngày 27 tháng 8 năm 2009","2009-08-27"
"15, thg 8 1990","1990-08-15"
"18 THG 7, 1980","1980-07-18"
"25 thg 2 1975","1975-02-25"
"29 thg 7 1980","1980-07-29"
"THỨ NĂM, NGÀY 15 THÁNG 8 NĂM 1991","1991-08-15"
"tháng 1 27 1971","1971-01-27"
"11 thg 2 2017","2017-02-11"
"28 THÁNG 7 1992","1992-07-28"
"4 thg 12, 1994","1994-12-04"
"ngày 03 tháng 09 năm 2006","2006-09-03"
"Ngày 15 tháng 10 năm 2016","2016-10-15"
"20, THG 6 1990","1990-06-20"
"tháng 2 22, 1985","1985-02-22"
"12 tháng 5 2018","2018-05-12"
"tháng 9 9 1975","1975-09-09"
"12/08/1974","1974-08-12"
"Thứ Ba, ngày 15 tháng 8 năm 1972","1972-08-15"
"4 thg 5, 2012","2012-05-04"
"18/10/2014","2014-10-18"
"29 tháng 7, 2014","2014-07-29"
"15 thg 10 2013","2013-10-15"
"tháng 5 14 1973","1973-05-14"
"27 09 08","2008-09-27"
"23 11 98","1998-11-23"
"30/04/1981","1981-04-30"
"31 tháng 7 2017","2017-07-31"
"01.11.79","1979-11-01"
"tháng 5 13 1978","1978-05-13"
"12 THG 3, 1990","1990-03-12"
"thứ năm, ngày 13 tháng 1 năm 2005","2005-01-13"
"24/08/1978","1978-08-24"
"13 thg 5, 1994","1994-05-13"
"3 thg 1 2007","2007-01-03"
"tháng 12 5 1983","1983-12-05"
"25 THG 3 1985","1985-03-25"
"7 THG 12, 2002","2002-12-07"
"16 tháng 10, 2016","2016-10-16"
"3 tháng 11, 2004","2004-11-03"
"12/11/2001","2001-11-12"
"22 tháng 1 1985","1985-01-22"
"22 THG 2 2017","2017-02-22"
"17, THG 12 1972","1972-12-17"
"Thứ Hai, ngày 18 tháng 3 năm 1974","1974-03-18"
"ngày 12 tháng 07 năm 1991","1991-07-12"
"02, thg 9 1999","1999-09-02"
"12 thg 4, 1991","1991-04-12"
"22 10 80","1980-10-22"
"17, thg 5 1977","1977-05-17"
"11 05 02","2002-05-11"
"tháng 2 11 2011","2011-02-11"
"Ngày 01 tháng 02 năm 1974","1974-02-01"
"19 THÁNG 7 1982","1982-07-19"
"13/05/1992","1992-05-13"
"12 tháng 10 1974","1974-10-12"
"15 THG 7, 2008","2008-07-15"
"21.11.84","1984-11-21"
"15 thg 6, 1999","1999-06-15"
"24/01/1977","1977-01-24"
"07, thg 3 1991","1991-03-07"
"16/01/1978","1978-01-16"
"24 thg 12 2017","2017-12-24"
"tháng 5 25 2014","2014-05-25"
"15 04 99","1999-04-15"
"09, THG 5 1989","1989-05-09"
"NGÀY 13 THÁNG 06 NĂM 1998","1998-06-13"
"13.08.02","2002-08-13"
"15 thg 12, 1995","1995-12-15"
"10 thg 8 1970","1970-08-10"
"THỨ TƯ, NGÀY 08 THÁNG 4 NĂM 2009","2009-04-08"
"30, THG 9 1974","1974-09-30"
"05 thg 5 1973","1973-05-05"
"8 THÁNG 12, 1978","1978-12-08"
"14.03.81","1981-03-14"
"15 thg 7 1997","1997-07-15"
"tháng 1 10 2016","2016-01-10"
"22 tháng 11, 1996","1996-11-22"
"1 THG 7 2008","2008-07-01"
"3 THG 2 1982","1982-02-03"
"26, thg 11 2005","2005-11-26"
"27/04/1976","1976-04-27"
"6 tháng 6 1999","1999-06-06"
"9 thg 8, 1993","1993-08-09"
"tháng 11 3 1976","1976-11-03"
"8 tháng 11 1983","1983-11-08"
"Ngày 22 tháng 07 năm 1983","1983-07-22"
"Ngày 05 tháng 02 năm 1985","1985-02-05"
"08.02.01","2001-02-08"
"16 thg 1, 1971","1971-01-16"
"tháng 8 23, 2010","2010-08-23"
"14 03 00","2000-03-14"
"tháng 10 5 2003","2003-10-05"
"28 tháng 6, 1997","1997-06-28"
"10.02.77","1977-02-10"
"24 THÁNG 10 1978","1978-10-24"
"Ngày 03 tháng 12 năm 1980","1980-12-03"
"5 11 88","1988-11-05"
"28 THÁNG 7, 1999","1999-07-28"
"26 tháng 2 1994","1994-02-26"
"6 08 15","2015-08-06"
"thứ tư, ngày 20 tháng 12 năm 2017","2017-12-20"
"Thứ Tư, ngày 07 tháng 6 năm 2000","2000-06-07"
"3 tháng 7 2002","2002-07-03"
"04.02.96","1996-02-04"
"11 THÁNG 8, 2013","2013-08-11"
"17 tháng 9 1991","1991-09-17"
"18.06.05","2005-06-18"
"01 THG 3 2018","2018-03-01"
"26 thg 10, 2012","2012-10-26"
"THỨ BẢY, NGÀY 30 THÁNG 12 NĂM 2006","2006-12-30"
"THÁNG 2 2, 1980","1980-02-02"
"9 tháng 7 2014","2014-07-09"
"17 thg 9 2011","2011-09-17"
"22 tháng 8 1980","1980-08-22"
"tháng 2 12, 1991","1991-02-12"
"05 thg 3 1974","1974-03-05"
"18 01 78","1978-01-18"
"Ngày 24 tháng 11 năm 1989","1989-11-24"
"08, THG 3 1991","1991-03-08"
"11/05/1999","1999-05-11"
"26 06 80","1980-06-26"
"13 tháng 12, 2016","2016-12-13"
"10 thg 7, 2015","2015-07-10"
"16.06.04","2004-06-16"
"03, thg 9 1995","1995-09-03"
"tháng 12 16, 1984","1984-12-16"
"4 thg 8 2015","2015-08-04"
"10, THG 7 1984","1984-07-10"
"tháng 12 19 1976","1976-12-19"
"17 THG 6 2006","2006-06-17"
"12 thg 11, 2003","2003-11-12"
"5 tháng 9 1980","1980-09-05"
"Thứ Năm, ngày 28 tháng 8 năm 1975","1975-08-28"
"05/12/2011","2011-12-05"
"03 thg 1 1997","1997-01-03"
"23 thg 2, 2011","2011-02-23"
"18 thg 7 2015","2015-07-18"
"14 12 72","1972-12-14"
"26 tháng 2 2004","2004-02-26"
"5 thg 12 1983","1983-12-05"
"thứ ba, ngày 02 tháng 3 năm 2010","2010-03-02"
"14 tháng 5, 2005","2005-05-14"
"tháng 3 21, 1999","1999-03-21"
"09/03/1995","1995-03-09"
"11 THG 10, 2008","2008-10-11"
"26 thg 3 1995","1995-03-26"
"ngày 04 tháng 04 năm 2011","2011-04-04"
"22 thg 1 1990","1990-01-22"
"4 thg 5, 1971","1971-05-04"
"16 tháng 4, 1979","1979-04-16"
"26.02.13","2013-02-26"
"16/05/1975","1975-05-16"
"1 tháng 12 1999","1999-12-01"
"20 thg 12 1980","1980-12-20"
"Chủ Nhật, ngày 20 tháng 8 năm 1972","1972-08-20"
"tháng 9 28 2012","2012-09-28"
"Chủ Nhật, ngày 31 tháng 1 năm 2016","2016-01-31"
"NGÀY 13 THÁNG 03 NĂM 1986","1986-03-13"
"Ngày 20 tháng 04 năm 2007","2007-04-20"
"06/08/1970","1970-08-06"
"29, THG 10 2014","2014-10-29"
"17, thg 1 1972","1972-01-17"
"THỨ NĂM, NGÀY 21 THÁNG 6 NĂM 2018","2018-06-21"
"21 THG 7, 1984","1984-07-21"
"21.05.88","1988-05-21"
"7 thg 2, 2003","2003-02-07"
"Ngày 22 tháng 09 năm 1986","1986-09-22"
"13 tháng 12 1985","1985-12-13"
"19 thg 2 2015","2015-02-19"
"tháng 4 9, 1983","1983-04-09"
"4 09 08","2008-09-04"
"14 thg 5 1990","1990-05-14"
"19.01.81","1981-01-19"
"ngày 24 tháng 05 năm 2007","2007-05-24"
"07.03.71","1971-03-07"
"Ngày 20 tháng 11 năm 1972","1972-11-20"
"05, thg 4 2011","2011-04-05"
"2 06 95","1995-06-02"
"6 tháng 9 2015","2015-09-06"
"30/05/1996","1996-05-30"
"4 05 18","2018-05-04"
"24 thg 6 1976","1976-06-24"
"19, thg 4 1993","1993-04-19"
"31 03 14","2014-03-31"
"Ngày 14 tháng 10 năm 1999","1999-10-14"
"6 tháng 6 1987","1987-06-06"
"8 tháng 8, 2018","2018-08-08"
"tháng 11 30, 1978","1978-11-30"
"NGÀY 11 THÁNG 10 NĂM 2015","2015-10-11"
"28.11.97","1997-11-28"
"3 THÁNG 10 1971","1971-10-03"
"Ngày 10 tháng 02 năm 2008","2008-02-10"
"25 thg 9, 1985","1985-09-25"
"1 thg 8, 2000","2000-08-01"
"THÁNG 8 29, 1988","1988-08-29"
"tháng 1 6 2016","2016-01-06"
"23, thg 12 2007","2007-12-23"
"26 THG 2, 1983","1983-02-26"
"Ngày 25 tháng 05 năm 2017","2017-05-25"
"11.09.92","1992-09-11"
"6 thg 10 1972","1972-10-06"
"07/01/1992","1992-01-07"
"NGÀY 12 THÁNG 12 NĂM 1974","1974-12-12"
"27.08.95","1995-08-27"
"Ngày 04 tháng 11 năm 1993","1993-11-04"
"THỨ BA, NGÀY 16 THÁNG 9 NĂM 2008","2008-09-16"
"13 thg 4, 1978","1978-04-13"
"4 tháng 2, 1987","1987-02-04"
"THÁNG 11 19 1996","1996-11-19"
"tháng 1 25, 2007","2007-01-25"
"24 thg 1, 2001","2001-01-24"
"5 THG 11, 2006","2006-11-05"
"6 tháng 6 1981","1981-06-06"
"tháng 3 3 2000","2000-03-03"
"20 thg 9 1996","1996-09-20"
"Chủ Nhật, ngày 12 tháng 6 năm 2005","2005-06-12"
"07, thg 2 1991","1991-02-07"
"15/09/2018","2018-09-15"
"19 10 98","1998-10-19"
"20 tháng 9, 1995","1995-09-20"
"10 thg 6 1987","1987-06-10"
"26 thg 3, 2013","2013-03-26"
"21, THG 6 2014","2014-06-21"
"01, thg 4 1990","1990-04-01"
"13 THG 3 2010","2010-03-13"
"Chủ Nhật, ngày 08 tháng 3 năm 1998","1998-03-08"
"27 tháng 11 2016","2016-11-27"
"3 thg 10, 1976","1976-10-03"
"07 thg 7 1993","1993-07-07"
"THÁNG 1 15, 2017","2017-01-15"
"03.01.81","1981-01-03"
"THỨ BẢY, NGÀY 08 THÁNG 10 NĂM 1983","1983-10-08"
"10.01.93","1993-01-10"
"11.09.15","2015-09-11"
"28.09.01","2001-09-28"
"tháng 2 22 2003","2003-02-22"
"6 tháng 9 1974","1974-09-06"
"22 thg 11, 1994","1994-11-22"
"25 tháng 8 2011","2011-08-25"
"20/12/2001","2001-12-20"
"10/05/1970","1970-05-10"
"07 thg 10 1973","1973-10-07"
"4 02 92","1992-02-04"
"28 tháng 11 1976","1976-11-28"
"12 thg 8 1993","1993-08-12"
"25 tháng 11 2002","2002-11-25"
"ngày 09 tháng 11 năm 2001","2001-11-09"
"7 THÁNG 9, 1994","1994-09-07"
"8 THG 1, 1996","1996-01-08"
"chủ nhật, ngày 15 tháng 3 năm 2015","2015-03-15"
"16 tháng 9 2009","2009-09-16"
"17.12.93","1993-12-17"
"tháng 9 14 1983","1983-09-14"
"21 thg 12 1982","1982-12-21"
"10/08/1986","1986-08-10"
"25 10 88","1988-10-25"
"Ngày 21 tháng 12 năm 1974","1974-12-21"
"26 tháng 1 1989","1989-01-26"
"19 thg 2 2005","2005-02-19"
"15 THÁNG 7 2017","2017-07-15"
"20 11 06","2006-11-20"
"Ngày 17 tháng 05 năm 1990","1990-05-17"
"23 thg 2 1981","1981-02-23"
"24 tháng 4, 2010","2010-04-24"
"21 thg 4 1993","1993-04-21"
"10/09/1997","1997-09-10"
"NGÀY 26 THÁNG 07 NĂM 1999","1999-07-26"
"04.05.12","2012-05-04"
"11, thg 10 1985","1985-10-11"
"19 thg 6 1983","1983-06-19"
"1 thg 1 2013","2013-01-01"
"13.09.00","2000-09-13"
"tháng 11 20, 1998","1998-11-20"
"6 THÁNG 6 1988","1988-06-06"
"08/08/2015","2015-08-08"
"20 thg 5, 1973","1973-05-20"
"Thứ Tư, ngày 27 tháng 3 năm 2002","2002-03-27"
"tháng 7 22 1982","1982-07-22"
"16 07 85","1985-07-16"
"28 thg 8 1982","1982-08-28"
"16 thg 7 1982","1982-07-16"
"5 thg 6 1994","1994-06-05"
"5 thg 12 2008","2008-12-05"
"18, thg 11 1980","1980-11-18"
"tháng 8 19, 1973","1973-08-19"
"29/03/2012","2012-03-29"
"tháng 1 5 2002","2002-01-05"
"tháng 2 2 1991","1991-02-02"
"THỨ NĂM, NGÀY 03 THÁNG 9 NĂM 1970","1970-09-03"
"30 thg 9 1980","1980-09-30"
"14 tháng 5 1989","1989-05-14"
"8 tháng 3, 2016","2016-03-08"
"29 tháng 11 1977","1977-11-29"
"tháng 8 8, 1984","1984-08-08"
"21 thg 1, 2003","2003-01-21"
"18 THG 2, 2014","2014-02-18"
"3 thg 9 1989","1989-09-03"
"12/10/1971","1971-10-12"
"tháng 10 21, 2013","2013-10-21"
"3 thg 6 1971","1971-06-03"
"tháng 1 31 1974","1974-01-31"
"18 thg 8 2002","2002-08-18"
"31.03.85","1985-03-31"
"31 THÁNG 7 2001","2001-07-31"
"16 thg 11, 2017","2017-11-16"
"11 THG 2 2018","2018-02-11"
"Thứ Tư, ngày 22 tháng 11 năm 1972","1972-11-22"
"Thứ Hai, ngày 18 tháng 1 năm 2016","2016-01-18"
"THÁNG 2 15, 1989","1989-02-15"
"12 THÁNG 11, 1996","1996-11-12"
"29 thg 6 2016","2016-06-29"
"30 thg 8, 2016","2016-08-30"
"Ngày 26 tháng 02 năm 1997","1997-02-26"
"07/03/1975","1975-03-07"
"18 THG 2, 1985","1985-02-18"
"tháng 5 13 1990","1990-05-13"
"tháng 10 14, 1990","1990-10-14"
"Chủ Nhật, ngày 11 tháng 1 năm 1981","1981-01-11"
"THÁNG 7 16 1974","1974-07-16"
"4 thg 12 2006","2006-12-04"
"20 THG 11, 2004","2004-11-20"
"10 03 11","2011-03-10"
"ngày 17 tháng 07 năm 1985","1985-07-17"
"5 thg 8, 1971","1971-08-05"
"3 thg 9 1976","1976-09-03"
"13 thg 4, 2014","2014-04-13"
"28 thg 1, 1974","1974-01-28"
"1 THG 11, 1976","1976-11-01"
"thứ hai, ngày 02 tháng 9 năm 1985","1985-09-02"
"tháng 2 12, 2006","2006-02-12"
"30 tháng 3 1987","1987-03-30"
"28 thg 11, 1983","1983-11-28"
"28 THG 3, 1997","1997-03-28"
"13 10 96","1996-10-13"
"thứ bảy, ngày 26 tháng 7 năm 1986","1986-07-26"
"15.08.72","1972-08-15"
"22 thg 4 1970","1970-04-22"
"21 06 12","2012-06-21"
"THỨ NĂM, NGÀY 18 THÁNG 1 NĂM 1996","1996-01-18"
"Thứ Năm, ngày 01 tháng 1 năm 2009","2009-01-01"
"tháng 9 18 1995","1995-09-18"
"10 tháng 9 1974","1974-09-10"
"05 thg 11 1994","1994-11-05"
"05.05.06","2006-05-05"
"3 THG 12 1979","1979-12-03"
"15, thg 9 1997","1997-09-15"
"21 thg 3 2003","2003-03-21"
"THỨ BA, NGÀY 08 THÁNG 1 NĂM 1974","1974-01-08"
"16 tháng 3 1990","1990-03-16"
"11/05/1995","1995-05-11"
"thứ sáu, ngày 22 tháng 9 năm 1989","1989-09-22"
"29 THG 5 1985","1985-05-29"
"tháng 10 2, 1980","1980-10-02"
"tháng 11 13 1984","1984-11-13"
"5 thg 2, 1998","1998-02-05"
"tháng 6 11, 2002","2002-06-11"
"16 tháng 4 1987","1987-04-16"
"tháng 11 25, 1970","1970-11-25"
"NGÀY 14 THÁNG 04 NĂM 2000","2000-04-14"
"3 tháng 2, 1994","1994-02-03"
"25 07 05","2005-07-25"
"03, thg 1 1990","1990-01-03"
"tháng 5 4 1979","1979-05-04"
"30 thg 11 1977","1977-11-30"
"30 tháng 1, 1975","1975-01-30"
"23, thg 2 1978","1978-02-23"
"14 thg 8 1979","1979-08-14"
"12 tháng 2 1971","1971-02-12"
"16/12/1988","1988-12-16"
"24, thg 6 1980","1980-06-24"
"17.02.99","1999-02-17"
"3 thg 10, 1977","1977-10-03"
"30 tháng 8 2011","2011-08-30"
"THÁNG 7 25, 1970","1970-07-25"
"15 thg 1 1982","1982-01-15"
"12, thg 6 1991","1991-06-12"
"17/03/1988","1988-03-17"
"02/02/1983","1983-02-02"
"19.03.73","1973-03-19"
"30 THÁNG 7, 1976","1976-07-30"
"2 tháng 4 1973","1973-04-02"
"tháng 4 8, 1971","1971-04-08"
"31 tháng 8, 1989","1989-08-31"
"THỨ TƯ, NGÀY 17 THÁNG 7 NĂM 2002","2002-07-17"
"NGÀY 18 THÁNG 01 NĂM 1983","1983-01-18"
"NGÀY 26 THÁNG 04 NĂM 1978","1978-04-26"
"tháng 10 20, 1976","1976-10-20"
"22 tháng 6, 1974","1974-06-22"
"09/06/1974","1974-06-09"
"11, thg 10 1998","1998-10-11"
"03 thg 10 1972","1972-10-03"
"THỨ SÁU, NGÀY 10 THÁNG 3 NĂM 2017","2017-03-10"
"04.07.94","1994-07-04"
"tháng 3 24, 1985","1985-03-24"
"12 thg 7, 2004","2004-07-12"
"NGÀY 29 THÁNG 09 NĂM 1979","1979-09-29"
"20 thg 11 1998","1998-11-20"
"29 thg 3 1999","1999-03-29"
"ngày 11 tháng 04 năm 2008","2008-04-11"
"tháng 3 20 1974","1974-03-20"
"27 thg 2, 2005","2005-02-27"
"13 thg 9, 2000","2000-09-13"
"19 tháng 12 2018","2018-12-19"
"23 thg 12 1970","1970-12-23"
"tháng 5 1 1993","1993-05-01"
"22 THG 6 2015","2015-06-22"
"16, thg 3 1992","1992-03-16"
"14 03 91","1991-03-14"
"22 07 16","2016-07-22"
"24/07/1976","1976-07-24"
"28, THG 4 1994","1994-04-28"
"NGÀY 25 THÁNG 02 NĂM 1972","1972-02-25"
"18.03.94","1994-03-18"
"21 THG 9, 1992","1992-09-21"
"1 tháng 3, 1994","1994-03-01"
"THÁNG 3 19 1973","1973-03-19"
"22, thg 6 1999","1999-06-22"
"tháng 1 16, 1971","1971-01-16"
"15.03.81","1981-03-15"
"THỨ SÁU, NGÀY 23 THÁNG 2 NĂM 2007","2007-02-23"
"25, THG 11 1971","1971-11-25"
"28 thg 9, 1975","1975-09-28"
"Ngày 10 tháng 07 năm 1975","1975-07-10"
"chủ nhật, ngày 25 tháng 3 năm 2001","2001-03-25"
"NGÀY 29 THÁNG 07 NĂM 2004","2004-07-29"
"11 thg 5, 1979","1979-05-11"
"28 tháng 8 1984","1984-08-28"
"20 thg 12, 1999","1999-12-20"
"31 thg 12 1990","1990-12-31"
"THÁNG 7 14 1972","1972-07-14"
"thứ bảy, ngày 23 tháng 12 năm 1978","1978-12-23"
"7 thg 10, 1982","1982-10-07"
"tháng 3 23, 1978","1978-03-23"
"13.08.11","2011-08-13"
"thứ năm, ngày 30 tháng 4 năm 2009","2009-04-30"
"1 01 70","1970-01-01"
"7 11 10","2010-11-07"
"12 thg 2 2006","2006-02-12"
"tháng 6 11 1978","1978-06-11"
"24 THG 11, 1989","1989-11-24"
"25/01/2003","2003-01-25"
"3 10 74","1974-10-03"
"4 tháng 4 2016","2016-04-04"
"Ngày 26 tháng 06 năm 2012","2012-06-26"
"29/03/2006","2006-03-29"
"26 THÁNG 1 2018","2018-01-26"
"27 tháng 4, 1999","1999-04-27"
"14 THÁNG 7 1975","1975-07-14"
"tháng 4 3, 1998","1998-04-03"
"4 thg 4, 1995","1995-04-04"
"20/05/1986","1986-05-20"
"16 tháng 4 1978","1978-04-16"
"10 THG 5, 2006","2006-05-10"
"THÁNG 10 21 1980","1980-10-21"
"3 THÁNG 9 1986","1986-09-03"
"16 THÁNG 3 2004","2004-03-16"
"chủ nhật, ngày 20 tháng 3 năm 2005","2005-03-20"
"27/06/2004","2004-06-27"
"6 thg 12 2009","2009-12-06"
"07 thg 2 1978","1978-02-07"
"thứ năm, ngày 13 tháng 5 năm 1999","1999-05-13"
"18/05/2006","2006-05-18"
"7 tháng 12, 1991","1991-12-07"
"thứ hai, ngày 04 tháng 2 năm 1991","1991-02-04"
"tháng 9 11, 1970","1970-09-11"
"23 thg 12 1988","1988-12-23"
"29 thg 6 1982","1982-06-29"
"tháng 2 28, 1995","1995-02-28"
"10, thg 8 1991","1991-08-10"
"07, thg 12 2018","2018-12-07"
"tháng 9 24, 1974","1974-09-24"
"27, thg 2 1987","1987-02-27"
"4 tháng 2, 2016","2016-02-04"
"13 thg 7, 2005","2005-07-13"
"16 thg 12, 1987","1987-12-16"
"06, thg 2 2004","2004-02-06"
"5 tháng 12 1979","1979-12-05"
"tháng 6 23, 2009","2009-06-23"
"THỨ SÁU, NGÀY 02 THÁNG 8 NĂM 1974","1974-08-02"
"27 tháng 9, 1979","1979-09-27"
"22 07 85","1985-07-22"
"22 12 92","1992-12-22"
"Ngày 23 tháng 01 năm 1977","1977-01-23"
"17 thg 12, 1980","1980-12-17"
"4 tháng 7 1991","1991-07-04"
"07 thg 1 1991","1991-01-07"
"13 thg 2 2010","2010-02-13"
"19 tháng 7 2011","2011-07-19"
"25 THG 6 1987","1987-06-25"
"15 tháng 10 1999","1999-10-15"
"30 THG 3 2002","2002-03-30"
"27 THG 4, 1983","1983-04-27"
"04.06.94","1994-06-04"
"18/09/2014","2014-09-18"
"16 tháng 1, 2013","2013-01-16"
"tháng 1 29, 1972","1972-01-29"
"29, thg 10 1980","1980-10-29"
"31 07 09","2009-07-31"
"tháng 4 11 2000","2000-04-11"
"20 tháng 8, 2018","2018-08-20"
"18, thg 3 1993","1993-03-18"
"Thứ Bảy, ngày 30 tháng 4 năm 2016","2016-04-30"
"tháng 1 31, 1996","1996-01-31"
"8 tháng 7 1981","1981-07-08"
"tháng 9 3 2015","2015-09-03"
"04 THG 5 1998","1998-05-04"
"22, THG 1 1995","1995-01-22"
"tháng 8 28, 1982","1982-08-28"
"Chủ Nhật, ngày 03 tháng 9 năm 1978","1978-09-03"
"28 tháng 12 1974","1974-12-28"
"tháng 10 9 2018","2018-10-09"
"12/05/1998","1998-05-12"
"THÁNG 10 17, 1983","1983-10-17"
"26 THG 7, 1970","1970-07-26"
"tháng 5 30, 2011","2011-05-30"
"13 tháng 3 1976","1976-03-13"
"23 thg 5, 1987","1987-05-23"
"THỨ NĂM, NGÀY 30 THÁNG 9 NĂM 1993","1993-09-30"
"30 THG 5, 1984","1984-05-30"
"14, thg 3 2012","2012-03-14"
"14 tháng 4, 1971","1971-04-14"
"25 THG 4 1976","1976-04-25"
"24 THG 10, 1992","1992-10-24"
"NGÀY 18 THÁNG 05 NĂM 1984","1984-05-18"
"3 12 09","2009-12-03"
"thứ hai, ngày 12 tháng 9 năm 2011","2011-09-12"
"28 tháng 2 1972","1972-02-28"
"20 tháng 12 1995","1995-12-20"
"20 thg 1, 2002","2002-01-20"
"19 THG 2, 1978","1978-02-19"
"24 11 76","1976-11-24"
"13/11/1971","1971-11-13"
"01, thg 9 2008","2008-09-01"
"31 thg 7, 1971","1971-07-31"
"26 tháng 7, 1992","1992-07-26"
"07, THG 7 2011","2011-07-07"
"30 03 80","1980-03-30"
"19 11 89","1989-11-19"
"21/02/1972","1972-02-21"
"Ngày 02 tháng 10 năm 2002","2002-10-02"
"THÁNG 4 1, 2017","2017-04-01"
"ngày 03 tháng 12 năm 1992","1992-12-03"
"24 THG 9, 1996","1996-09-24"
"tháng 8 3 1999","1999-08-03"
"tháng 3 1, 1971","1971-03-01"
"08 THG 4 1992","1992-04-08"
"tháng 11 28, 1987","1987-11-28"
"06 thg 12 2015","2015-12-06"
"16.05.12","2012-05-16"
"THÁNG 1 31 1973","1973-01-31"
"THỨ BA, NGÀY 12 THÁNG 8 NĂM 1986","1986-08-12"
"5 thg 5, 2011","2011-05-05"
"31 tháng 10 2002","2002-10-31"
"THỨ BA, NGÀY 25 THÁNG 8 NĂM 2015","2015-08-25"
"23.05.81","1981-05-23"
"16/03/1980","1980-03-16"
"02, thg 5 1978","1978-05-02"
"tháng 3 19, 1982","1982-03-19"
"22.03.96","1996-03-22"
"1 thg 11, 1973","1973-11-01"
"5 07 76","1976-07-05"
"23 thg 7 2014","2014-07-23"
"4 tháng 1, 2001","2001-01-04"
"21 thg 11 1972","1972-11-21"
"21/04/1988","1988-04-21"
"14/03/2016","2016-03-14"
"06.02.76","1976-02-06"
"12 THÁNG 5, 1974","1974-05-12"
"11 10 84","1984-10-11"
"THÁNG 7 23 1999","1999-07-23"
"10 thg 12, 1986","1986-12-10"
"14 tháng 12 2011","2011-12-14"
"27 tháng 7 2005","2005-07-27"
"15, thg 2 1979","1979-02-15"
"21.05.83","1983-05-21"
"06.05.99","1999-05-06"
"tháng 7 29 1981","1981-07-29"
"21, thg 1 1994","1994-01-21"
"02/05/2007","2007-05-02"
"13.09.72","1972-09-13"
"06/08/1978","1978-08-06"
"tháng 5 27 1997","1997-05-27"
"4 thg 11, 1992","1992-11-04"
"14 tháng 9 1990","1990-09-14"
"tháng 2 14, 1983","1983-02-14"
"4 02 70","1970-02-04"
"7 THÁNG 11 1998","1998-11-07"
"21.03.70","1970-03-21"
"28 THÁNG 3, 2008","2008-03-28"
"17/09/2000","2000-09-17"
"THÁNG 10 18 1995","1995-10-18"
"30 tháng 11 1987","1987-11-30"
"18 01 79","1979-01-18"
"17 tháng 8 1982","1982-08-17"
"11 thg 3, 1988","1988-03-11"
"19 thg 11, 2008","2008-11-19"
"28 tháng 8 1981","1981-08-28"
"5 THG 10, 2017","2017-10-05"
"NGÀY 13 THÁNG 09 NĂM 2006","2006-09-13"
"tháng 1 10, 1986","1986-01-10"
"9 tháng 7 2009","2009-07-09"
"23 12 94","1994-12-23"
"tháng 5 10, 1987","1987-05-10"
"16, thg 2 1973","1973-02-16"
"THỨ BẢY, NGÀY 09 THÁNG 1 NĂM 1993","1993-01-09"
"12 thg 7 2014","2014-07-12"
"02, thg 1 1995","1995-01-02"
"NGÀY 03 THÁNG 10 NĂM 1991","1991-10-03"
"21 tháng 9 1970","1970-09-21"
"20 03 72","1972-03-20"
"3 tháng 9 2000","2000-09-03"
"31 tháng 8, 1995","1995-08-31"
"6 THG 4, 2012","2012-04-06"
"thứ tư, ngày 23 tháng 3 năm 2005","2005-03-23"
"tháng 1 21 1990","1990-01-21"
"2 thg 2, 1978","1978-02-02"
"NGÀY 11 THÁNG 09 NĂM 1998","1998-09-11"
"Ngày 13 tháng 11 năm 1992","1992-11-13"
"31 tháng 10 1977","1977-10-31"
"ngày 28 tháng 07 năm 1992","1992-07-28"
"CHỦ NHẬT, NGÀY 15 THÁNG 11 NĂM 1981","1981-11-15"
"23 thg 10 1995","1995-10-23"
"NGÀY 18 THÁNG 07 NĂM 2017","2017-07-18"
"5 tháng 7, 1977","1977-07-05"
"2 THÁNG 9 1981","1981-09-02"
"31 THÁNG 12 2005","2005-12-31"
"NGÀY 21 THÁNG 08 NĂM 2007","2007-08-21"
"1 tháng 11 1993","1993-11-01"
"26 tháng 7, 2007","2007-07-26"
"18 THG 12, 2010","2010-12-18"
"tháng 12 31, 2014","2014-12-31"
"29 THÁNG 5 2011","2011-05-29"
"29.06.98","1998-06-29"
"15 thg 12, 1985","1985-12-15"
"21 thg 9 1999","1999-09-21"
"thứ hai, ngày 26 tháng 7 năm 1976","1976-07-26"
"10, thg 7 2004","2004-07-10"
"tháng 1 19 1992","1992-01-19"
"13 thg 2 1977","1977-02-13"
"08 thg 10 1985","1985-10-08"
"30 THG 12, 2002","2002-12-30"
"8 thg 2 2014","2014-02-08"
"19/05/1974","1974-05-19"
"tháng 11 3 2018","2018-11-03"
"23/08/1997","1997-08-23"
"03.11.09","2009-11-03"
"25 thg 2, 1976","1976-02-25"
"27 tháng 10 2007","2007-10-27"
"5 tháng 5 1974","1974-05-05"
"26 THG 6, 2007","2007-06-26"
"chủ nhật, ngày 08 tháng 3 năm 1998","1998-03-08"
"4 THÁNG 1 2009","2009-01-04"
"15, THG 4 1999","1999-04-15"
"09.05.91","1991-05-09"
"7 tháng 1 1984","1984-01-07"
"12 10 07","2007-10-12"
"7 thg 3 2002","2002-03-07"
"26 tháng 6 1982","1982-06-26"
"23, thg 9 1982","1982-09-23"
"15 THG 5 1978","1978-05-15"
"14 thg 2 1971","1971-02-14"
"18 THÁNG 9 2013","2013-09-18"
"tháng 2 14, 2002","2002-02-14"
"18 thg 12 1970","1970-12-18"
"02/12/2004","2004-12-02"
"10 thg 11, 2000","2000-11-10"
"Thứ Sáu, ngày 26 tháng 6 năm 1981","1981-06-26"
"23 thg 6 2017","2017-06-23"
"ngày 02 tháng 12 năm 2008","2008-12-02"
"4 11 88","1988-11-04"
"ngày 22 tháng 01 năm 1978","1978-01-22"
"Chủ Nhật, ngày 22 tháng 7 năm 2012","2012-07-22"
"05/08/2014","2014-08-05"
"thứ sáu, ngày 01 tháng 7 năm 2016","2016-07-01"
"20/07/1992","1992-07-20"
"THỨ HAI, NGÀY 07 THÁNG 9 NĂM 2009","2009-09-07"
"14 THÁNG 4 1980","1980-04-14"
"Chủ Nhật, ngày 07 tháng 4 năm 1985","1985-04-07"
"6 tháng 1, 2003","2003-01-06"
"10/04/1990","1990-04-10"
"17/07/1984","1984-07-17"
"24 tháng 6 2010","2010-06-24"
"22 thg 2 2014","2014-02-22"
"Ngày 01 tháng 03 năm 1980","1980-03-01"
"Ngày 31 tháng 08 năm 2001","2001-08-31"
"24 thg 2, 1994","1994-02-24"
"29.04.01","2001-04-29"
"6 tháng 9, 2006","2006-09-06"
"THỨ BẢY, NGÀY 20 THÁNG 4 NĂM 1996","1996-04-20"
"THÁNG 4 16, 1979","1979-04-16"
"16 tháng 8 2000","2000-08-16"
"22 tháng 7, 2005","2005-07-22"
"14/12/2013","2013-12-14"
"27/12/1996","1996-12-27"
"4 THG 11, 2014","2014-11-04"
"15, thg 9 1983","1983-09-15"
"THÁNG 7 24 1993","1993-07-24"
"14 tháng 9, 1976","1976-09-14"
"tháng 2 16, 2011","2011-02-16"
"4 THG 4, 2005","2005-04-04"
"26 tháng 11, 1976","1976-11-26"
"29 tháng 12 1978","1978-12-29"
"31 THG 10 1984","1984-10-31"
"26 thg 3, 1999","1999-03-26"
"2 tháng 4 1997","1997-04-02"
"16.12.81","1981-12-16"
"THỨ HAI, NGÀY 26 THÁNG 4 NĂM 1976","1976-04-26"
"22/04/2013","2013-04-22"
"22, thg 9 2004","2004-09-22"
"27 THG 5, 1997","1997-05-27"
"23 THG 4, 1999","1999-04-23"
"tháng 12 21, 1983","1983-12-21"
"28 06 83","1983-06-28"
"22/07/1983","1983-07-22"
"14 thg 2 2004","2004-02-14"
"24 thg 11, 1990","1990-11-24"
"21 tháng 12 1986","1986-12-21"
"THÁNG 3 7, 2003","2003-03-07"
"11.11.77","1977-11-11"
"Thứ Năm, ngày 08 tháng 1 năm 1998","1998-01-08"
"10, thg 8 1995","1995-08-10"
"tháng 10 3 2015","2015-10-03"
"7 tháng 10 1998","1998-10-07"
"tháng 10 29, 1994","1994-10-29"
"Ngày 27 tháng 07 năm 2013","2013-07-27"
"NGÀY 18 THÁNG 03 NĂM 1998","1998-03-18"
"30 04 07","2007-04-30"
"4 thg 8 2002","2002-08-04"
"20, thg 2 1985","1985-02-20"
"20 THG 11, 1998","1998-11-20"
"18 thg 3, 1997","1997-03-18"
"tháng 7 20 2006","2006-07-20"
"26 thg 2, 2018","2018-02-26"
"05/07/1971","1971-07-05"
"15 thg 9, 1997","1997-09-15"
"24 THG 8, 2014","2014-08-24"
"22.03.16","2016-03-22"
"10 tháng 4 1976","1976-04-10"
"04, thg 8 2008","2008-08-04"
"26/04/1990","1990-04-26"
"08 thg 10 1980","1980-10-08"
"7 THÁNG 7, 1988","1988-07-07"
"7 thg 7, 1976","1976-07-07"
"Thứ Tư, ngày 09 tháng 11 năm 2011","2011-11-09"
"THÁNG 11 15 1973","1973-11-15"
"tháng 8 28 1979","1979-08-28"
"06 THG 7 1970","1970-07-06"
"17 THÁNG 11 1998","1998-11-17"
"5 thg 7, 2014","2014-07-05"
"Ngày 12 tháng 12 năm 2007","2007-12-12"
"NGÀY 25 THÁNG 06 NĂM 2002","2002-06-25"
"26 thg 11 2013","2013-11-26"
"18 THG 11, 1997","1997-11-18"
"THỨ BẢY, NGÀY 15 THÁNG 12 NĂM 1984","1984-12-15"
"17 thg 3 2006","2006-03-17"
"tháng 1 14, 1987","1987-01-14"
"27 tháng 2 2003","2003-02-27"
"tháng 6 22 1974","1974-06-22"
"24, thg 3 2003","2003-03-24"
"27, THG 6 1990","1990-06-27"
"11 tháng 3 1995","1995-03-11"
"13 tháng 7, 2009","2009-07-13"
"23 thg 6 1993","1993-06-23"
"18 thg 2 2009","2009-02-18"
"12 THG 8 1976","1976-08-12"
"22.08.15","2015-08-22"
"tháng 2 9, 1990","1990-02-09"
"19 thg 11 2007","2007-11-19"
"THÁNG 2 4, 1999","1999-02-04"
"Thứ Tư, ngày 30 tháng 12 năm 2015","2015-12-30"
"31 THÁNG 12 1973","1973-12-31"
"5 thg 11, 1987","1987-11-05"
"13 thg 3 1976","1976-03-13"
"THỨ BA, NGÀY 14 THÁNG 4 NĂM 1992","1992-04-14"
"THỨ BA, NGÀY 22 THÁNG 4 NĂM 2008","2008-04-22"
"25 THG 10 1976","1976-10-25"
"3 thg 8 2008","2008-08-03"
"tháng 12 31, 1982","1982-12-31"
"16 thg 12 1978","1978-12-16"
"3 THG 4, 1976","1976-04-03"
"ngày 03 tháng 06 năm 1997","1997-06-03"
"11 10 12","2012-10-11"
"2 THÁNG 11 1990","1990-11-02"
"17 tháng 10 1980","1980-10-17"
"18 tháng 11 2000","2000-11-18"
"04.09.07","2007-09-04"
"tháng 12 5, 2006","2006-12-05"
"07/04/2001","2001-04-07"
"31 tháng 12 1999","1999-12-31"
"2 tháng 11 1992","1992-11-02"
"tháng 5 4, 1982","1982-05-04"
"08.03.74","1974-03-08"
"8 06 83","1983-06-08"
"30 thg 3 1998","1998-03-30"
"NGÀY 27 THÁNG 06 NĂM 2007","2007-06-27"
"Thứ Ba, ngày 01 tháng 7 năm 1997","1997-07-01"
"25, THG 8 1971","1971-08-25"
"20/02/1994","1994-02-20"
"Ngày 17 tháng 12 năm 1993","1993-12-17"
"THỨ HAI, NGÀY 14 THÁNG 10 NĂM 1996","1996-10-14"
"8 THÁNG 6 1992","1992-06-08"
"10 thg 11 1990","1990-11-10"
"21 THÁNG 7, 1976","1976-07-21"
"09/09/1995","1995-09-09"
"27 THG 12, 2002","2002-12-27"
"20 05 96","1996-05-20"
"26 08 93","1993-08-26"
"4 THG 7, 2010","2010-07-04"
"29 tháng 12 2013","2013-12-29"
"Thứ Bảy, ngày 29 tháng 5 năm 1993","1993-05-29"
"12 tháng 9, 2013","2013-09-12"
"8 thg 3, 1991","1991-03-08"
"9 tháng 9 1971","1971-09-09"
"25 thg 1 1978","1978-01-25"
"chủ nhật, ngày 13 tháng 11 năm 2016","2016-11-13"
"tháng 7 20, 1999","1999-07-20"
"ngày 14 tháng 03 năm 1991","1991-03-14"
"5 tháng 10, 2008","2008-10-05"
"31/03/2013","2013-03-31"
"14 thg 8 2010","2010-08-14"
"tháng 12 21, 1997","1997-12-21"
"27/04/1992","1992-04-27"
"12 03 86","1986-03-12"
"30 08 00","2000-08-30"
"27 thg 3 2004","2004-03-27"
"tháng 9 15 1993","1993-09-15"
"19 thg 4 2006","2006-04-19"
"16 tháng 3 1987","1987-03-16"
"08/04/1973","1973-04-08"
"24 tháng 3 1973","1973-03-24"
"Thứ Tư, ngày 17 tháng 8 năm 2011","2011-08-17"
"4 tháng 5 2005","2005-05-04"
"8 THÁNG 1 2006","2006-01-08"
"6 tháng 8 2004","2004-08-06"
"31 tháng 12, 1991","1991-12-31"
"18 thg 1 1973","1973-01-18"
"tháng 11 5, 1979","1979-11-05"
"9 tháng 5 2017","2017-05-09"
"21 THG 1 1970","1970-01-21"
"29 THG 3, 2000","2000-03-29"
"20 thg 2 2005","2005-02-20"
"16 04 98","1998-04-16"
"05.12.81","1981-12-05"
"tháng 7 5 1988","1988-07-05"
"13 thg 2, 1985","1985-02-13"
"THÁNG 10 30 1977","1977-10-30"
"2 tháng 6 1981","1981-06-02"
"26 05 09","2009-05-26"
"tháng 1 16 2009","2009-01-16"
"06 thg 12 1998","1998-12-06"
"30 thg 3 2015","2015-03-30"
"17 thg 6, 1995","1995-06-17"
"18.03.90","1990-03-18"
"21 04 17","2017-04-21"
"29 tháng 4, 2005","2005-04-29"
"29 08 13","2013-08-29"
"15.10.77","1977-10-15"
"04/09/1988","1988-09-04"
"3 THÁNG 10, 2001","2001-10-03"
"9 THG 4, 1992","1992-04-09"
"tháng 5 3, 1989","1989-05-03"
"29 THG 3 2006","2006-03-29"
"3 thg 4, 2016","2016-04-03"
"9 07 98","1998-07-09"
"1 THÁNG 3 2016","2016-03-01"
"tháng 5 7 2015","2015-05-07"
"21.04.90","1990-04-21"
"21 THG 2 1971","1971-02-21"
"31 thg 7, 1986","1986-07-31"
"25 tháng 5 1973","1973-05-25"
"Ngày 02 tháng 09 năm 1995","1995-09-02"
"29, thg 3 1976","1976-03-29"
"8 02 17","2017-02-08"
"Ngày 14 tháng 08 năm 1996","1996-08-14"
"7 tháng 4, 1997","1997-04-07"
"NGÀY 17 THÁNG 07 NĂM 1995","1995-07-17"
"20 thg 5, 1992","1992-05-20"
"03, THG 2 1978","1978-02-03"
"12 THG 9 1985","1985-09-12"
"tháng 10 20, 1986","1986-10-20"
"tháng 3 1, 1972","1972-03-01"
"05/08/2017","2017-08-05"
"THỨ BẢY, NGÀY 04 THÁNG 1 NĂM 1997","1997-01-04"
"16 THG 7, 1975","1975-07-16"
"19 tháng 10 1986","1986-10-19"
"NGÀY 16 THÁNG 09 NĂM 2017","2017-09-16"
"04.02.99","1999-02-04"
"03.04.04","2004-04-03"
"24 THÁNG 4, 2013","2013-04-24"
"14 tháng 3 1975","1975-03-14"
"04.06.80","1980-06-04"
"23, THG 8 2016","2016-08-23"
"24 THG 2 2013","2013-02-24"
"25 tháng 5 1994","1994-05-25"
"12 11 85","1985-11-12"
"9 tháng 5, 1982","1982-05-09"
"6 THÁNG 1 1993","1993-01-06"
"Thứ Hai, ngày 11 tháng 6 năm 2001","2001-06-11"
"19 tháng 3 1973","1973-03-19"
"THÁNG 12 7 2014","2014-12-07"
"tháng 10 8 1976","1976-10-08"
"3 thg 11, 1973","1973-11-03"
"5 tháng 12 2008","2008-12-05"
"6 tháng 11 2009","2009-11-06"
"21 thg 5, 1975","1975-05-21"
"tháng 12 30, 2007","2007-12-30"
"23 THÁNG 2 1981","1981-02-23"
"4 thg 8, 2009","2009-08-04"
"01.12.72","1972-12-01"
"20, THG 6 2018","2018-06-20"
"8 thg 1, 1999","1999-01-08"
"14 thg 7 1985","1985-07-14"
"2 04 02","2002-04-02"
"19 THG 11, 1984","1984-11-19"
"14 thg 7, 1975","1975-07-14"
"22 thg 1 1989","1989-01-22"
"26/04/1981","1981-04-26"
"23.05.10","2010-05-23"
"25 THÁNG 10, 1971","1971-10-25"
"8 thg 11, 1974","1974-11-08"
"7 thg 1, 2003","2003-01-07"
"9 thg 4 1996","1996-04-09"
"20.07.00","2000-07-20"
"10 thg 8 1981","1981-08-10"
"31/03/1988","1988-03-31"
"04, thg 5 1971","1971-05-04"
"Ngày 19 tháng 07 năm 2018","2018-07-19"
"17 THÁNG 6 2009","2009-06-17"
"30 tháng 8 1971","1971-08-30"
"27 tháng 7 1992","1992-07-27"
"26 tháng 8 1989","1989-08-26"
"24 thg 3 1994","1994-03-24"
"11 tháng 2, 1977","1977-02-11"
"31 thg 5, 1980","1980-05-31"
"03/02/1970","1970-02-03"
"20 thg 12 2014","2014-12-20"
"tháng 11 4, 1970","1970-11-04"
"7 thg 2, 2018","2018-02-07"
"09 thg 6 2003","2003-06-09"
"tháng 8 31, 1995","1995-08-31"
"15.09.15","2015-09-15"
"tháng 11 21, 2009","2009-11-21"
"NGÀY 20 THÁNG 07 NĂM 2006","2006-07-20"
"2 tháng 12, 1979","1979-12-02"
"THÁNG 1 4 2017","2017-01-04"
"24 tháng 3, 1970","1970-03-24"
"tháng 2 16, 2008","2008-02-16"
"23.03.73","1973-03-23"
"19 thg 9, 1987","1987-09-19"
"24 10 81","1981-10-24"
"17 thg 5 1977","1977-05-17"
"15 THÁNG 10 1990","1990-10-15"
"13 thg 2, 1973","1973-02-13"
"26 09 86","1986-09-26"
"Ngày 15 tháng 03 năm 1981","1981-03-15"
"15 thg 6, 1994","1994-06-15"
"05/06/2014","2014-06-05"
"23 tháng 5 2002","2002-05-23"
"29 11 10","2010-11-29"
"09/07/1973","1973-07-09"
"THÁNG 11 8 1988","1988-11-08"
"17 thg 1, 2014","2014-01-17"
"14 thg 3, 2013","2013-03-14"
"THÁNG 9 2, 2015","2015-09-02"
"07.11.09","2009-11-07"
"ngày 07 tháng 09 năm 2017","2017-09-07"
"7 thg 6 1983","1983-06-07"
"26 10 73","1973-10-26"
"17 THÁNG 10 1991","1991-10-17"
"17 thg 2 1978","1978-02-17"
"12 thg 12, 1973","1973-12-12"
"Ngày 23 tháng 07 năm 1972","1972-07-23"
"01 thg 5 1987","1987-05-01"
"NGÀY 31 THÁNG 07 NĂM 1971","1971-07-31"
"18.11.12","2012-11-18"
"05.12.98","1998-12-05"
"17 thg 4, 2002","2002-04-17"
"30, thg 6 1987","1987-06-30"
"tháng 1 20 1982","1982-01-20"
"9 tháng 3 1992","1992-03-09"
"07 thg 9 2009","2009-09-07"
"Thứ Ba, ngày 20 tháng 2 năm 1973","1973-02-20"
"17 thg 2 1975","1975-02-17"
"28.10.14","2014-10-28"
"Ngày 10 tháng 07 năm 1971","1971-07-10"
"08/12/1971","1971-12-08"
"06, thg 8 1980","1980-08-06"
"24 THÁNG 5, 2004","2004-05-24"
"21 04 73","1973-04-21"
"5 tháng 6, 1996","1996-06-05"
"Thứ Bảy, ngày 14 tháng 4 năm 2018","2018-04-14"
"21 thg 12 2008","2008-12-21"
"29.06.72","1972-06-29"
"15 tháng 3 2000","2000-03-15"
"THÁNG 4 3, 2005","2005-04-03"
"30, thg 4 2013","2013-04-30"
"2 thg 11 2000","2000-11-02"
"12 THÁNG 5 2011","2011-05-12"
"14 thg 1 2015","2015-01-14"
"28 THÁNG 4 1996","1996-04-28"
"09/02/1994","1994-02-09"
"THỨ NĂM, NGÀY 11 THÁNG 7 NĂM 1991","1991-07-11"
"12.10.78","1978-10-12"
"12 08 07","2007-08-12"
"NGÀY 05 THÁNG 06 NĂM 2017","2017-06-05"
"29/12/1975","1975-12-29"
"16 thg 12 2006","2006-12-16"
"THÁNG 4 24, 1986","1986-04-24"
"13 04 01","2001-04-13"
"04.09.77","1977-09-04"
"4 THG 6 2017","2017-06-04"
"NGÀY 13 THÁNG 03 NĂM 1971","1971-03-13"
"20 10 06","2006-10-20"
"Ngày 03 tháng 10 năm 1985","1985-10-03"
"29 tháng 1, 1979","1979-01-29"
"3 THÁNG 10 2018","2018-10-03"
"27 tháng 1, 1973","1973-01-27"
"29 01 18","2018-01-29"
"13, THG 3 2002","2002-03-13"
"NGÀY 23 THÁNG 12 NĂM 2001","2001-12-23"
"08/11/1985","1985-11-08"
"11 thg 9, 1996","1996-09-11"
"Thứ Hai, ngày 20 tháng 11 năm 2000","2000-11-20"
"28 thg 8, 2010","2010-08-28"
"tháng 8 8 1970","1970-08-08"
"8 thg 4, 1995","1995-04-08"
"12 thg 4, 2010","2010-04-12"
"Thứ Hai, ngày 28 tháng 11 năm 1983","1983-11-28"
"27.09.14","2014-09-27"
"24.08.82","1982-08-24"
"tháng 5 1 2013","2013-05-01"
"9 tháng 11 2009","2009-11-09"
"13 tháng 4 1981","1981-04-13"
"16 tháng 7, 2008","2008-07-16"
"THÁNG 9 11, 2000","2000-09-11"
"24 thg 3, 2012","2012-03-24"
"28, thg 7 2008","2008-07-28"
"23.01.09","2009-01-23"
"12 THG 7, 1986","1986-07-12"
"tháng 12 20, 1994","1994-12-20"
"6 tháng 5 2003","2003-05-06"
"10 10 98","1998-10-10"
"23 thg 4 2005","2005-04-23"
"18 THG 10 2004","2004-10-18"
"tháng 7 31, 1981","1981-07-31"
"14.04.80","1980-04-14"
"23 tháng 9 1978","1978-09-23"
"THỨ BẢY, NGÀY 01 THÁNG 12 NĂM 2007","2007-12-01"
"3 05 02","2002-05-03"
"Thứ Ba, ngày 28 tháng 6 năm 2011","2011-06-28"
"15, thg 10 2015","2015-10-15"
"30 THG 11, 2018","2018-11-30"
"14 12 03","2003-12-14"
"27 thg 4 1997","1997-04-27"
"26 tháng 3 1991","1991-03-26"
"13 tháng 11 2003","2003-11-13"
"11.05.72","1972-05-11"
"14 thg 3 1972","1972-03-14"
"17 thg 9 2010","2010-09-17"
"9 THG 10, 1984","1984-10-09"
"29 thg 8, 1982","1982-08-29"
"8 thg 9 1979","1979-09-08"
"09/08/1988","1988-08-09"
"07, thg 5 1984","1984-05-07"
"18 thg 3, 1979","1979-03-18"
"10 tháng 9 1987","1987-09-10"
"20 thg 10, 1981","1981-10-20"
"8 THG 8, 1984","1984-08-08"
"THÁNG 12 24 1971","1971-12-24"
"Thứ Ba, ngày 27 tháng 8 năm 1985","1985-08-27"
"tháng 10 23, 2005","2005-10-23"
"tháng 7 16, 1983","1983-07-16"
"tháng 10 9, 2007","2007-10-09"
"30 tháng 5, 2014","2014-05-30"
"3 tháng 9, 1981","1981-09-03"
"29 thg 11 1977","1977-11-29"
"23 thg 8 1985","1985-08-23"
"31 THÁNG 12 2011","2011-12-31"
"8 09 00","2000-09-08"
"Ngày 27 tháng 11 năm 2006","2006-11-27"
"ngày 14 tháng 10 năm 2002","2002-10-14"
"22 tháng 3 1987","1987-03-22"
"25 THG 5 2010","2010-05-25"
"19 tháng 6, 2007","2007-06-19"
"THÁNG 12 24, 2003","2003-12-24"
"23 tháng 4 1983","1983-04-23"
"14 thg 9, 2007","2007-09-14"
"17 thg 3, 1998","1998-03-17"
"10/09/2007","2007-09-10"
"07.03.03","2003-03-07"
"7 thg 6, 1978","1978-06-07"
"5 tháng 3 1971","1971-03-05"
"02.01.05","2005-01-02"
"05.08.03","2003-08-05"
"15 THG 4 1974","1974-04-15"
"11 THÁNG 6 1996","1996-06-11"
"Ngày 14 tháng 02 năm 1982","1982-02-14"
"thứ sáu, ngày 04 tháng 4 năm 1986","1986-04-04"
"23 12 02","2002-12-23"
"THÁNG 9 30 1993","1993-09-30"
"09.03.91","1991-03-09"
"15 tháng 11 1987","1987-11-15"
"8 06 89","1989-06-08"
"21, THG 12 1988","1988-12-21"
"31 thg 3 1986","1986-03-31"
"tháng 12 7 1991","1991-12-07"
"01 thg 10 1997","1997-10-01"
"ngày 05 tháng 06 năm 2008","2008-06-05"
"26/10/2010","2010-10-26"
"Thứ Hai, ngày 18 tháng 12 năm 1995","1995-12-18"
"10 10 05","2005-10-10"
"tháng 9 4, 2000","2000-09-04"
"10 thg 3, 1970","1970-03-10"
"15 thg 1, 2002","2002-01-15"
"12 THG 4 1994","1994-04-12"
"15 thg 11, 2015","2015-11-15"
"31, THG 3 1972","1972-03-31"
"Ngày 10 tháng 10 năm 1977","1977-10-10"
"31, THG 10 2004","2004-10-31"
"10/09/1999","1999-09-10"
"THÁNG 8 2 2018","2018-08-02"
"3 THÁNG 10 2016","2016-10-03"
"13/12/1988","1988-12-13"
"19/08/1998","1998-08-19"
"25 tháng 8 2010","2010-08-25"
"28 THÁNG 4 1996","1996-04-28"
"15 THÁNG 11, 1998","1998-11-15"
"ngày 24 tháng 11 năm 1977","1977-11-24"
"NGÀY 08 THÁNG 11 NĂM 1981","1981-11-08"
"26 tháng 12, 2001","2001-12-26"
"9 05 09","2009-05-09"
"Thứ Sáu, ngày 04 tháng 12 năm 2009","2009-12-04"
"17/09/1993","1993-09-17"
"THÁNG 4 6, 1981","1981-04-06"
"CHỦ NHẬT, NGÀY 27 THÁNG 11 NĂM 2011","2011-11-27"
"thứ năm, ngày 09 tháng 11 năm 2017","2017-11-09"
"24 THÁNG 12 1970","1970-12-24"
"THÁNG 10 9 2003","2003-10-09"
"30/12/1987","1987-12-30"
"24 thg 10 1980","1980-10-24"
"24 thg 1 1979","1979-01-24"
"13, thg 1 1983","1983-01-13"
"20 THÁNG 5, 2004","2004-05-20"
"22 tháng 7 1986","1986-07-22"
"13.06.00","2000-06-13"
"23 thg 10 1992","1992-10-23"
"23 thg 2, 1993","1993-02-23"
"20 thg 12, 1993","1993-12-20"
"08.09.77","1977-09-08"
"26 tháng 4 2007","2007-04-26"
"24 tháng 8 1992","1992-08-24"
"tháng 10 3 1999","1999-10-03"
"30 thg 7, 1997","1997-07-30"
"15 tháng 7, 1988","1988-07-15"
"CHỦ NHẬT, NGÀY 01 THÁNG 8 NĂM 1999","1999-08-01"
"15, thg 4 1976","1976-04-15"
"27 THG 2 2007","2007-02-27"
"thứ tư, ngày 17 tháng 10 năm 1984","1984-10-17"
"25 THG 6, 2012","2012-06-25"
"25 11 10","2010-11-25"
"19.11.76","1976-11-19"
"15/08/1988","1988-08-15"
"27 thg 11, 1983","1983-11-27"
"04/04/1985","1985-04-04"
"13 thg 6, 1980","1980-06-13"
"21 THG 11 2003","2003-11-21"
"09, thg 9 1993","1993-09-09"
"29 THÁNG 6 1974","1974-06-29"
"Ngày 11 tháng 01 năm 1999","1999-01-11"
"30 thg 6, 1990","1990-06-30"
"17 THG 4 2001","2001-04-17"
"Thứ Sáu, ngày 30 tháng 10 năm 1992","1992-10-30"
"tháng 11 24, 1975","1975-11-24"
"6 tháng 12, 2007","2007-12-06"
"tháng 3 17 1980","1980-03-17"
"tháng 5 16 1995","1995-05-16"
"tháng 1 11, 2002","2002-01-11"
"Thứ Bảy, ngày 10 tháng 3 năm 1984","1984-03-10"
"13 tháng 5, 2000","2000-05-13"
"NGÀY 02 THÁNG 01 NĂM 2018","2018-01-02"
"12 thg 1, 2015","2015-01-12"
"8 THG 4, 2014","2014-04-08"
"11, thg 4 2008","2008-04-11"
"THÁNG 10 23 1982","1982-10-23"
"tháng 8 20, 2012","2012-08-20"
"11 01 89","1989-01-11"
"05 thg 2 1972","1972-02-05"
"11 07 75","1975-07-11"
"10 tháng 6 2012","2012-06-10"
"15 tháng 6, 1996","1996-06-15"
"tháng 7 15, 1973","1973-07-15"
"20 02 74","1974-02-20"
"24 THÁNG 3, 2018","2018-03-24"
"tháng 5 12 1999","1999-05-12"
"tháng 4 21, 1999","1999-04-21"
"02, THG 3 1982","1982-03-02"
"1 thg 3, 2015","2015-03-01"
"22 THÁNG 12 2002","2002-12-22"
"23 THG 12, 2015","2015-12-23"
"3 thg 8 2002","2002-08-03"
"tháng 3 10 2014","2014-03-10"
"28 THG 2, 2014","2014-02-28"
"NGÀY 08 THÁNG 11 NĂM 1995","1995-11-08"
"tháng 12 29 1986","1986-12-29"
"2 thg 7 2004","2004-07-02"
"1 04 95","1995-04-01"
"07, thg 3 1988","1988-03-07"
"24 tháng 12 1990","1990-12-24"
"13 tháng 6, 1972","1972-06-13"
"31 THG 8 1993","1993-08-31"
"14 THG 9 1983","1983-09-14"
"13 THG 9, 1999","1999-09-13"
"18 tháng 2, 1979","1979-02-18"
"28/09/2002","2002-09-28"
"Ngày 09 tháng 12 năm 1991","1991-12-09"
"29/02/2008","2008-02-29"
"19 thg 12, 2002","2002-12-19"
"Ngày 05 tháng 10 năm 2006","2006-10-05"
"19 thg 5, 1983","1983-05-19"
"thứ ba, ngày 12 tháng 6 năm 2001","2001-06-12"
"9 tháng 12 2009","2009-12-09"
"15 thg 11, 1974","1974-11-15"
"tháng 3 30 1983","1983-03-30"
"08/08/1986","1986-08-08"
"ngày 18 tháng 01 năm 1992","1992-01-18"
"6 thg 9 2013","2013-09-06"
"22 thg 12, 2014","2014-12-22"
"18/01/2011","2011-01-18"
"10/07/2006","2006-07-10"
"29 tháng 3 1989","1989-03-29"
"24, thg 1 1996","1996-01-24"
"NGÀY 29 THÁNG 12 NĂM 1971","1971-12-29"
"13 THÁNG 4 1971","1971-04-13"
"tháng 10 21 1985","1985-10-21"
"tháng 8 25 2017","2017-08-25"
"29/10/1996","1996-10-29"
"21 thg 12, 1992","1992-12-21"
"23 THG 11 1988","1988-11-23"
"10, thg 10 1996","1996-10-10"
"20 thg 8, 1989","1989-08-20"
"Thứ Ba, ngày 11 tháng 7 năm 1972","1972-07-11"
"10/03/1978","1978-03-10"
"25 THG 7, 1986","1986-07-25"
"06.06.14","2014-06-06"
"17 thg 7 2016","2016-07-17"
"5 thg 4, 2007","2007-04-05"
"1 tháng 1, 2008","2008-01-01"
"22 tháng 8, 2006","2006-08-22"
"thứ tư, ngày 04 tháng 11 năm 1987","1987-11-04"
"Ngày 25 tháng 09 năm 1974","1974-09-25"
"23/02/1979","1979-02-23"
"10 THG 1, 1988","1988-01-10"
"20 tháng 1, 1972","1972-01-20"
"THÁNG 3 11, 1987","1987-03-11"
"23 THG 9, 1988","1988-09-23"
"tháng 11 12 1995","1995-11-12"
"29 THG 4 2002","2002-04-29"
"29, THG 8 2008","2008-08-29"
"25, thg 1 1990","1990-01-25"
"tháng 10 26 1974","1974-10-26"
"6 THÁNG 10 2004","2004-10-06"
"13 thg 3 2013","2013-03-13"
"28 tháng 4 1985","1985-04-28"
"thứ bảy, ngày 04 tháng 4 năm 2015","2015-04-04"
"24, THG 3 1999","1999-03-24"
"18 12 91","1991-12-18"
"30 THG 7 1982","1982-07-30"
"26/11/2001","2001-11-26"
"18 10 12","2012-10-18"
"27 THÁNG 12 2002","2002-12-27"
"6 thg 7, 1987","1987-07-06"
"22/04/1986","1986-04-22"
"7 tháng 11 2004","2004-11-07"
"29 thg 11 1971","1971-11-29"
"31/08/2007","2007-08-31"
"1 thg 7, 1987","1987-07-01"
"29 tháng 9 2011","2011-09-29"
"Thứ Sáu, ngày 12 tháng 11 năm 2004","2004-11-12"
"22/09/2017","2017-09-22"
"3 thg 8, 1988","1988-08-03"
"01, THG 6 1990","1990-06-01"
"10 thg 5, 1977","1977-05-10"
"8 tháng 3 2000","2000-03-08"
"19 tháng 5 1970","1970-05-19"
"16 tháng 12, 2012","2012-12-16"
"27 thg 5, 2009","2009-05-27"
"18 THÁNG 6 2018","2018-06-18"
"14 thg 7 1978","1978-07-14"
"16 08 09","2009-08-16"
"29 09 76","1976-09-29"
"1 tháng 1 1979","1979-01-01"
"tháng 9 23 1975","1975-09-23"
"09 thg 4 1981","1981-04-09"
"21, thg 12 1988","1988-12-21"
"tháng 5 11, 1992","1992-05-11"
"19 thg 6, 2009","2009-06-19"
"4 tháng 3 2003","2003-03-04"
"02, THG 2 2002","2002-02-02"
"24 07 95","1995-07-24"
"13 thg 7, 1989","1989-07-13"
"9 thg 5, 2002","2002-05-09"
"31 tháng 1 1989","1989-01-31"
"THÁNG 10 4 1971","1971-10-04"
"THÁNG 7 8, 1999","1999-07-08"
"30 THG 7 1972","1972-07-30"
"3 tháng 4 2002","2002-04-03"
"23 thg 12 1999","1999-12-23"
"14 thg 6, 1994","1994-06-14"
"22/03/2017","2017-03-22"
"THỨ BA, NGÀY 20 THÁNG 10 NĂM 1987","1987-10-20"
"5 THG 3 1980","1980-03-05"
"tháng 11 15, 1972","1972-11-15"
"NGÀY 28 THÁNG 09 NĂM 1990","1990-09-28"
"Ngày 26 tháng 12 năm 2013","2013-12-26"
"16 tháng 8, 1983","1983-08-16"
"7 thg 6, 2000","2000-06-07"
"25 THG 8 1970","1970-08-25"
"9 THÁNG 9 1975","1975-09-09"
"THÁNG 11 19, 1984","1984-11-19"
"tháng 10 15 1971","1971-10-15"
"05/07/2000","2000-07-05"
"05, thg 3 1988","1988-03-05"
"26 tháng 2 2017","2017-02-26"
"26 thg 7 2001","2001-07-26"
"tháng 4 5 2015","2015-04-05"
"26 05 92","1992-05-26"
"26/06/2008","2008-06-26"
"ngày 23 tháng 05 năm 2015","2015-05-23"
"29 tháng 12 1973","1973-12-29"
"6 THÁNG 9 1989","1989-09-06"
"THÁNG 11 16 2014","2014-11-16"
"thứ năm, ngày 29 tháng 7 năm 1982","1982-07-29"
"13 thg 5 1971","1971-05-13"
"Ngày 23 tháng 05 năm 1996","1996-05-23"
"8 tháng 9, 1983","1983-09-08"
"Thứ Sáu, ngày 15 tháng 3 năm 2002","2002-03-15"
"29 thg 1 1987","1987-01-29"
"4 tháng 10 1984","1984-10-04"
"9 thg 9 1994","1994-09-09"
"31 THÁNG 10, 1989","1989-10-31"
"1 tháng 11, 2011","2011-11-01"
"7 thg 7 1983","1983-07-07"
"13 tháng 2 2018","2018-02-13"
"tháng 7 19, 2002","2002-07-19"
"20 06 10","2010-06-20"
"THÁNG 5 2, 1973","1973-05-02"
"27 tháng 12, 2013","2013-12-27"
"THÁNG 3 12, 1975","1975-03-12"
"23 THG 11, 1979","1979-11-23"
"07/12/2002","2002-12-07"
"Ngày 10 tháng 11 năm 1971","1971-11-10"
"12.11.76","1976-11-12"
"Ngày 24 tháng 10 năm 2004","2004-10-24"
"16 thg 2 2011","2011-02-16"
"28 thg 2 1983","1983-02-28"
"27/10/1983","1983-10-27"
"16 tháng 10 1988","1988-10-16"
"05.04.97","1997-04-05"
"18 12 96","1996-12-18"
"29 tháng 12, 1985","1985-12-29"
"16 thg 2 2014","2014-02-16"
"13 10 72","1972-10-13"
"NGÀY 11 THÁNG 09 NĂM 1984","1984-09-11"
"5 thg 3, 1997","1997-03-05"
"2 THG 10, 1981","1981-10-02"
"24 tháng 8 1993","1993-08-24"
"27/02/2009","2009-02-27"
"11 tháng 10, 1993","1993-10-11"
"Ngày 09 tháng 03 năm 2001","2001-03-09"
"28 01 07","2007-01-28"
"23 tháng 4 1972","1972-04-23"
"Ngày 23 tháng 11 năm 1976","1976-11-23"
"2 08 10","2010-08-02"
"tháng 4 20 2014","2014-04-20"
"16 THÁNG 8 1982","1982-08-16"
"06 thg 6 1992","1992-06-06"
"11 THG 6, 1975","1975-06-11"
"tháng 2 10, 1972","1972-02-10"
"22 tháng 11 1974","1974-11-22"
"27 THÁNG 3 1977","1977-03-27"
"16 THG 1 2018","2018-01-16"
"6 THG 9, 1993","1993-09-06"
"3 THG 3 1976","1976-03-03"
"10 tháng 2, 1989","1989-02-10"
"22 tháng 9, 1981","1981-09-22"
"16 tháng 11 1989","1989-11-16"
"Thứ Hai, ngày 18 tháng 10 năm 1982","1982-10-18"
"29 tháng 7 1977","1977-07-29"
"24 tháng 3 1970","1970-03-24"
"26 thg 9, 2004","2004-09-26"
"03, thg 9 1991","1991-09-03"
"11 thg 10, 1984","1984-10-11"
"30 THÁNG 11, 1974","1974-11-30"
"13 tháng 6, 2005","2005-06-13"
"Ngày 30 tháng 01 năm 1974","1974-01-30"
"22 tháng 3 1988","1988-03-22"
"13.04.07","2007-04-13"
"15 tháng 12 2005","2005-12-15"
"29.08.17","2017-08-29"
"12 THG 5 1996","1996-05-12"
"23, thg 5 2002","2002-05-23"
"9 thg 6 1973","1973-06-09"
"30 tháng 7 2001","2001-07-30"
"16 tháng 12 1995","1995-12-16"
"7 tháng 5 1994","1994-05-07"
"19 08 05","2005-08-19"
"3 thg 12 1998","1998-12-03"
"tháng 3 8, 1997","1997-03-08"
"tháng 2 28 2010","2010-02-28"
"04.10.76","1976-10-04"
"20 THÁNG 1, 1989","1989-01-20"
"12 thg 7 2014","2014-07-12"
"30, thg 10 1984","1984-10-30"
"23 tháng 2 1976","1976-02-23"
"7 tháng 10, 2007","2007-10-07"
"20 THG 12, 1970","1970-12-20"
"THÁNG 12 19, 1973","1973-12-19"
"21 thg 2, 1989","1989-02-21"
"14 THÁNG 10 2018","2018-10-14"
"Thứ Bảy, ngày 15 tháng 5 năm 1999","1999-05-15"
"12 tháng 7, 2007","2007-07-12"
"09, thg 2 2018","2018-02-09"
"29 tháng 5 1982","1982-05-29"
"20 thg 3, 1983","1983-03-20"
"THÁNG 1 11 1977","1977-01-11"
"tháng 1 30, 2008","2008-01-30"
"29 08 07","2007-08-29"
"tháng 10 15 1995","1995-10-15"
"1 tháng 10 1984","1984-10-01"
"Ngày 12 tháng 10 năm 1974","1974-10-12"
"30 tháng 11 2002","2002-11-30"
"04/03/2017","2017-03-04"
"30 tháng 7 2000","2000-07-30"
"17, thg 5 1984","1984-05-17"
"19 10 04","2004-10-19"
"6 thg 8, 1990","1990-08-06"
"7 thg 12, 1979","1979-12-07"
"24 THG 10, 1995","1995-10-24"
"01 thg 6 2010","2010-06-01"
"30 thg 12, 1994","1994-12-30"
"03 thg 3 2013","2013-03-03"
"28 THÁNG 4 1987","1987-04-28"
"14 thg 9 2002","2002-09-14"
"9 tháng 6 1995","1995-06-09"
"16, thg 3 1972","1972-03-16"
"THÁNG 6 12, 1979","1979-06-12"
"09.02.10","2010-02-09"
"tháng 9 17 1989","1989-09-17"
"01, thg 9 2002","2002-09-01"
"thứ bảy, ngày 26 tháng 8 năm 1972","1972-08-26"
"THỨ TƯ, NGÀY 06 THÁNG 3 NĂM 1991","1991-03-06"
"07, thg 8 1986","1986-08-07"
"20 thg 8, 2002","2002-08-20"
"20/12/1980","1980-12-20"
"04, thg 11 2005","2005-11-04"
"tháng 8 14 2015","2015-08-14"
"NGÀY 05 THÁNG 10 NĂM 2004","2004-10-05"
"4 THG 12 1982","1982-12-04"
"6 thg 12, 2018","2018-12-06"
"15 THG 11 1981","1981-11-15"
"01/02/1975","1975-02-01"
"16.03.77","1977-03-16"
"12 tháng 3 2007","2007-03-12"
"26 THG 7 2014","2014-07-26"
"11 thg 2, 1971","1971-02-11"
"14.08.84","1984-08-14"
"19 thg 8 2017","2017-08-19"
"tháng 1 16 1998","1998-01-16"
"tháng 7 10 1996","1996-07-10"
"thứ tư, ngày 08 tháng 6 năm 1983","1983-06-08"
"29.08.83","1983-08-29"
"ngày 29 tháng 11 năm 1990","1990-11-29"
"15 THG 12, 1999","1999-12-15"
"4 tháng 11 2010","2010-11-04"
"31 tháng 1 2000","2000-01-31"
"tháng 11 10, 2000","2000-11-10"
"24.12.93","1993-12-24"
"ngày 11 tháng 06 năm 1983","1983-06-11"
"7 THÁNG 10, 2016","2016-10-07"
"15 THG 2, 2000","2000-02-15"
"5 THÁNG 1 1996","1996-01-05"
"22 THG 11 1978","1978-11-22"
"Thứ Năm, ngày 24 tháng 5 năm 2012","2012-05-24"
"08.04.04","2004-04-08"
"7 THG 2 2000","2000-02-07"
"ngày 08 tháng 10 năm 1990","1990-10-08"
"24 thg 10 1976","1976-10-24"
"28 08 01","2001-08-28"
"15.06.02","2002-06-15"
"7 06 90","1990-06-07"
"22 thg 2, 2018","2018-02-22"
"14 01 05","2005-01-14"
"tháng 8 3 1978","1978-08-03"
"THỨ HAI, NGÀY 25 THÁNG 11 NĂM 1974","1974-11-25"
"Thứ Sáu, ngày 26 tháng 5 năm 1978","1978-05-26"
"16 thg 8 2018","2018-08-16"
"Ngày 03 tháng 12 năm 1986","1986-12-03"
"2 tháng 6 2004","2004-06-02"
"14 tháng 6 2011","2011-06-14"
"17.01.91","1991-01-17"
"17 THÁNG 2 2002","2002-02-17"
"01/11/1970","1970-11-01"
"CHỦ NHẬT, NGÀY 19 THÁNG 8 NĂM 1990","1990-08-19"
"15.08.75","1975-08-15"
"Thứ Năm, ngày 27 tháng 11 năm 1997","1997-11-27"
"04/09/1981","1981-09-04"
"Thứ Tư, ngày 25 tháng 5 năm 1983","1983-05-25"
"THÁNG 3 27 2004","2004-03-27"
"Ngày 05 tháng 08 năm 1994","1994-08-05"
"04/03/1990","1990-03-04"
"16 THÁNG 4, 2017","2017-04-16"
"Ngày 01 tháng 05 năm 2009","2009-05-01"
"8 tháng 5, 2006","2006-05-08"
"24 THÁNG 11, 1982","1982-11-24"
"thứ tư, ngày 08 tháng 3 năm 1978","1978-03-08"
"tháng 7 30, 1974","1974-07-30"
"20 thg 4, 2015","2015-04-20"
"16 tháng 2 1990","1990-02-16"
"8 thg 10, 2003","2003-10-08"
"17 thg 11, 1973","1973-11-17"
"26 tháng 11, 2004","2004-11-26"
"27 tháng 3, 1970","1970-03-27"
"21 THÁNG 12, 1999","1999-12-21"
"07/01/1975","1975-01-07"
"13 thg 12 1984","1984-12-13"
"25 thg 10 2014","2014-10-25"
"Ngày 22 tháng 11 năm 2007","2007-11-22"
"THÁNG 11 27, 1996","1996-11-27"
"08, thg 9 1985","1985-09-08"
"4 tháng 7 1986","1986-07-04"
"22 thg 9, 1988","1988-09-22"
"19 thg 9 1992","1992-09-19"
"Ngày 22 tháng 10 năm 1987","1987-10-22"
"27 tháng 9 2000","2000-09-27"
"11 thg 3, 1987","1987-03-11"
"21 thg 2 1981","1981-02-21"
"27 10 02","2002-10-27"
"21 thg 3, 2015","2015-03-21"
"19 thg 5, 1992","1992-05-19"
"4 THÁNG 11 1984","1984-11-04"
"2 thg 5 1985","1985-05-02"
"4 THÁNG 2 1971","1971-02-04"
"tháng 12 2 1986","1986-12-02"
"22/04/1985","1985-04-22"
"17 thg 6 1978","1978-06-17"
"tháng 8 18, 1972","1972-08-18"
"08 THG 12 2005","2005-12-08"
"tháng 12 4 2008","2008-12-04"
"tháng 8 2 1989","1989-08-02"
"15 tháng 2 1997","1997-02-15"
"30 THÁNG 5 2018","2018-05-30"
"09, THG 10 1990","1990-10-09"
"tháng 2 12, 1972","1972-02-12"
"9 THG 10, 1996","1996-10-09"
"3 05 94","1994-05-03"
"6 07 08","2008-07-06"
"9 THG 1, 2005","2005-01-09"
"10 tháng 6 1990","1990-06-10"
"03, thg 1 2017","2017-01-03"
"11 thg 4, 2000","2000-04-11"
"11/09/2016","2016-09-11"
"13.11.86","1986-11-13"
"19 thg 5, 1988","1988-05-19"
"THÁNG 2 10 2001","2001-02-10"
"tháng 5 12 2010","2010-05-12"
"Ngày 25 tháng 07 năm 1983","1983-07-25"
"4 thg 3, 2009","2009-03-04"
"07.05.06","2006-05-07"
"8 tháng 8 1988","1988-08-08"
"tháng 5 3, 2001","2001-05-03"
"05.01.96","1996-01-05"
"19/01/1988","1988-01-19"
"8 04 00","2000-04-08"
"22/11/1982","1982-11-22"
"tháng 5 15 1999","1999-05-15"
"30, thg 11 1985","1985-11-30"
"5 THG 6 2017","2017-06-05"
"Ngày 23 tháng 08 năm 2002","2002-08-23"
"24 06 13","2013-06-24"
"3 thg 12, 1974","1974-12-03"
"14/11/1973","1973-11-14"
"tháng 3 7 2004","2004-03-07"
"04/12/1999","1999-12-04"
"04/04/1983","1983-04-04"
"29.06.83","1983-06-29"
"16.01.76","1976-01-16"
"5 thg 6, 2006","2006-06-05"
"01, THG 10 2013","2013-10-01"
"1 tháng 6, 2011","2011-06-01"
"10 10 92","1992-10-10"
"28 THÁNG 12 1987","1987-12-28"
"07, thg 6 1980","1980-06-07"
"25 tháng 1 2005","2005-01-25"
"Thứ Bảy, ngày 12 tháng 11 năm 2011","2011-11-12"
"tháng 11 16 1984","1984-11-16"
"25 tháng 11, 1987","1987-11-25"
"14 thg 1 2012","2012-01-14"
"6 THÁNG 4 1997","1997-04-06"
"17 tháng 12, 1972","1972-12-17"
"20 thg 8, 2013","2013-08-20"
"NGÀY 11 THÁNG 09 NĂM 1998","1998-09-11"
"24 12 00","2000-12-24"
"Thứ Bảy, ngày 13 tháng 6 năm 1987","1987-06-13"
"19 tháng 11 1972","1972-11-19"
"8 tháng 1, 2011","2011-01-08"
"6 08 81","1981-08-06"
"22, thg 10 2004","2004-10-22"
"NGÀY 02 THÁNG 01 NĂM 1996","1996-01-02"
"thứ ba, ngày 28 tháng 3 năm 1995","1995-03-28"
"17 thg 8, 1992","1992-08-17"
"Ngày 29 tháng 10 năm 1995","1995-10-29"
"6 THÁNG 2 2002","2002-02-06"
"19 thg 3 2012","2012-03-19"
"28 thg 12, 2011","2011-12-28"
"Thứ Tư, ngày 12 tháng 10 năm 1977","1977-10-12"
"24 thg 12, 1980","1980-12-24"
"tháng 1 14 2005","2005-01-14"
"tháng 9 29 2011","2011-09-29"
"Ngày 01 tháng 08 năm 2013","2013-08-01"
"04 thg 1 1977","1977-01-04"
"23 thg 9 2004","2004-09-23"
"tháng 4 12, 1984","1984-04-12"
"Thứ Hai, ngày 07 tháng 11 năm 2005","2005-11-07"
"06, thg 11 2012","2012-11-06"
"2 04 90","1990-04-02"
"29 thg 10, 1990","1990-10-29"
"15 thg 6, 2014","2014-06-15"
"25 thg 10 2002","2002-10-25"
"30.11.89","1989-11-30"
"01, thg 11 2009","2009-11-01"
"THÁNG 10 25, 1979","1979-10-25"
"18 01 87","1987-01-18"
"Thứ Bảy, ngày 28 tháng 8 năm 2004","2004-08-28"
"1 thg 9 1983","1983-09-01"
"15 thg 3, 1976","1976-03-15"
"20.04.88","1988-04-20"
"9 tháng 2, 1971","1971-02-09"
"THÁNG 6 8, 2003","2003-06-08"
"30.03.05","2005-03-30"
"tháng 3 11 1980","1980-03-11"
"21, thg 6 1990","1990-06-21"
"31 thg 1 2010","2010-01-31"
"15 THÁNG 5 1995","1995-05-15"
"24 tháng 8 2000","2000-08-24"
"tháng 11 27, 1998","1998-11-27"
"26, thg 2 1972","1972-02-26"
"30 tháng 11 2000","2000-11-30"
"27 thg 3, 1995","1995-03-27"
"THÁNG 9 23 2013","2013-09-23"
"30 THÁNG 7, 1997","1997-07-30"
"14 thg 8, 1999","1999-08-14"
"14 thg 10, 1971","1971-10-14"
"tháng 7 15, 1987","1987-07-15"
"16 thg 10 1979","1979-10-16"
"28 11 10","2010-11-28"
"12 thg 2, 2001","2001-02-12"
"01/03/1971","1971-03-01"
"10/10/1990","1990-10-10"
"9 thg 5 1989","1989-05-09"
"19.11.02","2002-11-19"
"27 thg 6 1974","1974-06-27"
"10 tháng 11 1994","1994-11-10"
"THÁNG 9 3 2017","2017-09-03"
"1 tháng 9, 1981","1981-09-01"
"20 THG 11 2017","2017-11-20"
"17 09 90","1990-09-17"
"20 THÁNG 8, 1982","1982-08-20"
"25 tháng 10 2016","2016-10-25"
"20 thg 9, 1982","1982-09-20"
"26 thg 11, 1997","1997-11-26"
"11 thg 7 1985","1985-07-11"
"12 thg 2 2001","2001-02-12"
"tháng 2 20 2009","2009-02-20"
"28 thg 3, 1973","1973-03-28"
"tháng 8 24 2000","2000-08-24"
"THÁNG 8 13 1971","1971-08-13"
"23 THG 12 1991","1991-12-23"
"21 tháng 8, 1997","1997-08-21"
"6 tháng 7, 1971","1971-07-06"
"2 tháng 4, 1990","1990-04-02"
"11 tháng 9 1994","1994-09-11"
"21 tháng 2 2017","2017-02-21"
"tháng 12 21 1974","1974-12-21"
"29 tháng 12, 1978","1978-12-29"
"24 12 07","2007-12-24"
"18 THG 8, 2011","2011-08-18"
"24 thg 4 2007","2007-04-24"
"05 thg 5 2004","2004-05-05"
"4 thg 2, 2000","2000-02-04"
"4 thg 5, 1985","1985-05-04"
"13 tháng 12 2014","2014-12-13"
"25 thg 11, 2016","2016-11-25"
"27 tháng 8 2016","2016-08-27"
"5 tháng 6, 2014","2014-06-05"
"08, thg 9 1982","1982-09-08"
"21/07/2017","2017-07-21"
"27 tháng 2, 1972","1972-02-27"
"14, thg 10 2018","2018-10-14"
"13 thg 8, 1977","1977-08-13"
"24 thg 7, 1995","1995-07-24"
"18, thg 2 2008","2008-02-18"
"14 thg 8, 2000","2000-08-14"
"18, thg 12 1998","1998-12-18"
"tháng 4 9 1984","1984-04-09"
"08, THG 1 1983","1983-01-08"
"tháng 11 27 1981","1981-11-27"
"24, thg 8 1979","1979-08-24"
"thứ năm, ngày 18 tháng 8 năm 2011","2011-08-18"
"28 THÁNG 1, 1978","1978-01-28"
"12.04.13","2013-04-12"
"21 06 81","1981-06-21"
"10/11/1979","1979-11-10"
"tháng 6 22, 1976","1976-06-22"
"21.02.85","1985-02-21"
"1 tháng 2 2016","2016-02-01"
"25 THÁNG 2, 2008","2008-02-25"
"30 tháng 10 1988","1988-10-30"
"THỨ BẢY, NGÀY 17 THÁNG 3 NĂM 2012","2012-03-17"
"6 thg 1, 2016","2016-01-06"
"10 03 03","2003-03-10"
"27, thg 10 2004","2004-10-27"
"28 THG 7 1972","1972-07-28"
"tháng 11 28 2011","2011-11-28"
"ngày 07 tháng 04 năm 1987","1987-04-07"
"tháng 12 3, 1971","1971-12-03"
"20 thg 8 1991","1991-08-20"
"tháng 6 24, 1993","1993-06-24"
"Chủ Nhật, ngày 14 tháng 11 năm 2010","2010-11-14"
"tháng 4 11 2005","2005-04-11"
"30 08 88","1988-08-30"
"15 tháng 3, 2004","2004-03-15"
"24 THÁNG 6 1989","1989-06-24"
"Thứ Năm, ngày 17 tháng 7 năm 1997","1997-07-17"
"THỨ BẢY, NGÀY 04 THÁNG 4 NĂM 1981","1981-04-04"
"Ngày 11 tháng 08 năm 2006","2006-08-11"
"26 thg 7, 1977","1977-07-26"
"13 thg 6 1983","1983-06-13"
"10 THG 8, 1983","1983-08-10"
"22.09.12","2012-09-22"
"tháng 5 9 1980","1980-05-09"
"10 THG 9 1989","1989-09-10"
"20 THÁNG 3 2000","2000-03-20"
"25 tháng 2 2012","2012-02-25"
"tháng 3 7, 1995","1995-03-07"
"16 thg 6, 2011","2011-06-16"
"tháng 1 9 2001","2001-01-09"
"19 tháng 2, 1976","1976-02-19"
"18/01/1996","1996-01-18"
"01.05.09","2009-05-01"
"Ngày 03 tháng 05 năm 1971","1971-05-03"
"20 tháng 7 1980","1980-07-20"
"9 THÁNG 10 1990","1990-10-09"
"16, thg 10 2018","2018-10-16"
"THỨ NĂM, NGÀY 06 THÁNG 2 NĂM 1986","1986-02-06"
"18 THÁNG 4 1999","1999-04-18"
"14 tháng 9 1981","1981-09-14"
"tháng 10 21, 2008","2008-10-21"
"Ngày 22 tháng 08 năm 1993","1993-08-22"
"27, thg 11 1990","1990-11-27"
"28 THÁNG 2 2016","2016-02-28"
"23 thg 1, 1985","1985-01-23"
"ngày 06 tháng 02 năm 2015","2015-02-06"
"27 THÁNG 5 1991","1991-05-27"
"Chủ Nhật, ngày 30 tháng 5 năm 1982","1982-05-30"
"01/04/1976","1976-04-01"
"Ngày 06 tháng 08 năm 1992","1992-08-06"
"10.07.01","2001-07-10"
"18/03/1993","1993-03-18"
"15 tháng 12, 1977","1977-12-15"
"27 thg 3, 2010","2010-03-27"
"tháng 11 25, 2009","2009-11-25"
"28 thg 5, 2014","2014-05-28"
"9 THG 11 2018","2018-11-09"
"tháng 11 9 1991","1991-11-09"
"tháng 9 15, 2003","2003-09-15"
"18 thg 6 1978","1978-06-18"
"21 tháng 2 1987","1987-02-21"
"28 tháng 12 2009","2009-12-28"
"16 tháng 9, 1975","1975-09-16"
"9 tháng 9, 1993","1993-09-09"
"26 THÁNG 9, 1993","1993-09-26"
"14.04.90","1990-04-14"
"7 tháng 2, 1988","1988-02-07"
"tháng 4 9 2007","2007-04-09"
"21/05/2006","2006-05-21"
"31 tháng 10 2008","2008-10-31"
"17 thg 1 1987","1987-01-17"
"15 02 76","1976-02-15"
"22 tháng 4 1998","1998-04-22"
"THÁNG 10 25 1977","1977-10-25"
"25 07 89","1989-07-25"
"24.12.14","2014-12-24"
"6 thg 7 1991","1991-07-06"
"15 tháng 3, 1984","1984-03-15"
"Chủ Nhật, ngày 12 tháng 6 năm 2011","2011-06-12"
"Thứ Ba, ngày 05 tháng 11 năm 1985","1985-11-05"
"19 tháng 3 1992","1992-03-19"
"17.10.13","2013-10-17"
"25 tháng 4, 1976","1976-04-25"
"2 05 05","2005-05-02"
"ngày 03 tháng 12 năm 1986","1986-12-03"
"THÁNG 3 8, 2014","2014-03-08"
"1 thg 12 2011","2011-12-01"
"22.06.04","2004-06-22"
"23, thg 4 1988","1988-04-23"
"3 thg 2, 1985","1985-02-03"
"14 THG 10 1970","1970-10-14"
"04 thg 8 2006","2006-08-04"
"21 tháng 11, 2006","2006-11-21"
"8 THG 5, 1972","1972-05-08"
"07/01/2018","2018-01-07"
"2 thg 11, 2013","2013-11-02"
"tháng 11 27, 2016","2016-11-27"
"13 THG 11 2005","2005-11-13"
"Ngày 22 tháng 01 năm 1995","1995-01-22"
"8 tháng 9, 2008","2008-09-08"
"Ngày 23 tháng 10 năm 2014","2014-10-23"
"31 thg 8, 1973","1973-08-31"
"13/08/2011","2011-08-13"
"28 thg 10, 1986","1986-10-28"
"22 THG 3, 1980","1980-03-22"
"14.06.06","2006-06-14"
"19/06/1991","1991-06-19"
"thứ tư, ngày 31 tháng 12 năm 1986","1986-12-31"
"7 THÁNG 3 1984","1984-03-07"
"29 tháng 2, 2016","2016-02-29"
"06, THG 9 1980","1980-09-06"
"11 THG 7 1974","1974-07-11"
"17 thg 1 1985","1985-01-17"
"3 tháng 3 1980","1980-03-03"
"tháng 2 11, 2005","2005-02-11"
"27 thg 1 2003","2003-01-27"
"6 thg 3, 1978","1978-03-06"
"8 thg 5, 1985","1985-05-08"
"Ngày 13 tháng 02 năm 2005","2005-02-13"
"28 THÁNG 6 1979","1979-06-28"
"02, thg 5 2008","2008-05-02"
"thứ hai, ngày 25 tháng 11 năm 1974","1974-11-25"
"tháng 5 21 2013","2013-05-21"
"THỨ SÁU, NGÀY 04 THÁNG 3 NĂM 1988","1988-03-04"
"18 11 82","1982-11-18"
"19 tháng 7 1987","1987-07-19"
"8 12 03","2003-12-08"
"4 thg 9 1973","1973-09-04"
"THÁNG 8 4, 1985","1985-08-04"
"17 tháng 12 1970","1970-12-17"
"28 tháng 4 1985","1985-04-28"
"tháng 8 6 2009","2009-08-06"
"29 THG 1, 1979","1979-01-29"
"1 tháng 4 1980","1980-04-01"
"19.06.00","2000-06-19"
"31.01.09","2009-01-31"
"3 04 89","1989-04-03"
"22 THÁNG 12 1996","1996-12-22"
"09 thg 3 1981","1981-03-09"
"8 thg 1, 2017","2017-01-08"
"07.12.82","1982-12-07"
"ngày 24 tháng 12 năm 1998","1998-12-24"
"28/06/1985","1985-06-28"
"25 tháng 8, 2016","2016-08-25"
"Thứ Tư, ngày 02 tháng 7 năm 1980","1980-07-02"
"16 12 08","2008-12-16"
"tháng 11 13 2017","2017-11-13"
"02, THG 8 1991","1991-08-02"
"tháng 8 22 1980","1980-08-22"
"tháng 5 13, 1996","1996-05-13"
"03 thg 2 1980","1980-02-03"
"ngày 06 tháng 01 năm 2003","2003-01-06"
"tháng 3 7 1994","1994-03-07"
"24 tháng 4 2016","2016-04-24"
"tháng 8 11 1989","1989-08-11"
"THÁNG 4 15 2010","2010-04-15"
"16 THG 7, 2018","2018-07-16"
"15, THG 7 2008","2008-07-15"
"10/10/1978","1978-10-10"
"1 tháng 5 2004","2004-05-01"
"09.02.03","2003-02-09"
"Chủ Nhật, ngày 06 tháng 4 năm 1975","1975-04-06"
"Thứ Tư, ngày 02 tháng 2 năm 1977","1977-02-02"
"Thứ Tư, ngày 21 tháng 2 năm 2018","2018-02-21"
"12 THG 11, 1990","1990-11-12"
"25, thg 9 1995","1995-09-25"
"03.07.81","1981-07-03"
"19/07/1987","1987-07-19"
"Thứ Ba, ngày 03 tháng 6 năm 2008","2008-06-03"
"2 tháng 4 2001","2001-04-02"
"14 THG 11, 1981","1981-11-14"
"27.10.83","1983-10-27"
"12 02 77","1977-02-12"
"03 thg 4 1988","1988-04-03"
"tháng 5 4, 2002","2002-05-04"
"30 01 91","1991-01-30"
"thứ bảy, ngày 12 tháng 7 năm 2008","2008-07-12"
"8 tháng 12, 1993","1993-12-08"
"23 thg 1, 1992","1992-01-23"
"thứ tư, ngày 06 tháng 5 năm 1992","1992-05-06"
"14/09/2000","2000-09-14"
"NGÀY 18 THÁNG 07 NĂM 2007","2007-07-18"
"14 tháng 5 1987","1987-05-14"
"tháng 2 12 1984","1984-02-12"
"11 thg 9, 1982","1982-09-11"
"NGÀY 26 THÁNG 07 NĂM 1989","1989-07-26"
"28, thg 12 2012","2012-12-28"
"31 thg 1, 2002","2002-01-31"
"04 thg 12 1992","1992-12-04"
"17 thg 9, 2015","2015-09-17"
"10 tháng 11, 2013","2013-11-10"
"29/07/1975","1975-07-29"
"27 tháng 10, 1994","1994-10-27"
"thứ bảy, ngày 18 tháng 2 năm 1989","1989-02-18"
"09.06.12","2012-06-09"
"9 tháng 2 1995","1995-02-09"
"24 thg 12, 2017","2017-12-24"
"22 tháng 5 1995","1995-05-22"
"21 tháng 10 1990","1990-10-21"
"26 tháng 4 2001","2001-04-26"
"tháng 7 2 1977","1977-07-02"
"23 thg 7 1972","1972-07-23"
"20.08.05","2005-08-20"
"16 11 08","2008-11-16"
"19 tháng 5 1982","1982-05-19"
"04.02.71","1971-02-04"
"thứ sáu, ngày 30 tháng 6 năm 2017","2017-06-30"
"THÁNG 11 8, 1978","1978-11-08"
"21 tháng 3, 2003","2003-03-21"
"8 thg 8, 2013","2013-08-08"
"28 tháng 7, 1992","1992-07-28"
"THỨ TƯ, NGÀY 28 THÁNG 3 NĂM 2001","2001-03-28"
"26/01/1993","1993-01-26"
"26 THG 2 1978","1978-02-26"
"24 thg 7, 1973","1973-07-24"
"30 thg 4, 1981","1981-04-30"
"18 thg 2, 1971","1971-02-18"
"23/11/2001","2001-11-23"
"12/11/1973","1973-11-12"
"Ngày 10 tháng 09 năm 1975","1975-09-10"
"THỨ NĂM, NGÀY 17 THÁNG 5 NĂM 2007","2007-05-17"
"08, thg 6 1990","1990-06-08"
"Ngày 12 tháng 09 năm 1993","1993-09-12"
"13.04.16","2016-04-13"
"tháng 8 21, 2009","2009-08-21"
"12 02 89","1989-02-12"
"28/10/1984","1984-10-28"
"11 04 06","2006-04-11"
"NGÀY 20 THÁNG 06 NĂM 2013","2013-06-20"
"27 tháng 4, 1977","1977-04-27"
"4 09 00","2000-09-04"
"7 tháng 8 1983","1983-08-07"
"30 tháng 5 1981","1981-05-30"
"1 tháng 2, 2016","2016-02-01"
"15 thg 11 1985","1985-11-15"
"31 tháng 1 1978","1978-01-31"
"Ngày 11 tháng 07 năm 1974","1974-07-11"
"3 THG 11, 2018","2018-11-03"
"20 thg 1 1987","1987-01-20"
"19 tháng 7 1998","1998-07-19"
"THỨ BA, NGÀY 09 THÁNG 10 NĂM 1973","1973-10-09"
"27.02.97","1997-02-27"
"26 thg 9, 1972","1972-09-26"
"11 thg 8, 2017","2017-08-11"
"11 thg 5 2006","2006-05-11"
"Ngày 28 tháng 11 năm 1982","1982-11-28"
"12 THG 2 2012","2012-02-12"
"Thứ Bảy, ngày 05 tháng 1 năm 2002","2002-01-05"
"20 thg 5 2001","2001-05-20"
"21 thg 3 1973","1973-03-21"
"20 09 81","1981-09-20"
"15/01/1991","1991-01-15"
"17, thg 1 2017","2017-01-17"
"THÁNG 5 19, 1984","1984-05-19"
"26 tháng 8 2018","2018-08-26"
"3 THÁNG 8 2008","2008-08-03"
"thứ hai, ngày 27 tháng 6 năm 2005","2005-06-27"
"25.07.03","2003-07-25"
"30 THÁNG 9 1982","1982-09-30"
"thứ năm, ngày 20 tháng 10 năm 2016","2016-10-20"
"29 03 95","1995-03-29"
"27.10.83","1983-10-27"
"14/04/1984","1984-04-14"
"29.04.78","1978-04-29"
"28 12 18","2018-12-28"
"8 12 08","2008-12-08"
"6 tháng 11 1988","1988-11-06"
"9 thg 8, 1971","1971-08-09"
"19 10 08","2008-10-19"
"3 thg 2, 2000","2000-02-03"
"14.01.79","1979-01-14"
"26, THG 2 1991","1991-02-26"
"18 THÁNG 12, 1993","1993-12-18"
"19 thg 8, 2005","2005-08-19"
"9 THG 11, 1989","1989-11-09"
"05 THG 4 1998","1998-04-05"
"25 01 71","1971-01-25"
"ngày 03 tháng 10 năm 2007","2007-10-03"
"THÁNG 10 23, 1999","1999-10-23"
"29, thg 6 1985","1985-06-29"
"17 tháng 3 2007","2007-03-17"
"11 thg 8 1979","1979-08-11"
"tháng 11 10, 1994","1994-11-10"
"22 thg 1 1972","1972-01-22"
"15 05 01","2001-05-15"
"6 thg 4, 1997","1997-04-06"
"4 THG 3, 2008","2008-03-04"
"THÁNG 5 13, 1991","1991-05-13"
"3 thg 2, 1987","1987-02-03"
"25 tháng 11 1982","1982-11-25"
"THÁNG 7 11, 2003","2003-07-11"
"Thứ Hai, ngày 28 tháng 10 năm 2013","2013-10-28"
"THÁNG 7 18, 1987","1987-07-18"
"21 07 00","2000-07-21"
"tháng 6 26 1990","1990-06-26"
"18 thg 8 1989","1989-08-18"
"18 tháng 1 1994","1994-01-18"
"17 thg 7 1987","1987-07-17"
"19 THG 9 1996","1996-09-19"
"THÁNG 4 14 2016","2016-04-14"
"chủ nhật, ngày 21 tháng 1 năm 1979","1979-01-21"
"04.02.92","1992-02-04"
"Thứ Bảy, ngày 08 tháng 12 năm 1984","1984-12-08"
"thứ năm, ngày 12 tháng 12 năm 1996","1996-12-12"
"26 THÁNG 11 2011","2011-11-26"
"22.11.94","1994-11-22"
"11 thg 1, 2016","2016-01-11"
"13/10/2002","2002-10-13"
"15, THG 12 2008","2008-12-15"
"04/08/1982","1982-08-04"
"5 thg 5 2012","2012-05-05"
"18 THÁNG 11, 1994","1994-11-18"
"16/03/1973","1973-03-16"
"02.07.92","1992-07-02"
"18 tháng 1 2012","2012-01-18"
"NGÀY 01 THÁNG 11 NĂM 1983","1983-11-01"
"28 tháng 5, 1971","1971-05-28"
"tháng 12 22 2005","2005-12-22"
"14 thg 5, 1979","1979-05-14"
"11 thg 2, 1995","1995-02-11"
"6 06 02","2002-06-06"
"13.03.91","1991-03-13"
"Thứ Hai, ngày 05 tháng 3 năm 2018","2018-03-05"
"13 THG 12 1975","1975-12-13"
"31.03.75","1975-03-31"
"Ngày 24 tháng 09 năm 1999","1999-09-24"
"thứ ba, ngày 30 tháng 5 năm 2017","2017-05-30"
"22 thg 1 2015","2015-01-22"
"25 THG 12 2009","2009-12-25"
"25 tháng 8 1995","1995-08-25"
"25/03/2010","2010-03-25"
"27 THG 12 2016","2016-12-27"
"20.02.82","1982-02-20"
"8 02 08","2008-02-08"
"Thứ Sáu, ngày 23 tháng 8 năm 2013","2013-08-23"
"29 tháng 9 1991","1991-09-29"
"20/04/2018","2018-04-20"
"24 tháng 2 2001","2001-02-24"
"Thứ Ba, ngày 10 tháng 12 năm 1996","1996-12-10"
"15, thg 5 2000","2000-05-15"
"7 thg 7, 1992","1992-07-07"
"4 04 83","1983-04-04"
"24 tháng 9, 2001","2001-09-24"
"17 thg 1, 2010","2010-01-17"
"10 tháng 9, 1985","1985-09-10"
"19 thg 4, 2006","2006-04-19"
"20 THG 5, 1973","1973-05-20"
"9 THG 9 2004","2004-09-09"
"THỨ SÁU, NGÀY 17 THÁNG 6 NĂM 2016","2016-06-17"
"ngày 15 tháng 09 năm 2002","2002-09-15"
"24 tháng 1, 2014","2014-01-24"
"20 thg 5, 2004","2004-05-20"
"27 thg 10 1983","1983-10-27"
"Ngày 25 tháng 11 năm 1976","1976-11-25"
"02.03.14","2014-03-02"
"tháng 10 5 1995","1995-10-05"
"22/06/1992","1992-06-22"
"4 THG 1, 1979","1979-01-04"
"Thứ Năm, ngày 15 tháng 6 năm 1989","1989-06-15"
"3 THG 9, 2015","2015-09-03"
"9 THÁNG 9 2011","2011-09-09"
"tháng 4 16 2000","2000-04-16"
"9 THÁNG 8 2003","2003-08-09"
"29 THG 1 1994","1994-01-29"
"17 tháng 8 2013","2013-08-17"
"23 tháng 7, 1995","1995-07-23"
"11 07 17","2017-07-11"
"07 thg 12 2014","2014-12-07"
"CHỦ NHẬT, NGÀY 21 THÁNG 4 NĂM 1974","1974-04-21"
"4 THÁNG 6 2011","2011-06-04"
"4 thg 6, 1971","1971-06-04"
"19 thg 1 1996","1996-01-19"
"24/05/1978","1978-05-24"
"tháng 3 6 1978","1978-03-06"
"19 thg 12, 1998","1998-12-19"
"1 thg 9, 1989","1989-09-01"
"11 tháng 7, 1995","1995-07-11"
"29.07.06","2006-07-29"
"2 11 96","1996-11-02"
"Ngày 16 tháng 01 năm 1991","1991-01-16"
"12 thg 2 1987","1987-02-12"
"tháng 8 25, 2013","2013-08-25"
"22 tháng 12, 1993","1993-12-22"
"5 thg 2, 1980","1980-02-05"
"31 01 96","1996-01-31"
"13 thg 2, 1989","1989-02-13"
"05 thg 5 1998","1998-05-05"
"thứ ba, ngày 28 tháng 3 năm 1978","1978-03-28"
"27 THÁNG 2 1984","1984-02-27"
"01/01/2000","2000-01-01"
"ngày 12 tháng 06 năm 1979","1979-06-12"
"31 thg 3, 1982","1982-03-31"
"07.05.97","1997-05-07"
"8 thg 2, 1980","1980-02-08"
"13.08.72","1972-08-13"
"19.08.94","1994-08-19"
"20 THG 2 1984","1984-02-20"
"14, thg 9 2006","2006-09-14"
"19 thg 1 2007","2007-01-19"
"17 THG 6 2003","2003-06-17"
"Thứ Ba, ngày 10 tháng 2 năm 1976","1976-02-10"
"1 thg 9, 2015","2015-09-01"
"06.06.97","1997-06-06"
"16 tháng 12 2003","2003-12-16"
"30/01/2010","2010-01-30"
"21 thg 11, 1985","1985-11-21"
"27/12/2012","2012-12-27"
"1 tháng 5 1999","1999-05-01"
"17 tháng 8 2015","2015-08-17"
"11/07/1988","1988-07-11"
"31.12.03","2003-12-31"
"tháng 6 18 1993","1993-06-18"
"7 01 97","1997-01-07"
"NGÀY 09 THÁNG 12 NĂM 2004","2004-12-09"
"15, thg 8 1992","1992-08-15"
"27 thg 2, 2004","2004-02-27"
"03 THG 2 1977","1977-02-03"
"13/12/2008","2008-12-13"
"09, thg 4 2001","2001-04-09"
"tháng 4 23 1996","1996-04-23"
"22 thg 9 1984","1984-09-22"
"tháng 12 22 1987","1987-12-22"
"09.02.78","1978-02-09"
"tháng 3 2 1993","1993-03-02"
"10 THG 3 1990","1990-03-10"
"ngày 30 tháng 09 năm 1991","1991-09-30"
"19 THÁNG 5 1983","1983-05-19"
"17 thg 8, 2007","2007-08-17"
"30 tháng 8, 2011","2011-08-30"
"THÁNG 8 18, 1998","1998-08-18"
"26 thg 11 2009","2009-11-26"
"25 tháng 7 1970","1970-07-25"
"25 thg 12, 1974","1974-12-25"
"12 THG 1 1997","1997-01-12"
"25 THG 2, 2012","2012-02-25"
"21 thg 3, 2005","2005-03-21"
"22/03/1995","1995-03-22"
"24 thg 2, 1983","1983-02-24"
"01, thg 4 2012","2012-04-01"
"17 thg 1, 1990","1990-01-17"
"27, thg 10 1984","1984-10-27"
"24 03 76","1976-03-24"
"27 THÁNG 9 2016","2016-09-27"
"30/06/2014","2014-06-30"
"10 THG 2, 1971","1971-02-10"
"29 thg 12, 1984","1984-12-29"
"Chủ Nhật, ngày 21 tháng 1 năm 1990","1990-01-21"
"4 tháng 7 2016","2016-07-04"
"29 thg 4, 2002","2002-04-29"
"THÁNG 7 11, 1970","1970-07-11"
"30.10.15","2015-10-30"
"19 THÁNG 12 1976","1976-12-19"
"9 THG 12, 1992","1992-12-09"
"13 thg 7 1971","1971-07-13"
"Ngày 13 tháng 11 năm 1973","1973-11-13"
"22 THÁNG 12 2016","2016-12-22"
"Ngày 09 tháng 07 năm 1982","1982-07-09"
"10.01.70","1970-01-10"
"chủ nhật, ngày 22 tháng 4 năm 2007","2007-04-22"
"8 thg 11, 1981","1981-11-08"
"ngày 07 tháng 04 năm 2018","2018-04-07"
"13, thg 2 1981","1981-02-13"
"Thứ Sáu, ngày 11 tháng 8 năm 2000","2000-08-11"
"1 tháng 9 1982","1982-09-01"
"THỨ SÁU, NGÀY 23 THÁNG 1 NĂM 1981","1981-01-23"
"29 06 00","2000-06-29"
"25 tháng 1 1997","1997-01-25"
"31 tháng 8, 2018","2018-08-31"
"19 THG 1 1970","1970-01-19"
"15/05/1971","1971-05-15"
"4 thg 12 2000","2000-12-04"
"THỨ HAI, NGÀY 18 THÁNG 2 NĂM 1991","1991-02-18"
"1 thg 4, 1992","1992-04-01"
"tháng 11 18 1983","1983-11-18"
"08 THG 2 1988","1988-02-08"
"13 tháng 12, 1986","1986-12-13"
"6 THÁNG 2 2001","2001-02-06"
"22 thg 11, 2001","2001-11-22"
"9 THÁNG 4 1986","1986-04-09"
"13 thg 11 2008","2008-11-13"
"22.11.86","1986-11-22"
"26 THG 8, 2014","2014-08-26"
"09 THG 1 1997","1997-01-09"
"2 tháng 5 2006","2006-05-02"
"tháng 11 16, 2000","2000-11-16"
"9 thg 12, 1989","1989-12-09"
"25 thg 2 1991","1991-02-25"
"30 05 08","2008-05-30"
"21, thg 4 1997","1997-04-21"
"10 THÁNG 7, 1982","1982-07-10"
"10 thg 4 2002","2002-04-10"
"1 tháng 10, 1995","1995-10-01"
"Ngày 12 tháng 09 năm 1983","1983-09-12"
"23 thg 8 1978","1978-08-23"
"17 tháng 8, 1983","1983-08-17"
"9 03 09","2009-03-09"
"9 thg 12, 1985","1985-12-09"
"22, thg 4 2015","2015-04-22"
"tháng 8 18 1990","1990-08-18"
"17 02 08","2008-02-17"
"04, THG 8 2018","2018-08-04"
"Thứ Bảy, ngày 21 tháng 6 năm 2003","2003-06-21"
"tháng 11 29 1986","1986-11-29"
"20 tháng 12, 2002","2002-12-20"
"Thứ Sáu, ngày 11 tháng 6 năm 1993","1993-06-11"
"2 thg 12 1992","1992-12-02"
"30 thg 4, 1988","1988-04-30"
"31 thg 8 2013","2013-08-31"
"NGÀY 11 THÁNG 03 NĂM 1988","1988-03-11"
"3 tháng 4, 1976","1976-04-03"
"10.08.96","1996-08-10"
"15, thg 3 1978","1978-03-15"
"27.12.72","1972-12-27"
"15 THÁNG 5 1970","1970-05-15"
"26 06 77","1977-06-26"
"20 THÁNG 9, 1984","1984-09-20"
"31 03 13","2013-03-31"
"11, THG 10 1982","1982-10-11"
"02/12/2013","2013-12-02"
"09.05.96","1996-05-09"
"NGÀY 03 THÁNG 10 NĂM 2001","2001-10-03"
"24 THÁNG 5, 1972","1972-05-24"
"21 tháng 4 2013","2013-04-21"
"29 thg 3, 2010","2010-03-29"
"24 thg 1 1981","1981-01-24"
"4 tháng 7, 2005","2005-07-04"
"02 thg 3 1979","1979-03-02"
"2 11 10","2010-11-02"
"8 thg 11 1996","1996-11-08"
"thứ sáu, ngày 24 tháng 10 năm 1997","1997-10-24"
"Thứ Bảy, ngày 13 tháng 8 năm 1977","1977-08-13"
"tháng 1 11 1985","1985-01-11"
"01, THG 1 2014","2014-01-01"
"16 thg 1 1995","1995-01-16"
"7 tháng 7 2004","2004-07-07"
"07.04.98","1998-04-07"
"tháng 2 6, 1993","1993-02-06"
"THỨ SÁU, NGÀY 08 THÁNG 4 NĂM 2011","2011-04-08"
"03, thg 8 1976","1976-08-03"
"tháng 7 17, 1985","1985-07-17"
"12 thg 9, 2013","2013-09-12"
"22 THG 1, 2017","2017-01-22"
"ngày 09 tháng 08 năm 2002","2002-08-09"
"06.09.10","2010-09-06"
"03 thg 2 1972","1972-02-03"
"17 thg 2, 2015","2015-02-17"
"26 THG 1, 2018","2018-01-26"
"tháng 6 13 1990","1990-06-13"
"8 08 18","2018-08-08"
"Ngày 20 tháng 03 năm 1994","1994-03-20"
"tháng 3 10 1971","1971-03-10"
"14 thg 7, 1996","1996-07-14"
"13 tháng 9 2009","2009-09-13"
"22, thg 3 2001","2001-03-22"
"4 tháng 10 1981","1981-10-04"
"17 thg 6, 1993","1993-06-17"
"28 thg 8 2002","2002-08-28"
"16 THG 12 2013","2013-12-16"
"12 tháng 6 1998","1998-06-12"
"17 thg 3 1984","1984-03-17"
"17 thg 4 1979","1979-04-17"
"tháng 6 6, 2014","2014-06-06"
"14 thg 12, 1976","1976-12-14"
"17 THG 3, 2016","2016-03-17"
"NGÀY 23 THÁNG 04 NĂM 1990","1990-04-23"
"28/03/2001","2001-03-28"
"09, thg 9 1986","1986-09-09"
"28 thg 5, 1980","1980-05-28"
"THÁNG 12 22, 1978","1978-12-22"
"24 03 72","1972-03-24"
"THÁNG 11 17, 1974","1974-11-17"
"15 thg 6 2002","2002-06-15"
"18 thg 12 1998","1998-12-18"
"tháng 5 10 2008","2008-05-10"
"12, thg 6 1985","1985-06-12"
"25 tháng 6, 1984","1984-06-25"
"20 thg 5, 1973","1973-05-20"
"22 thg 5 1978","1978-05-22"
"14 11 96","1996-11-14"
"THÁNG 2 27 1988","1988-02-27"
"18 thg 1, 2007","2007-01-18"
"21/11/1970","1970-11-21"
"tháng 1 28 1981","1981-01-28"
"12/03/2010","2010-03-12"
"29 tháng 5 1991","1991-05-29"
"01.09.71","1971-09-01"
"22 thg 6 1982","1982-06-22"
"21 thg 11, 1985","1985-11-21"
"16 09 86","1986-09-16"
"19 tháng 1, 1980","1980-01-19"
"20 tháng 2 2000","2000-02-20"
"29, THG 7 1986","1986-07-29"
"14 thg 11 1990","1990-11-14"
"Ngày 06 tháng 01 năm 1994","1994-01-06"
"27/09/1987","1987-09-27"
"18 thg 3, 2002","2002-03-18"
"Thứ Năm, ngày 29 tháng 3 năm 1984","1984-03-29"
"22/03/1985","1985-03-22"
"tháng 9 5, 1980","1980-09-05"
"14 thg 3 2012","2012-03-14"
"15 tháng 10, 1979","1979-10-15"
"6 tháng 10 2001","2001-10-06"
"Ngày 18 tháng 11 năm 1972","1972-11-18"
"ngày 07 tháng 12 năm 2001","2001-12-07"
"23 thg 6 1976","1976-06-23"
"24/11/2009","2009-11-24"
"thứ năm, ngày 23 tháng 6 năm 1994","1994-06-23"
"24 tháng 10 2009","2009-10-24"
"17 THG 5 1973","1973-05-17"
"Thứ Bảy, ngày 15 tháng 2 năm 2003","2003-02-15"
"24 THG 4, 1994","1994-04-24"
"31.05.70","1970-05-31"
"24.04.91","1991-04-24"
"Thứ Sáu, ngày 15 tháng 10 năm 1976","1976-10-15"
"28.03.09","2009-03-28"
"1 thg 12, 1985","1985-12-01"
"1 01 96","1996-01-01"
"30, thg 8 2016","2016-08-30"
"16, thg 10 2015","2015-10-16"
"12.03.09","2009-03-12"
"Thứ Sáu, ngày 25 tháng 6 năm 1999","1999-06-25"
"03, THG 12 1975","1975-12-03"
"10/05/1988","1988-05-10"
"14.04.86","1986-04-14"
"30 09 04","2004-09-30"
"15 THÁNG 12, 2005","2005-12-15"
"1 thg 12, 2000","2000-12-01"
"23 thg 1, 2008","2008-01-23"
"8 12 18","2018-12-08"
"26 thg 9 1996","1996-09-26"
"15 thg 2 2012","2012-02-15"
"17 tháng 3, 1976","1976-03-17"
"Thứ Tư, ngày 21 tháng 10 năm 1987","1987-10-21"
"THÁNG 7 21 2000","2000-07-21"
"10 tháng 7 1997","1997-07-10"
"1 tháng 11 1973","1973-11-01"
"25 07 91","1991-07-25"
"16 THG 11, 1978","1978-11-16"
"11 thg 9 1973","1973-09-11"
"23 07 11","2011-07-23"
"2 tháng 5, 2012","2012-05-02"
"17 tháng 8 1981","1981-08-17"
"ngày 24 tháng 06 năm 1986","1986-06-24"
"29 THÁNG 10 2001","2001-10-29"
"ngày 07 tháng 08 năm 1980","1980-08-07"
"27 tháng 6, 2006","2006-06-27"
"22 THG 1, 1979","1979-01-22"
"10 tháng 8 2017","2017-08-10"
"13 thg 8, 1986","1986-08-13"
"17 THÁNG 4 2016","2016-04-17"
"tháng 6 14 2011","2011-06-14"
"tháng 8 10, 1998","1998-08-10"
"26 thg 3 2013","2013-03-26"
"Ngày 15 tháng 02 năm 2011","2011-02-15"
"4 THÁNG 2 2000","2000-02-04"
"Ngày 01 tháng 01 năm 2004","2004-01-01"
"tháng 2 11 2007","2007-02-11"
"2 tháng 12 1982","1982-12-02"
"tháng 1 13, 2000","2000-01-13"
"5 tháng 11 2004","2004-11-05"
"19 05 79","1979-05-19"
"Ngày 19 tháng 04 năm 1972","1972-04-19"
"10 thg 11 2017","2017-11-10"
"2 thg 5, 1971","1971-05-02"
"24 thg 11, 1973","1973-11-24"
"7 THÁNG 6 1995","1995-06-07"
"20/09/1993","1993-09-20"
"07/09/1991","1991-09-07"
"29 thg 4, 2008","2008-04-29"
"28 THÁNG 7 2011","2011-07-28"
"tháng 5 3, 1990","1990-05-03"
"22 THG 1 2004","2004-01-22"
"Ngày 16 tháng 10 năm 1974","1974-10-16"
"Ngày 05 tháng 03 năm 1971","1971-03-05"
"ngày 29 tháng 11 năm 1996","1996-11-29"
"31 tháng 7 2009","2009-07-31"
"30 thg 1, 2014","2014-01-30"
"Chủ Nhật, ngày 01 tháng 6 năm 1975","1975-06-01"
"10 01 92","1992-01-10"
"16 thg 7, 2011","2011-07-16"
"25 THÁNG 2, 2013","2013-02-25"
"Thứ Sáu, ngày 25 tháng 7 năm 1997","1997-07-25"
"9 tháng 11 2010","2010-11-09"
"18 thg 7 2000","2000-07-18"
"16 tháng 6 2010","2010-06-16"
"5 THÁNG 12 1972","1972-12-05"
"Thứ Hai, ngày 18 tháng 8 năm 2003","2003-08-18"
"31 tháng 3 1971","1971-03-31"
"11 tháng 9, 2014","2014-09-11"
"THỨ NĂM, NGÀY 19 THÁNG 9 NĂM 2002","2002-09-19"
"26/11/1988","1988-11-26"
"14 thg 12 2017","2017-12-14"
"29 tháng 3, 1985","1985-03-29"
"4 THÁNG 7 2018","2018-07-04"
"16.01.06","2006-01-16"
"27 thg 4, 1987","1987-04-27"
"NGÀY 07 THÁNG 01 NĂM 1972","1972-01-07"
"29 tháng 4, 2011","2011-04-29"
"20 09 16","2016-09-20"
"CHỦ NHẬT, NGÀY 07 THÁNG 8 NĂM 2011","2011-08-07"
"24, THG 8 2018","2018-08-24"
"tháng 10 7 2005","2005-10-07"
"NGÀY 11 THÁNG 04 NĂM 1991","1991-04-11"
"8 thg 1, 2005","2005-01-08"
"22 01 71","1971-01-22"
"6 thg 9, 1997","1997-09-06"
"15 tháng 7 2009","2009-07-15"
"3 THÁNG 1 2003","2003-01-03"
"tháng 7 14 1974","1974-07-14"
"26.10.82","1982-10-26"
"21 thg 11, 2001","2001-11-21"
"03 thg 7 1991","1991-07-03"
"6 thg 6 1991","1991-06-06"
"15.02.98","1998-02-15"
"tháng 12 1 1999","1999-12-01"
"ngày 07 tháng 05 năm 2012","2012-05-07"
"Thứ Ba, ngày 05 tháng 2 năm 2002","2002-02-05"
"12 THG 7 2015","2015-07-12"
"28, thg 8 2005","2005-08-28"
"15 03 13","2013-03-15"
"tháng 4 20, 1992","1992-04-20"
"22, thg 1 1975","1975-01-22"
"02 thg 4 1995","1995-04-02"
"THỨ BA, NGÀY 03 THÁNG 8 NĂM 1982","1982-08-03"
"10 tháng 5, 2002","2002-05-10"
"23 thg 1 1984","1984-01-23"
"tháng 4 16, 2005","2005-04-16"
"26 thg 4, 1979","1979-04-26"
"7 thg 1 1980","1980-01-07"
"18 THÁNG 2 1974","1974-02-18"
"16 THG 3, 1981","1981-03-16"
"30.04.10","2010-04-30"
"Ngày 17 tháng 05 năm 1974","1974-05-17"
"NGÀY 25 THÁNG 04 NĂM 1988","1988-04-25"
"tháng 1 20 2010","2010-01-20"
"Ngày 12 tháng 08 năm 1983","1983-08-12"
"20 thg 12, 1994","1994-12-20"
"tháng 9 18, 1978","1978-09-18"
"29 thg 4, 1978","1978-04-29"
"6 THG 8, 2014","2014-08-06"
"30.09.99","1999-09-30"
"Ngày 09 tháng 07 năm 1997","1997-07-09"
"02.02.18","2018-02-02"
"23 tháng 7, 2001","2001-07-23"
"31.03.03","2003-03-31"
"30/09/1977","1977-09-30"
"4 tháng 12 2017","2017-12-04"
"THỨ HAI, NGÀY 06 THÁNG 8 NĂM 1979","1979-08-06"
"15/02/1975","1975-02-15"
"ngày 29 tháng 12 năm 1975","1975-12-29"
"tháng 9 15 1974","1974-09-15"
"11 thg 2, 1996","1996-02-11"
"04/05/2018","2018-05-04"
"12 thg 11 1980","1980-11-12"
"tháng 12 18 1987","1987-12-18"
"THÁNG 12 2, 1999","1999-12-02"
"13, THG 7 1985","1985-07-13"
"01/05/1986","1986-05-01"
"THÁNG 9 14, 1980","1980-09-14"
"NGÀY 08 THÁNG 04 NĂM 2009","2009-04-08"
"THỨ BẢY, NGÀY 04 THÁNG 8 NĂM 2012","2012-08-04"
"5 tháng 2, 1977","1977-02-05"
"24 THG 8 1978","1978-08-24"
"Ngày 09 tháng 07 năm 2017","2017-07-09"
"17 tháng 4 1977","1977-04-17"
"tháng 5 23, 1976","1976-05-23"
"ngày 11 tháng 02 năm 1993","1993-02-11"
"16 thg 6 1971","1971-06-16"
"5 thg 5, 2006","2006-05-05"
"tháng 4 3, 1996","1996-04-03"
"16/12/2014","2014-12-16"
"15 thg 2 1995","1995-02-15"
"14 07 95","1995-07-14"
"18 thg 8 1984","1984-08-18"
"13 THG 7, 2004","2004-07-13"
"8 thg 12 1977","1977-12-08"
"31/03/2012","2012-03-31"
"03.04.94","1994-04-03"
"10 tháng 9 2007","2007-09-10"
"20 thg 10 1988","1988-10-20"
"THÁNG 7 11, 1984","1984-07-11"
"16 THG 12, 1998","1998-12-16"
"25 thg 10 1986","1986-10-25"
"ngày 21 tháng 10 năm 1990","1990-10-21"
"31 thg 7 1991","1991-07-31"
"thứ hai, ngày 28 tháng 11 năm 2016","2016-11-28"
"Chủ Nhật, ngày 19 tháng 9 năm 1976","1976-09-19"
"17 thg 8, 2008","2008-08-17"
"tháng 7 26, 1978","1978-07-26"
"23.06.76","1976-06-23"
"26/09/1979","1979-09-26"
"27 thg 1 2007","2007-01-27"
"22, thg 9 2018","2018-09-22"
"30, thg 11 2004","2004-11-30"
"12 thg 6, 1977","1977-06-12"
"2 THG 2, 1985","1985-02-02"
"THÁNG 7 21 1993","1993-07-21"
"Ngày 04 tháng 02 năm 1988","1988-02-04"
"21.05.89","1989-05-21"
"tháng 11 4 2012","2012-11-04"
"2 11 02","2002-11-02"
"30 thg 9 1992","1992-09-30"
"23 THÁNG 6 1995","1995-06-23"
"11 09 05","2005-09-11"
"06 thg 11 1999","1999-11-06"
"16 thg 4 1989","1989-04-16"
"14.02.08","2008-02-14"
"23 thg 12 1978","1978-12-23"
"9 thg 9, 1994","1994-09-09"
"27 05 75","1975-05-27"
"27.03.71","1971-03-27"
"14/10/2014","2014-10-14"
"19 tháng 9 1981","1981-09-19"
"06.08.85","1985-08-06"
"16 thg 5, 2014","2014-05-16"
"30 THÁNG 3, 2008","2008-03-30"
"4 11 89","1989-11-04"
"Ngày 06 tháng 03 năm 1994","1994-03-06"
"19 thg 11, 1994","1994-11-19"
"23 tháng 12, 1971","1971-12-23"
"Ngày 07 tháng 02 năm 2001","2001-02-07"
"20 thg 5 2004","2004-05-20"
"4 thg 10 1994","1994-10-04"
"26 thg 12 1976","1976-12-26"
"28 thg 9 1981","1981-09-28"
"Thứ Bảy, ngày 30 tháng 9 năm 1995","1995-09-30"
"20 thg 9 1985","1985-09-20"
"27 tháng 4, 1979","1979-04-27"
"25 07 13","2013-07-25"
"26 thg 7, 1986","1986-07-26"
"26 05 14","2014-05-26"
"4 07 75","1975-07-04"
"11/11/1994","1994-11-11"
"22 THG 7 1986","1986-07-22"
"09/03/1987","1987-03-09"
"21 thg 8 1982","1982-08-21"
"22 THÁNG 6 1992","1992-06-22"
"Thứ Bảy, ngày 05 tháng 11 năm 2005","2005-11-05"
"22 thg 6 1988","1988-06-22"
"tháng 7 11 1983","1983-07-11"
"8 tháng 3, 1971","1971-03-08"
"17.03.18","2018-03-17"
"thứ ba, ngày 19 tháng 7 năm 1983","1983-07-19"
"20 tháng 1 1988","1988-01-20"
"05.07.75","1975-07-05"
"11 tháng 5 1997","1997-05-11"
"9 tháng 7 1980","1980-07-09"
"12, THG 11 1975","1975-11-12"
"15, thg 5 1982","1982-05-15"
"31.05.04","2004-05-31"
"THỨ TƯ, NGÀY 03 THÁNG 2 NĂM 1999","1999-02-03"
"14 08 97","1997-08-14"
"21 thg 2, 1992","1992-02-21"
"Thứ Tư, ngày 12 tháng 2 năm 1997","1997-02-12"
"21 tháng 5, 1984","1984-05-21"
"tháng 9 3 1995","1995-09-03"
"9 thg 8 1986","1986-08-09"
"22.11.81","1981-11-22"
"23/05/1977","1977-05-23"
"Ngày 06 tháng 06 năm 2016","2016-06-06"
"4 07 79","1979-07-04"
"NGÀY 01 THÁNG 06 NĂM 2004","2004-06-01"
"31 THÁNG 7 2016","2016-07-31"
"Thứ Tư, ngày 06 tháng 4 năm 2005","2005-04-06"
"ngày 22 tháng 12 năm 2005","2005-12-22"
"2 THÁNG 7, 1977","1977-07-02"
"tháng 3 1, 2001","2001-03-01"
"17, thg 11 2006","2006-11-17"
"ngày 04 tháng 08 năm 1976","1976-08-04"
"2 11 14","2014-11-02"
"ngày 06 tháng 12 năm 1987","1987-12-06"
"THỨ TƯ, NGÀY 01 THÁNG 5 NĂM 1974","1974-05-01"
"23 04 93","1993-04-23"
"tháng 7 3 1986","1986-07-03"
"08, THG 3 1983","1983-03-08"
"tháng 5 10 1995","1995-05-10"
"27 THG 8 2017","2017-08-27"
"Ngày 04 tháng 06 năm 2010","2010-06-04"
"NGÀY 31 THÁNG 10 NĂM 1989","1989-10-31"
"15 THG 4 1979","1979-04-15"
"tháng 5 28 2009","2009-05-28"
"THÁNG 1 23 2016","2016-01-23"
"05.10.10","2010-10-05"
"27 tháng 7, 1982","1982-07-27"
"tháng 9 16, 2011","2011-09-16"
"24, thg 10 1987","1987-10-24"
"tháng 8 11, 2001","2001-08-11"
"24 thg 11 2006","2006-11-24"
"21.10.95","1995-10-21"
"21/07/1975","1975-07-21"
"8 thg 5, 1989","1989-05-08"
"Ngày 07 tháng 01 năm 2004","2004-01-07"
"22 tháng 11 1973","1973-11-22"
"tháng 12 8, 1985","1985-12-08"
"12.01.96","1996-01-12"
"Thứ Tư, ngày 23 tháng 3 năm 2011","2011-03-23"
"Ngày 31 tháng 08 năm 1987","1987-08-31"
"30.08.11","2011-08-30"
"21/07/2011","2011-07-21"
"19/02/2014","2014-02-19"
"chủ nhật, ngày 15 tháng 8 năm 1999","1999-08-15"
"Chủ Nhật, ngày 19 tháng 5 năm 2002","2002-05-19"
"21 THÁNG 3 2018","2018-03-21"
"8 tháng 12 2006","2006-12-08"
"10, thg 9 2008","2008-09-10"
"ngày 21 tháng 05 năm 1974","1974-05-21"
"24 tháng 3 1990","1990-03-24"
"3 THG 3, 1998","1998-03-03"
"17 thg 12, 1997","1997-12-17"
"tháng 1 17 1975","1975-01-17"
"tháng 1 6, 1999","1999-01-06"
"20 THÁNG 11, 1987","1987-11-20"
"20/10/1974","1974-10-20"
"09.04.03","2003-04-09"
"2 08 97","1997-08-02"
"26 thg 11, 1981","1981-11-26"
"6 thg 3 1988","1988-03-06"
"Ngày 29 tháng 11 năm 2005","2005-11-29"
"24 thg 11 1971","1971-11-24"
"tháng 8 12 1977","1977-08-12"
"21 thg 5 1971","1971-05-21"
"18 thg 2, 1994","1994-02-18"
"17 tháng 5 2018","2018-05-17"
"ngày 08 tháng 10 năm 2002","2002-10-08"
"tháng 11 30, 2007","2007-11-30"
"15.02.12","2012-02-15"
"8 tháng 7 1985","1985-07-08"
"tháng 2 14, 2004","2004-02-14"
"22, thg 5 1996","1996-05-22"
"08/11/1973","1973-11-08"
"26 thg 8 2015","2015-08-26"
"12.05.07","2007-05-12"
"14 thg 12 2012","2012-12-14"
"14 02 95","1995-02-14"
"26 THG 6 2006","2006-06-26"
"4 tháng 12, 2005","2005-12-04"
"tháng 7 14, 1970","1970-07-14"
"tháng 7 27 1987","1987-07-27"
"22 THÁNG 10 1997","1997-10-22"
"28 tháng 7 1976","1976-07-28"
"Thứ Ba, ngày 27 tháng 5 năm 1980","1980-05-27"
"THỨ BA, NGÀY 10 THÁNG 1 NĂM 2006","2006-01-10"
"THÁNG 8 8, 2011","2011-08-08"
"tháng 5 24, 2010","2010-05-24"
"tháng 4 15, 1976","1976-04-15"
"Ngày 22 tháng 08 năm 1988","1988-08-22"
"28 tháng 9 1976","1976-09-28"
"26 thg 5, 1993","1993-05-26"
"7 THG 4 1977","1977-04-07"
"THÁNG 12 19, 2003","2003-12-19"
"21/03/2001","2001-03-21"
"tháng 1 14, 2005","2005-01-14"
"28 tháng 1 1972","1972-01-28"
"13 tháng 5 1979","1979-05-13"
"21 tháng 10 1984","1984-10-21"
"THÁNG 2 27, 1986","1986-02-27"
"28 thg 7 1992","1992-07-28"
"Ngày 30 tháng 05 năm 2017","2017-05-30"
"tháng 10 21 1987","1987-10-21"
"21.12.86","1986-12-21"
"22 THG 10 2010","2010-10-22"
"THÁNG 9 21 1988","1988-09-21"
"13 thg 5, 2015","2015-05-13"
"21, thg 12 1980","1980-12-21"
"21.06.82","1982-06-21"
"26 thg 11, 2010","2010-11-26"
"tháng 6 27, 1981","1981-06-27"
"01/12/2018","2018-12-01"
"13 tháng 8 1994","1994-08-13"
"12.08.02","2002-08-12"
"Thứ Sáu, ngày 27 tháng 11 năm 2015","2015-11-27"
"24 thg 3 2014","2014-03-24"
"24 THG 1, 1986","1986-01-24"
"19, thg 6 1978","1978-06-19"
"tháng 12 20 1988","1988-12-20"
"10.12.10","2010-12-10"
"tháng 7 13 1986","1986-07-13"
"01 thg 8 1975","1975-08-01"
"24 thg 4, 1992","1992-04-24"
"6 THÁNG 6 2011","2011-06-06"
"3 thg 6, 1998","1998-06-03"
"9 thg 1, 2010","2010-01-09"
"9 tháng 10, 1978","1978-10-09"
"tháng 3 16, 1997","1997-03-16"
"12 THÁNG 6, 1989","1989-06-12"
"25 THG 1, 1998","1998-01-25"
"20 THÁNG 12, 1978","1978-12-20"
"4 thg 2 1990","1990-02-04"
"16 tháng 11 2001","2001-11-16"
"19 thg 3 2018","2018-03-19"
"11 06 16","2016-06-11"
"Thứ Năm, ngày 07 tháng 10 năm 1976","1976-10-07"
"27, thg 10 1993","1993-10-27"
"12, thg 1 1991","1991-01-12"
"22 THG 7 1982","1982-07-22"
"tháng 4 14, 1982","1982-04-14"
"12 THÁNG 12 1989","1989-12-12"
"05.02.97","1997-02-05"
"30 thg 7 1984","1984-07-30"
"23 tháng 9 1989","1989-09-23"
"2 02 74","1974-02-02"
"01 THG 4 2018","2018-04-01"
"tháng 11 29 1978","1978-11-29"
"9 tháng 5 1993","1993-05-09"
"2 thg 4 2003","2003-04-02"
"14 10 14","2014-10-14"
"15 tháng 1, 2006","2006-01-15"
"tháng 12 8, 1982","1982-12-08"
"Ngày 13 tháng 10 năm 1995","1995-10-13"
"20 thg 5, 1984","1984-05-20"
"05 thg 11 1979","1979-11-05"
"tháng 1 7 1998","1998-01-07"
"26 THG 2 1997","1997-02-26"
"Ngày 03 tháng 11 năm 2004","2004-11-03"
"12/01/2002","2002-01-12"
"25/09/2017","2017-09-25"
"27 thg 2 1999","1999-02-27"
"30 thg 11 1981","1981-11-30"
"Thứ Ba, ngày 21 tháng 10 năm 2003","2003-10-21"
"18 thg 8, 1987","1987-08-18"
"10 tháng 1, 2013","2013-01-10"
"9 tháng 1, 1975","1975-01-09"
"tháng 2 12, 2018","2018-02-12"
"07 thg 9 1973","1973-09-07"
"19 thg 10 1979","1979-10-19"
"9 thg 2, 1998","1998-02-09"
"25, thg 3 1990","1990-03-25"
"NGÀY 01 THÁNG 11 NĂM 1986","1986-11-01"
"20 tháng 12, 2007","2007-12-20"
"08, thg 3 2010","2010-03-08"
"19 thg 5, 1985","1985-05-19"
"27.02.11","2011-02-27"
"24/04/1999","1999-04-24"
"28 tháng 10 1971","1971-10-28"
"12 THG 9, 1974","1974-09-12"
"tháng 5 31, 2000","2000-05-31"
"21 THÁNG 10 1985","1985-10-21"
"01/01/2012","2012-01-01"
"NGÀY 08 THÁNG 05 NĂM 1974","1974-05-08"
"tháng 1 10, 2008","2008-01-10"
"tháng 1 7, 1992","1992-01-07"
"ngày 20 tháng 06 năm 1973","1973-06-20"
"Ngày 29 tháng 11 năm 1999","1999-11-29"
"07, THG 11 1984","1984-11-07"
"22 thg 1, 1986","1986-01-22"
"17 03 89","1989-03-17"
"18, thg 11 1983","1983-11-18"
"25 thg 4, 1993","1993-04-25"
"2 tháng 9, 1995","1995-09-02"
"Ngày 10 tháng 01 năm 1986","1986-01-10"
"8 tháng 4, 1985","1985-04-08"
"2 11 05","2005-11-02"
"tháng 9 14 2009","2009-09-14"
"29.01.17","2017-01-29"
"17 thg 10, 2002","2002-10-17"
"9 THG 6 2009","2009-06-09"
"6 thg 10, 2014","2014-10-06"
"10 thg 4 2002","2002-04-10"
"14 thg 12, 2005","2005-12-14"
"8 tháng 5 2000","2000-05-08"
"7 THÁNG 3 2006","2006-03-07"
"03 thg 4 1994","1994-04-03"
"27 thg 7, 1973","1973-07-27"
"23 tháng 3 2006","2006-03-23"
"21 thg 7 1975","1975-07-21"
"13 THÁNG 8 1986","1986-08-13"
"27 thg 1, 1974","1974-01-27"
"25 thg 9 1995","1995-09-25"
"ngày 19 tháng 01 năm 1973","1973-01-19"
"ngày 22 tháng 03 năm 2018","2018-03-22"
"30 THG 9, 2018","2018-09-30"
"25, thg 5 1971","1971-05-25"
"4 THÁNG 10, 2008","2008-10-04"
"tháng 3 14, 2002","2002-03-14"
"14.10.90","1990-10-14"
"1 THÁNG 7 1993","1993-07-01"
"26 thg 1, 1999","1999-01-26"
"02 thg 10 1979","1979-10-02"
"Ngày 04 tháng 10 năm 1985","1985-10-04"
"9 01 75","1975-01-09"
"21 THÁNG 8, 1979","1979-08-21"
"20/11/2018","2018-11-20"
"12 07 91","1991-07-12"
"26 tháng 12 2005","2005-12-26"
"17.05.72","1972-05-17"
"thứ sáu, ngày 07 tháng 1 năm 1977","1977-01-07"
"25.11.70","1970-11-25"
"27 08 18","2018-08-27"
"18 THÁNG 4, 2006","2006-04-18"
"02, thg 1 1989","1989-01-02"
"25, thg 4 2013","2013-04-25"
"21 thg 9, 1979","1979-09-21"
"tháng 8 7 2001","2001-08-07"
"22.05.05","2005-05-22"
"11 thg 9, 1978","1978-09-11"
"17 thg 3, 1973","1973-03-17"
"26 thg 7 1984","1984-07-26"
"27 THÁNG 12 1976","1976-12-27"
"THỨ BA, NGÀY 24 THÁNG 1 NĂM 1984","1984-01-24"
"09 thg 5 1989","1989-05-09"
"14 THÁNG 12 2006","2006-12-14"
"THÁNG 1 25, 1985","1985-01-25"
"3 thg 7 1991","1991-07-03"
"2 tháng 10 1977","1977-10-02"
"2 thg 11, 1995","1995-11-02"
"Ngày 17 tháng 01 năm 2004","2004-01-17"
"28 thg 4, 2003","2003-04-28"
"tháng 3 3 1970","1970-03-03"
"THÁNG 1 23, 1972","1972-01-23"
"03.03.06","2006-03-03"
"Ngày 16 tháng 09 năm 2015","2015-09-16"
"22 tháng 4 1981","1981-04-22"
"15 tháng 11, 1996","1996-11-15"
"16/08/1973","1973-08-16"
"thứ hai, ngày 20 tháng 3 năm 2000","2000-03-20"
"15 thg 2 1971","1971-02-15"
"13 THÁNG 8 2001","2001-08-13"
"10 thg 11, 2007","2007-11-10"
"tháng 6 11 1995","1995-06-11"
"28, thg 2 2014","2014-02-28"
"13 THG 9, 2009","2009-09-13"
"23 thg 7 1979","1979-07-23"
"14 tháng 5, 2008","2008-05-14"
"25, thg 9 2014","2014-09-25"
"10 THG 2, 1978","1978-02-10"
"28 THÁNG 5, 1974","1974-05-28"
"NGÀY 01 THÁNG 04 NĂM 1979","1979-04-01"
"02, THG 12 2007","2007-12-02"
"20 thg 1 1980","1980-01-20"
"22, thg 7 2005","2005-07-22"
"17 tháng 1 2008","2008-01-17"
"8 thg 2 1982","1982-02-08"
"23 thg 9 1993","1993-09-23"
"25 THG 1, 1986","1986-01-25"
"30 tháng 8, 1993","1993-08-30"
"30 tháng 8 2002","2002-08-30"
"17 03 78","1978-03-17"
"NGÀY 02 THÁNG 01 NĂM 1981","1981-01-02"
"7 THG 3, 2005","2005-03-07"
"16 THÁNG 2, 2006","2006-02-16"
"2 tháng 3, 1971","1971-03-02"
"8 05 14","2014-05-08"
"21 THG 10, 1976","1976-10-21"
"28.03.71","1971-03-28"
"tháng 10 27 1971","1971-10-27"
"14 THÁNG 12, 1998","1998-12-14"
"9 tháng 5 2000","2000-05-09"
"29 tháng 4 1981","1981-04-29"
"3 thg 8, 1975","1975-08-03"
"2 thg 1, 1993","1993-01-02"
"tháng 10 8 1993","1993-10-08"
"01/03/2017","2017-03-01"
"4 tháng 9, 2015","2015-09-04"
"23 thg 8, 1990","1990-08-23"
"12 thg 8, 2005","2005-08-12"
"Thứ Bảy, ngày 27 tháng 12 năm 2008","2008-12-27"
"26 tháng 5 2014","2014-05-26"
"21, thg 11 1970","1970-11-21"
"21 04 72","1972-04-21"
"THỨ SÁU, NGÀY 05 THÁNG 7 NĂM 2002","2002-07-05"
"tháng 5 2 1983","1983-05-02"
"24, thg 10 2003","2003-10-24"
"17 thg 1, 1981","1981-01-17"
"25 12 70","1970-12-25"
"25 thg 8 1999","1999-08-25"
"Thứ Tư, ngày 26 tháng 5 năm 1993","1993-05-26"
"27 THÁNG 10 2009","2009-10-27"
"Ngày 08 tháng 05 năm 1984","1984-05-08"
"20 THG 1, 1997","1997-01-20"
"23 THG 4 2002","2002-04-23"
"27 THÁNG 7, 1994","1994-07-27"
"26 tháng 6 1982","1982-06-26"
"7 thg 10 1974","1974-10-07"
"13 07 83","1983-07-13"
"4 tháng 8 1982","1982-08-04"
"14 05 88","1988-05-14"
"25, thg 4 2009","2009-04-25"
"8 10 99","1999-10-08"
"02/11/2013","2013-11-02"
"13, thg 11 2008","2008-11-13"
"23 thg 7, 1970","1970-07-23"
"24 thg 12, 1987","1987-12-24"
"16/08/1972","1972-08-16"
"19 thg 1 1981","1981-01-19"
"27 thg 9, 1994","1994-09-27"
"tháng 3 20, 1996","1996-03-20"
"26 tháng 11 1993","1993-11-26"
"11 tháng 5, 2016","2016-05-11"
"Ngày 21 tháng 01 năm 2018","2018-01-21"
"27 thg 2 2000","2000-02-27"
"21/05/2003","2003-05-21"
"22.05.08","2008-05-22"
"30 THÁNG 7 1979","1979-07-30"
"THÁNG 3 2 1989","1989-03-02"
"THÁNG 5 12, 2017","2017-05-12"
"06 thg 4 1974","1974-04-06"
"thứ hai, ngày 11 tháng 6 năm 1973","1973-06-11"
"tháng 3 22, 1988","1988-03-22"
"Thứ Hai, ngày 04 tháng 8 năm 2014","2014-08-04"
"Thứ Năm, ngày 01 tháng 3 năm 1984","1984-03-01"
"18 tháng 9 1970","1970-09-18"
"tháng 8 25, 2007","2007-08-25"
"24/10/1986","1986-10-24"
"tháng 11 28, 1986","1986-11-28"
"14, thg 12 1978","1978-12-14"
"THÁNG 4 30, 2000","2000-04-30"
"30, thg 4 2008","2008-04-30"
"14, thg 2 1994","1994-02-14"
"14 thg 4, 1994","1994-04-14"
"6 tháng 6 2010","2010-06-06"
"28 tháng 9, 1972","1972-09-28"
"15 THG 2, 1974","1974-02-15"
"NGÀY 25 THÁNG 11 NĂM 1993","1993-11-25"
"30, thg 3 1999","1999-03-30"
"06/07/1999","1999-07-06"
"THỨ HAI, NGÀY 12 THÁNG 9 NĂM 2011","2011-09-12"
"18, THG 11 2007","2007-11-18"
"17 THG 7, 1978","1978-07-17"
"28 thg 9, 2013","2013-09-28"
"25 THÁNG 8 2017","2017-08-25"
"NGÀY 02 THÁNG 09 NĂM 2010","2010-09-02"
"27 tháng 4, 1998","1998-04-27"
"14 THÁNG 3 1982","1982-03-14"
"Ngày 09 tháng 01 năm 1997","1997-01-09"
"tháng 3 3 2003","2003-03-03"
"05.10.80","1980-10-05"
"tháng 10 18 1985","1985-10-18"
"26 tháng 4 1979","1979-04-26"
"5 thg 1 2015","2015-01-05"
"10, thg 5 2016","2016-05-10"
"17 tháng 6 1970","1970-06-17"
"31 thg 8 1995","1995-08-31"
"24 thg 8, 1989","1989-08-24"
"21 06 03","2003-06-21"
"17.09.77","1977-09-17"
"22 thg 10, 2008","2008-10-22"
"18/11/1973","1973-11-18"
"11 tháng 9 1997","1997-09-11"
"Thứ Sáu, ngày 12 tháng 9 năm 1975","1975-09-12"
"14 tháng 1 1987","1987-01-14"
"Ngày 28 tháng 05 năm 1983","1983-05-28"
"06.06.03","2003-06-06"
"THÁNG 2 1, 1993","1993-02-01"
"22 tháng 7 2016","2016-07-22"
"24 thg 1, 1977","1977-01-24"
"NGÀY 31 THÁNG 10 NĂM 2006","2006-10-31"
"29.04.83","1983-04-29"
"22.04.71","1971-04-22"
"07 thg 4 2002","2002-04-07"
"NGÀY 30 THÁNG 12 NĂM 2008","2008-12-30"
"24 THG 7, 1982","1982-07-24"
"5 tháng 2 2013","2013-02-05"
"18, THG 7 1970","1970-07-18"
"17/04/1971","1971-04-17"
"tháng 2 7, 1992","1992-02-07"
"06, thg 11 1999","1999-11-06"
"19 thg 3 1976","1976-03-19"
"19, THG 2 1977","1977-02-19"
"1 thg 12, 1987","1987-12-01"
"13 tháng 6, 1977","1977-06-13"
"9 tháng 10 2015","2015-10-09"
"24 thg 10, 2015","2015-10-24"
"16 thg 3, 2018","2018-03-16"
"30 thg 6 1970","1970-06-30"
"tháng 11 23 2006","2006-11-23"
"20 tháng 7 2006","2006-07-20"
"28 thg 11 1978","1978-11-28"
"29 thg 4, 2012","2012-04-29"
"18, thg 7 2003","2003-07-18"
"22, thg 6 2011","2011-06-22"
"6 08 73","1973-08-06"
"19.03.93","1993-03-19"
"9 thg 12, 1995","1995-12-09"
"18 thg 12, 1995","1995-12-18"
"25 THG 12 2010","2010-12-25"
"1 THG 11, 2014","2014-11-01"
"23, thg 1 1997","1997-01-23"
"3 tháng 2, 1994","1994-02-03"
"THÁNG 3 19, 1971","1971-03-19"
"tháng 9 11 1986","1986-09-11"
"2 THÁNG 9 1990","1990-09-02"
"THÁNG 3 14 1996","1996-03-14"
"29/09/1975","1975-09-29"
"Thứ Năm, ngày 31 tháng 3 năm 2011","2011-03-31"
"11 tháng 1 2008","2008-01-11"
"20/09/1992","1992-09-20"
"22 tháng 5, 2004","2004-05-22"
"NGÀY 04 THÁNG 04 NĂM 2009","2009-04-04"
"17 thg 11, 2007","2007-11-17"
"28 thg 6 1978","1978-06-28"
"16 thg 7, 2012","2012-07-16"
"12, thg 7 1986","1986-07-12"
"16 tháng 1 1978","1978-01-16"
"28 thg 5 2016","2016-05-28"
"12 09 90","1990-09-12"
"11 tháng 4 1999","1999-04-11"
"19 THG 11 1982","1982-11-19"
"25 thg 7, 2018","2018-07-25"
"23 thg 11, 2009","2009-11-23"
"17 thg 6, 1984","1984-06-17"
"18.01.71","1971-01-18"
"1 thg 6, 1990","1990-06-01"
"11/09/1986","1986-09-11"
"08.08.91","1991-08-08"
"07 THG 3 2001","2001-03-07"
"Ngày 10 tháng 06 năm 1999","1999-06-10"
"tháng 11 15, 1980","1980-11-15"
"18 01 82","1982-01-18"
"27 thg 5, 1991","1991-05-27"
"3 tháng 8 2008","2008-08-03"
"02/04/1974","1974-04-02"
"14 tháng 12 1981","1981-12-14"
"23, thg 10 2002","2002-10-23"
"11 thg 11 2017","2017-11-11"
"1 01 81","1981-01-01"
"17 THG 5, 1974","1974-05-17"
"18 tháng 3, 1980","1980-03-18"
"8 thg 11, 2011","2011-11-08"
"thứ ba, ngày 10 tháng 3 năm 2009","2009-03-10"
"tháng 6 6 2014","2014-06-06"
"29 tháng 11 2015","2015-11-29"
"31, thg 7 1982","1982-07-31"
"05, thg 6 2007","2007-06-05"
"17 thg 12 1972","1972-12-17"
"19 tháng 12 1981","1981-12-19"
"THÁNG 8 4 1971","1971-08-04"
"12.02.80","1980-02-12"
"18 tháng 2, 1987","1987-02-18"
"21 thg 9, 1984","1984-09-21"
"20 thg 12, 1973","1973-12-20"
"8 tháng 12 2001","2001-12-08"
"ngày 21 tháng 10 năm 2008","2008-10-21"
"26 tháng 10, 1978","1978-10-26"
"20 02 13","2013-02-20"
"06 thg 8 2013","2013-08-06"
"13 thg 1 2009","2009-01-13"
"3 thg 1, 2015","2015-01-03"
"14, thg 11 2009","2009-11-14"
"3 THG 12, 1983","1983-12-03"
"10 THG 10 1984","1984-10-10"
"12 THÁNG 1 1994","1994-01-12"
"thứ bảy, ngày 05 tháng 3 năm 2005","2005-03-05"
"11 thg 8, 2013","2013-08-11"
"Thứ Sáu, ngày 02 tháng 5 năm 1986","1986-05-02"
"8 tháng 6 1990","1990-06-08"
"15 tháng 9, 2008","2008-09-15"
"tháng 1 5, 1975","1975-01-05"
"20/12/2011","2011-12-20"
"17 THÁNG 2 2011","2011-02-17"
"08 thg 6 1976","1976-06-08"
"5 thg 2, 1989","1989-02-05"
"03 thg 4 1996","1996-04-03"
"tháng 7 22, 1992","1992-07-22"
"20 thg 2 1993","1993-02-20"
"23 thg 11 1971","1971-11-23"
"17 thg 6 1979","1979-06-17"
"29 thg 7, 2001","2001-07-29"
"15 THG 12 2010","2010-12-15"
"23, thg 4 1977","1977-04-23"
"tháng 5 7 1974","1974-05-07"
"14, thg 10 2009","2009-10-14"
"16 05 00","2000-05-16"
"08/06/2013","2013-06-08"
"14.10.81","1981-10-14"
"28 THG 1, 2018","2018-01-28"
"29 thg 8 2016","2016-08-29"
"27, THG 9 2001","2001-09-27"
"Ngày 28 tháng 05 năm 1996","1996-05-28"
"tháng 9 9, 2005","2005-09-09"
"thứ sáu, ngày 20 tháng 1 năm 2012","2012-01-20"
"14, THG 9 1999","1999-09-14"
"tháng 2 1, 1972","1972-02-01"
"tháng 11 10 1987","1987-11-10"
"19/06/1971","1971-06-19"
"2 tháng 4 2013","2013-04-02"
"26 thg 9 1975","1975-09-26"
"14 06 96","1996-06-14"
"22, thg 3 1971","1971-03-22"
"20 THÁNG 10 2015","2015-10-20"
"tháng 2 27 1973","1973-02-27"
"04/04/1999","1999-04-04"
"tháng 9 26 1999","1999-09-26"
"6 thg 4 2011","2011-04-06"
"19 thg 1 1983","1983-01-19"
"26/10/1973","1973-10-26"
"18 tháng 8, 2014","2014-08-18"
"23 THG 4 1999","1999-04-23"
"7 tháng 9 1978","1978-09-07"
"chủ nhật, ngày 27 tháng 1 năm 1991","1991-01-27"
"Ngày 16 tháng 01 năm 1988","1988-01-16"
"2 tháng 5 1974","1974-05-02"
"THỨ TƯ, NGÀY 08 THÁNG 5 NĂM 2013","2013-05-08"
"15 thg 10 1991","1991-10-15"
"13 04 12","2012-04-13"
"21, thg 10 1984","1984-10-21"
"14 thg 10 1985","1985-10-14"
"21 thg 11, 1982","1982-11-21"
"10 thg 11 2011","2011-11-10"
"THỨ HAI, NGÀY 05 THÁNG 12 NĂM 1988","1988-12-05"
"16/02/2008","2008-02-16"
"03.02.75","1975-02-03"
"Ngày 19 tháng 06 năm 1995","1995-06-19"
"31 tháng 10 1987","1987-10-31"
"tháng 12 11, 2017","2017-12-11"
"19 tháng 7 1978","1978-07-19"
"Thứ Sáu, ngày 30 tháng 9 năm 1977","1977-09-30"
"26 THG 9 1974","1974-09-26"
"25.12.98","1998-12-25"
"21.09.90","1990-09-21"
"2 THÁNG 4 1999","1999-04-02"
"THÁNG 1 10, 1989","1989-01-10"
"12 tháng 7 1984","1984-07-12"
"23 THG 9, 1976","1976-09-23"
"8 tháng 7 2011","2011-07-08"
"23.01.86","1986-01-23"
"Chủ Nhật, ngày 12 tháng 8 năm 1984","1984-08-12"
"26/09/2007","2007-09-26"
"08.01.03","2003-01-08"
"20 tháng 7 1982","1982-07-20"
"3 THG 2 1988","1988-02-03"
"11 tháng 2, 1981","1981-02-11"
"3 THÁNG 7 1981","1981-07-03"
"11 thg 8 1987","1987-08-11"
"THỨ TƯ, NGÀY 21 THÁNG 3 NĂM 1984","1984-03-21"
"1 THÁNG 11 2011","2011-11-01"
"5 THÁNG 2, 1988","1988-02-05"
"tháng 4 3 2002","2002-04-03"
"21 07 03","2003-07-21"
"15 tháng 11, 1989","1989-11-15"
"6 THÁNG 9 2002","2002-09-06"
"06 thg 6 2001","2001-06-06"
"Thứ Tư, ngày 19 tháng 12 năm 2001","2001-12-19"
"THÁNG 10 7, 1997","1997-10-07"
"tháng 7 13 2016","2016-07-13"
"17 thg 11 1982","1982-11-17"
"23 08 81","1981-08-23"
"tháng 5 20, 2010","2010-05-20"
"Ngày 21 tháng 01 năm 2012","2012-01-21"
"10 thg 9 1996","1996-09-10"
"25 07 88","1988-07-25"
"9 11 13","2013-11-09"
"17 tháng 12 1994","1994-12-17"
"20 tháng 3 2000","2000-03-20"
"25 thg 3 1995","1995-03-25"
"31 tháng 8 1971","1971-08-31"
"19 THG 1 1986","1986-01-19"
"14 05 92","1992-05-14"
"tháng 8 28, 1989","1989-08-28"
"17 thg 12 1970","1970-12-17"
"10 11 94","1994-11-10"
"4 tháng 3, 1980","1980-03-04"
"3 tháng 4 1989","1989-04-03"
"13 tháng 10 1985","1985-10-13"
"19.09.07","2007-09-19"
"27, THG 9 1996","1996-09-27"
"THÁNG 5 30 1972","1972-05-30"
"26 THÁNG 1 1999","1999-01-26"
"30 thg 7, 1973","1973-07-30"
"19/10/1985","1985-10-19"
"23 tháng 3 1971","1971-03-23"
"21.10.93","1993-10-21"
"thứ ba, ngày 11 tháng 4 năm 2000","2000-04-11"
"THÁNG 11 16, 2006","2006-11-16"
"02.03.76","1976-03-02"
"22 THG 3 1993","1993-03-22"
"13 THG 12 1998","1998-12-13"
"14 thg 2 2011","2011-02-14"
"21 THG 12, 1977","1977-12-21"
"Thứ Năm, ngày 08 tháng 8 năm 1985","1985-08-08"
"19 09 07","2007-09-19"
"19/08/2003","2003-08-19"
"21 THÁNG 8 1981","1981-08-21"
"Ngày 05 tháng 06 năm 1993","1993-06-05"
"14 thg 5 2014","2014-05-14"
"28 tháng 1 1971","1971-01-28"
"8 thg 4, 2000","2000-04-08"
"13/06/1989","1989-06-13"
"tháng 9 26, 2014","2014-09-26"
"08.11.15","2015-11-08"
"19 thg 12, 1989","1989-12-19"
"Ngày 22 tháng 06 năm 2000","2000-06-22"
"27 tháng 2 1979","1979-02-27"
"6 thg 12 1992","1992-12-06"
"21 THÁNG 5 1982","1982-05-21"
"11 thg 4 1984","1984-04-11"
"26, thg 1 1989","1989-01-26"
"tháng 12 21 2004","2004-12-21"
"22 thg 4, 1974","1974-04-22"
"Ngày 27 tháng 07 năm 2010","2010-07-27"
"28 thg 5, 1973","1973-05-28"
"07, thg 8 2006","2006-08-07"
"20 thg 10 1979","1979-10-20"
"31 tháng 5 1971","1971-05-31"
"9 thg 11, 1975","1975-11-09"
"THÁNG 12 19, 1999","1999-12-19"
"26 thg 3 1980","1980-03-26"
"21 thg 6 2017","2017-06-21"
"NGÀY 22 THÁNG 07 NĂM 2006","2006-07-22"
"THÁNG 5 20 2014","2014-05-20"
"31.01.99","1999-01-31"
"10 thg 1 2004","2004-01-10"
"24 thg 7 1983","1983-07-24"
"tháng 1 10, 2014","2014-01-10"
"22 02 87","1987-02-22"
"29 tháng 6 1983","1983-06-29"
"4 tháng 11 1984","1984-11-04"
"NGÀY 21 THÁNG 10 NĂM 1981","1981-10-21"
"tháng 6 8, 1999","1999-06-08"
"14 thg 7, 2006","2006-07-14"
"11 tháng 1 1995","1995-01-11"
"tháng 12 1 2000","2000-12-01"
"THÁNG 10 1 2006","2006-10-01"
"25 thg 6, 1991","1991-06-25"
"24, thg 2 1983","1983-02-24"
"10.04.72","1972-04-10"
"5 tháng 8 1991","1991-08-05"
"Thứ Hai, ngày 25 tháng 10 năm 1982","1982-10-25"
"Thứ Bảy, ngày 17 tháng 5 năm 1975","1975-05-17"
"9 thg 4, 1988","1988-04-09"
"21.08.15","2015-08-21"
"THỨ HAI, NGÀY 01 THÁNG 1 NĂM 1979","1979-01-01"
"2 thg 5, 2016","2016-05-02"
"10 tháng 9 1981","1981-09-10"
"21 tháng 4 1975","1975-04-21"
"17 tháng 7 2012","2012-07-17"
"22 thg 8 1989","1989-08-22"
"13 tháng 7 1998","1998-07-13"
"19 tháng 10 1976","1976-10-19"
"18 09 86","1986-09-18"
"31.03.79","1979-03-31"
"6 tháng 4, 1994","1994-04-06"
"10 tháng 7 1971","1971-07-10"
"23, thg 7 2000","2000-07-23"
"10 thg 1 1985","1985-01-10"
"1 tháng 12 2015","2015-12-01"
"02.09.80","1980-09-02"
"21 THG 12 1976","1976-12-21"
"26/09/2005","2005-09-26"
"ngày 28 tháng 04 năm 2008","2008-04-28"
"2 THG 12 2001","2001-12-02"
"24 tháng 12 1992","1992-12-24"
"12.08.00","2000-08-12"
"tháng 1 18 2013","2013-01-18"
"NGÀY 27 THÁNG 11 NĂM 1970","1970-11-27"
"23 tháng 12 1973","1973-12-23"
"28 THÁNG 1 2018","2018-01-28"
"12 THG 3 1979","1979-03-12"
"THỨ TƯ, NGÀY 19 THÁNG 11 NĂM 2003","2003-11-19"
"04, thg 4 1991","1991-04-04"
"7 thg 10, 2004","2004-10-07"
"28 tháng 5, 1994","1994-05-28"
"4 tháng 6 2005","2005-06-04"
"tháng 6 28, 2004","2004-06-28"
"28 THG 6, 2001","2001-06-28"
"Thứ Bảy, ngày 15 tháng 1 năm 1983","1983-01-15"
"10 tháng 5 1970","1970-05-10"
"22 04 92","1992-04-22"
"18 tháng 12 1984","1984-12-18"
"NGÀY 27 THÁNG 12 NĂM 1987","1987-12-27"
"tháng 2 15, 1981","1981-02-15"
"7 11 83","1983-11-07"
"10 tháng 5, 2013","2013-05-10"
"Thứ Bảy, ngày 10 tháng 3 năm 1990","1990-03-10"
"3 tháng 3 2007","2007-03-03"
"Ngày 30 tháng 11 năm 2015","2015-11-30"
"27 thg 8 1975","1975-08-27"
"25.06.87","1987-06-25"
"26 thg 12 1971","1971-12-26"
"7 tháng 8 1990","1990-08-07"
"1 tháng 11, 1974","1974-11-01"
"30 THG 12 1997","1997-12-30"
"7 THG 4, 1979","1979-04-07"
"Ngày 26 tháng 02 năm 1991","1991-02-26"
"tháng 3 17, 2003","2003-03-17"
"26 thg 5 2007","2007-05-26"
"tháng 5 29, 1993","1993-05-29"
"20 thg 1, 1970","1970-01-20"
"15.09.95","1995-09-15"
"5 tháng 4 1997","1997-04-05"
"9 tháng 10, 2016","2016-10-09"
"16 tháng 12 1985","1985-12-16"
"3 THG 4, 2012","2012-04-03"
"16/01/2013","2013-01-16"
"26 thg 4 1976","1976-04-26"
"06 thg 12 2013","2013-12-06"
"THÁNG 8 5, 1992","1992-08-05"
"Thứ Năm, ngày 07 tháng 5 năm 2015","2015-05-07"
"tháng 8 14, 1976","1976-08-14"
"Ngày 20 tháng 02 năm 1989","1989-02-20"
"11 THG 9, 2014","2014-09-11"
"25 thg 1 2006","2006-01-25"
"24 thg 8, 2003","2003-08-24"
"19 THG 6 1992","1992-06-19"
"16 03 82","1982-03-16"
"23 tháng 11 1994","1994-11-23"
"7 06 89","1989-06-07"
"17 thg 1, 2009","2009-01-17"
"thứ năm, ngày 23 tháng 12 năm 1982","1982-12-23"
"26 THÁNG 8, 1971","1971-08-26"
"22 thg 6 2017","2017-06-22"
"THÁNG 1 1 2012","2012-01-01"
"16.05.95","1995-05-16"
"10 02 01","2001-02-10"
"2 tháng 1, 1973","1973-01-02"
"17 tháng 2 1972","1972-02-17"
"28.12.10","2010-12-28"
"6 thg 2, 1970","1970-02-06"
"20/07/2018","2018-07-20"
"Thứ Tư, ngày 10 tháng 9 năm 1997","1997-09-10"
"24 tháng 5, 1972","1972-05-24"
"Ngày 26 tháng 02 năm 1985","1985-02-26"
"12 07 06","2006-07-12"
"10 tháng 10 1992","1992-10-10"
"2 tháng 10 2007","2007-10-02"
"06 THG 6 2009","2009-06-06"
"tháng 11 8 2000","2000-11-08"
"NGÀY 05 THÁNG 05 NĂM 1979","1979-05-05"
"03/01/2015","2015-01-03"
"08/05/2009","2009-05-08"
"16 THÁNG 12, 2011","2011-12-16"
"31 tháng 10 2002","2002-10-31"
"30 THÁNG 3, 1995","1995-03-30"
"10/04/1995","1995-04-10"
"27/08/1983","1983-08-27"
"7 07 92","1992-07-07"
"Thứ Bảy, ngày 03 tháng 4 năm 1976","1976-04-03"
"07, thg 4 1987","1987-04-07"
"ngày 12 tháng 01 năm 2007","2007-01-12"
"Thứ Ba, ngày 19 tháng 11 năm 1985","1985-11-19"
"tháng 10 3, 1989","1989-10-03"
"15 tháng 7 1987","1987-07-15"
"04/12/2000","2000-12-04"
"22, thg 6 2008","2008-06-22"
"14, thg 8 2008","2008-08-14"
"tháng 2 9, 1993","1993-02-09"
"22 thg 10, 2015","2015-10-22"
"thứ bảy, ngày 13 tháng 10 năm 1979","1979-10-13"
"16 thg 6 1973","1973-06-16"
"8 07 93","1993-07-08"
"28 tháng 3 1991","1991-03-28"
"13 07 97","1997-07-13"
"THỨ NĂM, NGÀY 12 THÁNG 10 NĂM 2000","2000-10-12"
"1 thg 11, 1986","1986-11-01"
"20 tháng 4 2003","2003-04-20"
"9 tháng 1 2003","2003-01-09"
"THÁNG 10 14 1982","1982-10-14"
"THÁNG 8 15 1987","1987-08-15"
"25, thg 5 1970","1970-05-25"
"14 thg 12 1988","1988-12-14"
"29 THG 7 2016","2016-07-29"
"NGÀY 02 THÁNG 06 NĂM 1972","1972-06-02"
"18.07.99","1999-07-18"
"27 thg 2 2002","2002-02-27"
"Thứ Sáu, ngày 29 tháng 5 năm 1992","1992-05-29"
"24 thg 8 1998","1998-08-24"
"02, thg 8 1974","1974-08-02"
"1 thg 11 2003","2003-11-01"
"THÁNG 3 16, 2016","2016-03-16"
"NGÀY 04 THÁNG 01 NĂM 1981","1981-01-04"
"tháng 11 16 2018","2018-11-16"
"27/10/1990","1990-10-27"
"tháng 5 29, 2009","2009-05-29"
"Ngày 06 tháng 11 năm 1970","1970-11-06"
"2 tháng 1 1979","1979-01-02"
"21/08/1994","1994-08-21"
"22 02 98","1998-02-22"
"12 THÁNG 12 2001","2001-12-12"
"22/06/2014","2014-06-22"
"16 thg 12 2009","2009-12-16"
"20 THÁNG 9 2018","2018-09-20"
"31 thg 10 1979","1979-10-31"
"25 tháng 11 1994","1994-11-25"
"1 10 82","1982-10-01"
"3 thg 5 1990","1990-05-03"
"28, thg 5 1997","1997-05-28"
"16 tháng 6 1992","1992-06-16"
"2 THG 3, 2004","2004-03-02"
"11 tháng 11, 1998","1998-11-11"
"31/07/1987","1987-07-31"
"Chủ Nhật, ngày 15 tháng 8 năm 1971","1971-08-15"
"20 thg 9 2009","2009-09-20"
"5 tháng 11 1998","1998-11-05"
"15 THÁNG 12 2001","2001-12-15"
"23 04 73","1973-04-23"
"tháng 6 29, 2004","2004-06-29"
"Thứ Ba, ngày 17 tháng 4 năm 2007","2007-04-17"
"07, THG 12 2000","2000-12-07"
"24 tháng 2 2010","2010-02-24"
"29 tháng 10, 1993","1993-10-29"
"9 10 08","2008-10-09"
"23 tháng 1 2005","2005-01-23"
"4 thg 9 2012","2012-09-04"
"tháng 1 6 1998","1998-01-06"
"9 THÁNG 1 2013","2013-01-09"
"18/11/2001","2001-11-18"
"THÁNG 11 27, 1989","1989-11-27"
"27 thg 5 2005","2005-05-27"
"tháng 3 25 2005","2005-03-25"
"tháng 12 22, 1977","1977-12-22"
"30 03 93","1993-03-30"
"27 thg 6 2014","2014-06-27"
"Ngày 22 tháng 02 năm 1970","1970-02-22"
"tháng 3 24 1976","1976-03-24"
"16 THÁNG 11 2018","2018-11-16"
"24 thg 8, 2010","2010-08-24"
"27 thg 3, 1994","1994-03-27"
"28, thg 6 1973","1973-06-28"
"2 thg 1, 1970","1970-01-02"
"28 04 85","1985-04-28"
"17, thg 7 1980","1980-07-17"
"4 THG 7 2004","2004-07-04"
"Ngày 01 tháng 04 năm 2003","2003-04-01"
"tháng 12 19, 1986","1986-12-19"
"21 tháng 10, 1974","1974-10-21"
"11/08/1977","1977-08-11"
"26 thg 12 1983","1983-12-26"
"27, thg 4 1992","1992-04-27"
"16 THG 2 1995","1995-02-16"
"NGÀY 12 THÁNG 12 NĂM 1990","1990-12-12"
"ngày 26 tháng 04 năm 2000","2000-04-26"
"21 tháng 7, 1983","1983-07-21"
"THỨ HAI, NGÀY 22 THÁNG 5 NĂM 1978","1978-05-22"
"26 11 74","1974-11-26"
"9 THG 6, 2014","2014-06-09"
"ngày 17 tháng 02 năm 2014","2014-02-17"
"tháng 9 13 1995","1995-09-13"
"tháng 5 18, 2016","2016-05-18"
"30 tháng 10, 1990","1990-10-30"
"03, thg 12 1995","1995-12-03"
"Ngày 22 tháng 02 năm 1995","1995-02-22"
"9 THÁNG 10 1973","1973-10-09"
"THÁNG 10 2 2015","2015-10-02"
"10 THÁNG 9 1979","1979-09-10"
"Ngày 26 tháng 09 năm 2018","2018-09-26"
"18 THG 1, 2015","2015-01-18"
"7 tháng 12 2007","2007-12-07"
"7 THÁNG 4 1978","1978-04-07"
"6 thg 10, 1987","1987-10-06"
"15 thg 10, 1983","1983-10-15"
"15 thg 9, 2010","2010-09-15"
"31 thg 7, 2017","2017-07-31"
"24.06.78","1978-06-24"
"25, thg 8 1998","1998-08-25"
"tháng 4 29 1974","1974-04-29"
"04 thg 8 1986","1986-08-04"
"tháng 1 29 2001","2001-01-29"
"18/06/2007","2007-06-18"
"THÁNG 8 26 1981","1981-08-26"
"tháng 4 29, 1987","1987-04-29"
"thứ bảy, ngày 21 tháng 8 năm 1993","1993-08-21"
"tháng 2 26, 2017","2017-02-26"
"11 thg 2 2002","2002-02-11"
"29.04.91","1991-04-29"
"25 THÁNG 5, 1980","1980-05-25"
"Thứ Hai, ngày 27 tháng 11 năm 2006","2006-11-27"
"14 THG 7 2015","2015-07-14"
"12 tháng 10 1982","1982-10-12"
"04/02/2004","2004-02-04"
"26 tháng 5 2004","2004-05-26"
"5 tháng 7, 2007","2007-07-05"
"26 thg 12, 2000","2000-12-26"
"THÁNG 1 21 2010","2010-01-21"
"22 thg 6, 1995","1995-06-22"
"thứ sáu, ngày 18 tháng 3 năm 1988","1988-03-18"
"06, thg 10 2014","2014-10-06"
"27 04 88","1988-04-27"
"26 thg 2, 2005","2005-02-26"
"29 thg 1 1970","1970-01-29"
"17 thg 8 1980","1980-08-17"
"NGÀY 23 THÁNG 07 NĂM 2004","2004-07-23"
"tháng 6 13, 2010","2010-06-13"
"1 thg 7 1986","1986-07-01"
"tháng 4 6 1998","1998-04-06"
"05 thg 5 2007","2007-05-05"
"18 thg 4, 1980","1980-04-18"
"10 thg 1, 2000","2000-01-10"
"29 THG 7, 1981","1981-07-29"
"15 thg 5 2005","2005-05-15"
"THÁNG 10 29 2012","2012-10-29"
"25 tháng 3, 2002","2002-03-25"
"21 06 86","1986-06-21"
"tháng 2 23, 2003","2003-02-23"
"8 tháng 7 1983","1983-07-08"
"30 thg 8 2007","2007-08-30"
"tháng 2 1, 1970","1970-02-01"
"10.10.10","2010-10-10"
"6 thg 5, 1998","1998-05-06"
"Chủ Nhật, ngày 01 tháng 4 năm 1984","1984-04-01"
"tháng 7 22, 1990","1990-07-22"
"7 tháng 7 1995","1995-07-07"
"19.10.86","1986-10-19"
"25 03 86","1986-03-25"
"28 THG 1 2005","2005-01-28"
"23 tháng 12 2018","2018-12-23"
"31 tháng 7, 1977","1977-07-31"
"07, thg 10 2003","2003-10-07"
"THÁNG 9 15 1998","1998-09-15"
"24 thg 12 1971","1971-12-24"
"09.06.09","2009-06-09"
"29 01 00","2000-01-29"
"10 thg 3, 2000","2000-03-10"
"27 tháng 12 1984","1984-12-27"
"tháng 6 22, 1995","1995-06-22"
"5 THG 11 2004","2004-11-05"
"30 tháng 9 1981","1981-09-30"
"THÁNG 11 29, 1976","1976-11-29"
"01.06.18","2018-06-01"
"tháng 6 17 2003","2003-06-17"
"30 thg 1, 1979","1979-01-30"
"19 THG 11, 2017","2017-11-19"
"tháng 2 19 2002","2002-02-19"
"tháng 8 26 2018","2018-08-26"
"26 tháng 8 1970","1970-08-26"
"tháng 8 18, 1978","1978-08-18"
"9 thg 7, 1980","1980-07-09"
"tháng 8 9, 2007","2007-08-09"
"01/04/1980","1980-04-01"
"02, thg 10 2009","2009-10-02"
"12 THG 3, 1972","1972-03-12"
"05.11.82","1982-11-05"
"25, THG 10 2015","2015-10-25"
"20 THÁNG 9 1997","1997-09-20"
"25 10 10","2010-10-25"
"12 10 85","1985-10-12"
"tháng 1 10, 2006","2006-01-10"
"25.04.02","2002-04-25"
"13.10.85","1985-10-13"
"25 thg 8 1992","1992-08-25"
"21/05/2015","2015-05-21"
"tháng 9 1 2003","2003-09-01"
"tháng 10 12 1971","1971-10-12"
"27.03.18","2018-03-27"
"21 thg 2, 2002","2002-02-21"
"28 thg 7, 1994","1994-07-28"
"01/04/2010","2010-04-01"
"02 thg 9 1994","1994-09-02"
"20 thg 10 2005","2005-10-20"
"3 thg 9, 1986","1986-09-03"
"THÁNG 2 3, 1989","1989-02-03"
"15 thg 6, 1976","1976-06-15"
"06/10/1982","1982-10-06"
"3 tháng 2 1992","1992-02-03"
"04.01.76","1976-01-04"
"25 thg 11, 2018","2018-11-25"
"THÁNG 1 18, 1991","1991-01-18"
"31 tháng 10 2015","2015-10-31"
"7 tháng 5 2018","2018-05-07"
"24, thg 12 2004","2004-12-24"
"23 thg 10, 1994","1994-10-23"
"tháng 2 5 1975","1975-02-05"
"24.11.04","2004-11-24"
"01, thg 3 1982","1982-03-01"
"05 thg 7 1971","1971-07-05"
"10 tháng 6, 1992","1992-06-10"
"tháng 12 4, 2008","2008-12-04"
"26 04 00","2000-04-26"
"tháng 1 12 1980","1980-01-12"
"19 10 86","1986-10-19"
"Ngày 03 tháng 02 năm 1994","1994-02-03"
"26.11.07","2007-11-26"
"tháng 11 25 2008","2008-11-25"
"Ngày 13 tháng 02 năm 2012","2012-02-13"
"05, thg 2 2009","2009-02-05"
"21 tháng 8 1975","1975-08-21"
"3 THG 6 1994","1994-06-03"
"12.03.01","2001-03-12"
"03/09/2000","2000-09-03"
"27.12.92","1992-12-27"
"30 THG 7, 1983","1983-07-30"
"31 THG 10, 1993","1993-10-31"
"NGÀY 20 THÁNG 02 NĂM 2001","2001-02-20"
"29 THG 9 2002","2002-09-29"
"17 thg 4, 1971","1971-04-17"
"24 thg 12, 1996","1996-12-24"
"Thứ Hai, ngày 22 tháng 5 năm 1995","1995-05-22"
"28 THÁNG 5 1976","1976-05-28"
"2 tháng 7, 1995","1995-07-02"
"26/12/2008","2008-12-26"
"1 thg 5, 1985","1985-05-01"
"28 thg 2 1999","1999-02-28"
"tháng 4 15 2002","2002-04-15"
"21 tháng 3, 2004","2004-03-21"
"24 tháng 5, 1970","1970-05-24"
"06.01.76","1976-01-06"
"27 thg 5, 2002","2002-05-27"
"08.04.18","2018-04-08"
"26 tháng 2 1994","1994-02-26"
"2 tháng 9 1994","1994-09-02"
"18, thg 3 1980","1980-03-18"
"Thứ Sáu, ngày 27 tháng 11 năm 1981","1981-11-27"
"Ngày 05 tháng 12 năm 1974","1974-12-05"
"tháng 10 12 2015","2015-10-12"
"ngày 04 tháng 05 năm 1978","1978-05-04"
"tháng 9 30, 1976","1976-09-30"
"01.02.87","1987-02-01"
"12 tháng 3, 1998","1998-03-12"
"18 thg 9 2009","2009-09-18"
"15 thg 6 1993","1993-06-15"
"ngày 15 tháng 09 năm 2018","2018-09-15"
"28 thg 11 1986","1986-11-28"
"23.07.03","2003-07-23"
"Ngày 21 tháng 09 năm 1971","1971-09-21"
"tháng 3 6 2005","2005-03-06"
"19 thg 1, 2004","2004-01-19"
"Ngày 25 tháng 01 năm 2008","2008-01-25"
"15 THÁNG 5 1996","1996-05-15"
"tháng 9 23 1989","1989-09-23"
"30 THG 7, 2010","2010-07-30"
"5 08 16","2016-08-05"
"tháng 5 23, 1980","1980-05-23"
"25 THG 10, 2001","2001-10-25"
"25 thg 12, 2015","2015-12-25"
"tháng 4 27 2012","2012-04-27"
"20 tháng 11 1987","1987-11-20"
"THÁNG 5 15 1975","1975-05-15"
"25, thg 12 2002","2002-12-25"
"13 12 90","1990-12-13"
"16/02/2017","2017-02-16"
"19, thg 2 1984","1984-02-19"
"11 tháng 3, 1976","1976-03-11"
"30 thg 4 1997","1997-04-30"
"09, thg 2 1974","1974-02-09"
"25, thg 6 1997","1997-06-25"
"23 THÁNG 5, 2013","2013-05-23"
"15 THG 8, 1993","1993-08-15"
"18 THG 5 2015","2015-05-18"
"13 tháng 12, 2008","2008-12-13"
"tháng 6 6, 1971","1971-06-06"
"21 thg 3, 1974","1974-03-21"
"14.01.70","1970-01-14"
"tháng 11 8 2001","2001-11-08"
"25, thg 1 2003","2003-01-25"
"20, THG 1 1988","1988-01-20"
"25 thg 11, 2006","2006-11-25"
"24 thg 9, 2011","2011-09-24"
"tháng 12 7, 2008","2008-12-07"
"14 01 04","2004-01-14"
"THÁNG 7 21 2017","2017-07-21"
"4 tháng 3, 1994","1994-03-04"
"6 thg 8 2011","2011-08-06"
"19.08.14","2014-08-19"
"31 thg 5 1981","1981-05-31"
"05 thg 2 2001","2001-02-05"
"5 02 96","1996-02-05"
"17 THG 7 1973","1973-07-17"
"25, thg 8 2003","2003-08-25"
"tháng 12 30, 1993","1993-12-30"
"17 tháng 10 1974","1974-10-17"
"25/07/1988","1988-07-25"
"16 THG 2 2001","2001-02-16"
"12 THG 3, 1994","1994-03-12"
"14/02/2014","2014-02-14"
"3 thg 12, 2002","2002-12-03"
"24 thg 9 2016","2016-09-24"
"29/07/1985","1985-07-29"
"tháng 1 24 1987","1987-01-24"
"Ngày 11 tháng 02 năm 2012","2012-02-11"
"26 thg 1, 1995","1995-01-26"
"01, thg 4 1999","1999-04-01"
"29 10 70","1970-10-29"
"11 thg 6, 2011","2011-06-11"
"18 tháng 7 2000","2000-07-18"
"19 thg 9, 2008","2008-09-19"
"26 06 02","2002-06-26"
"tháng 2 8, 2010","2010-02-08"
"tháng 2 20 1980","1980-02-20"
"14/08/1989","1989-08-14"
"29 07 82","1982-07-29"
"Ngày 14 tháng 12 năm 2018","2018-12-14"
"18.03.85","1985-03-18"
"16 thg 11 1976","1976-11-16"
"tháng 7 4, 2017","2017-07-04"
"13 tháng 9 1982","1982-09-13"
"4 thg 9, 2011","2011-09-04"
"thứ tư, ngày 25 tháng 4 năm 2018","2018-04-25"
"28 thg 3 1984","1984-03-28"
"tháng 12 13 1994","1994-12-13"
"Thứ Hai, ngày 05 tháng 1 năm 1987","1987-01-05"
"10, THG 8 2017","2017-08-10"
"Thứ Năm, ngày 30 tháng 6 năm 1977","1977-06-30"
"5 tháng 11 2017","2017-11-05"
"tháng 1 30 2006","2006-01-30"
"22 tháng 11 2015","2015-11-22"
"THÁNG 2 11 2013","2013-02-11"
"Chủ Nhật, ngày 31 tháng 1 năm 2016","2016-01-31"
"tháng 8 1 2018","2018-08-01"
"NGÀY 11 THÁNG 07 NĂM 2004","2004-07-11"
"17 thg 12, 1983","1983-12-17"
"7 tháng 1 1997","1997-01-07"
"14, thg 2 2017","2017-02-14"
"30 tháng 6, 1999","1999-06-30"
"20.10.05","2005-10-20"
"11 thg 5 1976","1976-05-11"
"29.12.98","1998-12-29"
"4 tháng 10 1986","1986-10-04"
"07 thg 9 1991","1991-09-07"
"30 thg 10 2005","2005-10-30"
"tháng 7 8 1991","1991-07-08"
"Thứ Bảy, ngày 28 tháng 1 năm 1989","1989-01-28"
"THÁNG 5 7 2003","2003-05-07"
"tháng 6 1, 2003","2003-06-01"
"17 thg 8, 1989","1989-08-17"
"tháng 3 18, 1970","1970-03-18"
"10 thg 12 2008","2008-12-10"
"27 tháng 7, 2011","2011-07-27"
"30 11 92","1992-11-30"
"THỨ SÁU, NGÀY 21 THÁNG 8 NĂM 1981","1981-08-21"
"18 THG 5 1999","1999-05-18"
"8 thg 5 2001","2001-05-08"
"14 tháng 6 2011","2011-06-14"
"17.12.96","1996-12-17"
"2 tháng 10 2017","2017-10-02"
"15 tháng 3 1971","1971-03-15"
"9 thg 5, 1975","1975-05-09"
"THỨ BẢY, NGÀY 12 THÁNG 4 NĂM 2003","2003-04-12"
"23 thg 5 2005","2005-05-23"
"Thứ Năm, ngày 16 tháng 11 năm 1978","1978-11-16"
"1 THG 4, 1976","1976-04-01"
"24 thg 4, 1998","1998-04-24"
"NGÀY 09 THÁNG 12 NĂM 1979","1979-12-09"
"27 THG 5, 2009","2009-05-27"
"15.01.74","1974-01-15"
"27, THG 4 2002","2002-04-27"
"23 thg 11 1993","1993-11-23"
"26 THÁNG 4 1975","1975-04-26"
"12 02 91","1991-02-12"
"15 thg 5, 2016","2016-05-15"
"25.09.97","1997-09-25"
"Ngày 08 tháng 09 năm 2013","2013-09-08"
"Ngày 13 tháng 08 năm 1999","1999-08-13"
"29 thg 7 1978","1978-07-29"
"10 tháng 10 1973","1973-10-10"
"21 thg 1, 1986","1986-01-21"
"8 tháng 5, 2004","2004-05-08"
"22 tháng 1 1975","1975-01-22"
"tháng 10 26, 2018","2018-10-26"
"29 tháng 8 1991","1991-08-29"
"19/11/2018","2018-11-19"
"08.07.03","2003-07-08"
"16 tháng 11 1978","1978-11-16"
"21 tháng 7 2007","2007-07-21"
"24, thg 7 1992","1992-07-24"
"23 THG 6, 2010","2010-06-23"
"Chủ Nhật, ngày 12 tháng 5 năm 2013","2013-05-12"
"21 tháng 10 1998","1998-10-21"
"Thứ Hai, ngày 11 tháng 6 năm 1984","1984-06-11"
"09.05.89","1989-05-09"
"13 thg 9, 2012","2012-09-13"
"22, THG 8 1985","1985-08-22"
"19/12/2011","2011-12-19"
"21 03 99","1999-03-21"
"4 thg 9, 1975","1975-09-04"
"tháng 5 29, 2002","2002-05-29"
"tháng 10 1 1971","1971-10-01"
"tháng 7 28 2013","2013-07-28"
"1 tháng 6, 2002","2002-06-01"
"Thứ Tư, ngày 28 tháng 2 năm 1973","1973-02-28"
"28 thg 9 1987","1987-09-28"
"11 tháng 11 1985","1985-11-11"
"30 tháng 11 2017","2017-11-30"
"22 tháng 5 1991","1991-05-22"
"Ngày 30 tháng 08 năm 1993","1993-08-30"
"17, thg 9 1970","1970-09-17"
"THÁNG 4 7 1982","1982-04-07"
"26 02 78","1978-02-26"
"tháng 2 19 1979","1979-02-19"
"THÁNG 8 5, 2008","2008-08-05"
"thứ ba, ngày 05 tháng 8 năm 1997","1997-08-05"
"12 THG 4 2015","2015-04-12"
"22/07/2011","2011-07-22"
"10 thg 11 2010","2010-11-10"
"05, thg 3 2013","2013-03-05"
"tháng 9 2 2011","2011-09-02"
"23 thg 2, 1997","1997-02-23"
"18 tháng 5 1981","1981-05-18"
"21 thg 3, 1981","1981-03-21"
"31 THG 3 1973","1973-03-31"
"4 tháng 10 2000","2000-10-04"
"CHỦ NHẬT, NGÀY 21 THÁNG 12 NĂM 2003","2003-12-21"
"7 tháng 8, 2010","2010-08-07"
"11, thg 10 1971","1971-10-11"
"CHỦ NHẬT, NGÀY 05 THÁNG 9 NĂM 1971","1971-09-05"
"thứ ba, ngày 08 tháng 9 năm 1970","1970-09-08"
"17 tháng 6 2004","2004-06-17"
"23.09.04","2004-09-23"
"26 THÁNG 8 2017","2017-08-26"
"23.02.15","2015-02-23"
"23 tháng 1 1983","1983-01-23"
"tháng 2 8 2010","2010-02-08"
"02.01.05","2005-01-02"
"5 thg 4, 1986","1986-04-05"
"21, THG 3 2017","2017-03-21"
"23 tháng 4 1972","1972-04-23"
"tháng 11 22, 1990","1990-11-22"
"24, thg 6 2015","2015-06-24"
"28 THÁNG 9 1974","1974-09-28"
"13 THG 4, 1982","1982-04-13"
"15.06.70","1970-06-15"
"27 tháng 7 1988","1988-07-27"
"29/10/1988","1988-10-29"
"3 06 17","2017-06-03"
"tháng 1 13, 1970","1970-01-13"
"20, thg 12 1986","1986-12-20"
"ngày 23 tháng 05 năm 2002","2002-05-23"
"28 thg 8, 1972","1972-08-28"
"20 tháng 5, 1988","1988-05-20"
"25 thg 10, 2001","2001-10-25"
"4 THG 3 2016","2016-03-04"
"16.07.76","1976-07-16"
"NGÀY 14 THÁNG 04 NĂM 1974","1974-04-14"
"tháng 10 14 2015","2015-10-14"
"24, thg 11 1990","1990-11-24"
"ngày 20 tháng 01 năm 2007","2007-01-20"
"7 thg 9, 1979","1979-09-07"
"20, thg 7 1978","1978-07-20"
"31 thg 1, 2017","2017-01-31"
"23 THG 7 2014","2014-07-23"
"19 THÁNG 2 1999","1999-02-19"
"14 tháng 4, 1980","1980-04-14"
"17 tháng 1 1980","1980-01-17"
"03, thg 4 2018","2018-04-03"
"13 thg 7 2011","2011-07-13"
"27 tháng 6, 1995","1995-06-27"
"24 01 87","1987-01-24"
"8 thg 2, 1984","1984-02-08"
"18 thg 7, 1988","1988-07-18"
"4 thg 10, 2015","2015-10-04"
"NGÀY 27 THÁNG 04 NĂM 1995","1995-04-27"
"THÁNG 11 28, 1975","1975-11-28"
"25 tháng 4 1991","1991-04-25"
"07.09.93","1993-09-07"
"07/07/2014","2014-07-07"
"ngày 06 tháng 06 năm 1983","1983-06-06"
"16 thg 11 1988","1988-11-16"
"2 08 03","2003-08-02"
"18 thg 10, 2000","2000-10-18"
"4 12 74","1974-12-04"
"14 tháng 7, 2014","2014-07-14"
"27 thg 1 1978","1978-01-27"
"tháng 4 26 1978","1978-04-26"
"thứ hai, ngày 23 tháng 8 năm 1982","1982-08-23"
"9 thg 5, 1971","1971-05-09"
"tháng 5 15 2010","2010-05-15"
"22 thg 8 1972","1972-08-22"
"26 thg 7, 1995","1995-07-26"
"11/09/1993","1993-09-11"
"04 thg 7 2010","2010-07-04"
"20, THG 10 2016","2016-10-20"
"ngày 12 tháng 04 năm 2002","2002-04-12"
"7 thg 6, 1981","1981-06-07"
"tháng 6 29 1985","1985-06-29"
"9 tháng 12 2006","2006-12-09"
"2 tháng 4, 1984","1984-04-02"
"9 tháng 9 2016","2016-09-09"
"11 tháng 9 1971","1971-09-11"
"THÁNG 11 25, 2013","2013-11-25"
"4 THÁNG 6 2001","2001-06-04"
"5 thg 4, 1982","1982-04-05"
"THÁNG 1 5, 1973","1973-01-05"
"15 THG 4, 1975","1975-04-15"
"1 tháng 7, 1980","1980-07-01"
"10 07 05","2005-07-10"
"tháng 6 18, 1978","1978-06-18"
"tháng 7 17, 2011","2011-07-17"
"tháng 3 25 1984","1984-03-25"
"20 03 08","2008-03-20"
"5 tháng 2, 2000","2000-02-05"
"01.09.96","1996-09-01"
"30 THG 9 1972","1972-09-30"
"12.05.18","2018-05-12"
"NGÀY 01 THÁNG 07 NĂM 1985","1985-07-01"
"07, thg 12 2016","2016-12-07"
"thứ năm, ngày 17 tháng 8 năm 2006","2006-08-17"
"tháng 11 24 2007","2007-11-24"
"tháng 11 5, 1970","1970-11-05"
"13 thg 5, 1999","1999-05-13"
"tháng 6 27, 1994","1994-06-27"
"12 thg 1, 1994","1994-01-12"
"23 tháng 9 1983","1983-09-23"
"21 thg 1 1990","1990-01-21"
"24 thg 9, 1972","1972-09-24"
"18 THG 3, 1988","1988-03-18"
"THÁNG 2 3, 1972","1972-02-03"
"26 thg 8 1993","1993-08-26"
"8 02 14","2014-02-08"
"tháng 3 4 2005","2005-03-04"
"26 09 06","2006-09-26"
"20 THG 7, 1973","1973-07-20"
"27 tháng 2 2008","2008-02-27"
"9 THG 12, 1976","1976-12-09"
"20 THÁNG 7, 1978","1978-07-20"
"THÁNG 8 27, 1991","1991-08-27"
"3 THG 3, 1978","1978-03-03"
"04, thg 12 1972","1972-12-04"
"tháng 9 19, 2009","2009-09-19"
"22 08 17","2017-08-22"
"tháng 7 22 1993","1993-07-22"
"09/03/2011","2011-03-09"
"04.09.81","1981-09-04"
"Ngày 26 tháng 04 năm 2008","2008-04-26"
"thứ sáu, ngày 01 tháng 11 năm 1985","1985-11-01"
"tháng 3 15, 2000","2000-03-15"
"18, thg 3 2005","2005-03-18"
"THỨ BA, NGÀY 15 THÁNG 1 NĂM 1974","1974-01-15"
"29 08 81","1981-08-29"
"THÁNG 10 21, 2015","2015-10-21"
"27 thg 9, 1994","1994-09-27"
"6 thg 2 2014","2014-02-06"
"Ngày 19 tháng 03 năm 2004","2004-03-19"
"03, thg 1 1981","1981-01-03"
"6 tháng 4 2005","2005-04-06"
"16.05.17","2017-05-16"
"27 03 72","1972-03-27"
"12 thg 12, 1998","1998-12-12"
"4 THÁNG 6 1986","1986-06-04"
"2 thg 5, 1981","1981-05-02"
"20 tháng 9, 2003","2003-09-20"
"03.03.97","1997-03-03"
"Ngày 09 tháng 12 năm 1990","1990-12-09"
"6 thg 12, 2010","2010-12-06"
"2 THÁNG 2, 1989","1989-02-02"
"14.01.95","1995-01-14"
"THỨ HAI, NGÀY 13 THÁNG 2 NĂM 2006","2006-02-13"
"THÁNG 10 26, 1983","1983-10-26"
"1 01 94","1994-01-01"
"tháng 9 6, 1981","1981-09-06"
"30 tháng 8 1997","1997-08-30"
"THÁNG 3 31 1972","1972-03-31"
"16 02 81","1981-02-16"
"17 10 11","2011-10-17"
"14 05 84","1984-05-14"
"21 06 01","2001-06-21"
"25 thg 5 1988","1988-05-25"
"06/08/2008","2008-08-06"
"21 thg 6, 1979","1979-06-21"
"14 tháng 1 2007","2007-01-14"
"6 thg 1 1970","1970-01-06"
"17 12 16","2016-12-17"
"NGÀY 07 THÁNG 09 NĂM 2013","2013-09-07"
"11 07 95","1995-07-11"
"5 THG 5, 1980","1980-05-05"
"19 08 97","1997-08-19"
"19 09 03","2003-09-19"
"25 04 76","1976-04-25"
"NGÀY 07 THÁNG 01 NĂM 2018","2018-01-07"
"21 thg 1 1975","1975-01-21"
"10/02/1981","1981-02-10"
"16.02.73","1973-02-16"
"tháng 7 22 1999","1999-07-22"
"06, thg 7 1995","1995-07-06"
"19/10/1985","1985-10-19"
"15 tháng 10 2014","2014-10-15"
"09.12.14","2014-12-09"
"21, thg 5 2000","2000-05-21"
"20 THG 7 1982","1982-07-20"
"14 thg 3 1987","1987-03-14"
"02/01/2017","2017-01-02"
"6 thg 2 2016","2016-02-06"
"Ngày 05 tháng 08 năm 2014","2014-08-05"
"tháng 1 6, 1974","1974-01-06"
"20 tháng 7 2015","2015-07-20"
"05 thg 4 1994","1994-04-05"
"9 thg 4 2010","2010-04-09"
"30 tháng 9 1990","1990-09-30"
"6 thg 10, 1978","1978-10-06"
"10 thg 10 2014","2014-10-10"
"23.02.98","1998-02-23"
"01, thg 2 1986","1986-02-01"
"13 thg 2, 1972","1972-02-13"
"tháng 11 20 2005","2005-11-20"
"03 thg 1 1975","1975-01-03"
"11 tháng 4, 1987","1987-04-11"
"Ngày 12 tháng 12 năm 1998","1998-12-12"
"01.09.74","1974-09-01"
"10/11/1993","1993-11-10"
"THÁNG 1 24, 2002","2002-01-24"
"30.04.82","1982-04-30"
"25 tháng 10 2014","2014-10-25"
"16 thg 5 1986","1986-05-16"
"tháng 12 30, 1988","1988-12-30"
"09 THG 1 2008","2008-01-09"
"Ngày 01 tháng 08 năm 1989","1989-08-01"
"2 09 04","2004-09-02"
"22 thg 12, 1976","1976-12-22"
"ngày 10 tháng 08 năm 1988","1988-08-10"
"15 thg 4 1979","1979-04-15"
"29 thg 2 2008","2008-02-29"
"11 tháng 9 2004","2004-09-11"
"2 01 82","1982-01-02"
"15/02/1981","1981-02-15"
"11.05.05","2005-05-11"
"22 tháng 8 2003","2003-08-22"
"2 THG 8, 2012","2012-08-02"
"11 tháng 4 2015","2015-04-11"
"THÁNG 4 27 1979","1979-04-27"
"23 thg 6, 2015","2015-06-23"
"7 THG 1, 2010","2010-01-07"
"Thứ Tư, ngày 28 tháng 4 năm 1999","1999-04-28"
"tháng 11 1 2000","2000-11-01"
"26 THG 1 1979","1979-01-26"
"15 thg 9, 2008","2008-09-15"
"8 thg 9, 1984","1984-09-08"
"17, thg 2 2010","2010-02-17"
"10 thg 8 1977","1977-08-10"
"10 thg 7 2006","2006-07-10"
"25 THG 11, 1993","1993-11-25"
"Ngày 02 tháng 05 năm 2014","2014-05-02"
"THỨ BA, NGÀY 07 THÁNG 2 NĂM 2017","2017-02-07"
"17 tháng 5 2007","2007-05-17"
"09, thg 3 1999","1999-03-09"
"23 thg 8, 2010","2010-08-23"
"18/10/1985","1985-10-18"
"18 tháng 8 1986","1986-08-18"
"Thứ Hai, ngày 01 tháng 1 năm 2007","2007-01-01"
"30 tháng 5 1985","1985-05-30"
"20 11 04","2004-11-20"
"tháng 4 18 1996","1996-04-18"
"23 THÁNG 7, 2015","2015-07-23"
"24, thg 9 1977","1977-09-24"
"26 tháng 10 1992","1992-10-26"
"7 THÁNG 1, 2011","2011-01-07"
"29 tháng 1 2017","2017-01-29"
"THỨ BẢY, NGÀY 27 THÁNG 10 NĂM 2012","2012-10-27"
"11 thg 3, 2014","2014-03-11"
"3 tháng 6, 1982","1982-06-03"
"tháng 5 11, 1984","1984-05-11"
"tháng 8 18, 1979","1979-08-18"
"9 thg 6 1975","1975-06-09"
"23/04/1981","1981-04-23"
"19 THÁNG 9, 1970","1970-09-19"
"Ngày 21 tháng 02 năm 1974","1974-02-21"
"25 thg 10, 2009","2009-10-25"
"21 THÁNG 11, 1973","1973-11-21"
"ngày 26 tháng 04 năm 2003","2003-04-26"
"6 thg 12, 1988","1988-12-06"
"Thứ Ba, ngày 15 tháng 3 năm 1988","1988-03-15"
"THÁNG 10 24 1986","1986-10-24"
"12 tháng 8, 2000","2000-08-12"
"13 thg 7, 2016","2016-07-13"
"13 THÁNG 9, 2012","2012-09-13"
"5 THÁNG 12 2008","2008-12-05"
"25, thg 1 2002","2002-01-25"
"6 THG 7 1976","1976-07-06"
"2 THÁNG 1, 1972","1972-01-02"
"27 10 92","1992-10-27"
"chủ nhật, ngày 03 tháng 12 năm 1978","1978-12-03"
"NGÀY 08 THÁNG 07 NĂM 1993","1993-07-08"
"14, thg 6 2000","2000-06-14"
"15.01.01","2001-01-15"
"tháng 4 24 1976","1976-04-24"
"tháng 5 11 1976","1976-05-11"
"THÁNG 10 21 2017","2017-10-21"
"31 thg 3 1986","1986-03-31"
"28 tháng 9 1998","1998-09-28"
"22 tháng 8, 1983","1983-08-22"
"09.10.94","1994-10-09"
"THỨ BẢY, NGÀY 19 THÁNG 10 NĂM 1974","1974-10-19"
"04/05/2013","2013-05-04"
"tháng 6 21 1972","1972-06-21"
"12 tháng 4 1985","1985-04-12"
"03 THG 2 2017","2017-02-03"
"28 thg 10 1995","1995-10-28"
"THỨ SÁU, NGÀY 07 THÁNG 8 NĂM 2015","2015-08-07"
"24 tháng 8 2005","2005-08-24"
"28 thg 6, 1977","1977-06-28"
"15 THÁNG 9 1996","1996-09-15"
"Thứ Năm, ngày 07 tháng 4 năm 1994","1994-04-07"
"5 THG 9 1981","1981-09-05"
"tháng 12 27 2009","2009-12-27"
"27 THG 7 2003","2003-07-27"
"12/02/1992","1992-02-12"
"16 thg 4, 1977","1977-04-16"
"10 THG 2 1975","1975-02-10"
"02.01.06","2006-01-02"
"3 tháng 5 2010","2010-05-03"
"chủ nhật, ngày 17 tháng 5 năm 1987","1987-05-17"
"29, thg 12 1998","1998-12-29"
"21 THÁNG 8 1988","1988-08-21"
"Ngày 18 tháng 01 năm 1982","1982-01-18"
"13 THG 6 1975","1975-06-13"
"7 tháng 3 1997","1997-03-07"
"01/03/1993","1993-03-01"
"30 tháng 10 2009","2009-10-30"
"tháng 12 23, 2000","2000-12-23"
"25 02 97","1997-02-25"
"06 thg 3 2014","2014-03-06"
"27 tháng 2 1992","1992-02-27"
"23.04.97","1997-04-23"
"10/09/2000","2000-09-10"
"07.10.85","1985-10-07"
"09/11/1985","1985-11-09"
"08/04/2014","2014-04-08"
"tháng 10 14, 2002","2002-10-14"
"8 thg 1, 1977","1977-01-08"
"08/09/2017","2017-09-08"
"28/12/1973","1973-12-28"
"2 08 92","1992-08-02"
"28/10/2013","2013-10-28"
"22 THG 1 2008","2008-01-22"
"03/11/1982","1982-11-03"
"20 tháng 12 2008","2008-12-20"
"22 02 00","2000-02-22"
"tháng 6 21 1998","1998-06-21"
"12 THG 11 1972","1972-11-12"
"9 07 13","2013-07-09"
"10 THG 8, 1994","1994-08-10"
"19, thg 9 1988","1988-09-19"
"03.09.93","1993-09-03"
"Ngày 24 tháng 06 năm 1981","1981-06-24"
"25 thg 7 1971","1971-07-25"
"21/06/2000","2000-06-21"
"19 THG 8, 2016","2016-08-19"
"24 08 93","1993-08-24"
"29 thg 8 1996","1996-08-29"
"29 thg 12 1975","1975-12-29"
"tháng 8 9, 2000","2000-08-09"
"30 thg 8 1984","1984-08-30"
"tháng 10 27 1970","1970-10-27"
"tháng 3 29 1981","1981-03-29"
"tháng 10 9, 2015","2015-10-09"
"08, thg 10 2018","2018-10-08"
"27 THG 10 2001","2001-10-27"
"NGÀY 08 THÁNG 12 NĂM 1986","1986-12-08"
"31/07/1983","1983-07-31"
"tháng 2 10 1974","1974-02-10"
"5 tháng 6 1970","1970-06-05"
"Ngày 24 tháng 08 năm 2011","2011-08-24"
"7 tháng 7 1994","1994-07-07"
"17 thg 12 2004","2004-12-17"
"5 tháng 8, 2007","2007-08-05"
"9 THG 8 2007","2007-08-09"
"23.08.02","2002-08-23"
"15 tháng 11, 1975","1975-11-15"
"14 thg 12, 2002","2002-12-14"
"thứ tư, ngày 26 tháng 10 năm 2005","2005-10-26"
"tháng 3 3, 1982","1982-03-03"
"tháng 4 11, 2015","2015-04-11"
"28 THG 8, 2002","2002-08-28"
"THÁNG 10 17 1972","1972-10-17"
"29 06 97","1997-06-29"
"10/09/1979","1979-09-10"
"15 thg 10, 2015","2015-10-15"
"15 thg 1, 1972","1972-01-15"
"02/05/1987","1987-05-02"
"Ngày 28 tháng 02 năm 2001","2001-02-28"
"9 THÁNG 2 1992","1992-02-09"
"20 07 93","1993-07-20"
"Ngày 26 tháng 11 năm 1987","1987-11-26"
"5 04 11","2011-04-05"
"NGÀY 28 THÁNG 01 NĂM 1990","1990-01-28"
"28.06.06","2006-06-28"
"tháng 6 10 2000","2000-06-10"
"30 thg 10, 1995","1995-10-30"
"21 thg 6, 1999","1999-06-21"
"Thứ Năm, ngày 16 tháng 7 năm 2015","2015-07-16"
"Chủ Nhật, ngày 30 tháng 8 năm 1970","1970-08-30"
"20 03 97","1997-03-20"
"NGÀY 18 THÁNG 04 NĂM 1999","1999-04-18"
"20.11.93","1993-11-20"
"15 tháng 4 2002","2002-04-15"
"THÁNG 3 30 2000","2000-03-30"
"2 10 78","1978-10-02"
"tháng 8 15 1975","1975-08-15"
"24 09 76","1976-09-24"
"22, thg 2 2000","2000-02-22"
"04.03.88","1988-03-04"
"12 tháng 8 1980","1980-08-12"
"22, THG 11 1970","1970-11-22"
"25 tháng 8, 1971","1971-08-25"
"15/09/2016","2016-09-15"
"THÁNG 7 31, 1989","1989-07-31"
"18 THG 1 2016","2016-01-18"
"16 THÁNG 7, 1977","1977-07-16"
"19 tháng 11 2011","2011-11-19"
"18 THG 1, 1985","1985-01-18"
"tháng 11 23, 2017","2017-11-23"
"26.06.04","2004-06-26"
"18 THÁNG 10 1988","1988-10-18"
"18/01/2000","2000-01-18"
"23, THG 12 2010","2010-12-23"
"27, THG 3 1984","1984-03-27"
"17.11.09","2009-11-17"
"1 thg 12 1976","1976-12-01"
"7 thg 7, 2004","2004-07-07"
"27 tháng 4, 2012","2012-04-27"
"15 THG 8, 1983","1983-08-15"
"25 THÁNG 1 2017","2017-01-25"
"9 thg 6 2004","2004-06-09"
"5 thg 2 2001","2001-02-05"
"20 04 01","2001-04-20"
"5 thg 1, 1990","1990-01-05"
"20 09 15","2015-09-20"
"tháng 3 20, 1997","1997-03-20"
"30 09 01","2001-09-30"
"30 thg 7 2008","2008-07-30"
"14.05.82","1982-05-14"
"thứ sáu, ngày 11 tháng 6 năm 1982","1982-06-11"
"tháng 11 2, 1993","1993-11-02"
"Thứ Năm, ngày 30 tháng 10 năm 2008","2008-10-30"
"16 11 06","2006-11-16"
"5 thg 3, 1979","1979-03-05"
"6 thg 11 1982","1982-11-06"
"tháng 12 26 1991","1991-12-26"
"05 thg 8 2000","2000-08-05"
"5 thg 6, 2000","2000-06-05"
"16 THÁNG 3, 2004","2004-03-16"
"THỨ BA, NGÀY 17 THÁNG 6 NĂM 2003","2003-06-17"
"Ngày 15 tháng 11 năm 2006","2006-11-15"
"13, thg 8 1999","1999-08-13"
"19/05/1990","1990-05-19"
"02.02.91","1991-02-02"
"THÁNG 9 2, 2011","2011-09-02"
"15 thg 10 1989","1989-10-15"
"NGÀY 02 THÁNG 11 NĂM 2005","2005-11-02"
"06.10.03","2003-10-06"
"1 thg 12 2018","2018-12-01"
"31 03 13","2013-03-31"
"20 tháng 2 1977","1977-02-20"
"11, thg 6 2007","2007-06-11"
"8 04 89","1989-04-08"
"19, thg 2 1996","1996-02-19"
"5 thg 2 1997","1997-02-05"
"tháng 8 12 2008","2008-08-12"
"20 thg 3 2008","2008-03-20"
"24 tháng 8, 2001","2001-08-24"
"26 04 74","1974-04-26"
"3 03 97","1997-03-03"
"27 tháng 11 1992","1992-11-27"
"11 tháng 6, 2009","2009-06-11"
"26 THG 10, 1987","1987-10-26"
"16 thg 5 2017","2017-05-16"
"14 11 96","1996-11-14"
"Thứ Năm, ngày 23 tháng 7 năm 2015","2015-07-23"
"tháng 2 2, 1983","1983-02-02"
"22/09/2014","2014-09-22"
"23 tháng 1, 2010","2010-01-23"
"Thứ Ba, ngày 09 tháng 1 năm 2001","2001-01-09"
"Thứ Hai, ngày 16 tháng 2 năm 1970","1970-02-16"
"22 08 80","1980-08-22"
"tháng 10 2 1989","1989-10-02"
"16 thg 10 2000","2000-10-16"
"1 tháng 5, 1981","1981-05-01"
"13.08.90","1990-08-13"
"Ngày 07 tháng 05 năm 1995","1995-05-07"
"12 thg 11 1994","1994-11-12"
"Thứ Năm, ngày 11 tháng 2 năm 1971","1971-02-11"
"23 thg 6 1971","1971-06-23"
"tháng 12 19 1989","1989-12-19"
"24 thg 11, 2009","2009-11-24"
"14 thg 6 2014","2014-06-14"
"8 thg 8, 2005","2005-08-08"
"03.07.00","2000-07-03"
"16 tháng 10, 2015","2015-10-16"
"19, THG 1 1985","1985-01-19"
"20/07/2005","2005-07-20"
"28.03.07","2007-03-28"
"THÁNG 12 21 2004","2004-12-21"
"31 thg 12, 2005","2005-12-31"
"28 11 77","1977-11-28"
"07, thg 6 1993","1993-06-07"
"30 THG 11 2010","2010-11-30"
"tháng 12 10, 1983","1983-12-10"
"13, thg 2 1981","1981-02-13"
"Thứ Sáu, ngày 20 tháng 7 năm 2018","2018-07-20"
"tháng 7 5, 1971","1971-07-05"
"ngày 17 tháng 06 năm 1996","1996-06-17"
"ngày 10 tháng 12 năm 2000","2000-12-10"
"20 thg 7 1979","1979-07-20"
"8 thg 10, 1999","1999-10-08"
"12 thg 8 2002","2002-08-12"
"25 THG 5 1989","1989-05-25"
"27/09/1993","1993-09-27"
"Ngày 05 tháng 01 năm 1970","1970-01-05"
"28/03/1995","1995-03-28"
"THÁNG 12 25 2005","2005-12-25"
"07 thg 3 1971","1971-03-07"
"23 THG 6, 1971","1971-06-23"
"1 tháng 2 1990","1990-02-01"
"Thứ Sáu, ngày 23 tháng 3 năm 2001","2001-03-23"
"Ngày 11 tháng 07 năm 1996","1996-07-11"
"18 03 78","1978-03-18"
"9 tháng 11 1991","1991-11-09"
"9 tháng 5 1972","1972-05-09"
"20 THG 11, 1993","1993-11-20"
"26.06.02","2002-06-26"
"tháng 4 29, 1997","1997-04-29"
"Ngày 16 tháng 10 năm 2013","2013-10-16"
"Thứ Hai, ngày 28 tháng 12 năm 1998","1998-12-28"
"tháng 11 22 2011","2011-11-22"
"07/11/2016","2016-11-07"
"04.02.09","2009-02-04"
"29, thg 4 1980","1980-04-29"
"4 tháng 12 1998","1998-12-04"
"tháng 4 25 2009","2009-04-25"
"27 thg 3 1972","1972-03-27"
"22 thg 2, 1984","1984-02-22"
"6 thg 11 2016","2016-11-06"
"tháng 5 31, 1988","1988-05-31"
"23 04 15","2015-04-23"
"Ngày 26 tháng 01 năm 1986","1986-01-26"
"14 THG 10, 1978","1978-10-14"
"THÁNG 7 15 1997","1997-07-15"
"17.02.70","1970-02-17"
"12 thg 3, 1983","1983-03-12"
"tháng 10 12, 2012","2012-10-12"
"tháng 9 5, 2018","2018-09-05"
"26 09 79","1979-09-26"
"28 thg 3, 1989","1989-03-28"
"8 thg 6 2013","2013-06-08"
"12 thg 10 1974","1974-10-12"
"17 THG 7 2012","2012-07-17"
"THỨ NĂM, NGÀY 15 THÁNG 12 NĂM 2005","2005-12-15"
"Thứ Hai, ngày 14 tháng 4 năm 2008","2008-04-14"
"Ngày 27 tháng 02 năm 2017","2017-02-27"
"2 tháng 6 1975","1975-06-02"
"23 THG 2, 1980","1980-02-23"
"30, thg 9 1984","1984-09-30"
"THÁNG 10 10 1993","1993-10-10"
"3 thg 10 2011","2011-10-03"
"09/03/1975","1975-03-09"
"15 THG 2 2011","2011-02-15"
"3 03 16","2016-03-03"
"20 thg 10 1980","1980-10-20"
"8 thg 10, 1976","1976-10-08"
"28, THG 6 2013","2013-06-28"
"30 THÁNG 1 2015","2015-01-30"
"06, THG 11 2012","2012-11-06"
"Thứ Tư, ngày 22 tháng 12 năm 1982","1982-12-22"
"2 tháng 5 1980","1980-05-02"
"11 tháng 8 2009","2009-08-11"
"24.03.03","2003-03-24"
"26 THG 6 1982","1982-06-26"
"31 THÁNG 5 1987","1987-05-31"
"tháng 6 14, 1993","1993-06-14"
"23 tháng 8 1993","1993-08-23"
"11 thg 12 1974","1974-12-11"
"19 08 04","2004-08-19"
"tháng 7 2 2005","2005-07-02"
"09.07.91","1991-07-09"
"18/09/1997","1997-09-18"
"05, thg 12 1976","1976-12-05"
"1 THG 12, 2004","2004-12-01"
"16 12 10","2010-12-16"
"25 tháng 9 1992","1992-09-25"
"1 02 79","1979-02-01"
"Ngày 28 tháng 07 năm 2004","2004-07-28"
"Thứ Hai, ngày 13 tháng 3 năm 2006","2006-03-13"
"16 09 73","1973-09-16"
"THÁNG 5 16, 2006","2006-05-16"
"21.11.10","2010-11-21"
"07, thg 2 1991","1991-02-07"
"18, THG 9 1970","1970-09-18"
"30 thg 10 1984","1984-10-30"
"Thứ Sáu, ngày 16 tháng 5 năm 2008","2008-05-16"
"18 tháng 3 1973","1973-03-18"
"CHỦ NHẬT, NGÀY 13 THÁNG 10 NĂM 1985","1985-10-13"
"15 THÁNG 9, 2018","2018-09-15"
"12, THG 5 1983","1983-05-12"
"19 thg 5, 1971","1971-05-19"
"13 thg 12 2013","2013-12-13"
"09, thg 5 2007","2007-05-09"
"31 THÁNG 1 1971","1971-01-31"
"NGÀY 30 THÁNG 03 NĂM 1976","1976-03-30"
"tháng 8 2, 1974","1974-08-02"
"3 THÁNG 11 2001","2001-11-03"
"3 tháng 2 2001","2001-02-03"
"19 THG 7 1983","1983-07-19"
"24 thg 3 1992","1992-03-24"
"tháng 7 24 1977","1977-07-24"
"03/12/1997","1997-12-03"
"3 thg 9, 2012","2012-09-03"
"1 tháng 7, 1975","1975-07-01"
"11 tháng 2, 1996","1996-02-11"
"4 THG 1, 1989","1989-01-04"
"13 THG 9 1982","1982-09-13"
"tháng 2 7 1978","1978-02-07"
"THÁNG 10 25, 1995","1995-10-25"
"02/03/1996","1996-03-02"
"14 thg 2 2010","2010-02-14"
"Ngày 16 tháng 01 năm 2009","2009-01-16"
"17 tháng 12, 2002","2002-12-17"
"27 thg 8 2017","2017-08-27"
"9 THÁNG 9 1980","1980-09-09"
"tháng 9 1, 1980","1980-09-01"
"8 THG 5 1996","1996-05-08"
"03 thg 12 2002","2002-12-03"
"18.01.12","2012-01-18"
"01, THG 6 2014","2014-06-01"
"THÁNG 3 12, 1983","1983-03-12"
"THÁNG 4 27, 1985","1985-04-27"
"Ngày 25 tháng 02 năm 1972","1972-02-25"
"23.07.96","1996-07-23"
"tháng 11 6, 2002","2002-11-06"
"4 THÁNG 8 1984","1984-08-04"
"10, thg 3 1984","1984-03-10"
"15 thg 2 1993","1993-02-15"
"02 thg 1 1992","1992-01-02"
"6 05 83","1983-05-06"
"tháng 10 8 1972","1972-10-08"
"08.04.13","2013-04-08"
"22.01.16","2016-01-22"
"ngày 10 tháng 07 năm 1987","1987-07-10"
"29 tháng 4 1990","1990-04-29"
"31 thg 3 1972","1972-03-31"
"14 thg 1, 1993","1993-01-14"
"29 thg 6, 1974","1974-06-29"
"22, thg 3 1993","1993-03-22"
"08 thg 9 1977","1977-09-08"
"13 tháng 11 1995","1995-11-13"
"21 tháng 2, 2018","2018-02-21"
"27.02.09","2009-02-27"
"20 tháng 11 1972","1972-11-20"
"17 thg 8 2006","2006-08-17"
"10.06.09","2009-06-10"
"28 thg 11 2016","2016-11-28"
"thứ bảy, ngày 26 tháng 8 năm 1978","1978-08-26"
"tháng 6 27 2006","2006-06-27"
"28 06 70","1970-06-28"
"1 tháng 8 2009","2009-08-01"
"18 THÁNG 6 2012","2012-06-18"
"NGÀY 05 THÁNG 03 NĂM 1979","1979-03-05"
"10 thg 7, 1979","1979-07-10"
"20 THG 7 2010","2010-07-20"
"9 tháng 4 2005","2005-04-09"
"10/04/2007","2007-04-10"
"05.06.72","1972-06-05"
"15 THG 11 2011","2011-11-15"
"24 tháng 1 1992","1992-01-24"
"6 THÁNG 11, 1981","1981-11-06"
"1 thg 12, 1991","1991-12-01"
"30 THÁNG 7 1986","1986-07-30"
"11 10 06","2006-10-11"
"thứ bảy, ngày 18 tháng 10 năm 2014","2014-10-18"
"17 thg 2, 1990","1990-02-17"
"2 04 11","2011-04-02"
"5 tháng 2, 1972","1972-02-05"
"THÁNG 5 5 2016","2016-05-05"
"27 THG 9 1974","1974-09-27"
"25 THÁNG 5 2014","2014-05-25"
"6 thg 9 2008","2008-09-06"
"4 tháng 1 2010","2010-01-04"
"tháng 12 15, 1972","1972-12-15"
"25 thg 1, 1986","1986-01-25"
"THÁNG 11 21, 1984","1984-11-21"
"25 04 15","2015-04-25"
"25, thg 2 2012","2012-02-25"
"THÁNG 1 17 2016","2016-01-17"
"29 tháng 1 1997","1997-01-29"
"22 02 70","1970-02-22"
"31.12.86","1986-12-31"
"20 THÁNG 1, 1996","1996-01-20"
"21 THÁNG 2, 2005","2005-02-21"
"THÁNG 8 17 1990","1990-08-17"
"tháng 5 15, 1986","1986-05-15"
"29 thg 6 1984","1984-06-29"
"01.02.14","2014-02-01"
"17 THÁNG 4 2007","2007-04-17"
"20 thg 11 1991","1991-11-20"
"tháng 7 8 2007","2007-07-08"
"tháng 3 17 1984","1984-03-17"
"12 THÁNG 10 1983","1983-10-12"
"THÁNG 5 13 2011","2011-05-13"
"Ngày 01 tháng 02 năm 2001","2001-02-01"
"THỨ NĂM, NGÀY 12 THÁNG 4 NĂM 2018","2018-04-12"
"18 tháng 10 1989","1989-10-18"
"8 THÁNG 1, 1994","1994-01-08"
"23 01 88","1988-01-23"
"17 tháng 8 1986","1986-08-17"
"26 thg 4, 1992","1992-04-26"
"29 thg 4, 1985","1985-04-29"
"21 12 73","1973-12-21"
"tháng 3 27 2002","2002-03-27"
"ngày 28 tháng 02 năm 2015","2015-02-28"
"26 thg 10, 2001","2001-10-26"
"31 thg 1 1999","1999-01-31"
"16 tháng 1 1982","1982-01-16"
"THÁNG 11 7 1974","1974-11-07"
"21 tháng 1 1996","1996-01-21"
"1 tháng 1 2005","2005-01-01"
"26 THÁNG 3 2001","2001-03-26"
"chủ nhật, ngày 30 tháng 6 năm 1996","1996-06-30"
"THÁNG 10 13 2008","2008-10-13"
"tháng 11 16 2012","2012-11-16"
"16 thg 10, 1974","1974-10-16"
"23 thg 10, 1976","1976-10-23"
"7 thg 10, 2006","2006-10-07"
"Ngày 19 tháng 01 năm 1973","1973-01-19"
"1 THÁNG 11 1986","1986-11-01"
"6 thg 5, 1991","1991-05-06"
"ngày 25 tháng 11 năm 1971","1971-11-25"
"2 tháng 5 2015","2015-05-02"
"3 tháng 7 1973","1973-07-03"
"6 THÁNG 3 1976","1976-03-06"
"19 thg 6, 1977","1977-06-19"
"THÁNG 6 19 1988","1988-06-19"
"18 THG 10 1983","1983-10-18"
"18/04/2005","2005-04-18"
"3 thg 9 2003","2003-09-03"
"30 tháng 11 2000","2000-11-30"
"04.10.83","1983-10-04"
"9 THÁNG 1 1994","1994-01-09"
"ngày 18 tháng 06 năm 1977","1977-06-18"
"6 thg 6, 2009","2009-06-06"
"13 THÁNG 9 2012","2012-09-13"
"09.05.88","1988-05-09"
"03 thg 10 1988","1988-10-03"
"4 THÁNG 3, 2015","2015-03-04"
"Thứ Ba, ngày 21 tháng 3 năm 1972","1972-03-21"
"04, thg 11 1981","1981-11-04"
"4 tháng 11 1991","1991-11-04"
"ngày 02 tháng 04 năm 2008","2008-04-02"
"31 THÁNG 8, 1985","1985-08-31"
"28 thg 10, 1991","1991-10-28"
"11 11 93","1993-11-11"
"18 thg 3 1983","1983-03-18"
"THỨ TƯ, NGÀY 27 THÁNG 12 NĂM 2017","2017-12-27"
"31.10.93","1993-10-31"
"16.04.83","1983-04-16"
"tháng 6 8 1974","1974-06-08"
"27 tháng 9, 1977","1977-09-27"
"THÁNG 3 17, 1995","1995-03-17"
"02, THG 8 2011","2011-08-02"
"19 THG 1, 1998","1998-01-19"
"22 05 06","2006-05-22"
"tháng 5 25, 2012","2012-05-25"
"tháng 9 23 2004","2004-09-23"
"12 thg 4, 1982","1982-04-12"
"23, thg 9 2009","2009-09-23"
"Ngày 05 tháng 10 năm 1992","1992-10-05"
"NGÀY 01 THÁNG 03 NĂM 1984","1984-03-01"
"24 thg 5, 1974","1974-05-24"
"18 thg 9, 2017","2017-09-18"
"04, thg 8 1978","1978-08-04"
"10 tháng 10, 2008","2008-10-10"
"THỨ HAI, NGÀY 17 THÁNG 1 NĂM 2011","2011-01-17"
"tháng 10 8, 1996","1996-10-08"
"13, thg 3 2008","2008-03-13"
"19 thg 6, 1974","1974-06-19"
"06.05.97","1997-05-06"
"09/02/1996","1996-02-09"
"Thứ Ba, ngày 09 tháng 12 năm 1980","1980-12-09"
"5 thg 11, 1984","1984-11-05"
"ngày 22 tháng 05 năm 1983","1983-05-22"
"12 THG 5 2004","2004-05-12"
"02.01.12","2012-01-02"
"THÁNG 4 8, 1990","1990-04-08"
"Thứ Ba, ngày 15 tháng 3 năm 1977","1977-03-15"
"18 thg 5, 1998","1998-05-18"
"23 tháng 12, 2010","2010-12-23"
"3 THÁNG 9, 1983","1983-09-03"
"THÁNG 5 8 2016","2016-05-08"
"31, thg 5 1970","1970-05-31"
"24 tháng 7, 1996","1996-07-24"
"2 THÁNG 11 2008","2008-11-02"
"06/04/1978","1978-04-06"
"28 thg 1, 2013","2013-01-28"
"05.01.76","1976-01-05"
"8 tháng 7, 1972","1972-07-08"
"31 05 92","1992-05-31"
"2 thg 5, 1978","1978-05-02"
"22 11 75","1975-11-22"
"THỨ BA, NGÀY 11 THÁNG 12 NĂM 2012","2012-12-11"
"tháng 3 1 2002","2002-03-01"
"8 thg 10 2012","2012-10-08"
"20 tháng 10, 2018","2018-10-20"
"29 thg 12, 1998","1998-12-29"
"tháng 5 2, 1971","1971-05-02"
"29 thg 5 1991","1991-05-29"
"10 thg 7 2010","2010-07-10"
"22 10 07","2007-10-22"
"chủ nhật, ngày 23 tháng 1 năm 1983","1983-01-23"
"NGÀY 26 THÁNG 02 NĂM 1976","1976-02-26"
"tháng 12 30 1989","1989-12-30"
"29 thg 4 1970","1970-04-29"
"2 THG 4, 1991","1991-04-02"
"ngày 01 tháng 05 năm 1975","1975-05-01"
"15 thg 4 2017","2017-04-15"
"17 thg 2 1981","1981-02-17"
"6 thg 5, 2008","2008-05-06"
"THỨ BA, NGÀY 19 THÁNG 1 NĂM 1999","1999-01-19"
"tháng 4 11, 1975","1975-04-11"
"11/09/1988","1988-09-11"
"23, THG 12 2012","2012-12-23"
"18 10 84","1984-10-18"
"16/09/1981","1981-09-16"
"2 tháng 12 1997","1997-12-02"
"29/04/2014","2014-04-29"
"tháng 5 1 1970","1970-05-01"
"14 tháng 11 1976","1976-11-14"
"7 THG 9, 1989","1989-09-07"
"tháng 12 16, 1989","1989-12-16"
"10 tháng 11 1988","1988-11-10"
"ngày 26 tháng 07 năm 1991","1991-07-26"
"Ngày 11 tháng 05 năm 1980","1980-05-11"
"19, thg 1 1985","1985-01-19"
"THÁNG 12 23, 1975","1975-12-23"
"24, thg 3 1975","1975-03-24"
"27, thg 7 1970","1970-07-27"
"6 05 15","2015-05-06"
"Thứ Tư, ngày 25 tháng 2 năm 1987","1987-02-25"
"3 thg 4, 2004","2004-04-03"
"16 tháng 9 1993","1993-09-16"
"tháng 2 8 2003","2003-02-08"
"13/01/2010","2010-01-13"
"04 thg 4 2005","2005-04-04"
"tháng 2 9 1982","1982-02-09"
"7 thg 7, 2008","2008-07-07"
"05 thg 4 2008","2008-04-05"
"25 thg 3, 1987","1987-03-25"
"THÁNG 10 30 2001","2001-10-30"
"22 THÁNG 7 1989","1989-07-22"
"13 thg 8, 1972","1972-08-13"
"17 thg 2 1994","1994-02-17"
"Ngày 28 tháng 12 năm 1986","1986-12-28"
"11 thg 10, 2017","2017-10-11"
"04, thg 9 1984","1984-09-04"
"NGÀY 28 THÁNG 09 NĂM 1975","1975-09-28"
"14 THÁNG 8 2004","2004-08-14"
"14 tháng 9, 2007","2007-09-14"
"tháng 9 18 1973","1973-09-18"
"16, THG 8 1976","1976-08-16"
"tháng 7 19, 1980","1980-07-19"
"30/11/2002","2002-11-30"
"13.08.13","2013-08-13"
"12, thg 5 2009","2009-05-12"
"18 tháng 1 1980","1980-01-18"
"thứ hai, ngày 13 tháng 6 năm 1977","1977-06-13"
"15 01 81","1981-01-15"
"28 tháng 2 1990","1990-02-28"
"tháng 12 8, 2002","2002-12-08"
"26/05/1984","1984-05-26"
"2 thg 1 1982","1982-01-02"
"18 thg 9, 2008","2008-09-18"
"25 THG 3, 2013","2013-03-25"
"25 tháng 6, 1999","1999-06-25"
"19.08.02","2002-08-19"
"7 10 86","1986-10-07"
"14 THG 2, 1983","1983-02-14"
"04 THG 5 1970","1970-05-04"
"22 tháng 2 1999","1999-02-22"
"03, thg 3 2015","2015-03-03"
"tháng 11 9, 2001","2001-11-09"
"17 THG 1 1990","1990-01-17"
"13 thg 7, 1997","1997-07-13"
"12 THG 4, 2005","2005-04-12"
"7 thg 8, 2006","2006-08-07"
"18 thg 1, 1976","1976-01-18"
"10 tháng 9 1990","1990-09-10"
"23 tháng 10 2012","2012-10-23"
"THÁNG 1 24 2009","2009-01-24"
"27 07 84","1984-07-27"
"THÁNG 5 16 1993","1993-05-16"
"22 02 17","2017-02-22"
"25, THG 9 1996","1996-09-25"
"26 thg 6 1987","1987-06-26"
"thứ hai, ngày 26 tháng 6 năm 2006","2006-06-26"
"21 tháng 8, 1999","1999-08-21"
"14 05 10","2010-05-14"
"15 THG 11 2000","2000-11-15"
"29 THÁNG 12 1997","1997-12-29"
"Thứ Sáu, ngày 26 tháng 11 năm 1976","1976-11-26"
"17 tháng 7 2013","2013-07-17"
"tháng 11 25 2002","2002-11-25"
"12/08/1990","1990-08-12"
"21 thg 1 2007","2007-01-21"
"27 tháng 9 1994","1994-09-27"
"25/08/1979","1979-08-25"
"24 THG 10, 2000","2000-10-24"
"tháng 7 15, 2001","2001-07-15"
"23 10 07","2007-10-23"
"THÁNG 7 18 2002","2002-07-18"
"25 thg 7 1987","1987-07-25"
"27/06/2010","2010-06-27"
"03, thg 4 1984","1984-04-03"
"tháng 6 30 2005","2005-06-30"
"4 THG 2, 1980","1980-02-04"
"tháng 4 17, 1976","1976-04-17"
"18, THG 5 1998","1998-05-18"
"Ngày 02 tháng 05 năm 1993","1993-05-02"
"27 THG 9, 1991","1991-09-27"
"Ngày 08 tháng 06 năm 1974","1974-06-08"
"07, thg 2 2014","2014-02-07"
"9 04 17","2017-04-09"
"09.05.18","2018-05-09"
"1 tháng 11 1980","1980-11-01"
"tháng 9 21, 2002","2002-09-21"
"23/11/2000","2000-11-23"
"1 tháng 12, 1979","1979-12-01"
"tháng 3 9 1987","1987-03-09"
"tháng 3 6, 1982","1982-03-06"
"THÁNG 7 21, 1994","1994-07-21"
"10, THG 5 1987","1987-05-10"
"Chủ Nhật, ngày 17 tháng 7 năm 1977","1977-07-17"
"5 tháng 1, 1978","1978-01-05"
"20 thg 8 1976","1976-08-20"
"9 thg 5 1985","1985-05-09"
"Thứ Sáu, ngày 27 tháng 4 năm 1979","1979-04-27"
"11 tháng 3 1978","1978-03-11"
"13 tháng 10 1984","1984-10-13"
"1 tháng 9, 1989","1989-09-01"
"Thứ Hai, ngày 04 tháng 1 năm 1993","1993-01-04"
"7 thg 12, 1987","1987-12-07"
"tháng 1 29, 1990","1990-01-29"
"08, thg 10 1998","1998-10-08"
"23 tháng 3 2014","2014-03-23"
"tháng 3 5, 2009","2009-03-05"
"09.07.70","1970-07-09"
"02/05/1984","1984-05-02"
"THỨ BA, NGÀY 08 THÁNG 12 NĂM 2009","2009-12-08"
"14 tháng 11 2018","2018-11-14"
"Thứ Năm, ngày 22 tháng 6 năm 2006","2006-06-22"
"25 thg 5 2001","2001-05-25"
"12/09/2011","2011-09-12"
"17 tháng 4 2006","2006-04-17"
"25 tháng 12 1990","1990-12-25"
"27 THG 9 1991","1991-09-27"
"9 THÁNG 10 1989","1989-10-09"
"15 08 90","1990-08-15"
"tháng 2 7, 2005","2005-02-07"
"28 thg 12, 2002","2002-12-28"
"18 thg 2, 1991","1991-02-18"
"13 THG 5, 1990","1990-05-13"
"13 tháng 6 1972","1972-06-13"
"26 THG 4, 1983","1983-04-26"
"tháng 8 22, 1995","1995-08-22"
"tháng 4 13 1981","1981-04-13"
"03 thg 3 1985","1985-03-03"
"tháng 6 15, 1978","1978-06-15"
"27 thg 8 1975","1975-08-27"
"15 tháng 12, 1983","1983-12-15"
"tháng 10 26, 2004","2004-10-26"
"17 tháng 3 1995","1995-03-17"
"tháng 6 12 2007","2007-06-12"
"tháng 5 5 1998","1998-05-05"
"NGÀY 17 THÁNG 03 NĂM 1971","1971-03-17"
"23 04 01","2001-04-23"
"4 tháng 2 2015","2015-02-04"
"19 THG 1 2001","2001-01-19"
"07.07.78","1978-07-07"
"THỨ HAI, NGÀY 16 THÁNG 7 NĂM 2001","2001-07-16"
"24 thg 5, 1997","1997-05-24"
"26 thg 12, 1973","1973-12-26"
"tháng 3 1 1974","1974-03-01"
"09, thg 4 1995","1995-04-09"
"Ngày 10 tháng 10 năm 2002","2002-10-10"
"06 thg 10 1996","1996-10-06"
"28 THG 4 1994","1994-04-28"
"19 thg 6 1979","1979-06-19"
"THÁNG 1 10 1972","1972-01-10"
"01 thg 9 1975","1975-09-01"
"25, thg 3 1978","1978-03-25"
"19 thg 9, 1974","1974-09-19"
"tháng 10 21 2014","2014-10-21"
"02 THG 5 1993","1993-05-02"
"20 01 86","1986-01-20"
"21 THÁNG 2 2006","2006-02-21"
"THÁNG 5 8 1999","1999-05-08"
"07 THG 10 2007","2007-10-07"
"8 THG 2, 1991","1991-02-08"
"thứ ba, ngày 19 tháng 5 năm 1992","1992-05-19"
"27 thg 6, 2003","2003-06-27"
"chủ nhật, ngày 12 tháng 1 năm 1975","1975-01-12"
"05.11.99","1999-11-05"
"23 tháng 2 2008","2008-02-23"
"16 thg 4 1971","1971-04-16"
"2 thg 5, 1990","1990-05-02"
"tháng 2 7, 1978","1978-02-07"
"thứ hai, ngày 18 tháng 8 năm 1997","1997-08-18"
"03/10/1970","1970-10-03"
"Thứ Tư, ngày 07 tháng 11 năm 2018","2018-11-07"
"THÁNG 9 16 1992","1992-09-16"
"9 thg 6, 1978","1978-06-09"
"07 thg 9 1978","1978-09-07"
"tháng 5 26, 1981","1981-05-26"
"5 tháng 7 1995","1995-07-05"
"9 05 89","1989-05-09"
"tháng 2 11, 1996","1996-02-11"
"ngày 19 tháng 09 năm 1974","1974-09-19"
"11 thg 9, 2001","2001-09-11"
"18 11 04","2004-11-18"
"thứ sáu, ngày 10 tháng 10 năm 1975","1975-10-10"
"12 thg 7, 2001","2001-07-12"
"Chủ Nhật, ngày 14 tháng 10 năm 1973","1973-10-14"
"28 tháng 7, 2012","2012-07-28"
"4 thg 1 1991","1991-01-04"
"Ngày 01 tháng 06 năm 2000","2000-06-01"
"21 04 70","1970-04-21"
"29 09 91","1991-09-29"
"29 tháng 3 1998","1998-03-29"
"30 thg 10, 2016","2016-10-30"
"tháng 5 3 1995","1995-05-03"
"11 thg 6 1998","1998-06-11"
"6 tháng 10, 2008","2008-10-06"
"21 THÁNG 7 1972","1972-07-21"
"31/05/1999","1999-05-31"
"26 tháng 10, 1978","1978-10-26"
"8 tháng 10 2005","2005-10-08"
"ngày 29 tháng 05 năm 1979","1979-05-29"
"17 THÁNG 7 1980","1980-07-17"
"27 THG 12, 1991","1991-12-27"
"4 thg 7, 1989","1989-07-04"
"1 04 11","2011-04-01"
"06/08/2010","2010-08-06"
"10 thg 11 2014","2014-11-10"
"01/06/1983","1983-06-01"
"02, THG 10 1978","1978-10-02"
"21.01.00","2000-01-21"
"3 thg 2 1981","1981-02-03"
"6 THÁNG 7, 1974","1974-07-06"
"29 thg 6 1973","1973-06-29"
"Ngày 30 tháng 03 năm 1996","1996-03-30"
"20.05.08","2008-05-20"
"5 tháng 11, 2017","2017-11-05"
"THÁNG 7 5, 2013","2013-07-05"
"17 thg 1, 1987","1987-01-17"
"tháng 1 22 1976","1976-01-22"
"tháng 11 27 2003","2003-11-27"
"21 10 77","1977-10-21"
"2 thg 4, 1996","1996-04-02"
"14.11.75","1975-11-14"
"02, THG 5 2018","2018-05-02"
"10, thg 9 1982","1982-09-10"
"15 tháng 5 2010","2010-05-15"
"08, thg 5 2016","2016-05-08"
"11/08/1973","1973-08-11"
"5 thg 9, 1990","1990-09-05"
"NGÀY 25 THÁNG 10 NĂM 1999","1999-10-25"
"7 thg 3 1977","1977-03-07"
"31 tháng 3 2011","2011-03-31"
"26.05.01","2001-05-26"
"17 10 86","1986-10-17"
"Ngày 18 tháng 06 năm 1977","1977-06-18"
"THÁNG 7 5, 1971","1971-07-05"
"tháng 10 31 1970","1970-10-31"
"29 tháng 10 2000","2000-10-29"
"02 thg 5 1989","1989-05-02"
"tháng 2 1 1977","1977-02-01"
"THÁNG 11 3 1978","1978-11-03"
"26 thg 4, 1979","1979-04-26"
"6 thg 12, 1987","1987-12-06"
"20 thg 3 1981","1981-03-20"
"thứ năm, ngày 18 tháng 6 năm 1998","1998-06-18"
"28 THG 5 2006","2006-05-28"
"22 thg 5, 1972","1972-05-22"
"24 thg 5, 1972","1972-05-24"
"tháng 1 22, 1975","1975-01-22"
"23 THG 8 2017","2017-08-23"
"15 thg 2, 1977","1977-02-15"
"30 thg 1 1999","1999-01-30"
"5 thg 10 2004","2004-10-05"
"THỨ BẢY, NGÀY 14 THÁNG 8 NĂM 1999","1999-08-14"
"5 thg 4 2013","2013-04-05"
"15 tháng 8 2009","2009-08-15"
"6 thg 12, 1998","1998-12-06"
"THÁNG 5 7, 2007","2007-05-07"
"31 01 17","2017-01-31"
"THÁNG 1 15 2013","2013-01-15"
"NGÀY 29 THÁNG 01 NĂM 1984","1984-01-29"
"Ngày 11 tháng 11 năm 1996","1996-11-11"
"30/06/1985","1985-06-30"
"THÁNG 4 25 1977","1977-04-25"
"ngày 06 tháng 10 năm 2010","2010-10-06"
"07.04.95","1995-04-07"
"tháng 12 30, 1981","1981-12-30"
"18 thg 9, 1989","1989-09-18"
"2 THÁNG 2 1975","1975-02-02"
"15 THG 12, 1971","1971-12-15"
"THÁNG 12 17, 1990","1990-12-17"
"Ngày 10 tháng 03 năm 2017","2017-03-10"
"23/08/1973","1973-08-23"
"23 thg 4 2002","2002-04-23"
"11.04.01","2001-04-11"
"24 tháng 8 1985","1985-08-24"
"15.10.04","2004-10-15"
"Ngày 20 tháng 07 năm 2016","2016-07-20"
"20 tháng 11 2013","2013-11-20"
"11 tháng 11 2005","2005-11-11"
"Ngày 07 tháng 08 năm 1995","1995-08-07"
"07 THG 9 1995","1995-09-07"
"18 03 92","1992-03-18"
"18, thg 1 1983","1983-01-18"
"21 tháng 3 1978","1978-03-21"
"30/08/1998","1998-08-30"
"05 thg 8 1980","1980-08-05"
"17 thg 12, 1975","1975-12-17"
"tháng 8 19, 1989","1989-08-19"
"tháng 12 25 1995","1995-12-25"
"tháng 1 15 2017","2017-01-15"
"26 tháng 3 1979","1979-03-26"
"1 THG 4 1983","1983-04-01"
"THÁNG 9 2, 2009","2009-09-02"
"16 thg 2 2006","2006-02-16"
"Thứ Năm, ngày 30 tháng 11 năm 2000","2000-11-30"
"29 tháng 12, 1981","1981-12-29"
"tháng 12 20, 2009","2009-12-20"
"5 thg 1, 1992","1992-01-05"
"3 thg 2, 1996","1996-02-03"
"1 THÁNG 7 2004","2004-07-01"
"25 tháng 6 1997","1997-06-25"
"30/03/1991","1991-03-30"
"12.06.72","1972-06-12"
"18 THG 12 1981","1981-12-18"
"30, thg 6 1987","1987-06-30"
"THÁNG 4 28, 1971","1971-04-28"
"Thứ Ba, ngày 16 tháng 8 năm 1994","1994-08-16"
"19 thg 9, 2017","2017-09-19"
"2 tháng 12 1992","1992-12-02"
"7 thg 5, 1996","1996-05-07"
"27 thg 7, 1985","1985-07-27"
"NGÀY 18 THÁNG 12 NĂM 1971","1971-12-18"
"26, thg 1 1992","1992-01-26"
"Ngày 31 tháng 07 năm 2010","2010-07-31"
"16 thg 10, 2018","2018-10-16"
"Thứ Tư, ngày 06 tháng 8 năm 1980","1980-08-06"
"17 thg 8, 1978","1978-08-17"
"2 THÁNG 7, 2014","2014-07-02"
"16.06.73","1973-06-16"
"17/02/1993","1993-02-17"
"tháng 9 3 1996","1996-09-03"
"31/01/1997","1997-01-31"
"08 THG 2 1983","1983-02-08"
"THỨ SÁU, NGÀY 06 THÁNG 7 NĂM 1973","1973-07-06"
"tháng 6 12, 1974","1974-06-12"
"tháng 11 7 1992","1992-11-07"
"24 tháng 7 2015","2015-07-24"
"thứ sáu, ngày 13 tháng 10 năm 1978","1978-10-13"
"ngày 21 tháng 03 năm 2009","2009-03-21"
"01/07/1975","1975-07-01"
"25 THG 11, 2017","2017-11-25"
"24.01.05","2005-01-24"
"tháng 9 7, 2002","2002-09-07"
"12 thg 5 1984","1984-05-12"
"1 tháng 5 2001","2001-05-01"
"11 03 17","2017-03-11"
"9 thg 10, 1990","1990-10-09"
"25 tháng 8, 1971","1971-08-25"
"15 thg 1, 1973","1973-01-15"
"15 thg 4, 1980","1980-04-15"
"15 tháng 11 1994","1994-11-15"
"16 THG 8, 1993","1993-08-16"
"12, THG 12 2009","2009-12-12"
"24, thg 3 2007","2007-03-24"
"19 tháng 7 1991","1991-07-19"
"22 02 06","2006-02-22"
"4 THÁNG 10, 2003","2003-10-04"
"1 THG 11 1997","1997-11-01"
"Ngày 05 tháng 08 năm 1995","1995-08-05"
"tháng 6 5, 2006","2006-06-05"
"tháng 3 17 1998","1998-03-17"
"02, thg 7 1972","1972-07-02"
"25 thg 3 2016","2016-03-25"
"ngày 15 tháng 05 năm 2000","2000-05-15"
"THÁNG 12 10 1987","1987-12-10"
"Thứ Sáu, ngày 14 tháng 6 năm 1974","1974-06-14"
"5 thg 1, 1987","1987-01-05"
"NGÀY 05 THÁNG 07 NĂM 1990","1990-07-05"
"26.07.94","1994-07-26"
"tháng 12 9, 1972","1972-12-09"
"27/04/1993","1993-04-27"
"ngày 23 tháng 10 năm 1984","1984-10-23"
"1 thg 7, 2008","2008-07-01"
"tháng 6 12 2009","2009-06-12"
"19 thg 12 2005","2005-12-19"
"8 tháng 1 1997","1997-01-08"
"14 tháng 5 1972","1972-05-14"
"05.11.72","1972-11-05"
"05/07/2006","2006-07-05"
"24, thg 4 2012","2012-04-24"
"Ngày 23 tháng 02 năm 1999","1999-02-23"
"tháng 11 7, 1989","1989-11-07"
"Ngày 09 tháng 12 năm 1975","1975-12-09"
"13.09.88","1988-09-13"
"01.04.00","2000-04-01"
"23 thg 11 2011","2011-11-23"
"05.02.17","2017-02-05"
"06.11.73","1973-11-06"
"13 THÁNG 12 2004","2004-12-13"
"11, thg 6 2011","2011-06-11"
"09.08.78","1978-08-09"
"ngày 27 tháng 05 năm 2000","2000-05-27"
"9 thg 8, 2008","2008-08-09"
"21.08.86","1986-08-21"
"9 thg 7, 2002","2002-07-09"
"21 09 18","2018-09-21"
"tháng 6 29 1982","1982-06-29"
"10 THG 3 2000","2000-03-10"
"12 THÁNG 3 1992","1992-03-12"
"7 THG 9, 1990","1990-09-07"
"12 09 18","2018-09-12"
"22 THG 10 2006","2006-10-22"
"19 thg 1 2002","2002-01-19"
"ngày 10 tháng 01 năm 2006","2006-01-10"
"NGÀY 02 THÁNG 06 NĂM 1977","1977-06-02"
"18/10/1975","1975-10-18"
"11 tháng 10 2003","2003-10-11"
"24 thg 5 2016","2016-05-24"
"8 THG 11, 1977","1977-11-08"
"16 thg 3 2002","2002-03-16"
"13/06/2018","2018-06-13"
"06 thg 2 1992","1992-02-06"
"22 tháng 1, 1986","1986-01-22"
"THÁNG 9 18, 1989","1989-09-18"
"27.07.83","1983-07-27"
"8 thg 12 2011","2011-12-08"
"tháng 2 15 1991","1991-02-15"
"28 tháng 8 2015","2015-08-28"
"THÁNG 9 9, 1970","1970-09-09"
"27 THÁNG 10 2015","2015-10-27"
"11 thg 2, 1970","1970-02-11"
"THỨ BA, NGÀY 05 THÁNG 1 NĂM 2016","2016-01-05"
"04, thg 3 1989","1989-03-04"
"12 thg 4, 1986","1986-04-12"
"18 THG 2, 2017","2017-02-18"
"26 thg 10 2004","2004-10-26"
"tháng 4 16 2012","2012-04-16"
"tháng 10 8, 1989","1989-10-08"
"THÁNG 2 6 1989","1989-02-06"
"Ngày 02 tháng 03 năm 2013","2013-03-02"
"30 thg 11 2008","2008-11-30"
"tháng 5 30, 2016","2016-05-30"
"Ngày 12 tháng 12 năm 2016","2016-12-12"
"20 THÁNG 11 1993","1993-11-20"
"24 THÁNG 6 1975","1975-06-24"
"24 06 99","1999-06-24"
"23.12.87","1987-12-23"
"3 01 01","2001-01-03"
"17, THG 6 2011","2011-06-17"
"16, thg 5 2010","2010-05-16"
"28 thg 2, 1999","1999-02-28"
"19 THG 6, 1975","1975-06-19"
"ngày 26 tháng 02 năm 1995","1995-02-26"
"07/09/1990","1990-09-07"
"2 thg 10, 2003","2003-10-02"
"06/02/1999","1999-02-06"
"01, THG 3 2018","2018-03-01"
"31.03.88","1988-03-31"
"Thứ Bảy, ngày 16 tháng 9 năm 2017","2017-09-16"
"5 thg 2, 2001","2001-02-05"
"12 tháng 12 1997","1997-12-12"
"24 thg 4 2008","2008-04-24"
"22 thg 10, 1995","1995-10-22"
"9 thg 9 1981","1981-09-09"
"3 THG 2 2015","2015-02-03"
"3 thg 5 1989","1989-05-03"
"29.02.16","2016-02-29"
"7 08 76","1976-08-07"
"23 THG 9, 1976","1976-09-23"
"17 tháng 2, 2011","2011-02-17"
"28 01 81","1981-01-28"
"tháng 3 28 1972","1972-03-28"
"18 tháng 9, 2002","2002-09-18"
"05 thg 9 2002","2002-09-05"
"THÁNG 8 4 1991","1991-08-04"
"18 thg 2, 1983","1983-02-18"
"18/10/2004","2004-10-18"
"11 thg 7, 1991","1991-07-11"
"14 tháng 4, 2000","2000-04-14"
"23.12.83","1983-12-23"
"26 tháng 10 2003","2003-10-26"
"16/03/1986","1986-03-16"
"08.08.88","1988-08-08"
"15 THG 8, 1973","1973-08-15"
"14 THG 2, 1985","1985-02-14"
"Ngày 19 tháng 12 năm 2016","2016-12-19"
"Thứ Năm, ngày 26 tháng 12 năm 1985","1985-12-26"
"4 thg 12 2014","2014-12-04"
"Ngày 21 tháng 06 năm 2009","2009-06-21"
"24, thg 12 2007","2007-12-24"
"02.11.17","2017-11-02"
"20 THÁNG 8 1995","1995-08-20"
"26.07.97","1997-07-26"
"31 08 94","1994-08-31"
"28 tháng 6 2011","2011-06-28"
"Ngày 13 tháng 07 năm 1992","1992-07-13"
"25 thg 5, 2001","2001-05-25"
"8 THG 5, 2007","2007-05-08"
"7 tháng 3 1971","1971-03-07"
"31 tháng 12 1992","1992-12-31"
"01.01.71","1971-01-01"
"04.02.88","1988-02-04"
"Thứ Ba, ngày 08 tháng 1 năm 1985","1985-01-08"
"1 thg 6, 1983","1983-06-01"
"28.05.00","2000-05-28"
"3 02 83","1983-02-03"
"Ngày 07 tháng 04 năm 1991","1991-04-07"
"11 tháng 6 2011","2011-06-11"
"10 THG 11, 1974","1974-11-10"
"Thứ Bảy, ngày 02 tháng 6 năm 1984","1984-06-02"
"30 11 88","1988-11-30"
"05/07/2007","2007-07-05"
"Ngày 17 tháng 03 năm 1999","1999-03-17"
"Ngày 24 tháng 02 năm 1982","1982-02-24"
"13 tháng 3 1988","1988-03-13"
"29.05.83","1983-05-29"
"07/05/1982","1982-05-07"
"18 thg 9 1977","1977-09-18"
"14 tháng 4 2002","2002-04-14"
"26/02/2005","2005-02-26"
"25/11/1992","1992-11-25"
"15 thg 9 2009","2009-09-15"
"18 tháng 12 2010","2010-12-18"
"thứ tư, ngày 25 tháng 10 năm 2000","2000-10-25"
"NGÀY 05 THÁNG 11 NĂM 1976","1976-11-05"
"26 THÁNG 12, 1992","1992-12-26"
"1 08 94","1994-08-01"
"20 thg 3 1996","1996-03-20"
"25 thg 4, 1989","1989-04-25"
"22, thg 3 2015","2015-03-22"
"15.09.09","2009-09-15"
"1 tháng 4 1981","1981-04-01"
"9 thg 6, 1980","1980-06-09"
"15 thg 8 1983","1983-08-15"
"29, thg 5 2008","2008-05-29"
"19 thg 5 1971","1971-05-19"
"4 tháng 8 1978","1978-08-04"
"10 thg 4 2004","2004-04-10"
"3 THÁNG 11 2010","2010-11-03"
"15 THÁNG 4, 1981","1981-04-15"
"05 thg 3 2017","2017-03-05"
"tháng 3 27 1976","1976-03-27"
"Ngày 21 tháng 04 năm 1970","1970-04-21"
"tháng 5 7 2001","2001-05-07"
"Thứ Hai, ngày 30 tháng 7 năm 1990","1990-07-30"
"30 thg 5 2010","2010-05-30"
"NGÀY 03 THÁNG 07 NĂM 1987","1987-07-03"
"04/07/2008","2008-07-04"
"Chủ Nhật, ngày 26 tháng 10 năm 1975","1975-10-26"
"30 tháng 3, 2017","2017-03-30"
"26 tháng 5, 1975","1975-05-26"
"8 thg 5, 1975","1975-05-08"
"10 tháng 4 1999","1999-04-10"
"05/11/2007","2007-11-05"
"28 05 88","1988-05-28"
"THỨ TƯ, NGÀY 02 THÁNG 9 NĂM 1992","1992-09-02"
"15 tháng 12 1998","1998-12-15"
"Ngày 07 tháng 04 năm 1977","1977-04-07"
"19 09 15","2015-09-19"
"THÁNG 11 13 1994","1994-11-13"
"08.11.90","1990-11-08"
"4 tháng 3, 1974","1974-03-04"
"25 thg 8, 1974","1974-08-25"
"1 thg 4, 2000","2000-04-01"
"THÁNG 8 24, 1979","1979-08-24"
"5 tháng 5, 1980","1980-05-05"
"9 thg 9, 1987","1987-09-09"
"25 THÁNG 2 1994","1994-02-25"
"ngày 25 tháng 11 năm 2008","2008-11-25"
"22 thg 10 1980","1980-10-22"
"08, thg 5 2000","2000-05-08"
"09.08.93","1993-08-09"
"6 thg 1, 2015","2015-01-06"
"20 thg 2 2007","2007-02-20"
"06, thg 10 1998","1998-10-06"
"16 tháng 7 1984","1984-07-16"
"30 THG 3 1997","1997-03-30"
"17/02/1986","1986-02-17"
"31 thg 1 1986","1986-01-31"
"29 thg 1, 1980","1980-01-29"
"06.04.18","2018-04-06"
"06, thg 3 2006","2006-03-06"
"12 THÁNG 3, 1992","1992-03-12"
"tháng 8 6 1999","1999-08-06"
"14.12.03","2003-12-14"
"10, thg 11 2015","2015-11-10"
"7 10 08","2008-10-07"
"5 thg 2 1993","1993-02-05"
"15 THG 5, 1981","1981-05-15"
"tháng 9 29 1971","1971-09-29"
"chủ nhật, ngày 02 tháng 9 năm 2012","2012-09-02"
"17 tháng 6 1976","1976-06-17"
"09 THG 9 2004","2004-09-09"
"26 THÁNG 1 1973","1973-01-26"
"THÁNG 5 25 1998","1998-05-25"
"01.07.83","1983-07-01"
"11 thg 6, 1985","1985-06-11"
"05/01/1971","1971-01-05"
"THÁNG 10 16 1990","1990-10-16"
"10 12 15","2015-12-10"
"16 thg 3, 2011","2011-03-16"
"THÁNG 4 17 2007","2007-04-17"
"26 THG 4, 1988","1988-04-26"
"13 thg 12 1976","1976-12-13"
"01 thg 11 1993","1993-11-01"
"3 tháng 6 2012","2012-06-03"
"26, thg 4 2010","2010-04-26"
"24/10/2013","2013-10-24"
"17.10.85","1985-10-17"
"22 tháng 12 1990","1990-12-22"
"20.02.91","1991-02-20"
"12 thg 8, 1970","1970-08-12"
"CHỦ NHẬT, NGÀY 10 THÁNG 10 NĂM 1976","1976-10-10"
"30 thg 7, 2006","2006-07-30"
"14, THG 9 1972","1972-09-14"
"24 THÁNG 8 1982","1982-08-24"
"28 thg 12, 2006","2006-12-28"
"19 thg 7 2002","2002-07-19"
"07, THG 2 1977","1977-02-07"
"21 THG 4 1987","1987-04-21"
"23 tháng 5, 1971","1971-05-23"
"16, thg 9 2005","2005-09-16"
"21 thg 11 2005","2005-11-21"
"NGÀY 21 THÁNG 08 NĂM 2018","2018-08-21"
"24.08.02","2002-08-24"
"tháng 2 4, 2017","2017-02-04"
"17 thg 2, 1972","1972-02-17"
"7 THG 3 1978","1978-03-07"
"26 thg 9 2010","2010-09-26"
"27, thg 7 1977","1977-07-27"
"04, thg 8 1995","1995-08-04"
"28 11 14","2014-11-28"
"23 tháng 11, 2012","2012-11-23"
"15 thg 11, 1980","1980-11-15"
"05.06.01","2001-06-05"
"02.06.70","1970-06-02"
"15 THÁNG 6 1982","1982-06-15"
"28, thg 6 2004","2004-06-28"
"18 THÁNG 9 2004","2004-09-18"
"23 thg 6 2015","2015-06-23"
"Chủ Nhật, ngày 05 tháng 7 năm 2015","2015-07-05"
"18 thg 4, 1970","1970-04-18"
"chủ nhật, ngày 13 tháng 6 năm 1993","1993-06-13"
"22 thg 4, 1970","1970-04-22"
"23 thg 8, 2005","2005-08-23"
"THÁNG 2 20, 1986","1986-02-20"
"tháng 10 3 2003","2003-10-03"
"30/06/1976","1976-06-30"
"tháng 11 11, 1981","1981-11-11"
"12 THÁNG 10, 1972","1972-10-12"
"08 thg 11 1985","1985-11-08"
"24 04 08","2008-04-24"
"tháng 6 29 1985","1985-06-29"
"10 THG 2 1979","1979-02-10"
"NGÀY 07 THÁNG 08 NĂM 1977","1977-08-07"
"22 thg 4 1971","1971-04-22"
"THÁNG 7 24 2003","2003-07-24"
"17, thg 4 2001","2001-04-17"
"16/07/1978","1978-07-16"
"23 thg 9 1986","1986-09-23"
"Thứ Hai, ngày 03 tháng 11 năm 1997","1997-11-03"
"Thứ Hai, ngày 09 tháng 2 năm 1998","1998-02-09"
"29 thg 11, 1987","1987-11-29"
"17, THG 4 1993","1993-04-17"
"21/09/1996","1996-09-21"
"22 tháng 10 1995","1995-10-22"
"26 tháng 7 1977","1977-07-26"
"5 thg 3, 1971","1971-03-05"
"16/11/1995","1995-11-16"
"thứ tư, ngày 04 tháng 8 năm 1976","1976-08-04"
"01 THG 2 2011","2011-02-01"
"23 tháng 1 1982","1982-01-23"
"24 thg 12, 2012","2012-12-24"
"THÁNG 7 5, 1975","1975-07-05"
"3 thg 12, 2009","2009-12-03"
"15 tháng 3 2012","2012-03-15"
"17 thg 10 1982","1982-10-17"
"13 11 14","2014-11-13"
"14 thg 1, 2015","2015-01-14"
"17 thg 12, 1990","1990-12-17"
"tháng 10 2 2013","2013-10-02"
"01 thg 4 2002","2002-04-01"
"31 tháng 12, 2016","2016-12-31"
"22, thg 4 1985","1985-04-22"
"17 thg 10, 2006","2006-10-17"
"30/10/2002","2002-10-30"
"1 THG 8, 2007","2007-08-01"
"30 THÁNG 5 2013","2013-05-30"
"Ngày 26 tháng 02 năm 1989","1989-02-26"
"08.04.90","1990-04-08"
"12 thg 12, 2001","2001-12-12"
"18 THG 7, 1987","1987-07-18"
"19 THG 10, 2013","2013-10-19"
"13 THÁNG 10 1986","1986-10-13"
"Thứ Tư, ngày 22 tháng 3 năm 2006","2006-03-22"
"25 tháng 6 2011","2011-06-25"
"19 thg 3, 2017","2017-03-19"
"Thứ Bảy, ngày 20 tháng 12 năm 1986","1986-12-20"
"3 thg 10 1980","1980-10-03"
"31.10.03","2003-10-31"
"12 thg 7 2010","2010-07-12"
"thứ tư, ngày 16 tháng 5 năm 2012","2012-05-16"
"24.02.16","2016-02-24"
"10 thg 7 1986","1986-07-10"
"tháng 5 29, 1974","1974-05-29"
"8 THÁNG 2, 1987","1987-02-08"
"19 tháng 1, 1993","1993-01-19"
"28/11/2001","2001-11-28"
"15/05/2012","2012-05-15"
"15 tháng 2 1998","1998-02-15"
"THÁNG 12 24 2017","2017-12-24"
"13.03.85","1985-03-13"
"NGÀY 31 THÁNG 12 NĂM 2016","2016-12-31"
"Thứ Tư, ngày 21 tháng 12 năm 1977","1977-12-21"
"thứ tư, ngày 09 tháng 5 năm 2012","2012-05-09"
"9 tháng 1 2010","2010-01-09"
"9 03 72","1972-03-09"
"27 thg 12, 1972","1972-12-27"
"22 tháng 12 1982","1982-12-22"
"30, thg 5 1990","1990-05-30"
"29 tháng 6, 2006","2006-06-29"
"11 thg 4 1986","1986-04-11"
"16 thg 12, 2010","2010-12-16"
"7 THÁNG 6 1992","1992-06-07"
"13.09.82","1982-09-13"
"27 THÁNG 4, 1980","1980-04-27"
"tháng 3 24 1996","1996-03-24"
"19, thg 5 2015","2015-05-19"
"9 THG 7, 2005","2005-07-09"
"Ngày 15 tháng 03 năm 2000","2000-03-15"
"THÁNG 1 20 2013","2013-01-20"
"16 THG 11, 1986","1986-11-16"
"02/03/2017","2017-03-02"
"02 thg 12 2011","2011-12-02"
"16/04/2006","2006-04-16"
"NGÀY 27 THÁNG 06 NĂM 1976","1976-06-27"
"1 tháng 7 2016","2016-07-01"
"14 thg 11 2009","2009-11-14"
"6 thg 2 1973","1973-02-06"
"21 THG 8 1982","1982-08-21"
"30.08.77","1977-08-30"
"23.01.77","1977-01-23"
"THÁNG 3 3, 2014","2014-03-03"
"05 thg 2 1974","1974-02-05"
"20/07/1978","1978-07-20"
"21/10/2002","2002-10-21"
"12.09.16","2016-09-12"
"16.01.00","2000-01-16"
"23, thg 8 1993","1993-08-23"
"4 THÁNG 11, 2009","2009-11-04"
"7 06 87","1987-06-07"
"tháng 4 4, 1981","1981-04-04"
"22.11.95","1995-11-22"
"16 tháng 5 1972","1972-05-16"
"10 THG 5, 1993","1993-05-10"
"25 thg 7, 2002","2002-07-25"
"tháng 8 18, 1990","1990-08-18"
"25 01 84","1984-01-25"
"07.10.85","1985-10-07"
"1 tháng 5 2011","2011-05-01"
"07 thg 4 2004","2004-04-07"
"03/05/1998","1998-05-03"
"07/02/2014","2014-02-07"
"16.10.02","2002-10-16"
"21.01.06","2006-01-21"
"25/09/1991","1991-09-25"
"tháng 11 21 2018","2018-11-21"
"Thứ Năm, ngày 23 tháng 10 năm 2014","2014-10-23"
"12, thg 2 1984","1984-02-12"
"04, thg 4 1986","1986-04-04"
"22 THÁNG 3, 1996","1996-03-22"
"14/03/2015","2015-03-14"
"16 01 95","1995-01-16"
"11, thg 12 1984","1984-12-11"
"tháng 6 20 1975","1975-06-20"
"Thứ Sáu, ngày 01 tháng 6 năm 1984","1984-06-01"
"21 10 86","1986-10-21"
"24 thg 11 1990","1990-11-24"
"31 07 72","1972-07-31"
"Chủ Nhật, ngày 14 tháng 1 năm 1979","1979-01-14"
"13 tháng 7, 2006","2006-07-13"
"24 thg 7, 2010","2010-07-24"
"16 THG 11 2006","2006-11-16"
"24/03/1993","1993-03-24"
"THỨ BẢY, NGÀY 09 THÁNG 1 NĂM 1971","1971-01-09"
"28 thg 12, 2004","2004-12-28"
"5 tháng 11, 1989","1989-11-05"
"3 thg 1 2008","2008-01-03"
"12 thg 7, 2010","2010-07-12"
"tháng 9 16 1975","1975-09-16"
"3 thg 5, 2018","2018-05-03"
"22.07.74","1974-07-22"
"20 THÁNG 8 1971","1971-08-20"
"2 thg 6 1986","1986-06-02"
"15 thg 10, 2013","2013-10-15"
"27 thg 3, 1983","1983-03-27"
"19, thg 1 1997","1997-01-19"
"13 thg 11, 2018","2018-11-13"
"8 thg 9, 1975","1975-09-08"
"thứ ba, ngày 05 tháng 7 năm 1977","1977-07-05"
"21.01.18","2018-01-21"
"28 thg 1 1988","1988-01-28"
"19/03/1998","1998-03-19"
"16 THÁNG 6, 1976","1976-06-16"
"6 11 71","1971-11-06"
"22 09 06","2006-09-22"
"26 06 92","1992-06-26"
"20 tháng 8 2011","2011-08-20"
"23 thg 9, 2004","2004-09-23"
"25 thg 7, 2001","2001-07-25"
"9 tháng 5 1974","1974-05-09"
"8 07 03","2003-07-08"
"18 THG 9, 2016","2016-09-18"
"23 thg 5 1979","1979-05-23"
"14/03/1989","1989-03-14"
"tháng 10 12, 2007","2007-10-12"
"tháng 4 27, 2002","2002-04-27"
"THỨ HAI, NGÀY 23 THÁNG 12 NĂM 2013","2013-12-23"
"17.08.84","1984-08-17"
"31 THG 8, 2007","2007-08-31"
"3 THÁNG 8, 1989","1989-08-03"
"12 10 12","2012-10-12"
"tháng 3 13 1976","1976-03-13"
"5 THG 9, 1981","1981-09-05"
"tháng 4 15, 1991","1991-04-15"
"THỨ SÁU, NGÀY 20 THÁNG 7 NĂM 2012","2012-07-20"
"11 tháng 7 1975","1975-07-11"
"tháng 6 16, 1991","1991-06-16"
"13 thg 8, 1998","1998-08-13"
"03/12/2017","2017-12-03"
"5 thg 4 2002","2002-04-05"
"14 THG 9 1982","1982-09-14"
"17 tháng 5 1990","1990-05-17"
"16 04 79","1979-04-16"
"CHỦ NHẬT, NGÀY 14 THÁNG 4 NĂM 1996","1996-04-14"
"CHỦ NHẬT, NGÀY 30 THÁNG 6 NĂM 2002","2002-06-30"
"tháng 6 25, 1986","1986-06-25"
"12 thg 9, 1997","1997-09-12"
"tháng 10 20, 1985","1985-10-20"
"19/10/1979","1979-10-19"
"5 07 11","2011-07-05"
"11 thg 10 2010","2010-10-11"
"26 11 08","2008-11-26"
"25 THG 11 1988","1988-11-25"
"21, thg 1 1973","1973-01-21"
"4 THÁNG 7 1988","1988-07-04"
"Ngày 03 tháng 02 năm 1971","1971-02-03"
"tháng 4 27, 1993","1993-04-27"
"15 01 95","1995-01-15"
"Chủ Nhật, ngày 30 tháng 8 năm 1970","1970-08-30"
"12 thg 11 2001","2001-11-12"
"NGÀY 03 THÁNG 07 NĂM 1993","1993-07-03"
"26 thg 3 1977","1977-03-26"
"24 thg 7 1992","1992-07-24"
"04/12/1999","1999-12-04"
"tháng 8 25, 2011","2011-08-25"
"15 THG 10 1995","1995-10-15"
"2 tháng 8 2015","2015-08-02"
"Thứ Sáu, ngày 15 tháng 4 năm 1988","1988-04-15"
"tháng 11 4, 1986","1986-11-04"
"19 05 90","1990-05-19"
"THỨ TƯ, NGÀY 16 THÁNG 6 NĂM 2004","2004-06-16"
"1 thg 1 1981","1981-01-01"
"24 thg 6, 1989","1989-06-24"
"26.05.01","2001-05-26"
"chủ nhật, ngày 08 tháng 6 năm 2014","2014-06-08"
"17 thg 8 2017","2017-08-17"
"04/01/1995","1995-01-04"
"24 thg 7, 1980","1980-07-24"
"9 thg 8 1971","1971-08-09"
"5 tháng 9 2010","2010-09-05"
"16.05.88","1988-05-16"
"30 tháng 6, 1973","1973-06-30"
"18 10 04","2004-10-18"
"19 THG 12 2006","2006-12-19"
"29 01 02","2002-01-29"
"3 thg 8 1985","1985-08-03"
"tháng 5 24 1996","1996-05-24"
"ngày 03 tháng 06 năm 2017","2017-06-03"
"29, thg 11 1999","1999-11-29"
"28 thg 3 1975","1975-03-28"
"7 THG 6, 2012","2012-06-07"
"16 THG 6 1971","1971-06-16"
"Thứ Ba, ngày 15 tháng 4 năm 1997","1997-04-15"
"tháng 3 17 1993","1993-03-17"
"05/01/1970","1970-01-05"
"Thứ Bảy, ngày 17 tháng 7 năm 1976","1976-07-17"
"13 06 06","2006-06-13"
"2 thg 10, 1984","1984-10-02"
"THÁNG 6 18, 1991","1991-06-18"
"26 tháng 7 1975","1975-07-26"
"29 THG 10, 1996","1996-10-29"
"20 tháng 12 2006","2006-12-20"
"5 thg 2, 1984","1984-02-05"
"Ngày 20 tháng 05 năm 1970","1970-05-20"
"02.02.82","1982-02-02"
"04.03.02","2002-03-04"
"13, THG 4 1975","1975-04-13"
"05.10.18","2018-10-05"
"04/08/1972","1972-08-04"
"thứ ba, ngày 14 tháng 9 năm 1993","1993-09-14"
"tháng 3 28 1971","1971-03-28"
"20 05 86","1986-05-20"
"22.12.82","1982-12-22"
"tháng 10 10 2005","2005-10-10"
"THÁNG 10 1 1987","1987-10-01"
"18 thg 7, 1977","1977-07-18"
"2 03 08","2008-03-02"
"28 thg 1, 2001","2001-01-28"
"20 thg 5 1973","1973-05-20"
"22 12 08","2008-12-22"
"6 THG 11, 1986","1986-11-06"
"24 THG 1, 1996","1996-01-24"
"5 05 93","1993-05-05"
"NGÀY 12 THÁNG 01 NĂM 1993","1993-01-12"
"tháng 5 13 1994","1994-05-13"
"ngày 23 tháng 04 năm 2001","2001-04-23"
"6 06 14","2014-06-06"
"12 tháng 10 1984","1984-10-12"
"Thứ Ba, ngày 03 tháng 9 năm 2002","2002-09-03"
"tháng 9 4 1976","1976-09-04"
"2 THÁNG 10 1983","1983-10-02"
"23 thg 10 2011","2011-10-23"
"Thứ Ba, ngày 01 tháng 8 năm 2000","2000-08-01"
"1 tháng 10, 1988","1988-10-01"
"Ngày 01 tháng 11 năm 2015","2015-11-01"
"16 THÁNG 2, 1994","1994-02-16"
"24 tháng 8, 2004","2004-08-24"
"5 05 84","1984-05-05"
"18 tháng 3 1994","1994-03-18"
"26, thg 1 1989","1989-01-26"
"10 THG 5, 2007","2007-05-10"
"Thứ Bảy, ngày 26 tháng 9 năm 1987","1987-09-26"
"27 THG 8, 2003","2003-08-27"
"30, THG 7 1982","1982-07-30"
"30, thg 5 1999","1999-05-30"
"tháng 10 1, 2014","2014-10-01"
"THÁNG 5 5 1998","1998-05-05"
"23 08 91","1991-08-23"
"29 thg 7 1994","1994-07-29"
"27 tháng 7 1975","1975-07-27"
"Ngày 30 tháng 01 năm 1972","1972-01-30"
"09, thg 1 1983","1983-01-09"
"13 THÁNG 11 2017","2017-11-13"
"thứ hai, ngày 20 tháng 2 năm 1978","1978-02-20"
"14, thg 10 1991","1991-10-14"
"12 thg 5, 1996","1996-05-12"
"22/02/1996","1996-02-22"
"ngày 12 tháng 07 năm 2010","2010-07-12"
"16 tháng 2 2017","2017-02-16"
"tháng 12 27, 1985","1985-12-27"
"tháng 8 29 1997","1997-08-29"
"tháng 1 10, 2016","2016-01-10"
"21 THÁNG 6, 1971","1971-06-21"
"22/01/2014","2014-01-22"
"thứ năm, ngày 20 tháng 1 năm 2011","2011-01-20"
"03 THG 2 1980","1980-02-03"
"12.12.03","2003-12-12"
"26 thg 11 2008","2008-11-26"
"19.02.86","1986-02-19"
"03, THG 4 1972","1972-04-03"
"23.10.76","1976-10-23"
"13.08.14","2014-08-13"
"9 THG 6, 1977","1977-06-09"
"23 THG 4 1978","1978-04-23"
"Thứ Bảy, ngày 24 tháng 6 năm 1978","1978-06-24"
"28 tháng 12, 1983","1983-12-28"
"14 thg 10, 1985","1985-10-14"
"4 thg 8, 1999","1999-08-04"
"THÁNG 6 6 1988","1988-06-06"
"16 thg 12 1991","1991-12-16"
"31 THÁNG 3 2001","2001-03-31"
"21 tháng 8, 2002","2002-08-21"
"19 tháng 3, 2005","2005-03-19"
"04.08.92","1992-08-04"
"08/08/1999","1999-08-08"
"23 THG 3, 1996","1996-03-23"
"19 thg 4 2016","2016-04-19"
"19/12/1996","1996-12-19"
"tháng 10 23 1992","1992-10-23"
"02.12.94","1994-12-02"
"30, thg 6 1980","1980-06-30"
"Thứ Sáu, ngày 22 tháng 6 năm 1990","1990-06-22"
"16 THG 10 1986","1986-10-16"
"14 tháng 8 2014","2014-08-14"
"NGÀY 04 THÁNG 07 NĂM 2016","2016-07-04"
"22.04.70","1970-04-22"
"4 tháng 10 1992","1992-10-04"
"Ngày 27 tháng 07 năm 2018","2018-07-27"
"THỨ BA, NGÀY 25 THÁNG 7 NĂM 2006","2006-07-25"
"tháng 3 12, 1982","1982-03-12"
"29/12/2001","2001-12-29"
"21.07.09","2009-07-21"
"tháng 4 9, 2003","2003-04-09"
"23 tháng 9 2014","2014-09-23"
"15 tháng 11 2008","2008-11-15"
"3 tháng 7, 1999","1999-07-03"
"14 thg 12, 1998","1998-12-14"
"tháng 5 3 1980","1980-05-03"
"07/02/2002","2002-02-07"
"12 thg 4 2007","2007-04-12"
"30.06.84","1984-06-30"
"17.03.86","1986-03-17"
"tháng 1 14, 1974","1974-01-14"
"30/10/2010","2010-10-30"
"THỨ BẢY, NGÀY 01 THÁNG 8 NĂM 2015","2015-08-01"
"31 thg 12, 1979","1979-12-31"
"30/12/1998","1998-12-30"
"tháng 11 4 1985","1985-11-04"
"07/01/1984","1984-01-07"
"23, thg 3 1995","1995-03-23"
"26 tháng 12, 1982","1982-12-26"
"12 THG 11, 1976","1976-11-12"
"20 tháng 2 1980","1980-02-20"
"Thứ Hai, ngày 11 tháng 1 năm 2010","2010-01-11"
"27 tháng 4 1982","1982-04-27"
"5 tháng 2 2004","2004-02-05"
"20 tháng 6 1993","1993-06-20"
"THÁNG 9 14, 1976","1976-09-14"
"ngày 03 tháng 08 năm 1983","1983-08-03"
"THÁNG 1 10 1996","1996-01-10"
"21 THÁNG 12, 1973","1973-12-21"
"THÁNG 4 12 1976","1976-04-12"
"08 THG 9 1997","1997-09-08"
"tháng 3 31, 2012","2012-03-31"
"20 thg 3, 1989","1989-03-20"
"tháng 4 29 1987","1987-04-29"
"THỨ SÁU, NGÀY 22 THÁNG 6 NĂM 2007","2007-06-22"
"25.12.18","2018-12-25"
"9 thg 6, 1987","1987-06-09"
"7 thg 9, 2000","2000-09-07"
"23 09 82","1982-09-23"
"8 thg 10, 2008","2008-10-08"
"19 THG 8 2005","2005-08-19"
"21 05 79","1979-05-21"
"13 thg 11 1979","1979-11-13"
"26 THG 5 1989","1989-05-26"
"11 thg 1, 1987","1987-01-11"
"Ngày 26 tháng 09 năm 1982","1982-09-26"
"16 thg 4 2000","2000-04-16"
"16 thg 12 2005","2005-12-16"
"09 thg 3 2008","2008-03-09"
"tháng 10 14, 1979","1979-10-14"
"12 tháng 11 2015","2015-11-12"
"tháng 10 5, 1970","1970-10-05"
"18/11/1989","1989-11-18"
"30 thg 6, 2000","2000-06-30"
"19 thg 7, 2007","2007-07-19"
"1 THG 4, 2017","2017-04-01"
"Thứ Bảy, ngày 08 tháng 1 năm 2011","2011-01-08"
"16 thg 7 1983","1983-07-16"
"5 tháng 3 1971","1971-03-05"
"tháng 4 3, 1986","1986-04-03"
"tháng 4 27, 2006","2006-04-27"
"12 12 85","1985-12-12"
"11 tháng 7, 2010","2010-07-11"
"14, thg 5 1996","1996-05-14"
"3 tháng 8 1998","1998-08-03"
"02/01/1995","1995-01-02"
"06.12.71","1971-12-06"
"29 12 74","1974-12-29"
"14 THÁNG 4 1996","1996-04-14"
"25 tháng 12, 2004","2004-12-25"
"25 thg 7, 2013","2013-07-25"
"03, thg 8 1989","1989-08-03"
"21/03/1985","1985-03-21"
"tháng 11 9 2000","2000-11-09"
"tháng 11 20 1985","1985-11-20"
"12 02 07","2007-02-12"
"tháng 8 7, 1991","1991-08-07"
"THỨ HAI, NGÀY 03 THÁNG 10 NĂM 1994","1994-10-03"
"5 thg 3, 1980","1980-03-05"
"4 tháng 11, 1988","1988-11-04"
"18 thg 10 2002","2002-10-18"
"Thứ Ba, ngày 26 tháng 7 năm 2016","2016-07-26"
"11 THÁNG 2, 1996","1996-02-11"
"08 thg 1 2013","2013-01-08"
"10 thg 6 2004","2004-06-10"
"9 tháng 6, 1975","1975-06-09"
"2 thg 1 1998","1998-01-02"
"15 01 86","1986-01-15"
"27 thg 4 1987","1987-04-27"
"25 thg 1 1986","1986-01-25"
"9 thg 9 2002","2002-09-09"
"5 thg 4, 1989","1989-04-05"
"15 thg 1, 1986","1986-01-15"
"30 THG 5, 2012","2012-05-30"
"tháng 9 15, 1976","1976-09-15"
"10 thg 7, 1978","1978-07-10"
"07/04/1975","1975-04-07"
"Thứ Ba, ngày 22 tháng 9 năm 1992","1992-09-22"
"20 thg 6 1978","1978-06-20"
"05/05/1995","1995-05-05"
"THÁNG 4 12, 2010","2010-04-12"
"tháng 7 4 2005","2005-07-04"
"ngày 09 tháng 06 năm 1984","1984-06-09"
"17 tháng 12 2018","2018-12-17"
"28 thg 11 2006","2006-11-28"
"5 tháng 10 2018","2018-10-05"
"13, thg 4 1996","1996-04-13"
"22 thg 11 2015","2015-11-22"
"9 thg 1, 1987","1987-01-09"
"19 tháng 5 1994","1994-05-19"
"24/11/1991","1991-11-24"
"26 thg 2, 1991","1991-02-26"
"tháng 12 6, 2009","2009-12-06"
"24, thg 11 2017","2017-11-24"
"06, thg 5 1970","1970-05-06"
"25 thg 8 2015","2015-08-25"
"27.12.89","1989-12-27"
"3 tháng 12 1992","1992-12-03"
"23 THG 5 2015","2015-05-23"
"Thứ Tư, ngày 09 tháng 4 năm 1986","1986-04-09"
"6 tháng 2 1980","1980-02-06"
"14/05/1980","1980-05-14"
"18/02/2007","2007-02-18"
"21 THÁNG 4 2015","2015-04-21"
"15 thg 7, 1987","1987-07-15"
"5 tháng 2 2004","2004-02-05"
"22 tháng 12 1994","1994-12-22"
"tháng 3 22, 1986","1986-03-22"
"09.02.75","1975-02-09"
"1 THG 4, 2015","2015-04-01"
"14 THG 6, 2013","2013-06-14"
"9 thg 9 1988","1988-09-09"
"20 thg 11, 2013","2013-11-20"
"tháng 9 19, 1982","1982-09-19"
"03.09.93","1993-09-03"
"18 tháng 9, 1979","1979-09-18"
"03.09.80","1980-09-03"
"ngày 14 tháng 09 năm 1998","1998-09-14"
"24/12/1996","1996-12-24"
"tháng 6 11 2013","2013-06-11"
"Thứ Sáu, ngày 28 tháng 5 năm 1982","1982-05-28"
"5 THÁNG 2, 1986","1986-02-05"
"THÁNG 7 25, 1975","1975-07-25"
"03, thg 2 1976","1976-02-03"
"tháng 7 28, 1976","1976-07-28"
"12 THG 10, 2002","2002-10-12"
"6 THG 3, 1987","1987-03-06"
"14 tháng 9, 1991","1991-09-14"
"20 tháng 1 1986","1986-01-20"
"Ngày 30 tháng 08 năm 1981","1981-08-30"
"16 thg 10, 2012","2012-10-16"
"25.05.95","1995-05-25"
"20 thg 12 1992","1992-12-20"
"tháng 10 27 1989","1989-10-27"
"tháng 6 9 2006","2006-06-09"
"14 tháng 1 1988","1988-01-14"
"13 THG 1, 2014","2014-01-13"
"26 thg 6 1975","1975-06-26"
"THỨ NĂM, NGÀY 01 THÁNG 9 NĂM 2016","2016-09-01"
"THÁNG 12 22 1973","1973-12-22"
"tháng 1 4, 1988","1988-01-04"
"tháng 9 12, 1993","1993-09-12"
"Thứ Sáu, ngày 27 tháng 7 năm 2012","2012-07-27"
"CHỦ NHẬT, NGÀY 03 THÁNG 10 NĂM 2004","2004-10-03"
"30 thg 10 2005","2005-10-30"
"tháng 8 24 1979","1979-08-24"
"NGÀY 01 THÁNG 10 NĂM 2014","2014-10-01"
"28 THÁNG 3 1989","1989-03-28"
"18 tháng 8 2000","2000-08-18"
"tháng 11 22 1976","1976-11-22"
"23 THG 1, 1971","1971-01-23"
"05, THG 3 2006","2006-03-05"
"Thứ Ba, ngày 28 tháng 4 năm 1970","1970-04-28"
"tháng 6 16, 2015","2015-06-16"
"5 THÁNG 11 1993","1993-11-05"
"31 thg 10 2012","2012-10-31"
"4 thg 2 2005","2005-02-04"
"10 thg 1, 1990","1990-01-10"
"thứ hai, ngày 18 tháng 10 năm 1971","1971-10-18"
"tháng 12 9 2017","2017-12-09"
"22 tháng 11 2000","2000-11-22"
"30 thg 12, 1983","1983-12-30"
"4 tháng 5 1974","1974-05-04"
"19 THÁNG 5, 1982","1982-05-19"
"10 THG 2 1984","1984-02-10"
"18.05.92","1992-05-18"
"25/08/2000","2000-08-25"
"3 tháng 8, 1999","1999-08-03"
"01, thg 5 2016","2016-05-01"
"THÁNG 5 2, 1983","1983-05-02"
"THÁNG 9 8, 2007","2007-09-08"
"09 thg 3 1993","1993-03-09"
"16 02 79","1979-02-16"
"12 THÁNG 8, 2003","2003-08-12"
"tháng 3 16 1977","1977-03-16"
"NGÀY 10 THÁNG 06 NĂM 2010","2010-06-10"
"5 tháng 10 2018","2018-10-05"
"17 thg 8 2014","2014-08-17"
"23 06 79","1979-06-23"
"12 tháng 2, 2004","2004-02-12"
"19 thg 6, 2006","2006-06-19"
"28 12 70","1970-12-28"
"14.09.83","1983-09-14"
"19.05.03","2003-05-19"
"15 THG 6 1984","1984-06-15"
"20.08.01","2001-08-20"
"1 tháng 3 2017","2017-03-01"
"tháng 10 14 1981","1981-10-14"
"11 thg 11 1981","1981-11-11"
"22/09/1970","1970-09-22"
"15.02.89","1989-02-15"
"12 thg 9, 1995","1995-09-12"
"05, thg 5 1985","1985-05-05"
"23 tháng 4 2009","2009-04-23"
"25 tháng 8 1996","1996-08-25"
"27 THG 2, 1980","1980-02-27"
"28.04.98","1998-04-28"
"8 thg 1, 2010","2010-01-08"
"19 thg 2 2010","2010-02-19"
"30 tháng 9, 1986","1986-09-30"
"21 thg 5, 1985","1985-05-21"
"23 tháng 6 1971","1971-06-23"
"02, thg 9 2003","2003-09-02"
"26 04 71","1971-04-26"
"24/12/1994","1994-12-24"
"28 THG 10, 2009","2009-10-28"
"11 THG 1, 1992","1992-01-11"
"05/08/1985","1985-08-05"
"THỨ TƯ, NGÀY 25 THÁNG 5 NĂM 1977","1977-05-25"
"THỨ BA, NGÀY 22 THÁNG 10 NĂM 1974","1974-10-22"
"4 thg 12 1990","1990-12-04"
"tháng 12 21, 2013","2013-12-21"
"02.11.81","1981-11-02"
"26 THG 2, 1981","1981-02-26"
"29 thg 6 2007","2007-06-29"
"21, THG 9 1998","1998-09-21"
"29 thg 9, 1970","1970-09-29"
"tháng 10 6, 1972","1972-10-06"
"NGÀY 13 THÁNG 04 NĂM 2018","2018-04-13"
"27 tháng 12 1988","1988-12-27"
"31/12/1986","1986-12-31"
"22/03/2006","2006-03-22"
"08 thg 2 1990","1990-02-08"
"07, THG 1 1985","1985-01-07"
"23 tháng 12 1978","1978-12-23"
"16 THÁNG 10 2014","2014-10-16"
"2 07 10","2010-07-02"
"27 thg 6 1981","1981-06-27"
"04.11.95","1995-11-04"
"THÁNG 5 15, 2007","2007-05-15"
"THÁNG 5 5, 1970","1970-05-05"
"THÁNG 7 8 1998","1998-07-08"
"Thứ Tư, ngày 16 tháng 2 năm 2005","2005-02-16"
"ngày 23 tháng 10 năm 1974","1974-10-23"
"10/11/2011","2011-11-10"
"Thứ Hai, ngày 03 tháng 9 năm 2018","2018-09-03"
"11, thg 11 1982","1982-11-11"
"15 tháng 10, 1984","1984-10-15"
"Thứ Tư, ngày 26 tháng 7 năm 1978","1978-07-26"
"7 thg 2, 2014","2014-02-07"
"29/03/2018","2018-03-29"
"28.03.04","2004-03-28"
"14/04/1994","1994-04-14"
"19 tháng 7 1993","1993-07-19"
"29 tháng 6, 1990","1990-06-29"
"31 tháng 7 2001","2001-07-31"
"9 THÁNG 9 1984","1984-09-09"
"17 tháng 8 2001","2001-08-17"
"tháng 5 27 2006","2006-05-27"
"11 THG 7, 1986","1986-07-11"
"4 10 77","1977-10-04"
"19 thg 9 1974","1974-09-19"
"05/03/1988","1988-03-05"
"THỨ BẢY, NGÀY 31 THÁNG 10 NĂM 1998","1998-10-31"
"14/02/1976","1976-02-14"
"13 tháng 11 1977","1977-11-13"
"tháng 7 7 2010","2010-07-07"
"30 thg 11, 1999","1999-11-30"
"29.10.05","2005-10-29"
"30.04.18","2018-04-30"
"19 tháng 3, 1982","1982-03-19"
"23 THG 4, 2012","2012-04-23"
"31 thg 12, 2012","2012-12-31"
"25 thg 5, 1999","1999-05-25"
"20 thg 12 2004","2004-12-20"
"Thứ Sáu, ngày 29 tháng 12 năm 2006","2006-12-29"
"Ngày 31 tháng 12 năm 1987","1987-12-31"
"16 THG 10 1971","1971-10-16"
"23 THÁNG 2 2007","2007-02-23"
"Thứ Hai, ngày 14 tháng 11 năm 1977","1977-11-14"
"20 thg 3 1984","1984-03-20"
"4 thg 8, 1971","1971-08-04"
"26/02/1997","1997-02-26"
"28 thg 7, 2012","2012-07-28"
"27 tháng 4 2001","2001-04-27"
"22 tháng 4, 1987","1987-04-22"
"Thứ Bảy, ngày 03 tháng 2 năm 2001","2001-02-03"
"23 03 09","2009-03-23"
"tháng 12 9 1999","1999-12-09"
"13 tháng 11, 1996","1996-11-13"
"ngày 07 tháng 03 năm 2006","2006-03-07"
"ngày 01 tháng 03 năm 1988","1988-03-01"
"22/03/1994","1994-03-22"
"14 tháng 12 1980","1980-12-14"
"1 thg 12 1994","1994-12-01"
"tháng 2 26, 2013","2013-02-26"
"22 THÁNG 8 1972","1972-08-22"
"28 tháng 2 1992","1992-02-28"
"28 tháng 6, 1986","1986-06-28"
"11.10.08","2008-10-11"
"14 tháng 11 1996","1996-11-14"
"Ngày 17 tháng 04 năm 2014","2014-04-17"
"02 thg 9 1999","1999-09-02"
"Ngày 22 tháng 07 năm 1990","1990-07-22"
"28/02/1976","1976-02-28"
"Thứ Năm, ngày 18 tháng 12 năm 2003","2003-12-18"
"12 THG 1 1980","1980-01-12"
"7 tháng 5, 2004","2004-05-07"
"6 thg 6, 2016","2016-06-06"
"22 01 91","1991-01-22"
"8 thg 6, 1989","1989-06-08"
"THÁNG 5 20, 2005","2005-05-20"
"22 THÁNG 1 1989","1989-01-22"
"29 thg 1 2014","2014-01-29"
"tháng 7 5 1993","1993-07-05"
"29, thg 9 1980","1980-09-29"
"07.03.18","2018-03-07"
"tháng 6 3 2017","2017-06-03"
"10 09 99","1999-09-10"
"25/05/1997","1997-05-25"
"23 thg 4 1993","1993-04-23"
"12, thg 4 1972","1972-04-12"
"15 THG 8, 1977","1977-08-15"
"15 thg 11, 1974","1974-11-15"
"Ngày 09 tháng 01 năm 1989","1989-01-09"
"tháng 6 16 2002","2002-06-16"
"13 thg 9 1998","1998-09-13"
"16, thg 8 1983","1983-08-16"
"THÁNG 5 10, 1993","1993-05-10"
"21 tháng 3 2015","2015-03-21"
"28 thg 9, 1977","1977-09-28"
"14 09 80","1980-09-14"
"28.10.01","2001-10-28"
"26 thg 10, 2010","2010-10-26"
"1 tháng 7 2001","2001-07-01"
"ngày 01 tháng 10 năm 2016","2016-10-01"
"27 tháng 3, 1978","1978-03-27"
"20, thg 3 1975","1975-03-20"
"06 thg 8 1976","1976-08-06"
"8 THG 1, 2014","2014-01-08"
"tháng 10 12, 1973","1973-10-12"
"THÁNG 5 19, 1985","1985-05-19"
"14 thg 2, 1984","1984-02-14"
"16 THG 4 1989","1989-04-16"
"10.09.85","1985-09-10"
"Thứ Năm, ngày 15 tháng 6 năm 1989","1989-06-15"
"14 tháng 4, 2018","2018-04-14"
"09/03/2003","2003-03-09"
"11 thg 2 1982","1982-02-11"
"15 tháng 10 2010","2010-10-15"
"26.03.90","1990-03-26"
"2 02 90","1990-02-02"
"6 05 73","1973-05-06"
"21 thg 9, 1978","1978-09-21"
"12/10/1977","1977-10-12"
"19, thg 8 1995","1995-08-19"
"tháng 6 7, 2003","2003-06-07"
"11 THG 3, 1993","1993-03-11"
"23/04/1999","1999-04-23"
"03, thg 4 1988","1988-04-03"
"29 tháng 12, 1995","1995-12-29"
"Ngày 29 tháng 12 năm 1996","1996-12-29"
"23 thg 12 1979","1979-12-23"
"11 tháng 11 1989","1989-11-11"
"19 thg 11 2015","2015-11-19"
"22 09 11","2011-09-22"
"21 thg 7, 2016","2016-07-21"
"11 09 74","1974-09-11"
"18.01.12","2012-01-18"
"thứ sáu, ngày 31 tháng 3 năm 2017","2017-03-31"
"19 THG 11, 1994","1994-11-19"
"ngày 13 tháng 01 năm 1996","1996-01-13"
"30.05.16","2016-05-30"
"11 tháng 10, 1971","1971-10-11"
"4 tháng 6 2009","2009-06-04"
"7 thg 10, 1973","1973-10-07"
"THỨ BẢY, NGÀY 19 THÁNG 8 NĂM 2017","2017-08-19"
"20 thg 11, 2008","2008-11-20"
"10 tháng 11 2000","2000-11-10"
"THỨ TƯ, NGÀY 30 THÁNG 1 NĂM 1980","1980-01-30"
"25 THG 1, 2010","2010-01-25"
"tháng 7 25 1979","1979-07-25"
"01/02/1986","1986-02-01"
"02.10.85","1985-10-02"
"17 tháng 8, 1974","1974-08-17"
"THỨ BA, NGÀY 07 THÁNG 11 NĂM 2000","2000-11-07"
"31 THG 7 2007","2007-07-31"
"17/09/1999","1999-09-17"
"1 01 85","1985-01-01"
"24 tháng 12 2014","2014-12-24"
"11 thg 2, 2018","2018-02-11"
"30 thg 5 1977","1977-05-30"
"5 THÁNG 2, 1992","1992-02-05"
"thứ hai, ngày 18 tháng 7 năm 2016","2016-07-18"
"26 THÁNG 4 2010","2010-04-26"
"15.11.11","2011-11-15"
"14 thg 10 1971","1971-10-14"
"25.07.04","2004-07-25"
"07/12/1987","1987-12-07"
"26/03/1978","1978-03-26"
"12, thg 8 1995","1995-08-12"
"22, thg 6 1983","1983-06-22"
"23.04.92","1992-04-23"
"27, thg 9 1988","1988-09-27"
"07 thg 4 1997","1997-04-07"
"THÁNG 10 1 2008","2008-10-01"
"31 thg 5, 1989","1989-05-31"
"Thứ Hai, ngày 09 tháng 4 năm 2001","2001-04-09"
"6 tháng 11, 1976","1976-11-06"
"1 thg 12, 1983","1983-12-01"
"07 thg 1 1989","1989-01-07"
"tháng 4 17, 1970","1970-04-17"
"18/08/1983","1983-08-18"
"22/12/1985","1985-12-22"
"Thứ Tư, ngày 30 tháng 8 năm 1995","1995-08-30"
"17 06 79","1979-06-17"
"23 thg 12 2002","2002-12-23"
"24 thg 2, 2005","2005-02-24"
"tháng 6 8, 2003","2003-06-08"
"8 tháng 2, 1971","1971-02-08"
"NGÀY 04 THÁNG 05 NĂM 1974","1974-05-04"
"16 thg 1 1979","1979-01-16"
"tháng 7 30, 2018","2018-07-30"
"24 THG 10 1973","1973-10-24"
"31 thg 12 2015","2015-12-31"
"Thứ Năm, ngày 07 tháng 7 năm 2005","2005-07-07"
"2 THÁNG 7, 2018","2018-07-02"
"1 thg 7 2013","2013-07-01"
"05 thg 12 2010","2010-12-05"
"19, thg 5 2017","2017-05-19"
"24 tháng 1, 2008","2008-01-24"
"5 tháng 10 2015","2015-10-05"
"11, THG 3 1999","1999-03-11"
"29 03 82","1982-03-29"
"14.02.90","1990-02-14"
"12 09 70","1970-09-12"
"Thứ Sáu, ngày 15 tháng 7 năm 1977","1977-07-15"
"5 thg 11 2014","2014-11-05"
"11 thg 9, 2011","2011-09-11"
"09 thg 12 2014","2014-12-09"
"06, thg 11 1976","1976-11-06"
"17 thg 12, 1990","1990-12-17"
"NGÀY 03 THÁNG 10 NĂM 1995","1995-10-03"
"22 thg 10, 1993","1993-10-22"
"THỨ SÁU, NGÀY 01 THÁNG 6 NĂM 2018","2018-06-01"
"27 tháng 6, 1992","1992-06-27"
"12 tháng 10 2011","2011-10-12"
"09, thg 5 2013","2013-05-09"
"26 tháng 6 1972","1972-06-26"
"tháng 9 1 2018","2018-09-01"
"08.06.07","2007-06-08"
"Ngày 19 tháng 12 năm 1983","1983-12-19"
"12 05 03","2003-05-12"
"22 thg 9, 2009","2009-09-22"
"22 tháng 9 1981","1981-09-22"
"9 THG 11 1989","1989-11-09"
"12/09/1972","1972-09-12"
"3 tháng 10, 2001","2001-10-03"
"7 THG 6, 1989","1989-06-07"
"15 tháng 12 2014","2014-12-15"
"25, thg 1 1995","1995-01-25"
"04, THG 10 1971","1971-10-04"
"24 THG 5 1972","1972-05-24"
"1 thg 10, 1981","1981-10-01"
"13/09/2016","2016-09-13"
"15 THG 11 1991","1991-11-15"
"01 thg 8 2014","2014-08-01"
"9 THÁNG 5 1979","1979-05-09"
"6 thg 9 1994","1994-09-06"
"Chủ Nhật, ngày 23 tháng 1 năm 2011","2011-01-23"
"1 THÁNG 2 2018","2018-02-01"
"Thứ Năm, ngày 02 tháng 7 năm 1987","1987-07-02"
"25 thg 11 1995","1995-11-25"
"tháng 1 18 1990","1990-01-18"
"tháng 12 14 1971","1971-12-14"
"19 THG 9, 1983","1983-09-19"
"10/02/1980","1980-02-10"
"19, thg 5 1988","1988-05-19"
"23.07.08","2008-07-23"
"Ngày 08 tháng 11 năm 1999","1999-11-08"
"07.08.16","2016-08-07"
"14, thg 6 1980","1980-06-14"
"28 07 96","1996-07-28"
"Ngày 20 tháng 03 năm 1976","1976-03-20"
"24 tháng 5 2016","2016-05-24"
"Thứ Bảy, ngày 04 tháng 2 năm 2012","2012-02-04"
"1 thg 3, 1984","1984-03-01"
"9 thg 9 2006","2006-09-09"
"14 thg 5, 1992","1992-05-14"
"3 thg 3 1973","1973-03-03"
"THÁNG 7 3, 1999","1999-07-03"
"7 tháng 1 1971","1971-01-07"
"THÁNG 12 26, 2011","2011-12-26"
"26 THG 12, 2006","2006-12-26"
"tháng 2 17 2010","2010-02-17"
"6 thg 2, 1994","1994-02-06"
"28, thg 9 1998","1998-09-28"
"19 thg 8, 1973","1973-08-19"
"20 thg 2, 2015","2015-02-20"
"Thứ Bảy, ngày 19 tháng 7 năm 2003","2003-07-19"
"THỨ TƯ, NGÀY 15 THÁNG 2 NĂM 1995","1995-02-15"
"tháng 12 27, 1972","1972-12-27"
"10 THG 8, 1971","1971-08-10"
"14 12 82","1982-12-14"
"10 thg 5, 1985","1985-05-10"
"thứ hai, ngày 07 tháng 5 năm 1984","1984-05-07"
"Ngày 18 tháng 07 năm 1974","1974-07-18"
"16 thg 7 1990","1990-07-16"
"19 tháng 12 1974","1974-12-19"
"tháng 6 4 1999","1999-06-04"
"29 thg 12 1991","1991-12-29"
"tháng 9 29 2008","2008-09-29"
"tháng 3 24, 1971","1971-03-24"
"08/01/1985","1985-01-08"
"30 THÁNG 1, 2005","2005-01-30"
"ngày 28 tháng 01 năm 1978","1978-01-28"
"tháng 8 8, 1971","1971-08-08"
"tháng 3 26 2013","2013-03-26"
"4 thg 6, 1973","1973-06-04"
"15.11.13","2013-11-15"
"thứ năm, ngày 23 tháng 12 năm 1982","1982-12-23"
"Thứ Ba, ngày 05 tháng 5 năm 1992","1992-05-05"
"02.04.72","1972-04-02"
"14 thg 10, 2009","2009-10-14"
"30 tháng 5 1986","1986-05-30"
"tháng 2 20, 2010","2010-02-20"
"18 tháng 3 2011","2011-03-18"
"Ngày 29 tháng 10 năm 1970","1970-10-29"
"4 tháng 12 2017","2017-12-04"
"22 THG 10 2001","2001-10-22"
"15.07.70","1970-07-15"
"2 THÁNG 8, 1996","1996-08-02"
"4 thg 5, 1985","1985-05-04"
"THÁNG 2 22, 2010","2010-02-22"
"11 THG 3, 1998","1998-03-11"
"14 THG 6, 2018","2018-06-14"
"2 THÁNG 1, 2001","2001-01-02"
"02.05.14","2014-05-02"
"12 THÁNG 4, 2009","2009-04-12"
"8 THÁNG 11 1979","1979-11-08"
"CHỦ NHẬT, NGÀY 27 THÁNG 11 NĂM 1977","1977-11-27"
"18 thg 2, 2005","2005-02-18"
"18.10.99","1999-10-18"
"THÁNG 6 1, 2016","2016-06-01"
"26.10.91","1991-10-26"
"05, thg 9 1989","1989-09-05"
"THÁNG 11 10, 1974","1974-11-10"
"08.09.89","1989-09-08"
"16 tháng 4, 1985","1985-04-16"
"21 thg 12, 1982","1982-12-21"
"Ngày 16 tháng 07 năm 2004","2004-07-16"
"27 thg 10 2004","2004-10-27"
"THỨ TƯ, NGÀY 12 THÁNG 4 NĂM 2000","2000-04-12"
"Ngày 17 tháng 10 năm 1973","1973-10-17"
"3 THÁNG 10, 1977","1977-10-03"
"25/07/1977","1977-07-25"
"16 thg 11, 2006","2006-11-16"
"13 thg 1 1997","1997-01-13"
"tháng 6 17 1980","1980-06-17"
"THÁNG 10 24 1990","1990-10-24"
"12 THG 9 1986","1986-09-12"
"17 tháng 8, 2014","2014-08-17"
"8 thg 1 2000","2000-01-08"
"23 thg 4 1983","1983-04-23"
"20 thg 11 1986","1986-11-20"
"THÁNG 2 12 1994","1994-02-12"
"17 tháng 9 1975","1975-09-17"
"17 thg 3 2018","2018-03-17"
"28 thg 4 2002","2002-04-28"
"26 05 93","1993-05-26"
"25 thg 11, 2007","2007-11-25"
"24 thg 9, 1994","1994-09-24"
"6 12 74","1974-12-06"
"02, THG 6 2015","2015-06-02"
"ngày 02 tháng 02 năm 1971","1971-02-02"
"18.01.73","1973-01-18"
"tháng 2 24, 2011","2011-02-24"
"30, thg 3 2012","2012-03-30"
"Ngày 28 tháng 02 năm 1986","1986-02-28"
"Ngày 07 tháng 07 năm 2002","2002-07-07"
"03, thg 1 1980","1980-01-03"
"tháng 1 31, 2018","2018-01-31"
"27, thg 8 1991","1991-08-27"
"11 thg 8, 1981","1981-08-11"
"18 tháng 11 1982","1982-11-18"
"8 THÁNG 1 1997","1997-01-08"
"1 THG 6, 1990","1990-06-01"
"THỨ TƯ, NGÀY 01 THÁNG 1 NĂM 2003","2003-01-01"
"17 tháng 4, 2004","2004-04-17"
"NGÀY 12 THÁNG 11 NĂM 1979","1979-11-12"
"11 thg 9 1987","1987-09-11"
"3 tháng 9, 1979","1979-09-03"
"2 tháng 2 1988","1988-02-02"
"18 thg 9, 2012","2012-09-18"
"04/04/1978","1978-04-04"
"06/11/2017","2017-11-06"
"16/11/1979","1979-11-16"
"30, thg 6 2013","2013-06-30"
"14 thg 10, 1980","1980-10-14"
"4 tháng 8 1990","1990-08-04"
"3 tháng 2, 1990","1990-02-03"
"29 THG 11 1991","1991-11-29"
"20 THG 1, 2000","2000-01-20"
"19.11.90","1990-11-19"
"22 12 98","1998-12-22"
"tháng 11 29 1982","1982-11-29"
"16 thg 4, 1970","1970-04-16"
"Thứ Hai, ngày 18 tháng 3 năm 2002","2002-03-18"
"07, thg 2 1976","1976-02-07"
"15 07 99","1999-07-15"
"8 tháng 3 2003","2003-03-08"
"NGÀY 10 THÁNG 05 NĂM 2008","2008-05-10"
"14 thg 1, 1977","1977-01-14"
"25 THG 4 1971","1971-04-25"
"17.09.75","1975-09-17"
"22 tháng 11 1971","1971-11-22"
"11.06.82","1982-06-11"
"THÁNG 3 31, 2011","2011-03-31"
"11 THÁNG 5 1992","1992-05-11"
"21 tháng 1 1970","1970-01-21"
"16 THG 8 1997","1997-08-16"
"1 thg 5, 2016","2016-05-01"
"17 THÁNG 10 1981","1981-10-17"
"30 thg 5 2012","2012-05-30"
"thứ năm, ngày 24 tháng 8 năm 1989","1989-08-24"
"15 tháng 11 1987","1987-11-15"
"tháng 4 18, 1975","1975-04-18"
"09, thg 8 2000","2000-08-09"
"23 thg 1 1996","1996-01-23"
"3 02 08","2008-02-03"
"tháng 9 24, 2009","2009-09-24"
"NGÀY 04 THÁNG 10 NĂM 1993","1993-10-04"
"24 tháng 1, 1985","1985-01-24"
"17 thg 6 2010","2010-06-17"
"27 thg 9 1999","1999-09-27"
"28 thg 4 2004","2004-04-28"
"30 07 71","1971-07-30"
"ngày 10 tháng 02 năm 2009","2009-02-10"
"3 THÁNG 10 1981","1981-10-03"
"10, thg 7 2008","2008-07-10"
"11 thg 10, 1975","1975-10-11"
"18 thg 9 2015","2015-09-18"
"21.03.95","1995-03-21"
"1 thg 4, 1997","1997-04-01"
"tháng 8 7 1977","1977-08-07"
"31 tháng 10, 2009","2009-10-31"
"18.12.10","2010-12-18"
"03.06.82","1982-06-03"
"21/11/1992","1992-11-21"
"15 THG 9 1974","1974-09-15"
"19 THÁNG 12, 2010","2010-12-19"
"30/09/1989","1989-09-30"
"25 tháng 6, 2003","2003-06-25"
"15/03/1990","1990-03-15"
"22 THÁNG 5 2018","2018-05-22"
"26.03.85","1985-03-26"
"Thứ Bảy, ngày 13 tháng 11 năm 1999","1999-11-13"
"tháng 1 28, 2007","2007-01-28"
"tháng 5 24 1999","1999-05-24"
"THỨ TƯ, NGÀY 09 THÁNG 10 NĂM 1991","1991-10-09"
"15, THG 3 2011","2011-03-15"
"30 THÁNG 10 1991","1991-10-30"
"14 thg 11 2015","2015-11-14"
"THỨ BẢY, NGÀY 19 THÁNG 2 NĂM 2005","2005-02-19"
"9 tháng 5 1987","1987-05-09"
"Ngày 23 tháng 09 năm 2011","2011-09-23"
"30 07 72","1972-07-30"
"19, thg 9 1978","1978-09-19"
"07, thg 8 2013","2013-08-07"
"tháng 11 24 2005","2005-11-24"
"03/08/2010","2010-08-03"
"6 THÁNG 10 1977","1977-10-06"
"THÁNG 3 6 1978","1978-03-06"
"26 thg 6, 1983","1983-06-26"
"15/07/2015","2015-07-15"
"tháng 3 31 1973","1973-03-31"
"4 thg 5 1978","1978-05-04"
"25 THÁNG 3 1990","1990-03-25"
"6 thg 9 2009","2009-09-06"
"Ngày 14 tháng 12 năm 1986","1986-12-14"
"15.07.06","2006-07-15"
"14 thg 10, 1998","1998-10-14"
"ngày 28 tháng 11 năm 1999","1999-11-28"
"22 thg 8 1970","1970-08-22"
"16 07 92","1992-07-16"
"5 tháng 11 2018","2018-11-05"
"14 tháng 11, 1996","1996-11-14"
"19.02.85","1985-02-19"
"06, thg 5 2005","2005-05-06"
"01.03.85","1985-03-01"
"11 THG 8 1971","1971-08-11"
"tháng 12 21, 2004","2004-12-21"
"8 thg 5, 1974","1974-05-08"
"tháng 3 24 1984","1984-03-24"
"24/04/1997","1997-04-24"
"Ngày 09 tháng 08 năm 1991","1991-08-09"
"NGÀY 11 THÁNG 08 NĂM 1985","1985-08-11"
"tháng 1 15 2018","2018-01-15"
"15 tháng 11 2000","2000-11-15"
"3 tháng 6 2011","2011-06-03"
"30 thg 5, 2010","2010-05-30"
"21 THG 12 1987","1987-12-21"
"24 tháng 1 2012","2012-01-24"
"03.05.13","2013-05-03"
"27 thg 5, 1998","1998-05-27"
"Thứ Năm, ngày 13 tháng 7 năm 1989","1989-07-13"
"30, thg 9 1977","1977-09-30"
"tháng 3 22 2007","2007-03-22"
"NGÀY 12 THÁNG 11 NĂM 1972","1972-11-12"
"16 thg 9 1994","1994-09-16"
"4 01 72","1972-01-04"
"tháng 2 4, 2014","2014-02-04"
"23/11/1982","1982-11-23"
"06/06/1993","1993-06-06"
"9 thg 1 2001","2001-01-09"
"tháng 5 20, 1978","1978-05-20"
"THÁNG 3 10, 1976","1976-03-10"
"22, thg 11 2010","2010-11-22"
"14 THÁNG 5 2017","2017-05-14"
"29 tháng 5 1994","1994-05-29"
"Ngày 05 tháng 10 năm 2008","2008-10-05"
"4 01 05","2005-01-04"
"9 tháng 4, 2000","2000-04-09"
"THÁNG 4 3, 1989","1989-04-03"
"20 thg 1 1974","1974-01-20"
"THÁNG 7 17, 2004","2004-07-17"
"19 THÁNG 9 1970","1970-09-19"
"28 thg 11 2002","2002-11-28"
"tháng 6 29 1978","1978-06-29"
"08, thg 6 1999","1999-06-08"
"04 THG 10 1995","1995-10-04"
"ngày 05 tháng 10 năm 2004","2004-10-05"
"12 THÁNG 5 1980","1980-05-12"
"22 01 04","2004-01-22"
"10 thg 6 1972","1972-06-10"
"24 tháng 6, 1982","1982-06-24"
"03, thg 5 1975","1975-05-03"
"29.08.04","2004-08-29"
"26 tháng 7 1992","1992-07-26"
"Thứ Hai, ngày 27 tháng 10 năm 2014","2014-10-27"
"tháng 2 28 1997","1997-02-28"
"5 thg 4, 2000","2000-04-05"
"4 tháng 11 2013","2013-11-04"
"20 05 82","1982-05-20"
"27 thg 3 2016","2016-03-27"
"Ngày 08 tháng 07 năm 2009","2009-07-08"
"16 THG 12, 2016","2016-12-16"
"14 THG 11 2001","2001-11-14"
"1 tháng 3, 1995","1995-03-01"
"Thứ Bảy, ngày 20 tháng 6 năm 1987","1987-06-20"
"21 tháng 9 1989","1989-09-21"
"25 tháng 9 2003","2003-09-25"
"22 03 95","1995-03-22"
"13.02.16","2016-02-13"
"09, thg 2 2011","2011-02-09"
"31.01.17","2017-01-31"
"4 THG 4, 1985","1985-04-04"
"tháng 11 10 1977","1977-11-10"
"18 tháng 5, 2000","2000-05-18"
"22 thg 3, 1984","1984-03-22"
"14 thg 2 2010","2010-02-14"
"31 tháng 12, 1975","1975-12-31"
"tháng 6 21, 1971","1971-06-21"
"29.09.78","1978-09-29"
"7 thg 7, 2001","2001-07-07"
"24 THÁNG 5 1970","1970-05-24"
"Thứ Tư, ngày 25 tháng 5 năm 2005","2005-05-25"
"tháng 2 8, 1990","1990-02-08"
"29 thg 12, 1978","1978-12-29"
"Thứ Ba, ngày 20 tháng 12 năm 1988","1988-12-20"
"25 tháng 12 2013","2013-12-25"
"tháng 8 25, 2012","2012-08-25"
"25 thg 1 1973","1973-01-25"
"3 tháng 4, 1978","1978-04-03"
"13/12/2016","2016-12-13"
"2 thg 2, 2001","2001-02-02"
"THÁNG 5 23 1984","1984-05-23"
"tháng 7 7, 1990","1990-07-07"
"10 thg 11 2001","2001-11-10"
"tháng 11 9, 1971","1971-11-09"
"7 thg 4, 1994","1994-04-07"
"5 thg 9, 1979","1979-09-05"
"tháng 1 2, 1978","1978-01-02"
"22/12/1973","1973-12-22"
"8 thg 2, 1980","1980-02-08"
"17 tháng 6 2004","2004-06-17"
"Thứ Năm, ngày 23 tháng 1 năm 2003","2003-01-23"
"13 thg 4, 2015","2015-04-13"
"26 thg 1, 2002","2002-01-26"
"17 thg 4 1998","1998-04-17"
"24/04/1996","1996-04-24"
"15 thg 8, 2012","2012-08-15"
"31 THG 7 1983","1983-07-31"
"tháng 1 2 2014","2014-01-02"
"25 thg 5 2011","2011-05-25"
"30 09 74","1974-09-30"
"Thứ Sáu, ngày 24 tháng 9 năm 1982","1982-09-24"
"12 tháng 10 2006","2006-10-12"
"21 thg 11 2009","2009-11-21"
"10.09.81","1981-09-10"
"28 tháng 1 1985","1985-01-28"
"Thứ Ba, ngày 30 tháng 7 năm 1991","1991-07-30"
"tháng 2 26, 1985","1985-02-26"
"20 THÁNG 3, 1971","1971-03-20"
"5 thg 5, 2003","2003-05-05"
"15 tháng 11 1981","1981-11-15"
"16, thg 8 1995","1995-08-16"
"01 THG 3 2001","2001-03-01"
"12 thg 1 1979","1979-01-12"
"THÁNG 11 26, 2015","2015-11-26"
"20 thg 4 1978","1978-04-20"
"11 thg 1 1987","1987-01-11"
"8 thg 10, 1972","1972-10-08"
"16 01 76","1976-01-16"
"14 tháng 7 1995","1995-07-14"
"tháng 11 9, 2007","2007-11-09"
"09.09.71","1971-09-09"
"21, thg 7 2012","2012-07-21"
"10 THG 11 1990","1990-11-10"
"6 thg 12, 1999","1999-12-06"
"31 tháng 5 2007","2007-05-31"
"4 thg 12 2000","2000-12-04"
"25, THG 2 1978","1978-02-25"
"26 THÁNG 12, 1992","1992-12-26"
"5 thg 12, 2005","2005-12-05"
"tháng 4 23, 1976","1976-04-23"
"22 thg 4 1991","1991-04-22"
"04.08.74","1974-08-04"
"tháng 9 8, 1979","1979-09-08"
"tháng 10 5, 2007","2007-10-05"
"7 tháng 5 1985","1985-05-07"
"11 thg 7 1995","1995-07-11"
"ngày 21 tháng 12 năm 1988","1988-12-21"
"THỨ TƯ, NGÀY 27 THÁNG 2 NĂM 2008","2008-02-27"
"29 04 82","1982-04-29"
"Thứ Ba, ngày 30 tháng 8 năm 2005","2005-08-30"
"15 09 99","1999-09-15"
"26 02 70","1970-02-26"
"16, thg 1 2005","2005-01-16"
"1 thg 12, 1989","1989-12-01"
"4 THG 3, 1994","1994-03-04"
"NGÀY 18 THÁNG 08 NĂM 2006","2006-08-18"
"31 tháng 7 2015","2015-07-31"
"6 tháng 10, 1984","1984-10-06"
"tháng 1 25 2008","2008-01-25"
"tháng 7 17 2008","2008-07-17"
"04 thg 6 2014","2014-06-04"
"6 tháng 1 1987","1987-01-06"
"15 tháng 9, 1994","1994-09-15"
"13 tháng 11 1975","1975-11-13"
"29 thg 5, 1995","1995-05-29"
"THÁNG 2 23 1993","1993-02-23"
"16 tháng 8, 1994","1994-08-16"
"4 tháng 4 2012","2012-04-04"
"14 thg 2, 2006","2006-02-14"
"22 tháng 11 1975","1975-11-22"
"19 thg 11, 1982","1982-11-19"
"tháng 1 29 1996","1996-01-29"
"4 thg 12, 2005","2005-12-04"
"11 thg 12 1981","1981-12-11"
"25/02/2009","2009-02-25"
"thứ ba, ngày 09 tháng 8 năm 1988","1988-08-09"
"THÁNG 7 13, 2016","2016-07-13"
"Chủ Nhật, ngày 10 tháng 3 năm 1991","1991-03-10"
"5 07 74","1974-07-05"
"tháng 5 3, 1978","1978-05-03"
"tháng 1 23 1987","1987-01-23"
"10 11 85","1985-11-10"
"Ngày 18 tháng 03 năm 1987","1987-03-18"
"26 tháng 5 1982","1982-05-26"
"30 tháng 6 1995","1995-06-30"
"Ngày 24 tháng 03 năm 1997","1997-03-24"
"24, THG 10 2016","2016-10-24"
"11 thg 2 1974","1974-02-11"
"22.08.16","2016-08-22"
"12/03/2015","2015-03-12"
"16/10/2001","2001-10-16"
"12.04.77","1977-04-12"
"1 tháng 3, 2008","2008-03-01"
"NGÀY 17 THÁNG 11 NĂM 1972","1972-11-17"
"14 09 09","2009-09-14"
"9 tháng 6 2004","2004-06-09"
"NGÀY 11 THÁNG 04 NĂM 2003","2003-04-11"
"14 tháng 2 1978","1978-02-14"
"4 THÁNG 12, 2009","2009-12-04"
"tháng 2 25, 2016","2016-02-25"
"Thứ Sáu, ngày 21 tháng 5 năm 2010","2010-05-21"
"16/07/1975","1975-07-16"
"Chủ Nhật, ngày 18 tháng 7 năm 1999","1999-07-18"
"11 THÁNG 6 1995","1995-06-11"
"Thứ Bảy, ngày 16 tháng 4 năm 1994","1994-04-16"
"22, thg 4 1971","1971-04-22"
"Thứ Hai, ngày 21 tháng 2 năm 1977","1977-02-21"
"ngày 17 tháng 01 năm 2006","2006-01-17"
"27/01/2013","2013-01-27"
"7 tháng 2 2008","2008-02-07"
"2 tháng 7 1990","1990-07-02"
"8 thg 4 1973","1973-04-08"
"16 tháng 4, 1994","1994-04-16"
"15 tháng 5 1997","1997-05-15"
"29 thg 10 1991","1991-10-29"
"tháng 1 2 2006","2006-01-02"
"17 tháng 3, 2018","2018-03-17"
"15.02.18","2018-02-15"
"27 tháng 9, 2010","2010-09-27"
"10, thg 7 1987","1987-07-10"
"15, THG 11 1995","1995-11-15"
"02, THG 10 2008","2008-10-02"
"11 tháng 5 1975","1975-05-11"
"22, thg 2 1975","1975-02-22"
"8 thg 2, 1970","1970-02-08"
"tháng 10 17, 1982","1982-10-17"
"tháng 3 20, 2000","2000-03-20"
"tháng 6 12, 2007","2007-06-12"
"tháng 12 31 1999","1999-12-31"
"22 thg 8, 1977","1977-08-22"
"25 thg 10 2008","2008-10-25"
"THÁNG 7 22, 1975","1975-07-22"
"01 thg 11 2003","2003-11-01"
"15 01 76","1976-01-15"
"19 thg 3, 1977","1977-03-19"
"5 thg 8, 2012","2012-08-05"
"9 04 95","1995-04-09"
"27 thg 5, 1974","1974-05-27"
"27.01.92","1992-01-27"
"tháng 5 6, 2006","2006-05-06"
"tháng 1 18 2010","2010-01-18"
"29 tháng 8, 2007","2007-08-29"
"19 tháng 7 1994","1994-07-19"
"9 tháng 1 2010","2010-01-09"
"3 tháng 4, 1987","1987-04-03"
"06.05.91","1991-05-06"
"16 thg 11, 1974","1974-11-16"
"5 thg 7 1993","1993-07-05"
"17 tháng 9 1988","1988-09-17"
"16.10.08","2008-10-16"
"9 tháng 7 2008","2008-07-09"
"tháng 11 1, 2011","2011-11-01"
"THÁNG 6 28, 1971","1971-06-28"
"tháng 1 10 1977","1977-01-10"
"7 02 98","1998-02-07"
"THỨ SÁU, NGÀY 30 THÁNG 9 NĂM 1977","1977-09-30"
"17, thg 4 2010","2010-04-17"
"07, thg 12 1996","1996-12-07"
"Ngày 21 tháng 02 năm 2010","2010-02-21"
"THÁNG 3 11 2017","2017-03-11"
"14.08.79","1979-08-14"
"NGÀY 11 THÁNG 06 NĂM 1989","1989-06-11"
"3 thg 8 1992","1992-08-03"
"10 tháng 1, 2012","2012-01-10"
"Ngày 05 tháng 08 năm 1999","1999-08-05"
"12 thg 8 2015","2015-08-12"
"11.08.98","1998-08-11"
"Thứ Bảy, ngày 18 tháng 12 năm 1982","1982-12-18"
"8 04 17","2017-04-08"
"tháng 12 19 2016","2016-12-19"
"thứ ba, ngày 14 tháng 8 năm 1979","1979-08-14"
"16 thg 8 2016","2016-08-16"
"26 thg 9, 1988","1988-09-26"
"6 thg 4, 2004","2004-04-06"
"ngày 28 tháng 09 năm 2009","2009-09-28"
"tháng 9 23 1971","1971-09-23"
"3 thg 1, 1980","1980-01-03"
"8 tháng 5 2001","2001-05-08"
"tháng 1 29 1986","1986-01-29"
"23, thg 8 2012","2012-08-23"
"23 thg 4 2010","2010-04-23"
"tháng 1 24, 1994","1994-01-24"
"13 thg 11 1977","1977-11-13"
"15 thg 5, 1972","1972-05-15"
"14 tháng 3 1974","1974-03-14"
"21 05 18","2018-05-21"
"19 tháng 1 1993","1993-01-19"
"THÁNG 7 1, 2005","2005-07-01"
"25 thg 12 2016","2016-12-25"
"11 06 00","2000-06-11"
"31 thg 7 1993","1993-07-31"
"05 THG 5 1976","1976-05-05"
"30 thg 1 1976","1976-01-30"
"28 tháng 1 2017","2017-01-28"
"12.03.90","1990-03-12"
"8 THÁNG 7, 2015","2015-07-08"
"05.07.02","2002-07-05"
"24 tháng 11 2004","2004-11-24"
"06 THG 1 1979","1979-01-06"
"3 thg 3, 2017","2017-03-03"
"13, thg 8 1985","1985-08-13"
"15 thg 1, 2017","2017-01-15"
"21 thg 8 2005","2005-08-21"
"03 thg 6 1981","1981-06-03"
"28, thg 2 1974","1974-02-28"
"09/12/1984","1984-12-09"
"25/09/1992","1992-09-25"
"tháng 4 30 2005","2005-04-30"
"09.10.06","2006-10-09"
"17 04 80","1980-04-17"
"ngày 29 tháng 12 năm 1999","1999-12-29"
"27/08/2018","2018-08-27"
"THÁNG 6 15 1988","1988-06-15"
"18.01.03","2003-01-18"
"11 tháng 8 2014","2014-08-11"
"10 thg 2, 1997","1997-02-10"
"30 thg 8, 1973","1973-08-30"
"18 thg 7 2010","2010-07-18"
"12 thg 2 1990","1990-02-12"
"08, thg 11 1998","1998-11-08"
"12, thg 6 1997","1997-06-12"
"20 tháng 8 2015","2015-08-20"
"24 THÁNG 11 1988","1988-11-24"
"27 thg 1 1981","1981-01-27"
"13 tháng 1 1975","1975-01-13"
"ngày 04 tháng 07 năm 2014","2014-07-04"
"thứ bảy, ngày 06 tháng 10 năm 2001","2001-10-06"
"ngày 04 tháng 10 năm 1981","1981-10-04"
"THÁNG 2 24 2016","2016-02-24"
"THỨ TƯ, NGÀY 25 THÁNG 3 NĂM 2015","2015-03-25"
"6 thg 10 2018","2018-10-06"
"12/04/1976","1976-04-12"
"07.01.95","1995-01-07"
"25 thg 5, 1996","1996-05-25"
"22 thg 3 2000","2000-03-22"
"THỨ TƯ, NGÀY 04 THÁNG 7 NĂM 1990","1990-07-04"
"5 thg 8, 2015","2015-08-05"
"Ngày 23 tháng 03 năm 1984","1984-03-23"
"5 thg 5 2009","2009-05-05"
"10 thg 3 1987","1987-03-10"
"02, THG 4 2017","2017-04-02"
"26 tháng 4, 2009","2009-04-26"
"26 THÁNG 5, 1985","1985-05-26"
"Ngày 10 tháng 11 năm 2015","2015-11-10"
"18 thg 5, 1990","1990-05-18"
"9 tháng 2, 1985","1985-02-09"
"14 thg 2, 1983","1983-02-14"
"5 THG 5 1970","1970-05-05"
"02, thg 5 1987","1987-05-02"
"4 thg 9, 1994","1994-09-04"
"15 11 12","2012-11-15"
"05, THG 3 1989","1989-03-05"
"28 tháng 2 1972","1972-02-28"
"tháng 6 28, 2004","2004-06-28"
"tháng 11 11 1999","1999-11-11"
"THÁNG 10 27 1972","1972-10-27"
"tháng 1 3, 1994","1994-01-03"
"15 thg 3 2008","2008-03-15"
"08, THG 10 1976","1976-10-08"
"1 tháng 9 1980","1980-09-01"
"31 thg 5 1983","1983-05-31"
"THỨ BA, NGÀY 23 THÁNG 9 NĂM 2014","2014-09-23"
"Ngày 14 tháng 09 năm 2017","2017-09-14"
"15 thg 2 1999","1999-02-15"
"16 THÁNG 4, 1996","1996-04-16"
"19 tháng 2 1983","1983-02-19"
"17, thg 10 1990","1990-10-17"
"16 12 09","2009-12-16"
"28 thg 9 1981","1981-09-28"
"19.08.80","1980-08-19"
"24 THG 7 1997","1997-07-24"
"11/08/2018","2018-08-11"
"16, thg 5 2000","2000-05-16"
"25 01 03","2003-01-25"
"21 thg 5 1987","1987-05-21"
"9 tháng 8 2016","2016-08-09"
"8 thg 6 1974","1974-06-08"
"30 THÁNG 7 1999","1999-07-30"
"Chủ Nhật, ngày 25 tháng 7 năm 2010","2010-07-25"
"08/02/2017","2017-02-08"
"24 thg 7, 1982","1982-07-24"
"27 tháng 1 1996","1996-01-27"
"01/12/1977","1977-12-01"
"17 03 14","2014-03-17"
"tháng 9 16 2015","2015-09-16"
"Thứ Ba, ngày 13 tháng 10 năm 1970","1970-10-13"
"30 thg 5 1984","1984-05-30"
"26 04 13","2013-04-26"
"tháng 12 22, 2000","2000-12-22"
"NGÀY 09 THÁNG 01 NĂM 1985","1985-01-09"
"29 tháng 5 1994","1994-05-29"
"ngày 26 tháng 04 năm 1973","1973-04-26"
"tháng 5 11, 1998","1998-05-11"
"29 11 10","2010-11-29"
"Ngày 19 tháng 05 năm 1997","1997-05-19"
"18 tháng 2 1979","1979-02-18"
"15/01/1995","1995-01-15"
"Ngày 04 tháng 04 năm 1978","1978-04-04"
"27.01.10","2010-01-27"
"25 tháng 11, 1981","1981-11-25"
"15, THG 6 1992","1992-06-15"
"tháng 2 16, 1986","1986-02-16"
"24, thg 4 1972","1972-04-24"
"21 thg 3 2004","2004-03-21"
"8 thg 2, 1973","1973-02-08"
"07.07.18","2018-07-07"
"9 tháng 12 2008","2008-12-09"
"16 thg 7 1971","1971-07-16"
"27, thg 4 1978","1978-04-27"
"10 tháng 7 2002","2002-07-10"
"15 THG 6 2015","2015-06-15"
"21 tháng 8 1976","1976-08-21"
"11 THÁNG 5 1997","1997-05-11"
"29.07.75","1975-07-29"
"17 thg 9 2005","2005-09-17"
"1 thg 10 2012","2012-10-01"
"30/01/2011","2011-01-30"
"thứ hai, ngày 04 tháng 8 năm 2003","2003-08-04"
"30/05/1992","1992-05-30"
"tháng 1 3, 1974","1974-01-03"
"29 thg 5 2007","2007-05-29"
"tháng 2 24 1970","1970-02-24"
"27 tháng 5, 1998","1998-05-27"
"30 tháng 9 1987","1987-09-30"
"THÁNG 5 26, 2005","2005-05-26"
"NGÀY 09 THÁNG 12 NĂM 1990","1990-12-09"
"16 THG 2 1979","1979-02-16"
"NGÀY 22 THÁNG 11 NĂM 1988","1988-11-22"
"5 tháng 11 1971","1971-11-05"
"19 thg 5, 1994","1994-05-19"
"tháng 6 20 1985","1985-06-20"
"12 THÁNG 7 2000","2000-07-12"
"thứ năm, ngày 13 tháng 12 năm 2018","2018-12-13"
"6 tháng 7, 2004","2004-07-06"
"Ngày 10 tháng 10 năm 1992","1992-10-10"
"05/10/1981","1981-10-05"
"Ngày 05 tháng 09 năm 2011","2011-09-05"
"04 thg 11 1986","1986-11-04"
"10 THÁNG 6, 1972","1972-06-10"
"thứ hai, ngày 09 tháng 5 năm 1983","1983-05-09"
"8 thg 12, 1972","1972-12-08"
"09 thg 9 1980","1980-09-09"
"25 thg 4 2017","2017-04-25"
"29 tháng 8, 1996","1996-08-29"
"tháng 10 22, 1979","1979-10-22"
"13 thg 9 1992","1992-09-13"
"Ngày 12 tháng 07 năm 1984","1984-07-12"
"31 tháng 10 2014","2014-10-31"
"Ngày 17 tháng 01 năm 2013","2013-01-17"
"11 THG 11 2015","2015-11-11"
"14.09.89","1989-09-14"
"25 thg 7 1972","1972-07-25"
"21 THÁNG 12 2005","2005-12-21"
"14 THG 12, 2002","2002-12-14"
"05/01/1979","1979-01-05"
"23 thg 3 2004","2004-03-23"
"Ngày 14 tháng 07 năm 1987","1987-07-14"
"19.09.96","1996-09-19"
"13 tháng 12 2008","2008-12-13"
"07/10/2004","2004-10-07"
"2 tháng 8 1985","1985-08-02"
"01/05/1997","1997-05-01"
"2 THG 8, 1992","1992-08-02"
"09/01/2015","2015-01-09"
"18 thg 5 1971","1971-05-18"
"tháng 6 12 2010","2010-06-12"
"13 thg 10, 1981","1981-10-13"
"26 tháng 4, 1978","1978-04-26"
"thứ ba, ngày 23 tháng 11 năm 2004","2004-11-23"
"tháng 4 13, 2018","2018-04-13"
"23, thg 3 2003","2003-03-23"
"8 THÁNG 11, 2004","2004-11-08"
"29 tháng 7 2006","2006-07-29"
"9 THÁNG 10, 2007","2007-10-09"
"1 THÁNG 2 1978","1978-02-01"
"26 tháng 2, 1981","1981-02-26"
"15 tháng 11, 1975","1975-11-15"
"tháng 2 28, 1993","1993-02-28"
"11 thg 8, 2017","2017-08-11"
"21 thg 9, 1984","1984-09-21"
"9 thg 9 1980","1980-09-09"
"24/09/1986","1986-09-24"
"14.11.96","1996-11-14"
"10 thg 8 1970","1970-08-10"
"12 THG 3, 1972","1972-03-12"
"26/02/2000","2000-02-26"
"Ngày 11 tháng 08 năm 2007","2007-08-11"
"28 thg 11, 1973","1973-11-28"
"tháng 12 15, 1981","1981-12-15"
"Chủ Nhật, ngày 29 tháng 9 năm 1974","1974-09-29"
"24 thg 1 2017","2017-01-24"
"20 thg 1, 2013","2013-01-20"
"06.05.76","1976-05-06"
"6 tháng 10 2003","2003-10-06"
"24 tháng 8, 2010","2010-08-24"
"14 tháng 11 1978","1978-11-14"
"03.11.70","1970-11-03"
"29 thg 1 1986","1986-01-29"
"6 thg 9, 2006","2006-09-06"
"27 tháng 7 1993","1993-07-27"
"THÁNG 3 22, 2005","2005-03-22"
"11.10.00","2000-10-11"
"24.04.74","1974-04-24"
"11 thg 12, 1975","1975-12-11"
"tháng 1 28, 1976","1976-01-28"
"25/07/2007","2007-07-25"
"12, THG 2 1998","1998-02-12"
"tháng 11 23 1988","1988-11-23"
"30 tháng 1 2005","2005-01-30"
"11 thg 8, 1989","1989-08-11"
"3 tháng 11 1977","1977-11-03"
"8 tháng 4 2005","2005-04-08"
"01/10/1985","1985-10-01"
"10/07/1975","1975-07-10"
"tháng 1 26 1991","1991-01-26"
"24 tháng 9 1982","1982-09-24"
"3 THÁNG 1 1984","1984-01-03"
"tháng 9 19, 1977","1977-09-19"
"Thứ Ba, ngày 09 tháng 5 năm 1989","1989-05-09"
"20.07.16","2016-07-20"
"02, thg 5 2016","2016-05-02"
"21 tháng 9 2010","2010-09-21"
"28 THÁNG 1 1988","1988-01-28"
"tháng 1 28 2015","2015-01-28"
"05/07/1977","1977-07-05"
"9 thg 4, 1987","1987-04-09"
"Ngày 05 tháng 07 năm 1987","1987-07-05"
"THỨ HAI, NGÀY 29 THÁNG 8 NĂM 2005","2005-08-29"
"THÁNG 4 29, 2002","2002-04-29"
"26/06/1973","1973-06-26"
"13 THG 2 1971","1971-02-13"
"11 thg 5, 1994","1994-05-11"
"Ngày 09 tháng 09 năm 1993","1993-09-09"
"19/12/2012","2012-12-19"
"17 12 94","1994-12-17"
"21 05 05","2005-05-21"
"28.09.83","1983-09-28"
"29 tháng 1, 1996","1996-01-29"
"21 01 05","2005-01-21"
"22 thg 11 1989","1989-11-22"
"21 THÁNG 8, 1971","1971-08-21"
"ngày 17 tháng 12 năm 2006","2006-12-17"
"18, thg 10 1972","1972-10-18"
"THÁNG 4 3 1983","1983-04-03"
"04.06.11","2011-06-04"
"13 06 70","1970-06-13"
"25 thg 12, 1981","1981-12-25"
"10/06/2004","2004-06-10"
"Thứ Hai, ngày 18 tháng 12 năm 1972","1972-12-18"
"2 THÁNG 7, 1988","1988-07-02"
"28 THG 1, 1990","1990-01-28"
"tháng 1 22, 1994","1994-01-22"
"11 thg 9 1973","1973-09-11"
"NGÀY 28 THÁNG 06 NĂM 1993","1993-06-28"
"19 thg 11, 1992","1992-11-19"
"2 tháng 7 2017","2017-07-02"
"17 tháng 5 2000","2000-05-17"
"9 thg 8, 2006","2006-08-09"
"21 thg 6 1977","1977-06-21"
"Ngày 22 tháng 01 năm 1988","1988-01-22"
"thứ ba, ngày 12 tháng 5 năm 1992","1992-05-12"
"25 09 08","2008-09-25"
"5 06 77","1977-06-05"
"4 tháng 4 2014","2014-04-04"
"tháng 9 29 2010","2010-09-29"
"2 THG 10, 1988","1988-10-02"
"13, thg 12 2009","2009-12-13"
"THÁNG 7 7 1987","1987-07-07"
"03.02.17","2017-02-03"
"04/02/2009","2009-02-04"
"17 THÁNG 8 1992","1992-08-17"
"10/10/1972","1972-10-10"
"Thứ Tư, ngày 01 tháng 10 năm 1980","1980-10-01"
"16 thg 5 1986","1986-05-16"
"7 tháng 3 2016","2016-03-07"
"30 thg 3, 1972","1972-03-30"
"05.05.94","1994-05-05"
"18, thg 3 1996","1996-03-18"
"5 thg 12, 1988","1988-12-05"
"6 tháng 4 1991","1991-04-06"
"THÁNG 9 15, 2000","2000-09-15"
"30 thg 11, 1995","1995-11-30"
"tháng 7 23, 2005","2005-07-23"
"Thứ Ba, ngày 20 tháng 9 năm 1994","1994-09-20"
"02.05.78","1978-05-02"
"3 tháng 3 1986","1986-03-03"
"tháng 9 19, 2018","2018-09-19"
"12 thg 8 2006","2006-08-12"
"15 tháng 12 1982","1982-12-15"
"10 tháng 3 1971","1971-03-10"
"05.12.84","1984-12-05"
"20 04 72","1972-04-20"
"THÁNG 6 16 1977","1977-06-16"
"tháng 9 22, 1992","1992-09-22"
"28 thg 10 1988","1988-10-28"
"THỨ BẢY, NGÀY 18 THÁNG 9 NĂM 1993","1993-09-18"
"4 tháng 4, 1980","1980-04-04"
"19.01.90","1990-01-19"
"31, thg 1 2007","2007-01-31"
"05, THG 9 1991","1991-09-05"
"03 THG 6 1974","1974-06-03"
"tháng 9 20, 2013","2013-09-20"
"11 tháng 8 1999","1999-08-11"
"THÁNG 2 12, 1988","1988-02-12"
"03 thg 8 1982","1982-08-03"
"10/09/1993","1993-09-10"
"31 05 15","2015-05-31"
"26 thg 4, 1993","1993-04-26"
"ngày 19 tháng 05 năm 1989","1989-05-19"
"thứ hai, ngày 27 tháng 4 năm 2009","2009-04-27"
"12 tháng 8 1983","1983-08-12"
"9 tháng 12, 1990","1990-12-09"
"3 thg 3 2016","2016-03-03"
"31 thg 3, 2001","2001-03-31"
"tháng 5 5 1993","1993-05-05"
"18 THG 7, 2003","2003-07-18"
"16 tháng 8 1996","1996-08-16"
"30 THG 11, 2009","2009-11-30"
"10 06 97","1997-06-10"
"15 thg 11 2011","2011-11-15"
"Thứ Năm, ngày 28 tháng 7 năm 1994","1994-07-28"
"24 THÁNG 7 2003","2003-07-24"
"28.06.01","2001-06-28"
"14 THÁNG 7, 1997","1997-07-14"
"19, thg 1 1997","1997-01-19"
"tháng 1 17, 2005","2005-01-17"
"NGÀY 27 THÁNG 09 NĂM 2001","2001-09-27"
"Ngày 01 tháng 11 năm 1979","1979-11-01"
"11.07.95","1995-07-11"
"29 THG 9, 1975","1975-09-29"
"18 tháng 3 1992","1992-03-18"
"3 THG 12, 2006","2006-12-03"
"27 07 04","2004-07-27"
"1 THÁNG 6, 2012","2012-06-01"
"30 tháng 7, 2011","2011-07-30"
"05.06.73","1973-06-05"
"3 thg 8 1987","1987-08-03"
"THỨ BẢY, NGÀY 14 THÁNG 12 NĂM 2002","2002-12-14"
"5 10 85","1985-10-05"
"Thứ Hai, ngày 29 tháng 12 năm 1980","1980-12-29"
"8 thg 9, 1972","1972-09-08"
"26 thg 12 1982","1982-12-26"
"10.08.90","1990-08-10"
"31, thg 12 2000","2000-12-31"
"Ngày 04 tháng 03 năm 1992","1992-03-04"
"2 THG 11 1996","1996-11-02"
"03.11.07","2007-11-03"
"01, thg 4 1976","1976-04-01"
"28 tháng 4 2015","2015-04-28"
"29, thg 3 2012","2012-03-29"
"14 thg 5 1978","1978-05-14"
"16.10.98","1998-10-16"
"03 thg 3 1974","1974-03-03"
"1 thg 6, 1982","1982-06-01"
"ngày 16 tháng 10 năm 1981","1981-10-16"
"18 THG 1 1977","1977-01-18"
"05 thg 3 2015","2015-03-05"
"07.03.70","1970-03-07"
"15 THG 2 2008","2008-02-15"
"8 thg 10 1985","1985-10-08"
"25/09/2013","2013-09-25"
"10/09/2007","2007-09-10"
"tháng 10 22, 1995","1995-10-22"
"28.09.79","1979-09-28"
"thứ hai, ngày 11 tháng 6 năm 2007","2007-06-11"
"tháng 10 16 1999","1999-10-16"
"Ngày 14 tháng 09 năm 2001","2001-09-14"
"9 tháng 11 1974","1974-11-09"
"21/07/1984","1984-07-21"
"26 12 70","1970-12-26"
"12 thg 3, 1974","1974-03-12"
"25.02.83","1983-02-25"
"THÁNG 4 2 2018","2018-04-02"
"19 THG 12, 2009","2009-12-19"
"12 thg 1, 1984","1984-01-12"
"12/01/2003","2003-01-12"
"9 06 82","1982-06-09"
"20 THG 3, 1972","1972-03-20"
"10 tháng 11 2001","2001-11-10"
"Thứ Ba, ngày 20 tháng 8 năm 1974","1974-08-20"
"21 thg 8 1982","1982-08-21"
"27, THG 9 1974","1974-09-27"
"03/11/2003","2003-11-03"
"2 THÁNG 9, 1971","1971-09-02"
"6 THÁNG 11 1983","1983-11-06"
"19.02.08","2008-02-19"
"31 THÁNG 1 1973","1973-01-31"
"24 08 85","1985-08-24"
"14, thg 7 1986","1986-07-14"
"19 thg 12, 2013","2013-12-19"
"06.04.95","1995-04-06"
"3 THÁNG 1, 2017","2017-01-03"
"22 thg 6, 2011","2011-06-22"
"18 THG 8 2015","2015-08-18"
"Thứ Hai, ngày 14 tháng 8 năm 2006","2006-08-14"
"02, THG 2 1986","1986-02-02"
"21/10/2006","2006-10-21"
"tháng 6 16, 1982","1982-06-16"
"15 05 06","2006-05-15"
"11 tháng 11 1999","1999-11-11"
"31 thg 5, 1993","1993-05-31"
"8 tháng 4 2010","2010-04-08"
"THÁNG 12 15, 2012","2012-12-15"
"5 thg 11 1971","1971-11-05"
"23 thg 12, 1978","1978-12-23"
"18, thg 12 1987","1987-12-18"
"19 thg 2 1994","1994-02-19"
"tháng 1 22 2018","2018-01-22"
"8 tháng 5 2013","2013-05-08"
"thứ hai, ngày 06 tháng 3 năm 2006","2006-03-06"
"29/08/1981","1981-08-29"
"18.09.89","1989-09-18"
"1 THÁNG 1 1989","1989-01-01"
"08, thg 1 1996","1996-01-08"
"8 tháng 4, 1984","1984-04-08"
"20 THG 7 2004","2004-07-20"
"19 tháng 7 1991","1991-07-19"
"26 THG 11 1993","1993-11-26"
"4 tháng 9, 1976","1976-09-04"
"23 tháng 3 1999","1999-03-23"
"20.05.84","1984-05-20"
"29 thg 1 1996","1996-01-29"
"26 tháng 2, 2000","2000-02-26"
"chủ nhật, ngày 21 tháng 2 năm 2016","2016-02-21"
"20 THÁNG 1, 1975","1975-01-20"
"06 thg 5 1991","1991-05-06"
"Ngày 25 tháng 07 năm 2003","2003-07-25"
"22 tháng 9, 1973","1973-09-22"
"19 THG 6, 1971","1971-06-19"
"05 THG 9 1980","1980-09-05"
"tháng 3 6 1999","1999-03-06"
"21, thg 11 1995","1995-11-21"
"30, THG 12 2016","2016-12-30"
"11.07.72","1972-07-11"
"tháng 3 17 1984","1984-03-17"
"12, THG 4 2012","2012-04-12"
"28 thg 3 2005","2005-03-28"
"tháng 8 10 2018","2018-08-10"
"tháng 9 5, 1995","1995-09-05"
"8 thg 7 2009","2009-07-08"
"22 THG 7 1994","1994-07-22"
"THỨ NĂM, NGÀY 10 THÁNG 4 NĂM 1986","1986-04-10"
"12/11/1984","1984-11-12"
"3 thg 11, 1988","1988-11-03"
"tháng 7 5 2005","2005-07-05"
"21 06 93","1993-06-21"
"31 thg 5 1976","1976-05-31"
"28 tháng 8, 1983","1983-08-28"
"tháng 2 8 1991","1991-02-08"
"14 thg 8 2018","2018-08-14"
"06 thg 11 1983","1983-11-06"
"tháng 2 7 2015","2015-02-07"
"10 tháng 2 1971","1971-02-10"
"22 THÁNG 10, 1995","1995-10-22"
"11 tháng 12 2017","2017-12-11"
"19 tháng 10, 1977","1977-10-19"
"tháng 11 6, 1989","1989-11-06"
"15/02/2016","2016-02-15"
"thứ năm, ngày 06 tháng 2 năm 1975","1975-02-06"
"4 thg 7, 1994","1994-07-04"
"10 thg 2, 1991","1991-02-10"
"5 tháng 8, 1990","1990-08-05"
"10.09.18","2018-09-10"
"Ngày 27 tháng 06 năm 1998","1998-06-27"
"THỨ HAI, NGÀY 18 THÁNG 5 NĂM 2015","2015-05-18"
"6 THG 3, 2002","2002-03-06"
"1 tháng 7, 2005","2005-07-01"
"02 thg 6 1984","1984-06-02"
"29 thg 8, 2014","2014-08-29"
"25 tháng 12, 1978","1978-12-25"
"20 thg 6 1987","1987-06-20"
"8 tháng 5, 1994","1994-05-08"
"tháng 12 28 1975","1975-12-28"
"16 tháng 8 1977","1977-08-16"
"28 08 77","1977-08-28"
"2 THG 9, 2013","2013-09-02"
"17 THG 8, 1989","1989-08-17"
"THỨ SÁU, NGÀY 20 THÁNG 1 NĂM 1978","1978-01-20"
"THÁNG 10 11 1983","1983-10-11"
"20 thg 10, 2011","2011-10-20"
"13/08/1982","1982-08-13"
"Thứ Ba, ngày 23 tháng 5 năm 1995","1995-05-23"
"14 tháng 8 1978","1978-08-14"
"tháng 6 7, 2014","2014-06-07"
"9 thg 7 1994","1994-07-09"
"tháng 8 27, 1976","1976-08-27"
"THÁNG 10 17 2013","2013-10-17"
"20 thg 11, 2004","2004-11-20"
"05.06.92","1992-06-05"
"tháng 12 27 2010","2010-12-27"
"ngày 04 tháng 12 năm 1974","1974-12-04"
"25 thg 10 1972","1972-10-25"
"13 tháng 6, 2014","2014-06-13"
"11 THÁNG 6, 2018","2018-06-11"
"25.08.89","1989-08-25"
"07, thg 4 2009","2009-04-07"
"20 THG 11, 2003","2003-11-20"
"05 thg 8 1992","1992-08-05"
"ngày 11 tháng 10 năm 2009","2009-10-11"
"2 thg 4, 1993","1993-04-02"
"25.09.10","2010-09-25"
"28.10.12","2012-10-28"
"13 tháng 8 1978","1978-08-13"
"27 07 99","1999-07-27"
"9 THÁNG 10, 1983","1983-10-09"
"24 tháng 2 1987","1987-02-24"
"18, thg 5 1977","1977-05-18"
"1 04 11","2011-04-01"
"17.11.90","1990-11-17"
"tháng 11 7, 1993","1993-11-07"
"18 thg 8, 1985","1985-08-18"
"11 tháng 8 1980","1980-08-11"
"20 tháng 2 1981","1981-02-20"
"5 THG 11 2016","2016-11-05"
"17 THG 1 1987","1987-01-17"
"26 07 90","1990-07-26"
"13.04.72","1972-04-13"
"05, THG 2 2018","2018-02-05"
"20 thg 9 2013","2013-09-20"
"7 thg 5, 2002","2002-05-07"
"2 thg 7, 1981","1981-07-02"
"thứ tư, ngày 09 tháng 11 năm 2005","2005-11-09"
"18 THG 4 1979","1979-04-18"
"14 THÁNG 1, 1972","1972-01-14"
"01, thg 10 1983","1983-10-01"
"Ngày 30 tháng 09 năm 1997","1997-09-30"
"tháng 7 24 1971","1971-07-24"
"4 THG 2, 2015","2015-02-04"
"20 tháng 6, 1982","1982-06-20"
"01/11/1970","1970-11-01"
"ngày 13 tháng 05 năm 1979","1979-05-13"
"tháng 8 18, 1974","1974-08-18"
"tháng 1 18 2009","2009-01-18"
"16 thg 3, 2015","2015-03-16"
"9 tháng 11, 2009","2009-11-09"
"13 THG 8 1995","1995-08-13"
"THỨ TƯ, NGÀY 06 THÁNG 6 NĂM 2012","2012-06-06"
"21 thg 6 2007","2007-06-21"
"29 tháng 3 1986","1986-03-29"
"24 THG 6 1975","1975-06-24"
"16.11.16","2016-11-16"
"tháng 4 2 2018","2018-04-02"
"Thứ Hai, ngày 02 tháng 7 năm 2001","2001-07-02"
"20 THÁNG 12 2014","2014-12-20"
"23 tháng 1, 2003","2003-01-23"
"28 tháng 4 1972","1972-04-28"
"Thứ Sáu, ngày 05 tháng 1 năm 1996","1996-01-05"
"ngày 31 tháng 12 năm 2015","2015-12-31"
"thứ năm, ngày 04 tháng 9 năm 2008","2008-09-04"
"27.11.93","1993-11-27"
"Thứ Sáu, ngày 16 tháng 8 năm 1974","1974-08-16"
"11 thg 2 1980","1980-02-11"
"9 thg 2 2016","2016-02-09"
"tháng 1 17 1989","1989-01-17"
"ngày 01 tháng 03 năm 1990","1990-03-01"
"19/09/2009","2009-09-19"
"10 thg 6 1985","1985-06-10"
"01, thg 10 1999","1999-10-01"
"tháng 7 20 1992","1992-07-20"
"12 THG 5 1976","1976-05-12"
"12 tháng 9, 2007","2007-09-12"
"23 tháng 12, 2002","2002-12-23"
"09/05/2018","2018-05-09"
"17 THÁNG 9 1992","1992-09-17"
"tháng 9 20 1977","1977-09-20"
"8 thg 10, 1995","1995-10-08"
"NGÀY 14 THÁNG 04 NĂM 1980","1980-04-14"
"Thứ Tư, ngày 12 tháng 10 năm 1977","1977-10-12"
"THỨ TƯ, NGÀY 23 THÁNG 7 NĂM 2003","2003-07-23"
"7 THÁNG 6 1985","1985-06-07"
"7 THG 2 2012","2012-02-07"
"23 tháng 6, 1990","1990-06-23"
"2 tháng 5 1984","1984-05-02"
"19/02/1971","1971-02-19"
"25, thg 2 2012","2012-02-25"
"08/11/2002","2002-11-08"
"4 07 04","2004-07-04"
"26.10.10","2010-10-26"
"04 thg 3 2002","2002-03-04"
"25 thg 1 1993","1993-01-25"
"24 THÁNG 11 1989","1989-11-24"
"10 THG 2 1975","1975-02-10"
"THÁNG 7 27, 2015","2015-07-27"
"25 thg 8, 2000","2000-08-25"
"07 thg 2 1979","1979-02-07"
"tháng 12 9, 1984","1984-12-09"
"12.03.89","1989-03-12"
"09/02/2002","2002-02-09"
"9 THÁNG 12 1985","1985-12-09"
"2 tháng 12, 2005","2005-12-02"
"2 tháng 3 1973","1973-03-02"
"11 THG 4 1974","1974-04-11"
"tháng 10 9, 1982","1982-10-09"
"20 tháng 11 1990","1990-11-20"
"NGÀY 07 THÁNG 01 NĂM 1975","1975-01-07"
"tháng 12 13 2002","2002-12-13"
"tháng 8 9, 1988","1988-08-09"
"18/01/2006","2006-01-18"
"28/02/1980","1980-02-28"
"10, THG 6 2008","2008-06-10"
"05.04.18","2018-04-05"
"26 thg 6 2008","2008-06-26"
"THÁNG 12 4 1984","1984-12-04"
"8 tháng 6 1989","1989-06-08"
"16 01 93","1993-01-16"
"24 thg 1, 2007","2007-01-24"
"20/03/1971","1971-03-20"
"12/12/1970","1970-12-12"
"25 02 86","1986-02-25"
"01, THG 6 1986","1986-06-01"
"17 03 83","1983-03-17"
"18 THG 10, 1983","1983-10-18"
"11 08 02","2002-08-11"
"02/06/1995","1995-06-02"
"Ngày 29 tháng 03 năm 1989","1989-03-29"
"THỨ BẢY, NGÀY 05 THÁNG 3 NĂM 2005","2005-03-05"
"Ngày 13 tháng 08 năm 1977","1977-08-13"
"THÁNG 10 29, 1975","1975-10-29"
"2 tháng 7 1981","1981-07-02"
"THỨ NĂM, NGÀY 01 THÁNG 1 NĂM 2009","2009-01-01"
"11, THG 4 1980","1980-04-11"
"THỨ SÁU, NGÀY 22 THÁNG 4 NĂM 1977","1977-04-22"
"19, thg 3 2017","2017-03-19"
"Ngày 17 tháng 12 năm 2018","2018-12-17"
"16 11 11","2011-11-16"
"Thứ Sáu, ngày 13 tháng 6 năm 2014","2014-06-13"
"21 thg 4, 1995","1995-04-21"
"Ngày 31 tháng 08 năm 2015","2015-08-31"
"21 tháng 1 2013","2013-01-21"
"21 thg 7 2006","2006-07-21"
"10 thg 4, 1989","1989-04-10"
"24 thg 9, 2009","2009-09-24"
"9 02 04","2004-02-09"
"23 tháng 4, 1998","1998-04-23"
"5 09 97","1997-09-05"
"01 thg 10 1991","1991-10-01"
"3 thg 8, 1972","1972-08-03"
"28 THÁNG 7 1974","1974-07-28"
"15/12/2015","2015-12-15"
"16 thg 5 2013","2013-05-16"
"17/10/2010","2010-10-17"
"12, thg 2 2016","2016-02-12"
"23, thg 1 2004","2004-01-23"
"Ngày 09 tháng 06 năm 2011","2011-06-09"
"11 thg 8 1993","1993-08-11"
"5 thg 3 2015","2015-03-05"
"8 thg 5, 1972","1972-05-08"
"3 THÁNG 2, 1974","1974-02-03"
"20/11/1982","1982-11-20"
"14 tháng 5 2015","2015-05-14"
"tháng 8 15 1997","1997-08-15"
"06 THG 5 1989","1989-05-06"
"3 thg 1 2006","2006-01-03"
"4 THÁNG 2 1984","1984-02-04"
"Thứ Hai, ngày 11 tháng 5 năm 1992","1992-05-11"
"NGÀY 11 THÁNG 02 NĂM 2002","2002-02-11"
"18.07.91","1991-07-18"
"06 thg 12 2008","2008-12-06"
"Ngày 14 tháng 03 năm 2015","2015-03-14"
"tháng 1 19, 2007","2007-01-19"
"03 thg 12 2013","2013-12-03"
"07.12.13","2013-12-07"
"5 thg 12 2014","2014-12-05"
"4 thg 2 2008","2008-02-04"
"31, thg 1 1994","1994-01-31"
"09 thg 11 1983","1983-11-09"
"11 tháng 10 1986","1986-10-11"
"THÁNG 8 21, 1993","1993-08-21"
"23 10 70","1970-10-23"
"28 tháng 3 1982","1982-03-28"
"THÁNG 2 25 2005","2005-02-25"
"9 tháng 9, 2018","2018-09-09"
"21 thg 12 2005","2005-12-21"
"26 thg 9 1992","1992-09-26"
"16 thg 2, 1981","1981-02-16"
"15 09 97","1997-09-15"
"6 tháng 4, 1985","1985-04-06"
"19 THG 1, 1992","1992-01-19"
"Ngày 24 tháng 07 năm 1988","1988-07-24"
"13 THG 9, 2000","2000-09-13"
"tháng 9 14 1987","1987-09-14"
"20 tháng 7 1996","1996-07-20"
"15, THG 1 1977","1977-01-15"
"THÁNG 5 10, 2018","2018-05-10"
"18/08/1995","1995-08-18"
"28 07 04","2004-07-28"
"14 THG 7 2001","2001-07-14"
"21 thg 4 1982","1982-04-21"
"13 09 83","1983-09-13"
"tháng 5 17 1979","1979-05-17"
"28 tháng 6, 2012","2012-06-28"
"THÁNG 7 10, 2007","2007-07-10"
"Thứ Sáu, ngày 01 tháng 3 năm 1974","1974-03-01"
"Ngày 24 tháng 12 năm 2000","2000-12-24"
"28 tháng 11 1977","1977-11-28"
"06.04.84","1984-04-06"
"ngày 02 tháng 03 năm 2002","2002-03-02"
"21 tháng 7 1999","1999-07-21"
"23/10/2017","2017-10-23"
"08.09.86","1986-09-08"
"2 tháng 4 1991","1991-04-02"
"15 thg 6, 1977","1977-06-15"
"26 THG 9 2006","2006-09-26"
"2 05 16","2016-05-02"
"06/01/1979","1979-01-06"
"tháng 2 19 1991","1991-02-19"
"THÁNG 9 12, 2006","2006-09-12"
"05, thg 5 1970","1970-05-05"
"16.01.16","2016-01-16"
"thứ năm, ngày 24 tháng 1 năm 2013","2013-01-24"
"18 tháng 11 1971","1971-11-18"
"tháng 3 24 1973","1973-03-24"
"10 04 18","2018-04-10"
"tháng 2 4, 1975","1975-02-04"
"24 THG 7, 1989","1989-07-24"
"tháng 12 11, 2006","2006-12-11"
"24 thg 2 1997","1997-02-24"
"THỨ NĂM, NGÀY 08 THÁNG 2 NĂM 1990","1990-02-08"
"Ngày 23 tháng 11 năm 1984","1984-11-23"
"12 THG 9, 1999","1999-09-12"
"20 tháng 6 1988","1988-06-20"
"07/01/2008","2008-01-07"
"29 thg 10, 2004","2004-10-29"
"18.06.83","1983-06-18"
"THÁNG 2 17, 2001","2001-02-17"
"12 thg 11, 1991","1991-11-12"
"Ngày 01 tháng 09 năm 1980","1980-09-01"
"18 THÁNG 9, 1972","1972-09-18"
"Ngày 31 tháng 07 năm 1975","1975-07-31"
"17 THG 7, 2014","2014-07-17"
"Ngày 23 tháng 01 năm 1977","1977-01-23"
"NGÀY 22 THÁNG 08 NĂM 1974","1974-08-22"
"22 09 91","1991-09-22"
"24 THG 1, 1980","1980-01-24"
"tháng 1 9 2015","2015-01-09"
"21 THÁNG 2, 1971","1971-02-21"
"20.01.17","2017-01-20"
"10 thg 12, 2011","2011-12-10"
"23 tháng 4 1998","1998-04-23"
"16/11/2008","2008-11-16"
"13 tháng 5 1993","1993-05-13"
"tháng 3 18, 1990","1990-03-18"
"Thứ Hai, ngày 03 tháng 2 năm 2003","2003-02-03"
"15 thg 2 2016","2016-02-15"
"tháng 1 29 1973","1973-01-29"
"20 THG 3 1976","1976-03-20"
"17 thg 2, 1998","1998-02-17"
"7 tháng 5 2012","2012-05-07"
"23 thg 2 1970","1970-02-23"
"THÁNG 2 3, 1975","1975-02-03"
"Ngày 23 tháng 10 năm 1989","1989-10-23"
"NGÀY 20 THÁNG 04 NĂM 1990","1990-04-20"
"8 06 14","2014-06-08"
"10 THG 2 2013","2013-02-10"
"03.01.87","1987-01-03"
"Thứ Năm, ngày 03 tháng 9 năm 2015","2015-09-03"
"tháng 12 20, 2001","2001-12-20"
"25 thg 1, 1994","1994-01-25"
"tháng 6 26 1987","1987-06-26"
"Ngày 26 tháng 11 năm 1995","1995-11-26"
"6 thg 12 2007","2007-12-06"
"12 THG 1 2012","2012-01-12"
"8 06 79","1979-06-08"
"26 tháng 5, 1979","1979-05-26"
"Thứ Hai, ngày 19 tháng 12 năm 1983","1983-12-19"
"19 02 16","2016-02-19"
"22 THG 10, 1989","1989-10-22"
"27 tháng 3 1991","1991-03-27"
"tháng 8 28 2012","2012-08-28"
"05, thg 4 1986","1986-04-05"
"11, thg 6 2013","2013-06-11"
"01 thg 12 1983","1983-12-01"
"Ngày 22 tháng 11 năm 2006","2006-11-22"
"09, thg 7 2009","2009-07-09"
"15.03.89","1989-03-15"
"13/04/1991","1991-04-13"
"17 thg 11, 1974","1974-11-17"
"15 thg 4 1991","1991-04-15"
"27/10/2017","2017-10-27"
"NGÀY 06 THÁNG 03 NĂM 1988","1988-03-06"
"7 tháng 6, 2006","2006-06-07"
"23.05.87","1987-05-23"
"22, thg 11 1993","1993-11-22"
"31 THÁNG 10 1986","1986-10-31"
"02 THG 9 1989","1989-09-02"
"Thứ Hai, ngày 05 tháng 7 năm 1982","1982-07-05"
"NGÀY 19 THÁNG 07 NĂM 1973","1973-07-19"
"23 thg 12 1973","1973-12-23"
"NGÀY 11 THÁNG 01 NĂM 1974","1974-01-11"
"5 tháng 4 1990","1990-04-05"
"28 thg 8 1985","1985-08-28"
"03 THG 7 2012","2012-07-03"
"30 THG 6, 1982","1982-06-30"
"tháng 3 4, 2002","2002-03-04"
"THÁNG 2 14, 2011","2011-02-14"
"Ngày 23 tháng 08 năm 2017","2017-08-23"
"26, thg 12 1998","1998-12-26"
"20 tháng 1, 1998","1998-01-20"
"20 thg 3, 1975","1975-03-20"
"15 tháng 9 2004","2004-09-15"
"30.11.74","1974-11-30"
"tháng 9 25 1997","1997-09-25"
"tháng 7 18, 2001","2001-07-18"
"thứ tư, ngày 30 tháng 7 năm 2008","2008-07-30"
"9 tháng 12, 2003","2003-12-09"
"11 thg 4, 1993","1993-04-11"
"22, THG 3 1971","1971-03-22"
"3 THG 7 1979","1979-07-03"
"27 tháng 2, 1997","1997-02-27"
"19 12 71","1971-12-19"
"3 THÁNG 6, 1986","1986-06-03"
"20 thg 9 1976","1976-09-20"
"Ngày 19 tháng 02 năm 1980","1980-02-19"
"01.10.92","1992-10-01"
"30.11.17","2017-11-30"
"THÁNG 12 11, 1977","1977-12-11"
"ngày 12 tháng 04 năm 1983","1983-04-12"
"10 tháng 10 1980","1980-10-10"
"tháng 1 14 1986","1986-01-14"
"THỨ SÁU, NGÀY 17 THÁNG 2 NĂM 2012","2012-02-17"
"20 tháng 11, 1986","1986-11-20"
"20, thg 6 2002","2002-06-20"
"28 thg 7, 1978","1978-07-28"
"22 thg 6 2008","2008-06-22"
"03, THG 2 2005","2005-02-03"
"9 THÁNG 11 2014","2014-11-09"
"09 THG 9 2014","2014-09-09"
"01, thg 6 1987","1987-06-01"
"31/12/1975","1975-12-31"
"31 thg 5, 1973","1973-05-31"
"tháng 4 28, 2015","2015-04-28"
"04 THG 8 2002","2002-08-04"
"20.11.99","1999-11-20"
"11 thg 3, 2001","2001-03-11"
"21.10.12","2012-10-21"
"9 THÁNG 9, 1970","1970-09-09"
"thứ bảy, ngày 14 tháng 1 năm 1978","1978-01-14"
"27 tháng 4 1973","1973-04-27"
"18.06.06","2006-06-18"
"15 09 10","2010-09-15"
"19.06.92","1992-06-19"
"09 THG 8 1981","1981-08-09"
"20 07 14","2014-07-20"
"17, thg 5 1985","1985-05-17"
"08, THG 10 1994","1994-10-08"
"29 thg 11, 1980","1980-11-29"
"28 03 73","1973-03-28"
"4 tháng 1, 2014","2014-01-04"
"25 thg 12 2007","2007-12-25"
"tháng 9 26, 1984","1984-09-26"
"13/06/2005","2005-06-13"
"23 thg 2, 1977","1977-02-23"
"1 09 12","2012-09-01"
"31 tháng 10 1970","1970-10-31"
"tháng 11 12 2013","2013-11-12"
"4 02 73","1973-02-04"
"15 tháng 5 2004","2004-05-15"
"3 thg 3, 1978","1978-03-03"
"Ngày 11 tháng 03 năm 1974","1974-03-11"
"16 THÁNG 10 1996","1996-10-16"
"tháng 6 30, 2016","2016-06-30"
"29 tháng 1, 2018","2018-01-29"
"11.07.82","1982-07-11"
"03/08/1973","1973-08-03"
"23 THÁNG 2 2008","2008-02-23"
"Chủ Nhật, ngày 21 tháng 5 năm 2000","2000-05-21"
"25 THG 10 2003","2003-10-25"
"10 THG 5, 1997","1997-05-10"
"20 thg 12 2018","2018-12-20"
"30 THG 5, 1988","1988-05-30"
"16 thg 4 1976","1976-04-16"
"tháng 10 28, 1994","1994-10-28"
"NGÀY 19 THÁNG 10 NĂM 1986","1986-10-19"
"16 tháng 8 1994","1994-08-16"
"Ngày 27 tháng 02 năm 1980","1980-02-27"
"tháng 1 25 1987","1987-01-25"
"16 thg 2, 1976","1976-02-16"
"tháng 12 26, 1977","1977-12-26"
"8 THG 8, 2014","2014-08-08"
"18 tháng 11 2006","2006-11-18"
"5 tháng 5 1995","1995-05-05"
"8 05 84","1984-05-08"
"9 tháng 5, 1990","1990-05-09"
"3 thg 11 2015","2015-11-03"
"19, thg 1 1992","1992-01-19"
"05, THG 1 2014","2014-01-05"
"THỨ SÁU, NGÀY 06 THÁNG 1 NĂM 2006","2006-01-06"
"23, THG 12 2011","2011-12-23"
"27 tháng 9 1973","1973-09-27"
"Ngày 29 tháng 05 năm 2017","2017-05-29"
"03, thg 9 2001","2001-09-03"
"06/12/2007","2007-12-06"
"Thứ Năm, ngày 13 tháng 6 năm 1974","1974-06-13"
"4 THG 2, 1984","1984-02-04"
"13 thg 1 1982","1982-01-13"
"tháng 11 19, 1985","1985-11-19"
"11 THG 11 1992","1992-11-11"
"16/05/1987","1987-05-16"
"25 02 03","2003-02-25"
"12 11 88","1988-11-12"
"3 05 98","1998-05-03"
"21/10/2000","2000-10-21"
"14 thg 11, 1986","1986-11-14"
"15 thg 10, 1995","1995-10-15"
"Thứ Năm, ngày 05 tháng 5 năm 1988","1988-05-05"
"tháng 4 16 2010","2010-04-16"
"27 03 12","2012-03-27"
"tháng 8 24 1980","1980-08-24"
"27 tháng 12 2012","2012-12-27"
"2 tháng 7, 1970","1970-07-02"
"11 05 81","1981-05-11"
"Ngày 10 tháng 12 năm 1997","1997-12-10"
"30 THÁNG 4, 2014","2014-04-30"
"08/12/1974","1974-12-08"
"11 thg 1, 1998","1998-01-11"
"25 11 99","1999-11-25"
"20 thg 2, 2012","2012-02-20"
"22 11 82","1982-11-22"
"16 thg 5 1983","1983-05-16"
"thứ bảy, ngày 11 tháng 12 năm 1982","1982-12-11"
"10 thg 9, 1976","1976-09-10"
"08/02/1998","1998-02-08"
"13 thg 7 1977","1977-07-13"
"4 tháng 11, 2017","2017-11-04"
"17 thg 4 1975","1975-04-17"
"25 thg 6 1988","1988-06-25"
"18 tháng 1 1994","1994-01-18"
"NGÀY 11 THÁNG 09 NĂM 1990","1990-09-11"
"Ngày 20 tháng 03 năm 2014","2014-03-20"
"30 THG 7 1984","1984-07-30"
"6 thg 9, 2004","2004-09-06"
"tháng 12 12, 1974","1974-12-12"
"22 04 71","1971-04-22"
"10 thg 7, 2004","2004-07-10"
"12, thg 8 2001","2001-08-12"
"tháng 4 21, 2016","2016-04-21"
"11/09/1976","1976-09-11"
"7 thg 6, 2010","2010-06-07"
"8 tháng 10 2010","2010-10-08"
"17 01 07","2007-01-17"
"29.03.82","1982-03-29"
"12 tháng 10, 2011","2011-10-12"
"28 THÁNG 9, 2016","2016-09-28"
"06 thg 4 2001","2001-04-06"
"19 tháng 5, 1987","1987-05-19"
"11/10/1982","1982-10-11"
"10 thg 3 1994","1994-03-10"
"22 thg 10, 2002","2002-10-22"
"15 thg 12, 1987","1987-12-15"
"23/10/1991","1991-10-23"
"2 thg 5, 1985","1985-05-02"
"3 thg 12, 1980","1980-12-03"
"thứ sáu, ngày 25 tháng 1 năm 1985","1985-01-25"
"10.11.92","1992-11-10"
"16/06/2012","2012-06-16"
"12 thg 12 2007","2007-12-12"
"tháng 11 7 2012","2012-11-07"
"8 thg 11, 2005","2005-11-08"
"tháng 12 12, 1989","1989-12-12"
"12 01 10","2010-01-12"
"08/02/1971","1971-02-08"
"30/11/2009","2009-11-30"
"7 thg 9, 1970","1970-09-07"
"17/03/1994","1994-03-17"
"09.05.97","1997-05-09"
"26 thg 8 2018","2018-08-26"
"23 09 86","1986-09-23"
"19 tháng 9 1985","1985-09-19"
"13.01.15","2015-01-13"
"4 tháng 6, 1996","1996-06-04"
"31 thg 12 1991","1991-12-31"
"16 tháng 3 2015","2015-03-16"
"10/10/1983","1983-10-10"
"24 thg 5, 1993","1993-05-24"
"tháng 2 17, 1973","1973-02-17"
"26 tháng 11, 1989","1989-11-26"
"24 thg 4, 1971","1971-04-24"
"28, thg 2 1979","1979-02-28"
"13 tháng 11, 1985","1985-11-13"
"9 12 85","1985-12-09"
"28/04/2000","2000-04-28"
"2 tháng 5 2015","2015-05-02"
"NGÀY 17 THÁNG 04 NĂM 1988","1988-04-17"
"31 tháng 3 1995","1995-03-31"
"5 thg 2 2013","2013-02-05"
"13 tháng 8 2014","2014-08-13"
"28 tháng 8, 2005","2005-08-28"
"16, thg 9 2000","2000-09-16"
"28 thg 8, 2003","2003-08-28"
"tháng 6 20, 2014","2014-06-20"
"18 thg 6, 1999","1999-06-18"
"5 thg 12 1973","1973-12-05"
"21 thg 3 1978","1978-03-21"
"02.04.87","1987-04-02"
"5 thg 12, 1996","1996-12-05"
"15 tháng 11, 2012","2012-11-15"
"05, thg 10 2000","2000-10-05"
"12 THG 2 2006","2006-02-12"
"THÁNG 5 8, 2017","2017-05-08"
"THỨ HAI, NGÀY 27 THÁNG 6 NĂM 1977","1977-06-27"
"10 THÁNG 11, 1999","1999-11-10"
"tháng 10 23, 2002","2002-10-23"
"25 thg 6, 2013","2013-06-25"
"29/10/1975","1975-10-29"
"Thứ Sáu, ngày 14 tháng 6 năm 2013","2013-06-14"
"19 11 71","1971-11-19"
"02.03.85","1985-03-02"
"NGÀY 09 THÁNG 12 NĂM 2008","2008-12-09"
"2 thg 3, 1979","1979-03-02"
"23 THG 1 1979","1979-01-23"
"25 THG 3, 2006","2006-03-25"
"24/07/1992","1992-07-24"
"23 THG 12, 1980","1980-12-23"
"02 thg 2 1975","1975-02-02"
"13 thg 4 1985","1985-04-13"
"18/03/1978","1978-03-18"
"12.12.03","2003-12-12"
"04.08.81","1981-08-04"
"2 tháng 7 2012","2012-07-02"
"THÁNG 12 13, 1986","1986-12-13"
"Ngày 26 tháng 01 năm 1996","1996-01-26"
"26/07/1997","1997-07-26"
"Thứ Bảy, ngày 27 tháng 11 năm 2010","2010-11-27"
"17 THG 6 1983","1983-06-17"
"8 tháng 3, 2016","2016-03-08"
"18 tháng 3 1984","1984-03-18"
"NGÀY 02 THÁNG 05 NĂM 2010","2010-05-02"
"07, THG 10 2005","2005-10-07"
"21 06 77","1977-06-21"
"tháng 7 14 1978","1978-07-14"
"21/08/2006","2006-08-21"
"5 thg 4 2017","2017-04-05"
"10 thg 5 1981","1981-05-10"
"14 THG 12, 2011","2011-12-14"
"3 THÁNG 5 1995","1995-05-03"
"6 12 11","2011-12-06"
"4 thg 2, 1994","1994-02-04"
"06, thg 5 2008","2008-05-06"
"27 thg 11 1978","1978-11-27"
"Thứ Tư, ngày 06 tháng 1 năm 2010","2010-01-06"
"6 thg 7 1993","1993-07-06"
"29 thg 8 1976","1976-08-29"
"17 06 17","2017-06-17"
"THỨ TƯ, NGÀY 19 THÁNG 2 NĂM 1975","1975-02-19"
"29 tháng 6 1975","1975-06-29"
"14 tháng 9, 1988","1988-09-14"
"Thứ Ba, ngày 10 tháng 10 năm 1995","1995-10-10"
"11 tháng 8, 1973","1973-08-11"
"16 tháng 9 2016","2016-09-16"
"20 THG 12 1990","1990-12-20"
"THÁNG 12 27 1991","1991-12-27"
"21, thg 5 1987","1987-05-21"
"9 07 06","2006-07-09"
"Chủ Nhật, ngày 22 tháng 10 năm 2006","2006-10-22"
"19 tháng 9 1985","1985-09-19"
"13/06/1993","1993-06-13"
"18 tháng 12 2015","2015-12-18"
"22 THÁNG 7, 2006","2006-07-22"
"15, THG 7 1978","1978-07-15"
"22 thg 11 1972","1972-11-22"
"10 09 03","2003-09-10"
"14 THG 12 2004","2004-12-14"
"05, thg 4 1991","1991-04-05"
"12 tháng 1 1992","1992-01-12"
"5 tháng 3, 2002","2002-03-05"
"12/12/1991","1991-12-12"
"1 tháng 8 2009","2009-08-01"
"27.03.82","1982-03-27"
"31 THÁNG 5 1975","1975-05-31"
"28/09/1982","1982-09-28"
"05.06.76","1976-06-05"
"6 07 12","2012-07-06"
"18/07/1992","1992-07-18"
"5 thg 11 2000","2000-11-05"
"05/07/2017","2017-07-05"
"tháng 1 10, 2001","2001-01-10"
"16 tháng 8 2006","2006-08-16"
"17 tháng 8 2009","2009-08-17"
"4 tháng 10 1989","1989-10-04"
"30/05/2009","2009-05-30"
"29 THÁNG 10 1973","1973-10-29"
"17 tháng 1 1985","1985-01-17"
"22 thg 12, 1984","1984-12-22"
"1 01 81","1981-01-01"
"04/02/2010","2010-02-04"
"05, THG 11 1972","1972-11-05"
"05 thg 7 2005","2005-07-05"
"ngày 29 tháng 03 năm 1978","1978-03-29"
"01, thg 1 1986","1986-01-01"
"18 tháng 5, 2016","2016-05-18"
"NGÀY 14 THÁNG 07 NĂM 2009","2009-07-14"
"tháng 11 7 1987","1987-11-07"
"6 tháng 7 1980","1980-07-06"
"7 thg 10 2002","2002-10-07"
"21 thg 9, 1997","1997-09-21"
"5 tháng 8 1987","1987-08-05"
"17, thg 2 1987","1987-02-17"
"18 THG 1 1989","1989-01-18"
"04, THG 7 1994","1994-07-04"
"11 04 78","1978-04-11"
"THÁNG 7 19 1970","1970-07-19"
"19 08 88","1988-08-19"
"6 tháng 11 2006","2006-11-06"
"17/10/1981","1981-10-17"
"15 thg 2 1992","1992-02-15"
"28 THÁNG 6 1987","1987-06-28"
"Ngày 08 tháng 01 năm 1984","1984-01-08"
"14 03 84","1984-03-14"
"1 THÁNG 12 1997","1997-12-01"
"16 thg 10 1982","1982-10-16"
"18 tháng 9, 1985","1985-09-18"
"8 tháng 3 1987","1987-03-08"
"Thứ Ba, ngày 02 tháng 7 năm 1991","1991-07-02"
"tháng 2 28, 1983","1983-02-28"
"21 thg 12 2016","2016-12-21"
"ngày 06 tháng 01 năm 1975","1975-01-06"
"20 THG 1 1984","1984-01-20"
"5 tháng 5 2014","2014-05-05"
"20 thg 1 2002","2002-01-20"
"Chủ Nhật, ngày 22 tháng 3 năm 2015","2015-03-22"
"22 tháng 5 2001","2001-05-22"
"tháng 2 26, 1984","1984-02-26"
"29 thg 12 2017","2017-12-29"
"25/05/2008","2008-05-25"
"18 04 79","1979-04-18"
"20.08.09","2009-08-20"
"Thứ Bảy, ngày 09 tháng 8 năm 2014","2014-08-09"
"12 06 12","2012-06-12"
"12 10 88","1988-10-12"
"7 05 18","2018-05-07"
"24 thg 4, 1993","1993-04-24"
"11 tháng 1, 1981","1981-01-11"
"17, THG 12 1986","1986-12-17"
"Ngày 31 tháng 05 năm 2000","2000-05-31"
"27, thg 2 1978","1978-02-27"
"9 tháng 3 1978","1978-03-09"
"6 tháng 12, 1972","1972-12-06"
"30 THG 12 1972","1972-12-30"
"8 thg 9, 1987","1987-09-08"
"tháng 3 27, 2009","2009-03-27"
"24 thg 5, 1993","1993-05-24"
"THÁNG 11 26 2010","2010-11-26"
"tháng 1 4, 2013","2013-01-04"
"13 tháng 4 1984","1984-04-13"
"19 06 16","2016-06-19"
"Thứ Hai, ngày 28 tháng 10 năm 1985","1985-10-28"
"28 THÁNG 6 1971","1971-06-28"
"21/11/1996","1996-11-21"
"CHỦ NHẬT, NGÀY 17 THÁNG 5 NĂM 1970","1970-05-17"
"tháng 1 23, 1991","1991-01-23"
"1 12 78","1978-12-01"
"15/03/1995","1995-03-15"
"24 tháng 12 2005","2005-12-24"
"24.06.01","2001-06-24"
"27 thg 9 2013","2013-09-27"
"10, thg 9 1979","1979-09-10"
"07.01.73","1973-01-07"
"THÁNG 3 8 1991","1991-03-08"
"NGÀY 20 THÁNG 12 NĂM 1987","1987-12-20"
"23 thg 1, 2017","2017-01-23"
"2 tháng 5 2012","2012-05-02"
"5 THÁNG 3, 2008","2008-03-05"
"3 01 70","1970-01-03"
"THỨ TƯ, NGÀY 21 THÁNG 1 NĂM 1981","1981-01-21"
"14, thg 1 1992","1992-01-14"
"6 thg 4 1991","1991-04-06"
"20 thg 4, 2001","2001-04-20"
"13/01/1979","1979-01-13"
"03/05/1973","1973-05-03"
"17 thg 1, 1984","1984-01-17"
"12 THG 8 2006","2006-08-12"
"02/10/1981","1981-10-02"
"17, thg 12 1997","1997-12-17"
"29 thg 8, 1979","1979-08-29"
"02.02.74","1974-02-02"
"29, thg 9 1975","1975-09-29"
"02, thg 7 1995","1995-07-02"
"20, thg 12 2004","2004-12-20"
"1 tháng 12 2012","2012-12-01"
"tháng 2 17, 1994","1994-02-17"
"30.03.77","1977-03-30"
"26 02 97","1997-02-26"
"07 THG 9 1974","1974-09-07"
"20 tháng 4 2015","2015-04-20"
"thứ ba, ngày 24 tháng 7 năm 2012","2012-07-24"
"8 tháng 3 1987","1987-03-08"
"31 thg 1 1996","1996-01-31"
"14.06.84","1984-06-14"
"07 thg 12 1976","1976-12-07"
"24 tháng 12, 1986","1986-12-24"
"22 THÁNG 8, 2007","2007-08-22"
"06/01/2003","2003-01-06"
"23 tháng 1, 2010","2010-01-23"
"THÁNG 2 4, 1978","1978-02-04"
"14.11.88","1988-11-14"
"2 tháng 5 1989","1989-05-02"
"7 05 82","1982-05-07"
"thứ ba, ngày 05 tháng 3 năm 1996","1996-03-05"
"24 tháng 4, 1987","1987-04-24"
"tháng 9 12 1978","1978-09-12"
"ngày 09 tháng 05 năm 1970","1970-05-09"
"21 THÁNG 5 1971","1971-05-21"
"THÁNG 3 10, 1986","1986-03-10"
"THÁNG 8 24 1996","1996-08-24"
"Ngày 14 tháng 02 năm 1995","1995-02-14"
"17/01/1999","1999-01-17"
"7 thg 8 2018","2018-08-07"
"Ngày 19 tháng 08 năm 2007","2007-08-19"
"21 thg 11 1990","1990-11-21"
"19 tháng 1, 1990","1990-01-19"
"16 tháng 9 1989","1989-09-16"
"16 thg 2, 2007","2007-02-16"
"7 tháng 11 1977","1977-11-07"
"28/08/1979","1979-08-28"
"Thứ Bảy, ngày 28 tháng 8 năm 1993","1993-08-28"
"07/07/2010","2010-07-07"
"27 tháng 3 2015","2015-03-27"
"9 thg 10 1976","1976-10-09"
"3 02 92","1992-02-03"
"tháng 2 14, 1974","1974-02-14"
"THÁNG 8 7, 1971","1971-08-07"
"16.02.05","2005-02-16"
"29.05.92","1992-05-29"
"Ngày 24 tháng 06 năm 1989","1989-06-24"
"21 thg 10, 2011","2011-10-21"
"25 02 86","1986-02-25"
"7 thg 6, 1985","1985-06-07"
"25 thg 11, 2007","2007-11-25"
"23 thg 9, 1980","1980-09-23"
"6 tháng 4 1987","1987-04-06"
"Thứ Bảy, ngày 10 tháng 11 năm 2012","2012-11-10"
"13 tháng 1 1986","1986-01-13"
"ngày 02 tháng 10 năm 1970","1970-10-02"
"tháng 10 3, 1983","1983-10-03"
"11 tháng 5 1989","1989-05-11"
"14 thg 2 2009","2009-02-14"
"29 thg 9 2000","2000-09-29"
"thứ hai, ngày 31 tháng 10 năm 1994","1994-10-31"
"25 tháng 7 2017","2017-07-25"
"26 11 86","1986-11-26"
"09 thg 11 1972","1972-11-09"
"29 THÁNG 6 1971","1971-06-29"
"24 thg 7, 1994","1994-07-24"
"31/10/1992","1992-10-31"
"28 tháng 9 1991","1991-09-28"
"16, thg 1 1971","1971-01-16"
"THÁNG 10 2, 2001","2001-10-02"
"16, thg 2 1983","1983-02-16"
"20 thg 8, 1973","1973-08-20"
"21, thg 8 2000","2000-08-21"
"22 THG 6 2012","2012-06-22"
"27 thg 3, 2017","2017-03-27"
"30 thg 11, 1989","1989-11-30"
"21/03/2007","2007-03-21"
"15/03/2002","2002-03-15"
"9 thg 10, 2000","2000-10-09"
"Thứ Tư, ngày 08 tháng 10 năm 1997","1997-10-08"
"21 thg 2, 1994","1994-02-21"
"tháng 9 16, 2012","2012-09-16"
"THÁNG 12 7, 2013","2013-12-07"
"25/12/1991","1991-12-25"
"ngày 18 tháng 05 năm 1994","1994-05-18"
"5 thg 3, 2007","2007-03-05"
"10, thg 1 1975","1975-01-10"
"18 thg 3 2014","2014-03-18"
"15 thg 2 2016","2016-02-15"
"tháng 10 9, 1971","1971-10-09"
"12, THG 1 2002","2002-01-12"
"31 THG 5 2007","2007-05-31"
"23 thg 11, 1986","1986-11-23"
"5 thg 11 1988","1988-11-05"
"CHỦ NHẬT, NGÀY 07 THÁNG 1 NĂM 2007","2007-01-07"
"13 thg 7 1994","1994-07-13"
"6 05 74","1974-05-06"
"5 06 01","2001-06-05"
"Thứ Bảy, ngày 27 tháng 6 năm 1998","1998-06-27"
"ngày 06 tháng 10 năm 2013","2013-10-06"
"15 thg 10 1971","1971-10-15"
"03, thg 1 2000","2000-01-03"
"21 thg 6 1990","1990-06-21"
"07/06/2004","2004-06-07"
"thứ tư, ngày 04 tháng 3 năm 2009","2009-03-04"
"14 tháng 3 1984","1984-03-14"
"28 thg 3 1988","1988-03-28"
"28 THG 1, 2008","2008-01-28"
"31 thg 8, 1971","1971-08-31"
"7 thg 6 1986","1986-06-07"
"30 THÁNG 6 1984","1984-06-30"
"22/11/2000","2000-11-22"
"Chủ Nhật, ngày 09 tháng 9 năm 1984","1984-09-09"
"7 tháng 2, 1979","1979-02-07"
"14 thg 11 2005","2005-11-14"
"Thứ Năm, ngày 27 tháng 7 năm 2017","2017-07-27"
"11 THÁNG 3 1975","1975-03-11"
"13 tháng 4 1987","1987-04-13"
"Ngày 01 tháng 02 năm 2005","2005-02-01"
"9 thg 8, 1988","1988-08-09"
"Ngày 15 tháng 05 năm 2010","2010-05-15"
"19 06 74","1974-06-19"
"Ngày 05 tháng 10 năm 2002","2002-10-05"
"tháng 2 18 1993","1993-02-18"
"02, thg 11 1992","1992-11-02"
"THỨ BẢY, NGÀY 08 THÁNG 9 NĂM 1990","1990-09-08"
"tháng 2 6, 2014","2014-02-06"
"NGÀY 11 THÁNG 02 NĂM 2001","2001-02-11"
"16.08.98","1998-08-16"
"24 thg 6, 1980","1980-06-24"
"20 thg 10 2009","2009-10-20"
"ngày 17 tháng 04 năm 1987","1987-04-17"
"18/02/1973","1973-02-18"
"Chủ Nhật, ngày 27 tháng 4 năm 1980","1980-04-27"
"10 tháng 1, 2007","2007-01-10"
"2 tháng 10 1973","1973-10-02"
"Ngày 10 tháng 11 năm 1994","1994-11-10"
"17.01.78","1978-01-17"
"2 THÁNG 7 1972","1972-07-02"
"13 THG 11, 1995","1995-11-13"
"4 thg 12 1991","1991-12-04"
"thứ ba, ngày 04 tháng 1 năm 2000","2000-01-04"
"09, THG 10 2007","2007-10-09"
"22 tháng 11, 2007","2007-11-22"
"5 thg 7, 1970","1970-07-05"
"8 THÁNG 8, 1979","1979-08-08"
"14 thg 7 1983","1983-07-14"
"18/11/2001","2001-11-18"
"3 tháng 12 2012","2012-12-03"
"8 tháng 11 1973","1973-11-08"
"04.06.03","2003-06-04"
"20 thg 11 2013","2013-11-20"
"22 THG 7, 1986","1986-07-22"
"22 thg 11 1984","1984-11-22"
"11.03.92","1992-03-11"
"9 THG 5 2017","2017-05-09"
"14 thg 3 1992","1992-03-14"
"16 THG 7 1986","1986-07-16"
"17, thg 6 2004","2004-06-17"
"5 THG 2, 1970","1970-02-05"
"26 thg 8, 2016","2016-08-26"
"4 THÁNG 1, 2010","2010-01-04"
"17, THG 2 1999","1999-02-17"
"2 tháng 12 2017","2017-12-02"
"6 THÁNG 4, 1997","1997-04-06"
"20 thg 9, 1984","1984-09-20"
"20 thg 6 1988","1988-06-20"
"5 tháng 4 1983","1983-04-05"
"Thứ Năm, ngày 01 tháng 1 năm 1987","1987-01-01"
"25/08/2018","2018-08-25"
"24/07/1986","1986-07-24"
"13.12.73","1973-12-13"
"thứ ba, ngày 13 tháng 1 năm 2004","2004-01-13"
"24 thg 10 1973","1973-10-24"
"NGÀY 08 THÁNG 11 NĂM 2002","2002-11-08"
"1 01 14","2014-01-01"
"tháng 10 31 1992","1992-10-31"
"thứ bảy, ngày 11 tháng 7 năm 1970","1970-07-11"
"29/09/1995","1995-09-29"
"17 03 93","1993-03-17"
"26 tháng 3 2015","2015-03-26"
"11 tháng 11, 1995","1995-11-11"
"Ngày 01 tháng 07 năm 1985","1985-07-01"
"tháng 1 25, 1979","1979-01-25"
"07 thg 10 2018","2018-10-07"
"05, THG 1 1981","1981-01-05"
"tháng 8 31, 1994","1994-08-31"
"5 thg 1 2005","2005-01-05"
"21.02.86","1986-02-21"
"8 tháng 7 1981","1981-07-08"
"ngày 03 tháng 01 năm 1975","1975-01-03"
"26, thg 8 2002","2002-08-26"
"NGÀY 07 THÁNG 04 NĂM 2016","2016-04-07"
"10.12.88","1988-12-10"
"18 thg 9 1999","1999-09-18"
"24 thg 3, 2001","2001-03-24"
"Thứ Năm, ngày 19 tháng 12 năm 1996","1996-12-19"
"THỨ TƯ, NGÀY 23 THÁNG 5 NĂM 1973","1973-05-23"
"tháng 11 6 1993","1993-11-06"
"24, thg 3 2004","2004-03-24"
"19/07/1980","1980-07-19"
"02/08/1973","1973-08-02"
"19 tháng 10 1998","1998-10-19"
"14 tháng 12, 2001","2001-12-14"
"10 thg 1, 1996","1996-01-10"
"06/08/2011","2011-08-06"
"tháng 9 21, 1974","1974-09-21"
"Ngày 19 tháng 12 năm 2000","2000-12-19"
"03.04.10","2010-04-03"
"tháng 2 10 2000","2000-02-10"
"19 thg 12 1975","1975-12-19"
"04, thg 8 2006","2006-08-04"
"24 thg 12, 1990","1990-12-24"
"9 tháng 1, 1997","1997-01-09"
"5 04 73","1973-04-05"
"22 tháng 8 1999","1999-08-22"
"13 tháng 12 2015","2015-12-13"
"23 tháng 1, 1976","1976-01-23"
"18.02.78","1978-02-18"
"15 THÁNG 5 1980","1980-05-15"
"08, thg 1 1976","1976-01-08"
"13, THG 2 2007","2007-02-13"
"15 03 73","1973-03-15"
"30 tháng 4 1989","1989-04-30"
"Chủ Nhật, ngày 14 tháng 8 năm 2005","2005-08-14"
"tháng 4 14, 1975","1975-04-14"
"thứ sáu, ngày 27 tháng 1 năm 2006","2006-01-27"
"4 tháng 12 1998","1998-12-04"
"8 thg 9 1983","1983-09-08"
"22 thg 8, 2003","2003-08-22"
"21 thg 2, 2007","2007-02-21"
"Thứ Ba, ngày 28 tháng 2 năm 1995","1995-02-28"
"10/12/1995","1995-12-10"
"Chủ Nhật, ngày 05 tháng 3 năm 1978","1978-03-05"
"25 thg 6 2009","2009-06-25"
"01, thg 4 2013","2013-04-01"
"16 THG 6, 1999","1999-06-16"
"17.02.15","2015-02-17"
"26 thg 3 1992","1992-03-26"
"ngày 01 tháng 09 năm 2016","2016-09-01"
"29 tháng 1, 1996","1996-01-29"
"21/11/2016","2016-11-21"
"Ngày 30 tháng 10 năm 2014","2014-10-30"
"tháng 8 4 2002","2002-08-04"
"02.12.76","1976-12-02"
"13 tháng 7 1976","1976-07-13"
"tháng 8 20 1993","1993-08-20"
"11 THG 10 1998","1998-10-11"
"17 THÁNG 1 2009","2009-01-17"
"07, thg 11 2007","2007-11-07"
"18 thg 11 2010","2010-11-18"
"chủ nhật, ngày 14 tháng 10 năm 1979","1979-10-14"
"9 THÁNG 3 2016","2016-03-09"
"11 THG 4 1994","1994-04-11"
"16.10.82","1982-10-16"
"21 tháng 6 1978","1978-06-21"
"21 THG 12, 2011","2011-12-21"
"26 THG 12 1990","1990-12-26"
"7 THG 5, 2017","2017-05-07"
"THÁNG 12 15, 1992","1992-12-15"
"tháng 1 29 2016","2016-01-29"
"05.07.80","1980-07-05"
"30 THG 1, 1971","1971-01-30"
"20/09/2004","2004-09-20"
"03.07.09","2009-07-03"
"25/10/1977","1977-10-25"
"25 thg 12 2008","2008-12-25"
"16 09 02","2002-09-16"
"16/05/1981","1981-05-16"
"24 thg 9, 1980","1980-09-24"
"17 tháng 9 2017","2017-09-17"
"30 thg 4 1988","1988-04-30"
"29 tháng 9, 1975","1975-09-29"
"16.01.02","2002-01-16"
"02/10/1999","1999-10-02"
"27 tháng 9 2012","2012-09-27"
"THÁNG 5 2 2011","2011-05-02"
"14 tháng 6, 1987","1987-06-14"
"14 THÁNG 9 1976","1976-09-14"
"7 THÁNG 12 2002","2002-12-07"
"Ngày 06 tháng 06 năm 2014","2014-06-06"
"15 thg 7 1982","1982-07-15"
"25 thg 10, 1999","1999-10-25"
"23 THG 10, 1987","1987-10-23"
"22/01/1988","1988-01-22"
"31 thg 1 1982","1982-01-31"
"01, THG 1 2008","2008-01-01"
"6 tháng 8, 2005","2005-08-06"
"26 tháng 5 1989","1989-05-26"
"thứ ba, ngày 03 tháng 5 năm 1988","1988-05-03"
"NGÀY 16 THÁNG 03 NĂM 2011","2011-03-16"
"tháng 12 7, 1985","1985-12-07"
"THÁNG 4 18, 1982","1982-04-18"
"28 tháng 5, 2008","2008-05-28"
"17 thg 3, 1973","1973-03-17"
"30, thg 7 1992","1992-07-30"
"11/12/1996","1996-12-11"
"5 thg 10, 1982","1982-10-05"
"22/06/2014","2014-06-22"
"5 12 89","1989-12-05"
"30 tháng 3 1996","1996-03-30"
"03 THG 6 1997","1997-06-03"
"21, thg 11 1985","1985-11-21"
"14 thg 3 1985","1985-03-14"
"Ngày 05 tháng 10 năm 1997","1997-10-05"
"tháng 3 28, 2000","2000-03-28"
"THỨ BẢY, NGÀY 03 THÁNG 5 NĂM 2003","2003-05-03"
"Thứ Năm, ngày 08 tháng 4 năm 2004","2004-04-08"
"16 THG 1, 1996","1996-01-16"
"NGÀY 13 THÁNG 07 NĂM 1988","1988-07-13"
"27, THG 2 1993","1993-02-27"
"tháng 2 28, 2010","2010-02-28"
"09/05/1972","1972-05-09"
"9 01 93","1993-01-09"
"31 08 91","1991-08-31"
"27 THG 6 2017","2017-06-27"
"13, thg 3 2011","2011-03-13"
"15 thg 3, 1977","1977-03-15"
"18 tháng 12 1971","1971-12-18"
"06 thg 6 1979","1979-06-06"
"20/01/2005","2005-01-20"
"ngày 02 tháng 01 năm 1996","1996-01-02"
"16 tháng 7 2002","2002-07-16"
"tháng 12 1 2002","2002-12-01"
"09 thg 2 2013","2013-02-09"
"19 thg 10, 2009","2009-10-19"
"tháng 7 25, 2002","2002-07-25"
"8 tháng 11 1973","1973-11-08"
"10 THÁNG 12 1981","1981-12-10"
"ngày 06 tháng 11 năm 2013","2013-11-06"
"1 THÁNG 6 2002","2002-06-01"
"THÁNG 8 23, 2018","2018-08-23"
"11 tháng 12, 2014","2014-12-11"
"27 tháng 11 1970","1970-11-27"
"22 tháng 10 1994","1994-10-22"
"22 THÁNG 11 1991","1991-11-22"
"THÁNG 5 4, 1990","1990-05-04"
"25 02 05","2005-02-25"
"13 tháng 11 1975","1975-11-13"
"14 thg 10, 1970","1970-10-14"
"2 THG 11 1980","1980-11-02"
"THỨ HAI, NGÀY 25 THÁNG 12 NĂM 1995","1995-12-25"
"15 THÁNG 9, 1986","1986-09-15"
"26 thg 9 1984","1984-09-26"
"04 thg 9 2007","2007-09-04"
"24, THG 5 1988","1988-05-24"
"29, THG 8 2014","2014-08-29"
"24, thg 11 1988","1988-11-24"
"25, thg 5 2015","2015-05-25"
"26 tháng 3, 1996","1996-03-26"
"20 thg 11 2012","2012-11-20"
"Thứ Sáu, ngày 29 tháng 1 năm 1993","1993-01-29"
"1 tháng 5 1981","1981-05-01"
"7 06 86","1986-06-07"
"ngày 27 tháng 04 năm 1979","1979-04-27"
"ngày 10 tháng 02 năm 2012","2012-02-10"
"12/04/2010","2010-04-12"
"23 THG 11 1985","1985-11-23"
"28.10.90","1990-10-28"
"12 thg 2, 2002","2002-02-12"
"17 03 95","1995-03-17"
"12 thg 10, 2010","2010-10-12"
"12 thg 11, 2006","2006-11-12"
"Thứ Năm, ngày 04 tháng 6 năm 1992","1992-06-04"
"27 thg 12 1996","1996-12-27"
"01/04/1998","1998-04-01"
"tháng 7 5, 1982","1982-07-05"
"17 tháng 7, 1971","1971-07-17"
"9 THG 12 1989","1989-12-09"
"31 01 14","2014-01-31"
"16.05.74","1974-05-16"
"tháng 7 31, 2011","2011-07-31"
"25/12/1971","1971-12-25"
"20 07 76","1976-07-20"
"28 tháng 2 1986","1986-02-28"
"9 tháng 10 1991","1991-10-09"
"06/05/1990","1990-05-06"
"tháng 10 25 1990","1990-10-25"
"22 tháng 1, 2012","2012-01-22"
"28 THG 11, 1973","1973-11-28"
"25 tháng 6 1999","1999-06-25"
"THÁNG 7 29, 2001","2001-07-29"
"17 THÁNG 9 2004","2004-09-17"
"11/08/1977","1977-08-11"
"27, thg 10 2005","2005-10-27"
"tháng 9 22, 2001","2001-09-22"
"26 tháng 7 2016","2016-07-26"
"17 tháng 6 1987","1987-06-17"
"30/06/2006","2006-06-30"
"20.02.93","1993-02-20"
"NGÀY 27 THÁNG 11 NĂM 1990","1990-11-27"
"tháng 3 11 1987","1987-03-11"
"tháng 9 12 1980","1980-09-12"
"12 tháng 6 1979","1979-06-12"
"15 thg 1, 2004","2004-01-15"
"16, thg 1 1970","1970-01-16"
"18.05.18","2018-05-18"
"tháng 4 2, 2009","2009-04-02"
"09, thg 10 2004","2004-10-09"
"tháng 6 17 2011","2011-06-17"
"05/02/1991","1991-02-05"
"11 thg 9 1992","1992-09-11"
"tháng 10 11 2016","2016-10-11"
"17 thg 2 1972","1972-02-17"
"31 tháng 7 2006","2006-07-31"
"13 tháng 10, 2008","2008-10-13"
"18 THG 4, 2008","2008-04-18"
"ngày 02 tháng 03 năm 1986","1986-03-02"
"THỨ SÁU, NGÀY 21 THÁNG 3 NĂM 1975","1975-03-21"
"17.05.87","1987-05-17"
"4 thg 2, 2001","2001-02-04"
"27.01.04","2004-01-27"
"16 THÁNG 7 1998","1998-07-16"
"13 tháng 3 1990","1990-03-13"
"17 tháng 5, 1972","1972-05-17"
"Ngày 25 tháng 03 năm 1984","1984-03-25"
"ngày 29 tháng 09 năm 1998","1998-09-29"
"12 09 87","1987-09-12"
"30 thg 12 2002","2002-12-30"
"4 thg 5 1992","1992-05-04"
"26, thg 9 1973","1973-09-26"
"22 thg 10, 1996","1996-10-22"
"01, thg 8 1974","1974-08-01"
"24.03.97","1997-03-24"
"NGÀY 24 THÁNG 07 NĂM 2006","2006-07-24"
"31 thg 3 1989","1989-03-31"
"tháng 7 13 1995","1995-07-13"
"NGÀY 07 THÁNG 07 NĂM 1998","1998-07-07"
"Ngày 12 tháng 01 năm 1979","1979-01-12"
"3 tháng 1, 2000","2000-01-03"
"15/08/1978","1978-08-15"
"25 tháng 7 2015","2015-07-25"
"03, thg 3 1985","1985-03-03"
"18 thg 11, 2003","2003-11-18"
"tháng 2 1, 2018","2018-02-01"
"16 tháng 3 1979","1979-03-16"
"10, thg 5 2011","2011-05-10"
"THÁNG 11 21, 2014","2014-11-21"
"30 THG 4, 1977","1977-04-30"
"THỨ BẢY, NGÀY 27 THÁNG 10 NĂM 1973","1973-10-27"
"29 tháng 12, 2007","2007-12-29"
"16 thg 2 1986","1986-02-16"
"25.10.79","1979-10-25"
"24 tháng 4 2003","2003-04-24"
"25 THG 2 1984","1984-02-25"
"23 THÁNG 9, 1999","1999-09-23"
"28 thg 3, 2010","2010-03-28"
"20.05.76","1976-05-20"
"tháng 7 8 1971","1971-07-08"
"Ngày 10 tháng 06 năm 1974","1974-06-10"
"14.11.07","2007-11-14"
"THÁNG 5 6 2009","2009-05-06"
"2 tháng 7, 1978","1978-07-02"
"5 04 90","1990-04-05"
"tháng 4 12, 2008","2008-04-12"
"17.03.07","2007-03-17"
"29/09/1988","1988-09-29"
"ngày 13 tháng 10 năm 2009","2009-10-13"
"tháng 1 23, 1991","1991-01-23"
"05/08/2016","2016-08-05"
"04/04/1981","1981-04-04"
"tháng 5 9 1996","1996-05-09"
"tháng 5 26 2017","2017-05-26"
"THÁNG 9 22 1979","1979-09-22"
"19 tháng 8 2004","2004-08-19"
"9 tháng 12 1984","1984-12-09"
"Thứ Hai, ngày 09 tháng 10 năm 1972","1972-10-09"
"15 tháng 8 1977","1977-08-15"
"18.09.93","1993-09-18"
"11 THG 2, 1977","1977-02-11"
"05 THG 8 1972","1972-08-05"
"8 tháng 3, 2013","2013-03-08"
"11 tháng 9, 1980","1980-09-11"
"22/05/2000","2000-05-22"
"21.05.05","2005-05-21"
"NGÀY 03 THÁNG 02 NĂM 1987","1987-02-03"
"28 thg 12, 2009","2009-12-28"
"tháng 6 30 1973","1973-06-30"
"21, thg 4 1984","1984-04-21"
"6 tháng 3 2010","2010-03-06"
"5 thg 9, 2011","2011-09-05"
"02 thg 7 1989","1989-07-02"
"Ngày 15 tháng 05 năm 2003","2003-05-15"
"16.06.92","1992-06-16"
"15 thg 10 1976","1976-10-15"
"24 THG 7, 2009","2009-07-24"
"9 THÁNG 5 2007","2007-05-09"
"NGÀY 09 THÁNG 08 NĂM 1995","1995-08-09"
"24/08/1975","1975-08-24"
"19 thg 1 2018","2018-01-19"
"22 tháng 5 1978","1978-05-22"
"tháng 11 8 1971","1971-11-08"
"27 thg 3 1988","1988-03-27"
"2 thg 9 2013","2013-09-02"
"19.12.06","2006-12-19"
"12 thg 6, 2008","2008-06-12"
"27 thg 12 2018","2018-12-27"
"03 THG 2 2015","2015-02-03"
"tháng 9 19, 1980","1980-09-19"
"30 THÁNG 9, 1998","1998-09-30"
"THÁNG 9 12 2008","2008-09-12"
"3 THG 4, 1978","1978-04-03"
"6 tháng 5 1993","1993-05-06"
"8 tháng 6 1978","1978-06-08"
"18 tháng 5 2015","2015-05-18"
"Ngày 02 tháng 10 năm 1984","1984-10-02"
"24, THG 3 2002","2002-03-24"
"02, thg 8 2011","2011-08-02"
"Thứ Ba, ngày 29 tháng 12 năm 1992","1992-12-29"
"31, THG 3 1981","1981-03-31"
"tháng 11 17, 1997","1997-11-17"
"09, thg 12 1990","1990-12-09"
"28 thg 11 2012","2012-11-28"
"19 THÁNG 7, 2008","2008-07-19"
"4 THG 10, 1995","1995-10-04"
"tháng 7 22 1981","1981-07-22"
"ngày 04 tháng 01 năm 2003","2003-01-04"
"5 tháng 2, 2014","2014-02-05"
"14, thg 2 2003","2003-02-14"
"3 12 18","2018-12-03"
"Ngày 21 tháng 11 năm 1999","1999-11-21"
"16 THG 12, 2017","2017-12-16"
"14/10/1979","1979-10-14"
"30 thg 5 1979","1979-05-30"
"30 THG 9 1994","1994-09-30"
"29 thg 1 1978","1978-01-29"
"15 THG 3 1976","1976-03-15"
"24 tháng 6 1979","1979-06-24"
"24 THÁNG 10 1984","1984-10-24"
"17 04 74","1974-04-17"
"12.01.91","1991-01-12"
"Ngày 28 tháng 06 năm 1975","1975-06-28"
"Thứ Sáu, ngày 18 tháng 3 năm 1977","1977-03-18"
"25/12/2018","2018-12-25"
"31 thg 10 2015","2015-10-31"
"17 thg 5, 1999","1999-05-17"
"01/03/1981","1981-03-01"
"Ngày 14 tháng 02 năm 1971","1971-02-14"
"16 thg 3 1993","1993-03-16"
"17 tháng 3, 2009","2009-03-17"
"NGÀY 18 THÁNG 11 NĂM 1984","1984-11-18"
"23.08.18","2018-08-23"
"21 THG 2 2000","2000-02-21"
"28 THG 10, 1984","1984-10-28"
"13 thg 6, 1989","1989-06-13"
"26 thg 10 2004","2004-10-26"
"Thứ Năm, ngày 13 tháng 3 năm 2003","2003-03-13"
"28 THÁNG 1 2018","2018-01-28"
"16 THG 2, 1998","1998-02-16"
"01 thg 10 2013","2013-10-01"
"tháng 7 24 2002","2002-07-24"
"13 01 85","1985-01-13"
"tháng 6 28 1973","1973-06-28"
"THỨ HAI, NGÀY 30 THÁNG 6 NĂM 1980","1980-06-30"
"20, thg 4 2014","2014-04-20"
"20 tháng 11 2001","2001-11-20"
"29 THG 7 2014","2014-07-29"
"Ngày 06 tháng 12 năm 2002","2002-12-06"
"07/03/2017","2017-03-07"
"17 thg 7, 1970","1970-07-17"
"28 THÁNG 5 1973","1973-05-28"
"21/07/2007","2007-07-21"
"tháng 7 25, 2018","2018-07-25"
"tháng 10 4, 1980","1980-10-04"
"8 thg 2, 2001","2001-02-08"
"THÁNG 9 25 1989","1989-09-25"
"11 tháng 3, 1975","1975-03-11"
"12 thg 1 1984","1984-01-12"
"7 tháng 8 1970","1970-08-07"
"30 tháng 7 1997","1997-07-30"
"Chủ Nhật, ngày 22 tháng 1 năm 1995","1995-01-22"
"01, thg 3 1989","1989-03-01"
"THÁNG 4 16, 1992","1992-04-16"
"tháng 3 21, 1997","1997-03-21"
"30 tháng 3 1983","1983-03-30"
"Thứ Hai, ngày 01 tháng 10 năm 2018","2018-10-01"
"12/08/1980","1980-08-12"
"7 tháng 8, 1983","1983-08-07"
"24 thg 1 1976","1976-01-24"
"21 THG 4 1980","1980-04-21"
"27/01/2014","2014-01-27"
"5 tháng 5 1990","1990-05-05"
"08 THG 6 1982","1982-06-08"
"THÁNG 1 26, 1987","1987-01-26"
"29 thg 6 1997","1997-06-29"
"22 thg 2 1984","1984-02-22"
"31.10.79","1979-10-31"
"11 thg 4 2004","2004-04-11"
"2 thg 11, 1994","1994-11-02"
"08.03.01","2001-03-08"
"15 THÁNG 6, 1991","1991-06-15"
"tháng 10 13, 1988","1988-10-13"
"09/07/1982","1982-07-09"
"26 tháng 3 1975","1975-03-26"
"22 thg 1, 2015","2015-01-22"
"24 THG 6 2008","2008-06-24"
"5 thg 4, 2003","2003-04-05"
"4 09 90","1990-09-04"
"31 05 18","2018-05-31"
"tháng 7 26, 1993","1993-07-26"
"1 tháng 10, 1984","1984-10-01"
"tháng 7 21 1989","1989-07-21"
"2 thg 7 1972","1972-07-02"
"21 tháng 7 2011","2011-07-21"
"tháng 6 14, 2014","2014-06-14"
"21 thg 8, 1973","1973-08-21"
"11 tháng 12 1987","1987-12-11"
"18 tháng 6 2003","2003-06-18"
"05, THG 9 1974","1974-09-05"
"30 thg 12, 2018","2018-12-30"
"NGÀY 07 THÁNG 10 NĂM 1986","1986-10-07"
"4 thg 11 1978","1978-11-04"
"29 thg 3, 1997","1997-03-29"
"THÁNG 1 16 2008","2008-01-16"
"tháng 2 22, 1986","1986-02-22"
"27, thg 9 2018","2018-09-27"
"07, thg 9 1984","1984-09-07"
"11 thg 2, 2017","2017-02-11"
"Ngày 19 tháng 09 năm 2000","2000-09-19"
"15/06/2013","2013-06-15"
"8 tháng 2 1977","1977-02-08"
"8 tháng 9 1981","1981-09-08"
"03/06/2017","2017-06-03"
"11 03 90","1990-03-11"
"tháng 1 5, 1975","1975-01-05"
"Ngày 05 tháng 03 năm 2001","2001-03-05"
"30 tháng 3 1978","1978-03-30"
"26 thg 6 1989","1989-06-26"
"3 12 09","2009-12-03"
"16, thg 6 2010","2010-06-16"
"2 03 07","2007-03-02"
"NGÀY 14 THÁNG 07 NĂM 1981","1981-07-14"
"Chủ Nhật, ngày 07 tháng 3 năm 1999","1999-03-07"
"thứ hai, ngày 17 tháng 11 năm 2014","2014-11-17"
"12 thg 2 1971","1971-02-12"
"4 tháng 9 1995","1995-09-04"
"27 thg 12, 2010","2010-12-27"
"25 thg 3, 1995","1995-03-25"
"17/02/1990","1990-02-17"
"tháng 10 14 2006","2006-10-14"
"16 thg 6 1975","1975-06-16"
"19/01/1985","1985-01-19"
"THÁNG 8 3, 1996","1996-08-03"
"12.09.92","1992-09-12"
"07.11.75","1975-11-07"
"30 thg 8, 2007","2007-08-30"
"tháng 9 8 2003","2003-09-08"
"6 thg 7 2003","2003-07-06"
"17 tháng 8, 1981","1981-08-17"
"10.02.77","1977-02-10"
"tháng 7 18, 1974","1974-07-18"
"2 tháng 11 1998","1998-11-02"
"4 tháng 7, 1985","1985-07-04"
"06 thg 3 2015","2015-03-06"
"tháng 4 21 2000","2000-04-21"
"NGÀY 10 THÁNG 05 NĂM 2004","2004-05-10"
"ngày 22 tháng 07 năm 2011","2011-07-22"
"12.04.86","1986-04-12"
"THÁNG 3 3 1987","1987-03-03"
"NGÀY 02 THÁNG 10 NĂM 2012","2012-10-02"
"07, THG 7 1990","1990-07-07"
"9 thg 9, 2016","2016-09-09"
"23 THG 11 2003","2003-11-23"
"Thứ Sáu, ngày 19 tháng 10 năm 2001","2001-10-19"
"Ngày 31 tháng 10 năm 2004","2004-10-31"
"27 thg 10, 1994","1994-10-27"
"Thứ Tư, ngày 26 tháng 2 năm 1997","1997-02-26"
"13 thg 6 2011","2011-06-13"
"THỨ SÁU, NGÀY 09 THÁNG 1 NĂM 1998","1998-01-09"
"ngày 04 tháng 08 năm 1997","1997-08-04"
"5 tháng 7 1971","1971-07-05"
"11.09.15","2015-09-11"
"9 thg 5, 1992","1992-05-09"
"22 tháng 9 2012","2012-09-22"
"8 thg 11 1981","1981-11-08"
"17 01 96","1996-01-17"
"tháng 1 21 2010","2010-01-21"
"THÁNG 3 31, 1977","1977-03-31"
"tháng 6 11, 1986","1986-06-11"
"10 thg 6 1986","1986-06-10"
"03/03/1992","1992-03-03"
"05/05/1997","1997-05-05"
"2 tháng 7, 1987","1987-07-02"
"THÁNG 6 9, 1987","1987-06-09"
"18 THÁNG 3 2008","2008-03-18"
"03, thg 6 2000","2000-06-03"
"22 tháng 4, 1970","1970-04-22"
"10 thg 11 1986","1986-11-10"
"Thứ Tư, ngày 06 tháng 11 năm 1985","1985-11-06"
"2 thg 3, 1998","1998-03-02"
"tháng 1 30, 1987","1987-01-30"
"27 THÁNG 7 1987","1987-07-27"
"1 thg 9, 1999","1999-09-01"
"THÁNG 5 27, 1978","1978-05-27"
"24 thg 1, 1991","1991-01-24"
"Thứ Hai, ngày 23 tháng 5 năm 2016","2016-05-23"
"11/05/1973","1973-05-11"
"13 tháng 11, 1989","1989-11-13"
"19 thg 9, 2000","2000-09-19"
"tháng 9 5 2004","2004-09-05"
"23 thg 11, 2008","2008-11-23"
"31 THÁNG 8, 1974","1974-08-31"
"25.03.80","1980-03-25"
"Ngày 07 tháng 10 năm 2000","2000-10-07"
"tháng 1 26 2018","2018-01-26"
"16.04.08","2008-04-16"
"27/02/1982","1982-02-27"
"Thứ Hai, ngày 26 tháng 6 năm 2006","2006-06-26"
"ngày 02 tháng 04 năm 1970","1970-04-02"
"29 tháng 7 1970","1970-07-29"
"tháng 3 17, 2002","2002-03-17"
"18 tháng 9 2012","2012-09-18"
"01, THG 4 2013","2013-04-01"
"4 THG 11, 1988","1988-11-04"
"06/10/2008","2008-10-06"
"THÁNG 10 6, 1978","1978-10-06"
"NGÀY 13 THÁNG 01 NĂM 1999","1999-01-13"
"2 thg 7, 2004","2004-07-02"
"07.04.77","1977-04-07"
"7 thg 9 1997","1997-09-07"
"tháng 6 30, 1991","1991-06-30"
"16 thg 4, 2018","2018-04-16"
"26 thg 5 1977","1977-05-26"
"21 08 06","2006-08-21"
"thứ bảy, ngày 10 tháng 8 năm 2013","2013-08-10"
"24 thg 11 1979","1979-11-24"
"25.11.14","2014-11-25"
"28 tháng 10 1986","1986-10-28"
"14/04/1974","1974-04-14"
"27/03/2007","2007-03-27"
"28 THG 11, 2001","2001-11-28"
"17 thg 5 1980","1980-05-17"
"08.05.14","2014-05-08"
"1 tháng 10 1970","1970-10-01"
"THỨ BA, NGÀY 15 THÁNG 3 NĂM 1988","1988-03-15"
"17 THÁNG 5 2010","2010-05-17"
"THÁNG 3 15, 1980","1980-03-15"
"tháng 9 3, 1981","1981-09-03"
"31.10.73","1973-10-31"
"chủ nhật, ngày 15 tháng 11 năm 1981","1981-11-15"
"22 thg 5, 2004","2004-05-22"
"29 08 98","1998-08-29"
"THÁNG 6 12, 1985","1985-06-12"
"Chủ Nhật, ngày 15 tháng 8 năm 1993","1993-08-15"
"04.06.80","1980-06-04"
"29 thg 11, 2014","2014-11-29"
"tháng 4 8, 1993","1993-04-08"
"08 thg 10 1986","1986-10-08"
"tháng 9 20 2004","2004-09-20"
"13, thg 10 1992","1992-10-13"
"02/03/1980","1980-03-02"
"27 THG 1, 1992","1992-01-27"
"ngày 22 tháng 09 năm 1994","1994-09-22"
"11 thg 3 1976","1976-03-11"
"28 tháng 10 1974","1974-10-28"
"THÁNG 12 31 1971","1971-12-31"
"5 thg 1, 1995","1995-01-05"
"13 thg 11 1997","1997-11-13"
"5 tháng 3 1975","1975-03-05"
"THÁNG 6 13 2012","2012-06-13"
"11 tháng 9 2005","2005-09-11"
"14 thg 8 2007","2007-08-14"
"11 thg 5, 2007","2007-05-11"
"02/08/2008","2008-08-02"
"THÁNG 5 22 2016","2016-05-22"
"2 THÁNG 10 1987","1987-10-02"
"tháng 9 28, 2007","2007-09-28"
"02.11.17","2017-11-02"
"tháng 11 14, 2005","2005-11-14"
"10 thg 12, 2012","2012-12-10"
"3 03 08","2008-03-03"
"tháng 8 4 1992","1992-08-04"
"11 tháng 9, 1987","1987-09-11"
"tháng 8 20, 1998","1998-08-20"
"Thứ Ba, ngày 12 tháng 10 năm 2004","2004-10-12"
"3 tháng 11 2011","2011-11-03"
"3 12 92","1992-12-03"
"07 THG 12 1995","1995-12-07"
"ngày 18 tháng 12 năm 2015","2015-12-18"
"28 thg 1 2011","2011-01-28"
"18, thg 7 1996","1996-07-18"
"20 THÁNG 10 1979","1979-10-20"
"23 thg 2, 1990","1990-02-23"
"01/05/1978","1978-05-01"
"tháng 7 29, 1992","1992-07-29"
"8 tháng 4 1985","1985-04-08"
"28 tháng 6 2011","2011-06-28"
"thứ hai, ngày 15 tháng 1 năm 2007","2007-01-15"
"chủ nhật, ngày 24 tháng 10 năm 1982","1982-10-24"
"NGÀY 02 THÁNG 03 NĂM 1990","1990-03-02"
"19 THG 11, 1982","1982-11-19"
"tháng 1 15 1979","1979-01-15"
"23 THÁNG 5, 1975","1975-05-23"
"14 thg 4 1988","1988-04-14"
"tháng 3 16, 2009","2009-03-16"
"28/03/2000","2000-03-28"
"tháng 5 21, 2010","2010-05-21"
"8 thg 6, 1994","1994-06-08"
"tháng 10 10, 1979","1979-10-10"
"20.03.87","1987-03-20"
"Ngày 14 tháng 10 năm 1983","1983-10-14"
"Ngày 08 tháng 02 năm 2005","2005-02-08"
"24.02.90","1990-02-24"
"thứ hai, ngày 29 tháng 5 năm 1995","1995-05-29"
"09 thg 6 2004","2004-06-09"
"Thứ Năm, ngày 17 tháng 11 năm 2016","2016-11-17"
"13, thg 11 2010","2010-11-13"
"tháng 5 18 2011","2011-05-18"
"12/01/2003","2003-01-12"
"26 tháng 12 1977","1977-12-26"
"31 THG 12 2003","2003-12-31"
"15 thg 6, 1979","1979-06-15"
"tháng 11 14, 2001","2001-11-14"
"tháng 8 20, 2007","2007-08-20"
"Ngày 16 tháng 09 năm 2012","2012-09-16"
"16.07.97","1997-07-16"
"tháng 9 21 1986","1986-09-21"
"tháng 12 6, 1974","1974-12-06"
"01/11/2008","2008-11-01"
"15 08 05","2005-08-15"
"tháng 9 23 1982","1982-09-23"
"28/10/2010","2010-10-28"
"23 thg 12, 2012","2012-12-23"
"14 THÁNG 10, 1981","1981-10-14"
"22 thg 1, 1989","1989-01-22"
"26 tháng 3 1972","1972-03-26"
"22.08.97","1997-08-22"
"17, thg 7 1976","1976-07-17"
"29.09.77","1977-09-29"
"2 thg 10, 2002","2002-10-02"
"ngày 08 tháng 12 năm 2003","2003-12-08"
"17 THG 8, 1999","1999-08-17"
"26 thg 7 1982","1982-07-26"
"Ngày 11 tháng 12 năm 1981","1981-12-11"
"29 thg 10 1976","1976-10-29"
"06 THG 2 1988","1988-02-06"
"Thứ Ba, ngày 22 tháng 7 năm 1997","1997-07-22"
"4 tháng 4, 2009","2009-04-04"
"24 tháng 10 1999","1999-10-24"
"31 12 98","1998-12-31"
"ngày 19 tháng 02 năm 1976","1976-02-19"
"5 tháng 6 1999","1999-06-05"
"26, thg 2 2001","2001-02-26"
"15 THG 8, 2008","2008-08-15"
"ngày 17 tháng 07 năm 1979","1979-07-17"
"21 tháng 12 1996","1996-12-21"
"05.09.00","2000-09-05"
"14 10 90","1990-10-14"
"4 12 84","1984-12-04"
"tháng 6 29, 1981","1981-06-29"
"8 thg 10, 1988","1988-10-08"
"tháng 6 19 2016","2016-06-19"
"16.09.72","1972-09-16"
"16.01.04","2004-01-16"
"tháng 11 18 1985","1985-11-18"
"2 thg 7, 1981","1981-07-02"
"thứ sáu, ngày 15 tháng 8 năm 1975","1975-08-15"
"NGÀY 12 THÁNG 02 NĂM 1974","1974-02-12"
"13 tháng 10 1998","1998-10-13"
"3 01 05","2005-01-03"
"10 tháng 2, 1972","1972-02-10"
"08, thg 10 1976","1976-10-08"
"tháng 6 17 1984","1984-06-17"
"5 THG 10, 1996","1996-10-05"
"THÁNG 2 28 1992","1992-02-28"
"22 THG 7 1976","1976-07-22"
"23 thg 9 2017","2017-09-23"
"CHỦ NHẬT, NGÀY 04 THÁNG 4 NĂM 1993","1993-04-04"
"21/01/2011","2011-01-21"
"5 thg 5 2001","2001-05-05"
"21 tháng 1, 2016","2016-01-21"
"24 THG 12, 1997","1997-12-24"
"10 tháng 8 2008","2008-08-10"
"28 thg 9, 1979","1979-09-28"
"17, thg 3 2003","2003-03-17"
"18 10 76","1976-10-18"
"8 tháng 6 1995","1995-06-08"
"07, thg 11 1990","1990-11-07"
"29 thg 11, 1997","1997-11-29"
"14 THG 2, 2000","2000-02-14"
"8 thg 1 1987","1987-01-08"
"15 tháng 1, 1999","1999-01-15"
"21 thg 1 2010","2010-01-21"
"THÁNG 8 31 1976","1976-08-31"
"13 thg 10, 1986","1986-10-13"
"17 thg 11, 1991","1991-11-17"
"THÁNG 10 18 1975","1975-10-18"
"29/05/1992","1992-05-29"
"tháng 10 31 1998","1998-10-31"
"31/01/2013","2013-01-31"
"THỨ HAI, NGÀY 20 THÁNG 3 NĂM 2006","2006-03-20"
"19 thg 4, 1989","1989-04-19"
"5 05 98","1998-05-05"
"3 thg 3, 1987","1987-03-03"
"9 tháng 7 1995","1995-07-09"
"tháng 6 21 1989","1989-06-21"
"30, THG 4 2017","2017-04-30"
"tháng 7 2, 1998","1998-07-02"
"Ngày 01 tháng 06 năm 1999","1999-06-01"
"THÁNG 10 23, 2000","2000-10-23"
"tháng 9 13, 1986","1986-09-13"
"20 THÁNG 8 1977","1977-08-20"
"ngày 26 tháng 11 năm 2001","2001-11-26"
"8 10 83","1983-10-08"
"12 thg 7, 1986","1986-07-12"
"Chủ Nhật, ngày 12 tháng 8 năm 1979","1979-08-12"
"10 tháng 12 2013","2013-12-10"
"12 thg 12, 1985","1985-12-12"
"15 tháng 1, 1980","1980-01-15"
"25 thg 1, 1972","1972-01-25"
"21 thg 5 1982","1982-05-21"
"13 thg 10 1974","1974-10-13"
"27 thg 12 2008","2008-12-27"
"30.12.05","2005-12-30"
"5 thg 11, 1983","1983-11-05"
"17 tháng 10 2003","2003-10-17"
"21 THG 6, 1975","1975-06-21"
"Thứ Bảy, ngày 09 tháng 8 năm 2003","2003-08-09"
"17/03/2015","2015-03-17"
"16 THG 12 2013","2013-12-16"
"10, THG 4 1974","1974-04-10"
"3 tháng 6 2000","2000-06-03"
"ngày 18 tháng 07 năm 1984","1984-07-18"
"18, thg 3 2016","2016-03-18"
"06, thg 5 2003","2003-05-06"
"13 thg 3, 1982","1982-03-13"
"7 thg 10, 2004","2004-10-07"
"thứ tư, ngày 22 tháng 4 năm 1998","1998-04-22"
"11, thg 11 1981","1981-11-11"
"20 THG 3, 1999","1999-03-20"
"4 thg 2, 1986","1986-02-04"
"25.09.06","2006-09-25"
"01, thg 10 1995","1995-10-01"
"NGÀY 12 THÁNG 03 NĂM 1990","1990-03-12"
"29 thg 12 2012","2012-12-29"
"23 thg 6 2004","2004-06-23"
"24 thg 2 2002","2002-02-24"
"1 tháng 3 1971","1971-03-01"
"29 thg 5, 2001","2001-05-29"
"27 tháng 10 1973","1973-10-27"
"24 THÁNG 1 2011","2011-01-24"
"9 THG 12, 1987","1987-12-09"
"08/07/2015","2015-07-08"
"tháng 12 31 2010","2010-12-31"
"Ngày 02 tháng 09 năm 1987","1987-09-02"
"Ngày 23 tháng 01 năm 2006","2006-01-23"
"17 thg 2, 1991","1991-02-17"
"05/12/2018","2018-12-05"
"18 THÁNG 4, 1988","1988-04-18"
"2 thg 4, 2002","2002-04-02"
"Ngày 08 tháng 07 năm 2001","2001-07-08"
"26 thg 11, 1988","1988-11-26"
"28 tháng 8, 1989","1989-08-28"
"tháng 4 4 2005","2005-04-04"
"10 thg 8, 1971","1971-08-10"
"21 tháng 11 1987","1987-11-21"
"ngày 07 tháng 07 năm 2015","2015-07-07"
"16 thg 4, 1977","1977-04-16"
"4 thg 6, 1975","1975-06-04"
"04, THG 8 2001","2001-08-04"
"18 01 86","1986-01-18"
"03/05/2003","2003-05-03"
"27, thg 8 1992","1992-08-27"
"THÁNG 9 11 2000","2000-09-11"
"tháng 5 26, 1973","1973-05-26"
"20, thg 7 1988","1988-07-20"
"8 tháng 9, 2010","2010-09-08"
"5 thg 12 1977","1977-12-05"
"THÁNG 1 31 2011","2011-01-31"
"tháng 1 14, 1976","1976-01-14"
"31 tháng 12, 1974","1974-12-31"
"29 10 73","1973-10-29"
"THÁNG 9 11, 1987","1987-09-11"
"28 thg 12, 1970","1970-12-28"
"27 THG 2, 2011","2011-02-27"
"27/04/1970","1970-04-27"
"THÁNG 4 4 1988","1988-04-04"
"14/08/2003","2003-08-14"
"23 thg 9, 1975","1975-09-23"
"7 thg 6, 1987","1987-06-07"
"29 THG 3, 1985","1985-03-29"
"22.05.92","1992-05-22"
"27 THÁNG 2 1978","1978-02-27"
"16 thg 8 2014","2014-08-16"
"Ngày 23 tháng 03 năm 2008","2008-03-23"
"12 thg 3 2007","2007-03-12"
"18 tháng 12, 1994","1994-12-18"
"2 THG 6, 1994","1994-06-02"
"THỨ TƯ, NGÀY 20 THÁNG 4 NĂM 2016","2016-04-20"
"9 tháng 5 1988","1988-05-09"
"4 THÁNG 1 2003","2003-01-04"
"Thứ Hai, ngày 24 tháng 3 năm 2008","2008-03-24"
"2 tháng 3, 1993","1993-03-02"
"25 tháng 10 2013","2013-10-25"
"1 tháng 2 1995","1995-02-01"
"9 THÁNG 1 1993","1993-01-09"
"23 THÁNG 6, 1985","1985-06-23"
"22 THG 8 2004","2004-08-22"
"Thứ Năm, ngày 01 tháng 4 năm 1976","1976-04-01"
"tháng 5 9, 2009","2009-05-09"
"25 07 96","1996-07-25"
"26 thg 11, 1986","1986-11-26"
"5 THG 3, 1989","1989-03-05"
"3 11 90","1990-11-03"
"15 THG 9 2007","2007-09-15"
"19/07/1989","1989-07-19"
"8 thg 6, 1979","1979-06-08"
"01, thg 2 2016","2016-02-01"
"19 tháng 3 2012","2012-03-19"
"thứ năm, ngày 30 tháng 11 năm 1972","1972-11-30"
"14 tháng 4, 1977","1977-04-14"
"17 thg 1 1973","1973-01-17"
"29 tháng 5, 2015","2015-05-29"
"6 thg 2, 2008","2008-02-06"
"10, THG 12 1974","1974-12-10"
"8 THÁNG 3 1989","1989-03-08"
"18/08/2003","2003-08-18"
"THÁNG 6 25, 1982","1982-06-25"
"tháng 5 7, 2003","2003-05-07"
"tháng 2 28, 1984","1984-02-28"
"2 thg 1, 1997","1997-01-02"
"tháng 5 5 2012","2012-05-05"
"13 THÁNG 7 1995","1995-07-13"
"18 THÁNG 12, 1972","1972-12-18"
"29 tháng 1, 1978","1978-01-29"
"8 thg 10, 2011","2011-10-08"
"13 thg 3, 1995","1995-03-13"
"Ngày 07 tháng 02 năm 1993","1993-02-07"
"23 THG 9 1974","1974-09-23"
"NGÀY 24 THÁNG 12 NĂM 1995","1995-12-24"
"20 thg 12 1989","1989-12-20"
"14 tháng 10 1973","1973-10-14"
"17 tháng 2 2007","2007-02-17"
"tháng 11 13, 1980","1980-11-13"
"20 tháng 10, 1996","1996-10-20"
"19 THG 1, 1992","1992-01-19"
"14 thg 12 1975","1975-12-14"
"tháng 1 24 1998","1998-01-24"
"16 thg 6, 1979","1979-06-16"
"ngày 27 tháng 11 năm 2018","2018-11-27"
"17 thg 3 2011","2011-03-17"
"25/09/2017","2017-09-25"
"26 11 12","2012-11-26"
"20 thg 8, 1982","1982-08-20"
"27 THG 4, 2005","2005-04-27"
"03 THG 3 1997","1997-03-03"
"14 thg 9, 1979","1979-09-14"
"THÁNG 4 6, 1970","1970-04-06"
"26 thg 3, 2009","2009-03-26"
"23/01/1989","1989-01-23"
"6 thg 9 1998","1998-09-06"
"THÁNG 7 19, 2001","2001-07-19"
"7 thg 9, 1992","1992-09-07"
"tháng 6 20, 1971","1971-06-20"
"19 THÁNG 8 1976","1976-08-19"
"02 thg 4 1972","1972-04-02"
"16 THG 9 1986","1986-09-16"
"20 04 72","1972-04-20"
"Ngày 08 tháng 06 năm 2011","2011-06-08"
"Thứ Năm, ngày 11 tháng 8 năm 1994","1994-08-11"
"1 thg 4, 1995","1995-04-01"
"26 10 90","1990-10-26"
"28 thg 3, 1974","1974-03-28"
"17.08.97","1997-08-17"
"19 tháng 4 1986","1986-04-19"
"26/04/1981","1981-04-26"
"24 thg 9, 1985","1985-09-24"
"25 thg 11, 1979","1979-11-25"
"10 thg 3 2012","2012-03-10"
"05, THG 4 2001","2001-04-05"
"Ngày 20 tháng 03 năm 2001","2001-03-20"
"22 thg 3, 1975","1975-03-22"
"tháng 6 12, 1985","1985-06-12"
"9 tháng 5, 2007","2007-05-09"
"21 12 86","1986-12-21"
"Ngày 15 tháng 11 năm 1992","1992-11-15"
"27 thg 6, 1982","1982-06-27"
"15 tháng 8 2014","2014-08-15"
"17 thg 8, 1976","1976-08-17"
"15 THG 11, 1984","1984-11-15"
"16 thg 5, 1983","1983-05-16"
"6 06 78","1978-06-06"
"tháng 2 18 2016","2016-02-18"
"16.04.93","1993-04-16"
"28/02/1970","1970-02-28"
"10.12.00","2000-12-10"
"2 thg 1 1999","1999-01-02"
"17 thg 11 2010","2010-11-17"
"08, thg 6 1978","1978-06-08"
"chủ nhật, ngày 05 tháng 5 năm 2013","2013-05-05"
"Thứ Bảy, ngày 10 tháng 9 năm 1994","1994-09-10"
"3 thg 8, 2005","2005-08-03"
"9 tháng 12, 1973","1973-12-09"
"15 tháng 9 2010","2010-09-15"
"22 thg 8 2007","2007-08-22"
"ngày 17 tháng 06 năm 1975","1975-06-17"
"2 thg 10, 1976","1976-10-02"
"02.12.09","2009-12-02"
"tháng 2 7 2006","2006-02-07"
"Ngày 24 tháng 03 năm 1981","1981-03-24"
"tháng 1 31, 2014","2014-01-31"
"Ngày 16 tháng 09 năm 1988","1988-09-16"
"15.04.79","1979-04-15"
"22 03 87","1987-03-22"
"Ngày 06 tháng 09 năm 1983","1983-09-06"
"07, thg 1 1996","1996-01-07"
"8 tháng 8, 1999","1999-08-08"
"26 thg 6 2009","2009-06-26"
"thứ năm, ngày 21 tháng 8 năm 1980","1980-08-21"
"19 08 80","1980-08-19"
"thứ năm, ngày 04 tháng 11 năm 1971","1971-11-04"
"21 tháng 6 1970","1970-06-21"
"THÁNG 1 25, 1971","1971-01-25"
"25/01/1994","1994-01-25"
"30 thg 12, 1971","1971-12-30"
"3 tháng 5, 2016","2016-05-03"
"11 tháng 4, 1980","1980-04-11"
"24 tháng 12 2003","2003-12-24"
"ngày 25 tháng 06 năm 2004","2004-06-25"
"6 04 88","1988-04-06"
"27 THG 5, 2011","2011-05-27"
"21 tháng 3 2014","2014-03-21"
"16 tháng 9 1986","1986-09-16"
"CHỦ NHẬT, NGÀY 19 THÁNG 10 NĂM 2003","2003-10-19"
"12 THÁNG 2 1992","1992-02-12"
"27 thg 8, 1989","1989-08-27"
"30 thg 5 1978","1978-05-30"
"29 tháng 6, 1987","1987-06-29"
"19 THG 2, 2013","2013-02-19"
"31.07.74","1974-07-31"
"1 12 13","2013-12-01"
"23 tháng 6, 1978","1978-06-23"
"31, thg 12 1996","1996-12-31"
"ngày 15 tháng 04 năm 1989","1989-04-15"
"15 THG 5, 1993","1993-05-15"
"18 tháng 1 1971","1971-01-18"
"19 thg 4, 1999","1999-04-19"
"08.12.92","1992-12-08"
"24 tháng 2 2004","2004-02-24"
"THÁNG 9 29, 1976","1976-09-29"
"1 thg 3 2007","2007-03-01"
"THỨ NĂM, NGÀY 16 THÁNG 8 NĂM 2001","2001-08-16"
"12/08/1998","1998-08-12"
"NGÀY 27 THÁNG 02 NĂM 1983","1983-02-27"
"THỨ SÁU, NGÀY 21 THÁNG 1 NĂM 1983","1983-01-21"
"14 tháng 1, 2002","2002-01-14"
"16 thg 6, 1979","1979-06-16"
"18 THÁNG 6 1980","1980-06-18"
"30 03 18","2018-03-30"
"Ngày 21 tháng 08 năm 1997","1997-08-21"
"20 06 71","1971-06-20"
"THÁNG 1 27, 1985","1985-01-27"
"29 tháng 9, 1996","1996-09-29"
"NGÀY 29 THÁNG 11 NĂM 2015","2015-11-29"
"26, thg 9 2009","2009-09-26"
"8 tháng 10 1992","1992-10-08"
"18 thg 1, 1993","1993-01-18"
"tháng 11 10 2002","2002-11-10"
"22/11/2012","2012-11-22"
"23 thg 6, 2001","2001-06-23"
"Thứ Năm, ngày 19 tháng 4 năm 2007","2007-04-19"
"9 tháng 1 2010","2010-01-09"
"18, thg 1 2007","2007-01-18"
"27.05.10","2010-05-27"
"22 thg 7, 1982","1982-07-22"
"27 tháng 7 1995","1995-07-27"
"14 thg 11, 1998","1998-11-14"
"tháng 3 23 2011","2011-03-23"
"22 THG 8 1970","1970-08-22"
"22.06.15","2015-06-22"
"22 thg 5 2017","2017-05-22"
"5 THÁNG 4, 1988","1988-04-05"
"02.08.84","1984-08-02"
"tháng 11 27, 2006","2006-11-27"
"20.08.92","1992-08-20"
"THÁNG 4 26 1993","1993-04-26"
"17 THÁNG 6 1993","1993-06-17"
"THỨ HAI, NGÀY 14 THÁNG 3 NĂM 1977","1977-03-14"
"28 tháng 9 1980","1980-09-28"
"19 thg 3, 1970","1970-03-19"
"28 thg 8, 1988","1988-08-28"
"9 THÁNG 6 2014","2014-06-09"
"13 tháng 5 2017","2017-05-13"
"03 thg 7 2001","2001-07-03"
"22, thg 10 1979","1979-10-22"
"23 thg 1, 1980","1980-01-23"
"29 tháng 5 2018","2018-05-29"
"18, thg 3 2001","2001-03-18"
"tháng 9 26 1989","1989-09-26"
"07, thg 9 2007","2007-09-07"
"29 tháng 2 2000","2000-02-29"
"14 tháng 4 1973","1973-04-14"
"6 tháng 1 1976","1976-01-06"
"Thứ Tư, ngày 13 tháng 8 năm 1980","1980-08-13"
"tháng 7 8 1980","1980-07-08"
"30 thg 8, 1992","1992-08-30"
"tháng 8 20 2015","2015-08-20"
"ngày 03 tháng 03 năm 2011","2011-03-03"
"3 thg 10 1979","1979-10-03"
"23 tháng 2 2009","2009-02-23"
"10/01/1988","1988-01-10"
"08.08.02","2002-08-08"
"tháng 1 20 1989","1989-01-20"
"7 THÁNG 4, 2008","2008-04-07"
"23 tháng 7, 2000","2000-07-23"
"8 05 91","1991-05-08"
"19 tháng 11, 2004","2004-11-19"
"19 06 03","2003-06-19"
"tháng 8 23 2006","2006-08-23"
"30, thg 5 1985","1985-05-30"
"tháng 11 19, 1995","1995-11-19"
"3 tháng 6 1978","1978-06-03"
"24 thg 2 1993","1993-02-24"
"22 thg 7 2010","2010-07-22"
"THÁNG 5 12, 2004","2004-05-12"
"23 thg 9 1988","1988-09-23"
"THÁNG 6 30, 1988","1988-06-30"
"25 thg 5, 1979","1979-05-25"
"10 thg 9, 2013","2013-09-10"
"tháng 5 23 1975","1975-05-23"
"20 THG 8, 1981","1981-08-20"
"12 tháng 6 2016","2016-06-12"
"14 tháng 9 1993","1993-09-14"
"02 thg 1 1976","1976-01-02"
"21 THÁNG 3, 1992","1992-03-21"
"19.04.71","1971-04-19"
"THÁNG 3 15, 2018","2018-03-15"
"13 thg 2, 1981","1981-02-13"
"13 thg 11 1980","1980-11-13"
"2 03 09","2009-03-02"
"21, THG 12 2017","2017-12-21"
"Thứ Sáu, ngày 20 tháng 5 năm 1977","1977-05-20"
"7 thg 12, 1995","1995-12-07"
"THỨ NĂM, NGÀY 29 THÁNG 6 NĂM 2000","2000-06-29"
"6 thg 11 1989","1989-11-06"
"8 thg 8, 1991","1991-08-08"
"14 THÁNG 5 1984","1984-05-14"
"7 thg 11, 2005","2005-11-07"
"26 thg 5, 1972","1972-05-26"
"7 THG 9, 1975","1975-09-07"
"15 tháng 6 1990","1990-06-15"
"Thứ Bảy, ngày 10 tháng 7 năm 1993","1993-07-10"
"tháng 5 16, 1987","1987-05-16"
"26 12 17","2017-12-26"
"tháng 4 17, 2010","2010-04-17"
"18 tháng 5 2009","2009-05-18"
"12 tháng 10 1971","1971-10-12"
"18.09.16","2016-09-18"
"2 thg 11, 2003","2003-11-02"
"31.07.18","2018-07-31"
"THÁNG 12 6 2003","2003-12-06"
"27 THG 2 1982","1982-02-27"
"17/12/2000","2000-12-17"
"18 thg 9, 2001","2001-09-18"
"17 THG 2 1996","1996-02-17"
"11 tháng 6 2013","2013-06-11"
"tháng 6 9 1978","1978-06-09"
"THÁNG 5 2, 1995","1995-05-02"
"24 tháng 4 2001","2001-04-24"
"Ngày 16 tháng 05 năm 2005","2005-05-16"
"19 tháng 12 1978","1978-12-19"
"9 tháng 3 2015","2015-03-09"
"21 THÁNG 1, 1977","1977-01-21"
"tháng 6 19, 1978","1978-06-19"
"tháng 3 8 1971","1971-03-08"
"2 tháng 12 2014","2014-12-02"
"29 thg 11, 1970","1970-11-29"
"1 thg 6, 1993","1993-06-01"
"29 thg 2 2008","2008-02-29"
"tháng 2 19, 1983","1983-02-19"
"THÁNG 3 30, 2013","2013-03-30"
"21 tháng 10 2016","2016-10-21"
"Ngày 20 tháng 02 năm 1984","1984-02-20"
"11 THG 11 1971","1971-11-11"
"11 12 02","2002-12-11"
"2 tháng 2 2014","2014-02-02"
"THỨ BẢY, NGÀY 24 THÁNG 3 NĂM 2001","2001-03-24"
"16 thg 2, 1970","1970-02-16"
"29 THG 3, 1975","1975-03-29"
"25 11 71","1971-11-25"
"12 tháng 11 1999","1999-11-12"
"Thứ Bảy, ngày 28 tháng 5 năm 2005","2005-05-28"
"THÁNG 11 13 1986","1986-11-13"
"25 thg 6, 1972","1972-06-25"
"16, thg 11 1992","1992-11-16"
"8 02 70","1970-02-08"
"28 thg 10, 1984","1984-10-28"
"NGÀY 15 THÁNG 08 NĂM 1978","1978-08-15"
"31 thg 5 2017","2017-05-31"
"2 tháng 12 1997","1997-12-02"
"24, thg 10 1987","1987-10-24"
"thứ ba, ngày 09 tháng 3 năm 1976","1976-03-09"
"tháng 8 6 1984","1984-08-06"
"THỨ NĂM, NGÀY 15 THÁNG 5 NĂM 1980","1980-05-15"
"20, thg 4 2012","2012-04-20"
"13 09 12","2012-09-13"
"THỨ BA, NGÀY 10 THÁNG 3 NĂM 1987","1987-03-10"
"Ngày 17 tháng 12 năm 1971","1971-12-17"
"tháng 6 19, 1979","1979-06-19"
"NGÀY 23 THÁNG 05 NĂM 2008","2008-05-23"
"14 thg 7 2002","2002-07-14"
"20 08 72","1972-08-20"
"16 tháng 2 1979","1979-02-16"
"NGÀY 15 THÁNG 01 NĂM 1983","1983-01-15"
"18 tháng 10, 2013","2013-10-18"
"Ngày 03 tháng 09 năm 1987","1987-09-03"
"thứ ba, ngày 28 tháng 2 năm 1995","1995-02-28"
"20 THG 5, 2001","2001-05-20"
"19 THG 12, 2006","2006-12-19"
"15 thg 6, 2003","2003-06-15"
"THÁNG 4 30 1978","1978-04-30"
"THÁNG 8 13 1998","1998-08-13"
"06.07.73","1973-07-06"
"7 THG 11, 1985","1985-11-07"
"NGÀY 22 THÁNG 04 NĂM 1979","1979-04-22"
"16 THG 6, 1997","1997-06-16"
"THÁNG 1 28, 2015","2015-01-28"
"ngày 05 tháng 07 năm 1972","1972-07-05"
"tháng 6 28, 2010","2010-06-28"
"16 tháng 6, 2007","2007-06-16"
"10 THG 4 2016","2016-04-10"
"Thứ Tư, ngày 07 tháng 11 năm 2007","2007-11-07"
"7 07 05","2005-07-07"
"Thứ Tư, ngày 29 tháng 7 năm 2009","2009-07-29"
"22/03/1981","1981-03-22"
"16, thg 6 1975","1975-06-16"
"tháng 11 21, 1973","1973-11-21"
"4 THG 2 2015","2015-02-04"
"tháng 4 4 1988","1988-04-04"
"tháng 3 8, 2007","2007-03-08"
"4 thg 9, 2012","2012-09-04"
"1 09 80","1980-09-01"
"30 thg 3 1980","1980-03-30"
"22 tháng 8, 1984","1984-08-22"
"tháng 5 19 2011","2011-05-19"
"13 THG 11 1998","1998-11-13"
"19 tháng 5 2016","2016-05-19"
"10 thg 6, 2014","2014-06-10"
"tháng 7 13, 1976","1976-07-13"
"07, thg 7 2018","2018-07-07"
"24 08 94","1994-08-24"
"tháng 12 29 1989","1989-12-29"
"26 tháng 9, 1988","1988-09-26"
"tháng 12 12, 2007","2007-12-12"
"9 tháng 5, 1993","1993-05-09"
"05 thg 12 2003","2003-12-05"
"17 thg 10 1993","1993-10-17"
"tháng 8 2 1988","1988-08-02"
"6 thg 7 1974","1974-07-06"
"28 tháng 8, 2012","2012-08-28"
"THỨ SÁU, NGÀY 09 THÁNG 5 NĂM 1986","1986-05-09"
"6 thg 12 1979","1979-12-06"
"01/05/1985","1985-05-01"
"22.09.06","2006-09-22"
"9 tháng 4 2003","2003-04-09"
"21 tháng 9, 2012","2012-09-21"
"Chủ Nhật, ngày 10 tháng 12 năm 1995","1995-12-10"
"15 thg 7 1991","1991-07-15"
"24/07/1984","1984-07-24"
"06/10/2008","2008-10-06"
"1 thg 3, 1997","1997-03-01"
"26 thg 12, 2007","2007-12-26"
"11 THG 3 2012","2012-03-11"
"17 thg 1 1974","1974-01-17"
"14 tháng 12, 1975","1975-12-14"
"06 thg 1 1986","1986-01-06"
"26 thg 6, 2006","2006-06-26"
"26 tháng 6, 1996","1996-06-26"
"26 tháng 3, 1981","1981-03-26"
"Ngày 10 tháng 01 năm 1972","1972-01-10"
"15 tháng 11 2017","2017-11-15"
"06, thg 2 1976","1976-02-06"
"10 11 88","1988-11-10"
"3 THÁNG 7 1998","1998-07-03"
"THÁNG 8 28 2018","2018-08-28"
"1 THÁNG 1, 1984","1984-01-01"
"25 thg 12 2011","2011-12-25"
"25.09.04","2004-09-25"
"18 tháng 5 1987","1987-05-18"
"tháng 3 27, 2004","2004-03-27"
"15 tháng 2, 1991","1991-02-15"
"24 thg 4 1994","1994-04-24"
"27 thg 4 1984","1984-04-27"
"13 THÁNG 2 1979","1979-02-13"
"12 thg 7, 1984","1984-07-12"
"THỨ BẢY, NGÀY 06 THÁNG 12 NĂM 1975","1975-12-06"
"28 tháng 3, 1975","1975-03-28"
"NGÀY 25 THÁNG 11 NĂM 1999","1999-11-25"
"28 thg 9 2001","2001-09-28"
"20, thg 4 1982","1982-04-20"
"26, thg 2 2001","2001-02-26"
"tháng 8 15, 1979","1979-08-15"
"THỨ SÁU, NGÀY 19 THÁNG 5 NĂM 2006","2006-05-19"
"29 thg 8, 2004","2004-08-29"
"20 tháng 11, 2011","2011-11-20"
"21 thg 8 1971","1971-08-21"
"2 THÁNG 10, 1971","1971-10-02"
"3 tháng 7 2014","2014-07-03"
"22 thg 10, 2006","2006-10-22"
"10 THG 3, 1990","1990-03-10"
"28.05.04","2004-05-28"
"06/11/1971","1971-11-06"
"21, THG 12 1982","1982-12-21"
"23 THÁNG 10 2003","2003-10-23"
"Thứ Ba, ngày 08 tháng 8 năm 1978","1978-08-08"
"9 THÁNG 5 2009","2009-05-09"
"tháng 12 14 1993","1993-12-14"
"Ngày 04 tháng 12 năm 2013","2013-12-04"
"17 tháng 10, 1979","1979-10-17"
"3 THÁNG 6, 2015","2015-06-03"
"15/06/1998","1998-06-15"
"09.10.03","2003-10-09"
"tháng 6 20, 1980","1980-06-20"
"4 tháng 8, 2007","2007-08-04"
"17 04 73","1973-04-17"
"7 tháng 1 2018","2018-01-07"
"4 tháng 4, 1984","1984-04-04"
"thứ hai, ngày 03 tháng 3 năm 2003","2003-03-03"
"18 thg 1 1975","1975-01-18"
"THÁNG 6 1, 1974","1974-06-01"
"8 thg 9, 2015","2015-09-08"
"tháng 9 22 1999","1999-09-22"
"29 thg 7, 1995","1995-07-29"
"4 thg 8, 2001","2001-08-04"
"14 tháng 8 1973","1973-08-14"
"Thứ Sáu, ngày 25 tháng 9 năm 1970","1970-09-25"
"18 tháng 12 1993","1993-12-18"
"24 06 86","1986-06-24"
"Chủ Nhật, ngày 15 tháng 12 năm 1991","1991-12-15"
"tháng 11 30, 1993","1993-11-30"
"19 THÁNG 12 1982","1982-12-19"
"22 08 80","1980-08-22"
"THỨ BA, NGÀY 09 THÁNG 4 NĂM 2002","2002-04-09"
"17 thg 4 1974","1974-04-17"
"20 thg 9, 2012","2012-09-20"
"tháng 9 29, 2003","2003-09-29"
"14 09 07","2007-09-14"
"17, thg 6 1970","1970-06-17"
"22/05/1974","1974-05-22"
"Ngày 06 tháng 06 năm 1992","1992-06-06"
"07/01/1989","1989-01-07"
"02/10/1999","1999-10-02"
"Ngày 18 tháng 09 năm 2001","2001-09-18"
"tháng 12 20 1974","1974-12-20"
"23.10.89","1989-10-23"
"27 thg 7 1994","1994-07-27"
"tháng 3 1, 1975","1975-03-01"
"2 thg 6, 1996","1996-06-02"
"27.04.91","1991-04-27"
"22 THG 4 1991","1991-04-22"
"tháng 6 16 1997","1997-06-16"
"11/03/1979","1979-03-11"
"3 thg 12, 2014","2014-12-03"
"10, thg 10 1993","1993-10-10"
"16 06 87","1987-06-16"
"20 tháng 11, 1982","1982-11-20"
"7 02 87","1987-02-07"
"18 thg 6 2004","2004-06-18"
"Thứ Hai, ngày 28 tháng 6 năm 2010","2010-06-28"
"07.12.02","2002-12-07"
"NGÀY 28 THÁNG 05 NĂM 1987","1987-05-28"
"Ngày 04 tháng 12 năm 1979","1979-12-04"
"tháng 5 26 1980","1980-05-26"
"29.08.09","2009-08-29"
"21 thg 11, 2016","2016-11-21"
"10 THG 7 1998","1998-07-10"
"31 tháng 10, 1990","1990-10-31"
"Ngày 26 tháng 08 năm 2013","2013-08-26"
"tháng 8 3, 1987","1987-08-03"
"NGÀY 18 THÁNG 11 NĂM 2002","2002-11-18"
"31.10.82","1982-10-31"
"22, thg 7 2001","2001-07-22"
"28 THÁNG 9, 2009","2009-09-28"
"THỨ SÁU, NGÀY 27 THÁNG 9 NĂM 1996","1996-09-27"
"21 tháng 4 1971","1971-04-21"
"tháng 5 9 1996","1996-05-09"
"22 08 18","2018-08-22"
"3 THG 3, 2006","2006-03-03"
"28 thg 5 1975","1975-05-28"
"24 thg 1, 2017","2017-01-24"
"Ngày 10 tháng 07 năm 2002","2002-07-10"
"28 THG 1, 1984","1984-01-28"
"12 tháng 5, 1990","1990-05-12"
"CHỦ NHẬT, NGÀY 01 THÁNG 9 NĂM 1985","1985-09-01"
"13 thg 3 2004","2004-03-13"
"8 tháng 7, 2015","2015-07-08"
"19 THG 5, 2007","2007-05-19"
"thứ năm, ngày 14 tháng 4 năm 1977","1977-04-14"
"27, THG 4 2010","2010-04-27"
"Ngày 20 tháng 09 năm 2017","2017-09-20"
"thứ hai, ngày 17 tháng 7 năm 2000","2000-07-17"
"22/09/1990","1990-09-22"
"tháng 3 7 1993","1993-03-07"
"Ngày 18 tháng 03 năm 1977","1977-03-18"
"THỨ HAI, NGÀY 11 THÁNG 6 NĂM 2007","2007-06-11"
"22, thg 3 2018","2018-03-22"
"10/05/1971","1971-05-10"
"1 tháng 4 2006","2006-04-01"
"24 tháng 12, 2004","2004-12-24"
"6 tháng 8 2011","2011-08-06"
"18 thg 8, 2002","2002-08-18"
"18 thg 4 1974","1974-04-18"
"02, thg 2 1970","1970-02-02"
"Thứ Sáu, ngày 28 tháng 12 năm 2018","2018-12-28"
"29 THÁNG 7 2006","2006-07-29"
"26 tháng 6 1972","1972-06-26"
"11 THÁNG 10 1990","1990-10-11"
"tháng 3 15, 1992","1992-03-15"
"4 tháng 12, 1990","1990-12-04"
"9 thg 9, 1990","1990-09-09"
"22 thg 10, 1981","1981-10-22"
"21/10/1999","1999-10-21"
"15.12.80","1980-12-15"
"9 tháng 9, 2017","2017-09-09"
"THÁNG 9 4, 1986","1986-09-04"
"NGÀY 02 THÁNG 05 NĂM 1972","1972-05-02"
"19 08 73","1973-08-19"
"tháng 1 11, 1979","1979-01-11"
"9 tháng 12, 1992","1992-12-09"
"29 thg 11, 2002","2002-11-29"
"04 THG 9 1978","1978-09-04"
"30/01/2004","2004-01-30"
"3 thg 11 1971","1971-11-03"
"19 05 82","1982-05-19"
"29 thg 6 1984","1984-06-29"
"5 tháng 12, 1992","1992-12-05"
"07.05.79","1979-05-07"
"30 thg 1, 1988","1988-01-30"
"2 THÁNG 7 1977","1977-07-02"
"thứ ba, ngày 01 tháng 4 năm 2003","2003-04-01"
"10 09 05","2005-09-10"
"14, thg 6 2012","2012-06-14"
"30/12/1989","1989-12-30"
"24 thg 6 2002","2002-06-24"
"31 thg 8, 1994","1994-08-31"
"7 THG 12, 2011","2011-12-07"
"Thứ Năm, ngày 03 tháng 3 năm 2005","2005-03-03"
"tháng 5 15, 1972","1972-05-15"
"4 08 77","1977-08-04"
"2 thg 1, 1975","1975-01-02"
"1 thg 4, 2007","2007-04-01"
"27 thg 3, 1989","1989-03-27"
"1 08 02","2002-08-01"
"tháng 5 31, 2012","2012-05-31"
"13 thg 6, 2006","2006-06-13"
"24, thg 1 1971","1971-01-24"
"tháng 11 24, 1978","1978-11-24"
"ngày 27 tháng 09 năm 1974","1974-09-27"
"29 tháng 7 1972","1972-07-29"
"15 12 80","1980-12-15"
"27/02/2009","2009-02-27"
"03/07/1974","1974-07-03"
"Ngày 15 tháng 01 năm 1970","1970-01-15"
"19.04.95","1995-04-19"
"04, thg 6 2008","2008-06-04"
"11, THG 7 1975","1975-07-11"
"tháng 5 24 2004","2004-05-24"
"24 thg 8, 1986","1986-08-24"
"29 THG 1 2006","2006-01-29"
"06/05/1998","1998-05-06"
"1 thg 8, 1982","1982-08-01"
"11/04/2011","2011-04-11"
"THÁNG 3 27, 2008","2008-03-27"
"12 THG 2, 2016","2016-02-12"
"tháng 1 9, 1984","1984-01-09"
"NGÀY 07 THÁNG 12 NĂM 1973","1973-12-07"
"23 thg 7 2005","2005-07-23"
"30 08 96","1996-08-30"
"4 tháng 10 1976","1976-10-04"
"26, THG 5 2018","2018-05-26"
"26 02 07","2007-02-26"
"4 tháng 8 2017","2017-08-04"
"11, THG 6 1988","1988-06-11"
"24, THG 11 2003","2003-11-24"
"27 12 82","1982-12-27"
"21 THÁNG 10 2006","2006-10-21"
"15 12 14","2014-12-15"
"12 thg 5 1991","1991-05-12"
"10/03/1984","1984-03-10"
"26 tháng 11 1972","1972-11-26"
"13/01/1981","1981-01-13"
"22 tháng 3, 2009","2009-03-22"
"tháng 9 14, 1997","1997-09-14"
"21 tháng 3 1979","1979-03-21"
"05.06.07","2007-06-05"
"02 thg 5 2018","2018-05-02"
"07 THG 3 2002","2002-03-07"
"17 thg 12 1987","1987-12-17"
"21 06 08","2008-06-21"
"03/04/2005","2005-04-03"
"23 02 80","1980-02-23"
"27.04.76","1976-04-27"
"THÁNG 5 19 1977","1977-05-19"
"01/05/1995","1995-05-01"
"31 01 72","1972-01-31"
"20, THG 9 1970","1970-09-20"
"26 thg 8, 1989","1989-08-26"
"30 THÁNG 12 2008","2008-12-30"
"6 02 96","1996-02-06"
"tháng 12 3 1998","1998-12-03"
"15.11.08","2008-11-15"
"26, thg 2 1988","1988-02-26"
"16 08 99","1999-08-16"
"3 tháng 2 2013","2013-02-03"
"Thứ Ba, ngày 23 tháng 8 năm 1988","1988-08-23"
"9 thg 8, 1972","1972-08-09"
"tháng 6 21, 1985","1985-06-21"
"17 tháng 2, 1984","1984-02-17"
"06/10/2008","2008-10-06"
"16 thg 9 1995","1995-09-16"
"31 tháng 8 1984","1984-08-31"
"7 thg 11, 1971","1971-11-07"
"22 tháng 10, 1996","1996-10-22"
"23 03 80","1980-03-23"
"20.10.97","1997-10-20"
"tháng 8 13, 1980","1980-08-13"
"9 THÁNG 12 1978","1978-12-09"
"5 thg 8 1999","1999-08-05"
"11.12.78","1978-12-11"
"13 tháng 6, 1984","1984-06-13"
"23 thg 7 2003","2003-07-23"
"26 thg 3, 1983","1983-03-26"
"24 thg 9 2007","2007-09-24"
"Ngày 16 tháng 04 năm 2016","2016-04-16"
"01.10.80","1980-10-01"
"tháng 7 2, 1987","1987-07-02"
"8 tháng 7 1988","1988-07-08"
"27 thg 10, 1971","1971-10-27"
"02, THG 7 2018","2018-07-02"
"13 tháng 3 2010","2010-03-13"
"23 thg 1, 2018","2018-01-23"
"13 tháng 6 1983","1983-06-13"
"04 thg 9 1981","1981-09-04"
"Thứ Sáu, ngày 07 tháng 6 năm 1991","1991-06-07"
"16 thg 5 1974","1974-05-16"
"THÁNG 10 27, 2018","2018-10-27"
"tháng 9 20, 2017","2017-09-20"
"29 thg 4, 2006","2006-04-29"
"20, thg 10 2016","2016-10-20"
"25 thg 11 2018","2018-11-25"
"THÁNG 6 11, 2004","2004-06-11"
"11 tháng 6 1980","1980-06-11"
"07, thg 7 2013","2013-07-07"
"23, thg 6 2002","2002-06-23"
"02, thg 12 1980","1980-12-02"
"4 thg 12 2013","2013-12-04"
"21 thg 3, 1996","1996-03-21"
"02.09.81","1981-09-02"
"03 thg 5 2005","2005-05-03"
"17 tháng 12 1982","1982-12-17"
"11 11 14","2014-11-11"
"Thứ Sáu, ngày 21 tháng 10 năm 1988","1988-10-21"
"THÁNG 1 20, 1991","1991-01-20"
"THỨ HAI, NGÀY 20 THÁNG 7 NĂM 1970","1970-07-20"
"tháng 12 27, 2006","2006-12-27"
"11 08 75","1975-08-11"
"2 03 03","2003-03-02"
"27.11.75","1975-11-27"
"16, thg 12 1997","1997-12-16"
"19 10 84","1984-10-19"
"04, THG 9 1977","1977-09-04"
"Thứ Bảy, ngày 28 tháng 4 năm 1973","1973-04-28"
"5 tháng 6 1993","1993-06-05"
"26 thg 2, 2004","2004-02-26"
"11 06 15","2015-06-11"
"09 thg 3 2001","2001-03-09"
"12 thg 11 1997","1997-11-12"
"26 THG 7 1974","1974-07-26"
"THÁNG 8 16, 2000","2000-08-16"
"THỨ BẢY, NGÀY 16 THÁNG 11 NĂM 2013","2013-11-16"
"Ngày 22 tháng 09 năm 1972","1972-09-22"
"THÁNG 1 20 2014","2014-01-20"
"tháng 6 25 1979","1979-06-25"
"tháng 8 10 1990","1990-08-10"
"21, THG 8 1989","1989-08-21"
"16/08/2005","2005-08-16"
"13 thg 6, 2010","2010-06-13"
"18 tháng 4 1976","1976-04-18"
"2 tháng 8, 1975","1975-08-02"
"30 thg 3 2004","2004-03-30"
"Ngày 20 tháng 10 năm 2013","2013-10-20"
"22 THÁNG 1 1991","1991-01-22"
"16.09.82","1982-09-16"
"13 THÁNG 3 1990","1990-03-13"
"25, thg 5 2017","2017-05-25"
"17 THG 8, 1972","1972-08-17"
"10 12 14","2014-12-10"
"02, thg 4 2012","2012-04-02"
"19 tháng 5 1990","1990-05-19"
"9 thg 2, 1971","1971-02-09"
"12/12/1989","1989-12-12"
"17 tháng 1, 2013","2013-01-17"
"thứ sáu, ngày 29 tháng 1 năm 1982","1982-01-29"
"18, thg 10 2013","2013-10-18"
"30 thg 11, 1979","1979-11-30"
"02/05/1976","1976-05-02"
"25 thg 12 1994","1994-12-25"
"12/03/2015","2015-03-12"
"4 tháng 12 1996","1996-12-04"
"ngày 20 tháng 03 năm 2002","2002-03-20"
"23 08 90","1990-08-23"
"11 THG 10, 1978","1978-10-11"
"NGÀY 13 THÁNG 01 NĂM 2004","2004-01-13"
"13 thg 5 1970","1970-05-13"
"30 THÁNG 3, 1988","1988-03-30"
"23 tháng 3 1985","1985-03-23"
"25 THG 10 1999","1999-10-25"
"18, thg 8 2015","2015-08-18"
"19, thg 2 2006","2006-02-19"
"14 thg 9 2011","2011-09-14"
"tháng 9 3 2006","2006-09-03"
"14, thg 7 2001","2001-07-14"
"24 thg 10 1984","1984-10-24"
"25 thg 4, 1990","1990-04-25"
"14 tháng 4, 1991","1991-04-14"
"2 06 01","2001-06-02"
"2 tháng 3 1980","1980-03-02"
"27 thg 7, 1982","1982-07-27"
"26 THÁNG 8 2006","2006-08-26"
"18 thg 8, 2012","2012-08-18"
"19 tháng 5 2011","2011-05-19"
"18 tháng 2 1993","1993-02-18"
"17.12.96","1996-12-17"
"1 thg 11 1991","1991-11-01"
"14 tháng 9 1993","1993-09-14"
"14 11 85","1985-11-14"
"7 10 94","1994-10-07"
"17/08/1987","1987-08-17"
"tháng 5 7, 1985","1985-05-07"
"31.07.10","2010-07-31"
"20/11/1970","1970-11-20"
"25 thg 2 2003","2003-02-25"
"26, thg 9 1975","1975-09-26"
"THÁNG 8 3, 2002","2002-08-03"
"5 06 03","2003-06-05"
"9 tháng 3 2009","2009-03-09"
"16/02/1997","1997-02-16"
"tháng 2 20 2012","2012-02-20"
"23 11 72","1972-11-23"
"4 thg 11 1974","1974-11-04"
"28, thg 7 1970","1970-07-28"
"THÁNG 2 20 1971","1971-02-20"
"23 thg 2 2003","2003-02-23"
"18.06.75","1975-06-18"
"Thứ Năm, ngày 26 tháng 1 năm 1989","1989-01-26"
"08.01.72","1972-01-08"
"thứ sáu, ngày 15 tháng 11 năm 2013","2013-11-15"
"16, THG 1 2018","2018-01-16"
"26.12.94","1994-12-26"
"05 thg 10 2008","2008-10-05"
"10 tháng 11 1973","1973-11-10"
"15/10/2009","2009-10-15"
"THÁNG 8 21 2016","2016-08-21"
"19 tháng 12, 2002","2002-12-19"
"05, thg 12 2010","2010-12-05"
"11.08.00","2000-08-11"
"21, THG 6 2001","2001-06-21"
"tháng 3 22 2000","2000-03-22"
"6 THÁNG 8, 2008","2008-08-06"
"22 THG 8, 1998","1998-08-22"
"23 THG 12, 2005","2005-12-23"
"22 03 14","2014-03-22"
"07.02.93","1993-02-07"
"29/12/2002","2002-12-29"
"7 thg 10, 2011","2011-10-07"
"Thứ Năm, ngày 10 tháng 6 năm 1999","1999-06-10"
"ngày 15 tháng 04 năm 1983","1983-04-15"
"9 thg 5, 2001","2001-05-09"
"THÁNG 5 1 1983","1983-05-01"
"29 tháng 2 1980","1980-02-29"
"24.01.82","1982-01-24"
"16 04 04","2004-04-16"
"NGÀY 02 THÁNG 09 NĂM 1977","1977-09-02"
"10 THG 10 1999","1999-10-10"
"26, THG 2 1994","1994-02-26"
"27 thg 6, 2014","2014-06-27"
"28/05/2009","2009-05-28"
"NGÀY 26 THÁNG 03 NĂM 1974","1974-03-26"
"THÁNG 3 8 1994","1994-03-08"
"22 thg 12, 2014","2014-12-22"
"28 thg 11, 1986","1986-11-28"
"3 04 08","2008-04-03"
"tháng 7 2 1975","1975-07-02"
"04.11.88","1988-11-04"
"25 thg 8 2001","2001-08-25"
"20.11.98","1998-11-20"
"15/06/1980","1980-06-15"
"16 thg 4, 1984","1984-04-16"
"9 11 12","2012-11-09"
"tháng 10 14 1982","1982-10-14"
"23 thg 12 2000","2000-12-23"
"19/10/1995","1995-10-19"
"tháng 12 25 2008","2008-12-25"
"20 THÁNG 2, 1976","1976-02-20"
"14 tháng 12 2014","2014-12-14"
"16, thg 5 2005","2005-05-16"
"NGÀY 20 THÁNG 07 NĂM 1974","1974-07-20"
"27 tháng 10 1995","1995-10-27"
"12 thg 7 2009","2009-07-12"
"19 thg 4, 1984","1984-04-19"
"20/08/2017","2017-08-20"
"THÁNG 11 30, 1973","1973-11-30"
"11.11.94","1994-11-11"
"4 THG 1, 1994","1994-01-04"
"tháng 4 15, 1990","1990-04-15"
"09/07/1981","1981-07-09"
"2 THG 10 1993","1993-10-02"
"14 06 75","1975-06-14"
"23 04 90","1990-04-23"
"THÁNG 4 11 2017","2017-04-11"
"18 thg 8 2005","2005-08-18"
"THỨ NĂM, NGÀY 02 THÁNG 5 NĂM 1991","1991-05-02"
"THÁNG 3 4, 2016","2016-03-04"
"22 06 16","2016-06-22"
"12.10.89","1989-10-12"
"06/06/2000","2000-06-06"
"16/01/2009","2009-01-16"
"THÁNG 10 21, 1997","1997-10-21"
"28 thg 12 1989","1989-12-28"
"8 thg 11, 1972","1972-11-08"
"15 THG 10 1980","1980-10-15"
"tháng 8 20 1976","1976-08-20"
"03 thg 10 2006","2006-10-03"
"30 thg 11 2014","2014-11-30"
"5 thg 5 1984","1984-05-05"
"Ngày 16 tháng 08 năm 2018","2018-08-16"
"24.07.16","2016-07-24"
"29.03.73","1973-03-29"
"3 tháng 10 1975","1975-10-03"
"1 07 75","1975-07-01"
"21 tháng 6 2003","2003-06-21"
"THÁNG 3 13 2001","2001-03-13"
"23 tháng 2 2012","2012-02-23"
"26 tháng 4, 2007","2007-04-26"
"11, thg 6 1977","1977-06-11"
"16 tháng 11 2005","2005-11-16"
"27/07/1990","1990-07-27"
"8 tháng 11 2011","2011-11-08"
"18 tháng 2 1985","1985-02-18"
"28 THG 12, 2012","2012-12-28"
"9 thg 5, 1977","1977-05-09"
"26 01 72","1972-01-26"
"Thứ Sáu, ngày 16 tháng 7 năm 1982","1982-07-16"
"tháng 10 23 1980","1980-10-23"
"30 thg 3 1998","1998-03-30"
"tháng 6 20, 2001","2001-06-20"
"thứ năm, ngày 30 tháng 12 năm 1993","1993-12-30"
"18 thg 1 1995","1995-01-18"
"4 tháng 2 2005","2005-02-04"
"03 thg 6 2014","2014-06-03"
"18 tháng 9, 2014","2014-09-18"
"22 thg 9, 2004","2004-09-22"
"tháng 12 11 1993","1993-12-11"
"1 thg 1 1978","1978-01-01"
"17.09.79","1979-09-17"
"12 tháng 11 1976","1976-11-12"
"2 thg 12, 1971","1971-12-02"
"tháng 9 7 1995","1995-09-07"
"tháng 8 4, 1973","1973-08-04"
"27 thg 1, 2007","2007-01-27"
"25 thg 2 1976","1976-02-25"
"02 thg 11 1988","1988-11-02"
"29 thg 1, 1974","1974-01-29"
"22 tháng 2, 2006","2006-02-22"
"13 THÁNG 5 2013","2013-05-13"
"18.04.89","1989-04-18"
"28 thg 12, 1998","1998-12-28"
"03, thg 2 2002","2002-02-03"
"22 thg 2 1977","1977-02-22"
"05, thg 11 1990","1990-11-05"
"22 THG 10 2008","2008-10-22"
"22 tháng 1, 1993","1993-01-22"
"thứ ba, ngày 23 tháng 10 năm 2001","2001-10-23"
"3 thg 5, 1984","1984-05-03"
"17 THG 8 1988","1988-08-17"
"13 THG 5, 2010","2010-05-13"
"03 thg 4 2016","2016-04-03"
"15/01/2003","2003-01-15"
"24 tháng 12 1989","1989-12-24"
"3 tháng 5 1978","1978-05-03"
"9 thg 11, 2009","2009-11-09"
"06 thg 1 2010","2010-01-06"
"NGÀY 27 THÁNG 04 NĂM 2000","2000-04-27"
"12, thg 10 2004","2004-10-12"
"25 thg 11 1982","1982-11-25"
"thứ hai, ngày 09 tháng 2 năm 1976","1976-02-09"
"9 02 13","2013-02-09"
"20.12.16","2016-12-20"
"19, thg 2 1981","1981-02-19"
"23 tháng 6, 1986","1986-06-23"
"18 tháng 10, 2001","2001-10-18"
"tháng 4 18, 1991","1991-04-18"
"31.03.88","1988-03-31"
"ngày 17 tháng 05 năm 2016","2016-05-17"
"10 thg 12 1998","1998-12-10"
"04, thg 5 1982","1982-05-04"
"10, thg 4 2013","2013-04-10"
"30 thg 11, 2013","2013-11-30"
"14 tháng 3 1993","1993-03-14"
"4 tháng 7 2016","2016-07-04"
"NGÀY 19 THÁNG 05 NĂM 2004","2004-05-19"
"17 tháng 12, 1986","1986-12-17"
"Thứ Ba, ngày 12 tháng 1 năm 1971","1971-01-12"
"27 THÁNG 5 1976","1976-05-27"
"12 tháng 4 1998","1998-04-12"
"NGÀY 12 THÁNG 09 NĂM 1995","1995-09-12"
"9 thg 12 1974","1974-12-09"
"21/09/2010","2010-09-21"
"05/03/2015","2015-03-05"
"9 thg 4, 2015","2015-04-09"
"14 tháng 7 1983","1983-07-14"
"THỨ BẢY, NGÀY 08 THÁNG 1 NĂM 1972","1972-01-08"
"tháng 7 14 1973","1973-07-14"
"21 04 08","2008-04-21"
"tháng 8 31 1990","1990-08-31"
"25 tháng 12, 1997","1997-12-25"
"12, thg 8 2008","2008-08-12"
"24 tháng 10 1983","1983-10-24"
"tháng 8 29, 1976","1976-08-29"
"13, THG 8 2017","2017-08-13"
"tháng 2 6, 2006","2006-02-06"
"18/05/1984","1984-05-18"
"27 tháng 8 2017","2017-08-27"
"16 thg 10 1986","1986-10-16"
"25 09 86","1986-09-25"
"Thứ Năm, ngày 05 tháng 3 năm 2015","2015-03-05"
"tháng 2 19 2002","2002-02-19"
"Thứ Bảy, ngày 14 tháng 3 năm 1970","1970-03-14"
"26 thg 10 1988","1988-10-26"
"04, THG 3 1980","1980-03-04"
"THÁNG 11 5, 2001","2001-11-05"
"1 THÁNG 7 2006","2006-07-01"
"02.01.02","2002-01-02"
"16 thg 3, 1987","1987-03-16"
"28 tháng 4 2005","2005-04-28"
"5 thg 6, 1985","1985-06-05"
"22 THÁNG 7, 2000","2000-07-22"
"26 thg 10 2017","2017-10-26"
"tháng 10 12, 2005","2005-10-12"
"14/01/2003","2003-01-14"
"15.09.12","2012-09-15"
"tháng 5 5, 1980","1980-05-05"
"26 tháng 4, 1983","1983-04-26"
"19/09/2009","2009-09-19"
"19 THÁNG 3 1986","1986-03-19"
"Thứ Bảy, ngày 25 tháng 3 năm 1989","1989-03-25"
"tháng 12 30, 2018","2018-12-30"
"8 THG 4 2009","2009-04-08"
"tháng 5 12, 2013","2013-05-12"
"THỨ TƯ, NGÀY 15 THÁNG 11 NĂM 1995","1995-11-15"
"1 tháng 9, 1995","1995-09-01"
"19 THG 11, 1979","1979-11-19"
"15 tháng 1, 1976","1976-01-15"
"5 thg 7, 2018","2018-07-05"
"26 tháng 2 1976","1976-02-26"
"01/02/2015","2015-02-01"
"14 thg 7, 1994","1994-07-14"
"tháng 3 29, 1987","1987-03-29"
"THÁNG 5 24 1978","1978-05-24"
"09, THG 4 2011","2011-04-09"
"30 thg 4, 1983","1983-04-30"
"tháng 8 29 1985","1985-08-29"
"17/05/2008","2008-05-17"
"14 thg 1 1991","1991-01-14"
"3 THÁNG 2 1996","1996-02-03"
"08.05.98","1998-05-08"
"2 04 93","1993-04-02"
"29 THG 1, 1985","1985-01-29"
"20 THG 2, 2004","2004-02-20"
"4 thg 3, 2011","2011-03-04"
"7 04 11","2011-04-07"
"tháng 2 7 2002","2002-02-07"
"17/04/1983","1983-04-17"
"16.11.14","2014-11-16"
"tháng 10 22, 1987","1987-10-22"
"18 THG 12 1995","1995-12-18"
"12/05/2003","2003-05-12"
"Thứ Bảy, ngày 02 tháng 2 năm 1985","1985-02-02"
"11 06 94","1994-06-11"
"10 thg 1 1985","1985-01-10"
"23 THG 12 2013","2013-12-23"
"27 tháng 11 1970","1970-11-27"
"Chủ Nhật, ngày 27 tháng 5 năm 2001","2001-05-27"
"18 thg 7 2006","2006-07-18"
"11/11/2007","2007-11-11"
"Ngày 25 tháng 09 năm 1989","1989-09-25"
"07/02/2003","2003-02-07"
"tháng 12 6 2004","2004-12-06"
"05 thg 5 1986","1986-05-05"
"30 tháng 9 2002","2002-09-30"
"18 thg 2, 1990","1990-02-18"
"5 tháng 4 2011","2011-04-05"
"12 08 86","1986-08-12"
"tháng 6 16 1989","1989-06-16"
"04.10.72","1972-10-04"
"30, thg 6 1980","1980-06-30"
"30 thg 11, 1972","1972-11-30"
"21 thg 7 1992","1992-07-21"
"tháng 1 16, 2011","2011-01-16"
"27 07 98","1998-07-27"
"7 thg 2 1981","1981-02-07"
"13 thg 10 1970","1970-10-13"
"31.07.74","1974-07-31"
"Ngày 18 tháng 03 năm 2016","2016-03-18"
"24 thg 12, 1992","1992-12-24"
"15, THG 2 1987","1987-02-15"
"27 tháng 8 1978","1978-08-27"
"tháng 3 8 1994","1994-03-08"
"2 thg 7 1980","1980-07-02"
"22 tháng 1 1993","1993-01-22"
"03/07/1986","1986-07-03"
"THỨ HAI, NGÀY 07 THÁNG 9 NĂM 1981","1981-09-07"
"02/09/1983","1983-09-02"
"8 thg 12, 2006","2006-12-08"
"tháng 3 27 1993","1993-03-27"
"08, thg 1 2004","2004-01-08"
"12 thg 5 1980","1980-05-12"
"1 thg 2, 1997","1997-02-01"
"9 12 11","2011-12-09"
"19 tháng 12, 2005","2005-12-19"
"thứ bảy, ngày 05 tháng 8 năm 2006","2006-08-05"
"17 tháng 1, 1988","1988-01-17"
"08/04/2004","2004-04-08"
"15 THÁNG 5 1981","1981-05-15"
"4 THG 12, 1981","1981-12-04"
"ngày 31 tháng 03 năm 1985","1985-03-31"
"24 thg 11, 1993","1993-11-24"
"ngày 27 tháng 01 năm 2010","2010-01-27"
"thứ hai, ngày 05 tháng 10 năm 1970","1970-10-05"
"NGÀY 09 THÁNG 02 NĂM 1987","1987-02-09"
"03/06/1980","1980-06-03"
"tháng 1 30 1984","1984-01-30"
"Thứ Tư, ngày 17 tháng 1 năm 2018","2018-01-17"
"6 THG 9, 2016","2016-09-06"
"31 03 92","1992-03-31"
"10 thg 1, 2016","2016-01-10"
"Ngày 22 tháng 04 năm 2011","2011-04-22"
"25 tháng 10 1997","1997-10-25"
"29 thg 4 2008","2008-04-29"
"19 tháng 10 2014","2014-10-19"
"31 THG 3 2010","2010-03-31"
"27 THG 3, 1971","1971-03-27"
"26, thg 8 1978","1978-08-26"
"20 11 85","1985-11-20"
"21.11.08","2008-11-21"
"THÁNG 11 2, 1988","1988-11-02"
"6 thg 3 1986","1986-03-06"
"6 thg 8 2005","2005-08-06"
"6 thg 10, 1989","1989-10-06"
"12, thg 10 1983","1983-10-12"
"tháng 10 10 2013","2013-10-10"
"tháng 3 26, 1993","1993-03-26"
"4 THÁNG 6 1976","1976-06-04"
"2 THÁNG 11 2007","2007-11-02"
"thứ sáu, ngày 14 tháng 2 năm 1997","1997-02-14"
"NGÀY 11 THÁNG 10 NĂM 2003","2003-10-11"
"20 thg 7 2011","2011-07-20"
"THÁNG 4 9, 2014","2014-04-09"
"22 03 10","2010-03-22"
"02.08.78","1978-08-02"
"NGÀY 23 THÁNG 10 NĂM 1984","1984-10-23"
"13 tháng 7, 1974","1974-07-13"
"03/06/2011","2011-06-03"
"21 thg 8 1974","1974-08-21"
"02 thg 1 1997","1997-01-02"
"3 tháng 10, 2015","2015-10-03"
"27 tháng 10, 1980","1980-10-27"
"25.11.16","2016-11-25"
"tháng 6 9 1985","1985-06-09"
"25, THG 3 1981","1981-03-25"
"08 thg 5 2011","2011-05-08"
"17 THÁNG 10 1983","1983-10-17"
"23 tháng 12 1976","1976-12-23"
"10 thg 5 1980","1980-05-10"
"tháng 10 8 2017","2017-10-08"
"19, thg 10 1994","1994-10-19"
"08, thg 5 1982","1982-05-08"
"NGÀY 11 THÁNG 07 NĂM 1989","1989-07-11"
"20, thg 4 1991","1991-04-20"
"7 tháng 2 1983","1983-02-07"
"3 tháng 11 1987","1987-11-03"
"19, thg 6 1991","1991-06-19"
"THỨ NĂM, NGÀY 26 THÁNG 8 NĂM 2004","2004-08-26"
"Thứ Hai, ngày 24 tháng 5 năm 1999","1999-05-24"
"30 04 12","2012-04-30"
"13 thg 2 1982","1982-02-13"
"10 THG 1 1992","1992-01-10"
"15/02/1981","1981-02-15"
"Ngày 28 tháng 01 năm 2008","2008-01-28"
"30 tháng 9, 1998","1998-09-30"
"8 09 74","1974-09-08"
"17, thg 12 1997","1997-12-17"
"12 tháng 3, 2010","2010-03-12"
"Ngày 09 tháng 02 năm 1973","1973-02-09"
"13 tháng 3, 2009","2009-03-13"
"4 THG 6, 1974","1974-06-04"
"tháng 12 2, 2013","2013-12-02"
"ngày 09 tháng 11 năm 2001","2001-11-09"
"24 tháng 7 1995","1995-07-24"
"tháng 10 28 2000","2000-10-28"
"THỨ TƯ, NGÀY 24 THÁNG 7 NĂM 1996","1996-07-24"
"27 thg 10 1981","1981-10-27"
"18 tháng 11 2004","2004-11-18"
"THÁNG 8 31 1972","1972-08-31"
"29 thg 11, 2011","2011-11-29"
"Thứ Tư, ngày 06 tháng 3 năm 2013","2013-03-06"
"17 10 89","1989-10-17"
"tháng 8 3, 1999","1999-08-03"
"19 tháng 12 1972","1972-12-19"
"Thứ Hai, ngày 19 tháng 10 năm 1970","1970-10-19"
"19/06/1979","1979-06-19"
"Thứ Hai, ngày 01 tháng 11 năm 1999","1999-11-01"
"Thứ Bảy, ngày 14 tháng 12 năm 1991","1991-12-14"
"tháng 3 11, 2003","2003-03-11"
"Chủ Nhật, ngày 20 tháng 12 năm 1981","1981-12-20"
"31/12/2009","2009-12-31"
"2 02 89","1989-02-02"
"tháng 2 7, 1998","1998-02-07"
"15 tháng 10 1992","1992-10-15"
"28/09/1998","1998-09-28"
"4 thg 10, 1995","1995-10-04"
"26 thg 1, 2003","2003-01-26"
"2 tháng 5 1977","1977-05-02"
"3 tháng 5 1981","1981-05-03"
"THỨ SÁU, NGÀY 14 THÁNG 9 NĂM 2007","2007-09-14"
"18, thg 6 1996","1996-06-18"
"19.02.84","1984-02-19"
"6 thg 2, 2005","2005-02-06"
"Thứ Sáu, ngày 27 tháng 8 năm 2010","2010-08-27"
"Thứ Tư, ngày 26 tháng 5 năm 1982","1982-05-26"
"Ngày 07 tháng 04 năm 1971","1971-04-07"
"9 THG 4 1981","1981-04-09"
"21, THG 3 2005","2005-03-21"
"28 thg 3, 1982","1982-03-28"
"17, thg 1 2016","2016-01-17"
"12.06.71","1971-06-12"
"7 THÁNG 4 1988","1988-04-07"
"2 04 82","1982-04-02"
"tháng 11 28, 1972","1972-11-28"
"14 THG 4 2017","2017-04-14"
"30 thg 3, 1987","1987-03-30"
"Ngày 07 tháng 01 năm 1999","1999-01-07"
"6 03 73","1973-03-06"
"14 thg 12 1993","1993-12-14"
"15 tháng 6 2015","2015-06-15"
"26 01 12","2012-01-26"
"14 thg 4, 2014","2014-04-14"
"27.08.86","1986-08-27"
"24 thg 12, 1983","1983-12-24"
"16 tháng 5, 1984","1984-05-16"
"tháng 11 19, 1991","1991-11-19"
"THÁNG 6 3 1983","1983-06-03"
"Ngày 12 tháng 02 năm 1972","1972-02-12"
"Thứ Hai, ngày 28 tháng 4 năm 2008","2008-04-28"
"16.04.03","2003-04-16"
"9 THÁNG 9 1992","1992-09-09"
"10 thg 5 2000","2000-05-10"
"5 tháng 11 1985","1985-11-05"
"tháng 7 2 1992","1992-07-02"
"21 10 76","1976-10-21"
"27 tháng 10, 2011","2011-10-27"
"20 THG 11 1987","1987-11-20"
"11 07 11","2011-07-11"
"ngày 24 tháng 12 năm 1997","1997-12-24"
"Thứ Bảy, ngày 16 tháng 6 năm 2001","2001-06-16"
"12, THG 2 1979","1979-02-12"
"5 THG 8, 1999","1999-08-05"
"24 thg 3, 1990","1990-03-24"
"31 10 92","1992-10-31"
"12 10 18","2018-10-12"
"24 tháng 2 1974","1974-02-24"
"11 thg 9 1988","1988-09-11"
"09, thg 6 1974","1974-06-09"
"THÁNG 3 14, 2016","2016-03-14"
"THỨ NĂM, NGÀY 28 THÁNG 12 NĂM 1978","1978-12-28"
"10 06 81","1981-06-10"
"09/05/1974","1974-05-09"
"19 thg 3 1989","1989-03-19"
"Thứ Hai, ngày 19 tháng 1 năm 2015","2015-01-19"
"THỨ TƯ, NGÀY 11 THÁNG 10 NĂM 1995","1995-10-11"
"25 01 86","1986-01-25"
"15 thg 5 1998","1998-05-15"
"NGÀY 08 THÁNG 03 NĂM 1998","1998-03-08"
"10 tháng 2 2014","2014-02-10"
"Ngày 18 tháng 08 năm 1977","1977-08-18"
"9 thg 4, 2004","2004-04-09"
"1 thg 2, 2014","2014-02-01"
"4 thg 8, 2013","2013-08-04"
"tháng 6 18 2014","2014-06-18"
"Ngày 18 tháng 05 năm 2002","2002-05-18"
"tháng 7 19 1985","1985-07-19"
"thứ hai, ngày 07 tháng 1 năm 1974","1974-01-07"
"tháng 7 24 2008","2008-07-24"
"thứ năm, ngày 14 tháng 11 năm 1991","1991-11-14"
"17 thg 7 2002","2002-07-17"
"3 tháng 1 1973","1973-01-03"
"CHỦ NHẬT, NGÀY 08 THÁNG 7 NĂM 1984","1984-07-08"
"THỨ BA, NGÀY 07 THÁNG 4 NĂM 2015","2015-04-07"
"tháng 5 21 1981","1981-05-21"
"8 12 95","1995-12-08"
"20 tháng 4 2002","2002-04-20"
"1 thg 11, 2016","2016-11-01"
"tháng 8 3, 2008","2008-08-03"
"THÁNG 4 9, 1995","1995-04-09"
"30 thg 10 1996","1996-10-30"
"10 THG 10 1987","1987-10-10"
"8 tháng 5 1988","1988-05-08"
"04/11/1977","1977-11-04"
"10 thg 10, 1979","1979-10-10"
"thứ bảy, ngày 28 tháng 8 năm 2010","2010-08-28"
"Thứ Năm, ngày 31 tháng 10 năm 1996","1996-10-31"
"11.02.13","2013-02-11"
"10 THG 8 1999","1999-08-10"
"2 tháng 5, 1989","1989-05-02"
"16 tháng 4, 2003","2003-04-16"
"13.06.95","1995-06-13"
"25 thg 5 1977","1977-05-25"
"11 THÁNG 11, 1995","1995-11-11"
"03 thg 8 1989","1989-08-03"
"07, thg 6 2007","2007-06-07"
"31 tháng 12 1991","1991-12-31"
"22 12 73","1973-12-22"
"13 tháng 5 2002","2002-05-13"
"Ngày 26 tháng 08 năm 1997","1997-08-26"
"tháng 7 29 1996","1996-07-29"
"11 tháng 7 1994","1994-07-11"
"THÁNG 4 5, 1978","1978-04-05"
"04, thg 1 1998","1998-01-04"
"19 THÁNG 7 1978","1978-07-19"
"11 thg 7, 1993","1993-07-11"
"15 tháng 11 1994","1994-11-15"
"20/03/1972","1972-03-20"
"20 thg 1, 2004","2004-01-20"
"tháng 12 24, 2006","2006-12-24"
"12 tháng 5, 2007","2007-05-12"
"18, thg 4 2011","2011-04-18"
"29 tháng 11, 2018","2018-11-29"
"22, thg 3 1992","1992-03-22"
"05.07.03","2003-07-05"
"24, thg 3 1976","1976-03-24"
"7 thg 7, 1994","1994-07-07"
"3 09 17","2017-09-03"
"Chủ Nhật, ngày 03 tháng 7 năm 1988","1988-07-03"
"28 thg 9 2002","2002-09-28"
"19, thg 5 1998","1998-05-19"
"22 thg 6, 2008","2008-06-22"
"15 thg 1 1993","1993-01-15"
"29 tháng 6 2010","2010-06-29"
"7 THG 7, 1986","1986-07-07"
"30 thg 1 1987","1987-01-30"
"02 thg 10 1970","1970-10-02"
"10.05.84","1984-05-10"
"THÁNG 10 23, 1973","1973-10-23"
"tháng 10 12, 1997","1997-10-12"
"03.07.84","1984-07-03"
"11/02/1971","1971-02-11"
"11 tháng 6 1986","1986-06-11"
"Ngày 31 tháng 05 năm 2002","2002-05-31"
"tháng 7 29, 1997","1997-07-29"
"29.12.90","1990-12-29"
"26 thg 8, 1996","1996-08-26"
"11/08/2014","2014-08-11"
"Thứ Hai, ngày 08 tháng 3 năm 1993","1993-03-08"
"1 tháng 4 1970","1970-04-01"
"31 thg 10 1987","1987-10-31"
"26 THG 6 2007","2007-06-26"
"8 thg 4 2005","2005-04-08"
"20 thg 5 1973","1973-05-20"
"7 tháng 5 1985","1985-05-07"
"6 tháng 10 2006","2006-10-06"
"2 03 05","2005-03-02"
"tháng 1 13, 1988","1988-01-13"
"11 THG 9 2013","2013-09-11"
"THÁNG 8 9, 1994","1994-08-09"
"13 tháng 7 2002","2002-07-13"
"15 tháng 11, 2011","2011-11-15"
"THÁNG 5 6 1973","1973-05-06"
"09, thg 11 1979","1979-11-09"
"Ngày 26 tháng 06 năm 2002","2002-06-26"
"ngày 20 tháng 07 năm 2017","2017-07-20"
"15, thg 6 2010","2010-06-15"
"16 thg 10, 2011","2011-10-16"
"thứ bảy, ngày 11 tháng 4 năm 1970","1970-04-11"
"THÁNG 9 14, 1978","1978-09-14"
"24/06/1992","1992-06-24"
"THÁNG 12 6, 2011","2011-12-06"
"10/07/1986","1986-07-10"
"20 THG 3, 2005","2005-03-20"
"28.11.16","2016-11-28"
"12 thg 7, 1991","1991-07-12"
"20 thg 2 1984","1984-02-20"
"06.03.76","1976-03-06"
"7 tháng 1 1999","1999-01-07"
"8 thg 4, 1985","1985-04-08"
"21 tháng 7 1985","1985-07-21"
"9 THG 12 2008","2008-12-09"
"09 thg 2 1986","1986-02-09"
"tháng 2 2 1991","1991-02-02"
"03 thg 10 2016","2016-10-03"
"16 thg 6, 1980","1980-06-16"
"Ngày 19 tháng 08 năm 2006","2006-08-19"
"18 tháng 7 2009","2009-07-18"
"10 THG 8, 1977","1977-08-10"
"ngày 15 tháng 09 năm 1975","1975-09-15"
"30 09 82","1982-09-30"
"17, thg 12 1995","1995-12-17"
"27 THÁNG 8, 1982","1982-08-27"
"ngày 01 tháng 12 năm 1983","1983-12-01"
"18 thg 12, 1995","1995-12-18"
"Thứ Tư, ngày 06 tháng 12 năm 2017","2017-12-06"
"07 thg 9 2000","2000-09-07"
"14 thg 4, 1988","1988-04-14"
"23 tháng 9, 2001","2001-09-23"
"28/03/2018","2018-03-28"
"1 thg 5, 1996","1996-05-01"
"Ngày 22 tháng 03 năm 1993","1993-03-22"
"THÁNG 1 23, 1987","1987-01-23"
"8 thg 1 1972","1972-01-08"
"15 tháng 3 1985","1985-03-15"
"12 thg 2, 2010","2010-02-12"
"26 11 89","1989-11-26"
"tháng 2 14, 1986","1986-02-14"
"tháng 3 16, 1974","1974-03-16"
"THỨ BẢY, NGÀY 06 THÁNG 6 NĂM 1998","1998-06-06"
"1 tháng 12 2001","2001-12-01"
"tháng 8 17, 1988","1988-08-17"
"12 thg 1 1991","1991-01-12"
"8 thg 8 1992","1992-08-08"
"Ngày 03 tháng 07 năm 2016","2016-07-03"
"15 THG 5, 2008","2008-05-15"
"26 thg 6, 1975","1975-06-26"
"12 THG 3 2004","2004-03-12"
"tháng 4 29 1990","1990-04-29"
"4 tháng 3 2018","2018-03-04"
"7 thg 2 1988","1988-02-07"
"5 thg 7 2008","2008-07-05"
"THÁNG 10 16 2004","2004-10-16"
"13.07.90","1990-07-13"
"27.07.91","1991-07-27"
"11 tháng 2 2010","2010-02-11"
"05 THG 9 2018","2018-09-05"
"26.07.71","1971-07-26"
"Ngày 14 tháng 03 năm 2000","2000-03-14"
"23.06.13","2013-06-23"
"26 THÁNG 3 2017","2017-03-26"
"Ngày 01 tháng 02 năm 2017","2017-02-01"
"23.10.79","1979-10-23"
"Ngày 15 tháng 03 năm 1989","1989-03-15"
"Ngày 30 tháng 04 năm 1981","1981-04-30"
"26 tháng 7, 2015","2015-07-26"
"09.01.91","1991-01-09"
"31.05.82","1982-05-31"
"17 01 92","1992-01-17"
"11 thg 5, 2000","2000-05-11"
"ngày 17 tháng 03 năm 1989","1989-03-17"
"4 thg 10, 2012","2012-10-04"
"thứ tư, ngày 02 tháng 4 năm 1975","1975-04-02"
"28 thg 7 1991","1991-07-28"
"10 03 17","2017-03-10"
"20 tháng 7, 1996","1996-07-20"
"Thứ Bảy, ngày 07 tháng 11 năm 1998","1998-11-07"
"09 THG 3 1991","1991-03-09"
"Thứ Bảy, ngày 07 tháng 4 năm 1979","1979-04-07"
"14 thg 10, 1980","1980-10-14"
"10 tháng 3 2014","2014-03-10"
"4 thg 4 1984","1984-04-04"
"4 tháng 8 2003","2003-08-04"
"2 tháng 5 1972","1972-05-02"
"tháng 2 14 1994","1994-02-14"
"9 tháng 12 2010","2010-12-09"
"8 tháng 12 1981","1981-12-08"
"7 tháng 8 1972","1972-08-07"
"17 THÁNG 12 1992","1992-12-17"
"tháng 3 28 2008","2008-03-28"
"Thứ Ba, ngày 18 tháng 5 năm 1976","1976-05-18"
"THÁNG 3 12, 1975","1975-03-12"
"05, thg 7 2013","2013-07-05"
"THÁNG 11 15, 2000","2000-11-15"
"11 tháng 10 2002","2002-10-11"
"4 thg 2, 2004","2004-02-04"
"16.09.72","1972-09-16"
"05, thg 1 1972","1972-01-05"
"28 08 72","1972-08-28"
"23 THG 9 2016","2016-09-23"
"22, thg 10 2007","2007-10-22"
"27 thg 12 1973","1973-12-27"
"Chủ Nhật, ngày 22 tháng 7 năm 1979","1979-07-22"
"tháng 7 23, 1993","1993-07-23"
"2 04 85","1985-04-02"
"08, thg 11 2001","2001-11-08"
"THỨ HAI, NGÀY 28 THÁNG 3 NĂM 1988","1988-03-28"
"28/04/1980","1980-04-28"
"Ngày 06 tháng 11 năm 1984","1984-11-06"
"16.10.13","2013-10-16"
"THÁNG 12 28 2002","2002-12-28"
"4 tháng 9, 2015","2015-09-04"
"10 tháng 4, 1974","1974-04-10"
"THÁNG 6 3, 1989","1989-06-03"
"15 tháng 12 2007","2007-12-15"
"25 tháng 8 1971","1971-08-25"
"5 tháng 3, 2002","2002-03-05"
"17, THG 9 2003","2003-09-17"
"18 12 97","1997-12-18"
"15/12/1984","1984-12-15"
"12 tháng 10 2009","2009-10-12"
"Thứ Hai, ngày 17 tháng 4 năm 1989","1989-04-17"
"THÁNG 8 9 1995","1995-08-09"
"ngày 25 tháng 08 năm 1985","1985-08-25"
"21 THG 9, 1993","1993-09-21"
"23 thg 10, 2016","2016-10-23"
"8 09 04","2004-09-08"
"THÁNG 1 3 1972","1972-01-03"
"Chủ Nhật, ngày 10 tháng 12 năm 2006","2006-12-10"
"16 tháng 4 1991","1991-04-16"
"13 05 73","1973-05-13"
"05, thg 3 1997","1997-03-05"
"22 thg 6 1998","1998-06-22"
"7 THÁNG 11 1999","1999-11-07"
"tháng 2 28, 1991","1991-02-28"
"6 04 03","2003-04-06"
"16/06/2003","2003-06-16"
"Ngày 27 tháng 06 năm 1973","1973-06-27"
"17 thg 6, 2018","2018-06-17"
"tháng 11 15, 2016","2016-11-15"
"31 tháng 3 2006","2006-03-31"
"Ngày 30 tháng 05 năm 1974","1974-05-30"
"27, thg 8 2005","2005-08-27"
"24 thg 12, 1978","1978-12-24"
"27 thg 10 2001","2001-10-27"
"THÁNG 9 24 2003","2003-09-24"
"8 tháng 10, 1999","1999-10-08"
"08.12.77","1977-12-08"
"23 thg 11, 1990","1990-11-23"
"19 thg 6, 1988","1988-06-19"
"10/06/2007","2007-06-10"
"4 thg 7 2003","2003-07-04"
"20 thg 12, 1975","1975-12-20"
"5 thg 4, 1992","1992-04-05"
"NGÀY 19 THÁNG 06 NĂM 1995","1995-06-19"
"24, thg 10 2007","2007-10-24"
"17 thg 7, 2015","2015-07-17"
"10 THG 9, 2014","2014-09-10"
"11 tháng 11 1985","1985-11-11"
"20/02/2005","2005-02-20"
"19 tháng 7, 1979","1979-07-19"
"18 tháng 8, 1975","1975-08-18"
"20 tháng 2 1977","1977-02-20"
"22 tháng 2, 1981","1981-02-22"
"17 tháng 7, 2005","2005-07-17"
"6 thg 5, 1989","1989-05-06"
"tháng 11 29, 1986","1986-11-29"
"tháng 5 4 1989","1989-05-04"
"26 THÁNG 8, 2005","2005-08-26"
"26 tháng 10, 1989","1989-10-26"
"Ngày 24 tháng 12 năm 2009","2009-12-24"
"2 THG 3 2015","2015-03-02"
"25 tháng 8, 1988","1988-08-25"
"tháng 2 8, 1994","1994-02-08"
"18.07.78","1978-07-18"
"10, THG 3 1977","1977-03-10"
"13.02.88","1988-02-13"
"15 thg 2 1999","1999-02-15"
"25, thg 3 2001","2001-03-25"
"14 thg 4, 2014","2014-04-14"
"28, thg 2 1998","1998-02-28"
"26 thg 7, 2013","2013-07-26"
"14/01/1991","1991-01-14"
"10 thg 8, 1985","1985-08-10"
"19 tháng 10 2012","2012-10-19"
"07.07.78","1978-07-07"
"04.01.73","1973-01-04"
"27 thg 5, 2009","2009-05-27"
"Ngày 21 tháng 06 năm 2008","2008-06-21"
"ngày 07 tháng 09 năm 1971","1971-09-07"
"2 12 18","2018-12-02"
"1 tháng 3 2001","2001-03-01"
"21 thg 5 2011","2011-05-21"
"Ngày 05 tháng 06 năm 2003","2003-06-05"
"NGÀY 21 THÁNG 08 NĂM 1977","1977-08-21"
"10 tháng 1 1997","1997-01-10"
"20 tháng 7 1989","1989-07-20"
"13 tháng 9 1983","1983-09-13"
"12 01 82","1982-01-12"
"12 THÁNG 8 2017","2017-08-12"
"25 thg 10 1972","1972-10-25"
"28/02/2017","2017-02-28"
"THỨ BẢY, NGÀY 12 THÁNG 9 NĂM 2009","2009-09-12"
"tháng 9 2 2014","2014-09-02"
"30 tháng 11, 2007","2007-11-30"
"7 12 09","2009-12-07"
"10 thg 3, 2003","2003-03-10"
"Ngày 07 tháng 05 năm 1983","1983-05-07"
"Chủ Nhật, ngày 16 tháng 8 năm 2009","2009-08-16"
"10/06/1997","1997-06-10"
"29 thg 9, 1985","1985-09-29"
"7 thg 2, 1987","1987-02-07"
"27 THÁNG 7 1990","1990-07-27"
"15 thg 10, 2004","2004-10-15"
"20 10 94","1994-10-20"
"21, thg 8 2012","2012-08-21"
"Ngày 01 tháng 11 năm 1992","1992-11-01"
"Chủ Nhật, ngày 21 tháng 12 năm 1975","1975-12-21"
"21 tháng 7, 2014","2014-07-21"
"27 tháng 6 2015","2015-06-27"
"05.08.78","1978-08-05"
"29 thg 1 1973","1973-01-29"
"Ngày 06 tháng 07 năm 1996","1996-07-06"
"2 tháng 11 2004","2004-11-02"
"1 thg 9, 2006","2006-09-01"
"05/08/1979","1979-08-05"
"Thứ Ba, ngày 25 tháng 7 năm 1978","1978-07-25"
"tháng 2 19 1980","1980-02-19"
"THỨ BA, NGÀY 07 THÁNG 3 NĂM 1995","1995-03-07"
"22 tháng 7, 1994","1994-07-22"
"22 thg 2, 2007","2007-02-22"
"tháng 6 2 1987","1987-06-02"
"7 thg 1 1977","1977-01-07"
"1 tháng 6 1989","1989-06-01"
"8 tháng 7 2009","2009-07-08"
"Thứ Ba, ngày 11 tháng 1 năm 2000","2000-01-11"
"THÁNG 11 8, 1991","1991-11-08"
"20.05.16","2016-05-20"
"27 thg 11 1990","1990-11-27"
"tháng 10 20, 2001","2001-10-20"
"15 THG 4, 2004","2004-04-15"
"1 tháng 10 2002","2002-10-01"
"Chủ Nhật, ngày 30 tháng 6 năm 1991","1991-06-30"
"26 tháng 9 2006","2006-09-26"
"THÁNG 9 2, 1992","1992-09-02"
"ngày 17 tháng 10 năm 1989","1989-10-17"
"06/12/1980","1980-12-06"
"29 thg 12 2001","2001-12-29"
"20 THÁNG 9, 2017","2017-09-20"
"13 thg 1, 1978","1978-01-13"
"08 thg 3 1978","1978-03-08"
"18 THÁNG 7, 2002","2002-07-18"
"07 thg 7 1995","1995-07-07"
"25 tháng 2, 1999","1999-02-25"
"18 tháng 7 1985","1985-07-18"
"31 thg 1 1997","1997-01-31"
"tháng 5 24, 2000","2000-05-24"
"03.04.88","1988-04-03"
"27 thg 9, 1999","1999-09-27"
"06.01.87","1987-01-06"
"29, thg 6 2011","2011-06-29"
"22 THÁNG 9 2006","2006-09-22"
"16, thg 8 1978","1978-08-16"
"20 tháng 7 1981","1981-07-20"
"30 tháng 7 1993","1993-07-30"
"4 THÁNG 6 1973","1973-06-04"
"25 thg 7 1970","1970-07-25"
"tháng 10 2, 2010","2010-10-02"
"28 tháng 4 2010","2010-04-28"
"28, thg 9 2013","2013-09-28"
"08.02.02","2002-02-08"
"01.01.78","1978-01-01"
"24/03/1972","1972-03-24"
"9 tháng 12, 1997","1997-12-09"
"13 thg 6, 1991","1991-06-13"
"19 06 99","1999-06-19"
"THÁNG 1 28 1978","1978-01-28"
"31 THÁNG 7 2000","2000-07-31"
"25 05 97","1997-05-25"
"4 thg 4, 1983","1983-04-04"
"11, thg 1 1977","1977-01-11"
"tháng 5 22 1985","1985-05-22"
"THÁNG 6 22, 1976","1976-06-22"
"26.07.72","1972-07-26"
"18 09 75","1975-09-18"
"10, thg 4 1986","1986-04-10"
"1 thg 6 1999","1999-06-01"
"16.07.06","2006-07-16"
"17.03.77","1977-03-17"
"tháng 9 4 1998","1998-09-04"
"Thứ Năm, ngày 12 tháng 2 năm 2004","2004-02-12"
"25 tháng 8 2012","2012-08-25"
"12 THÁNG 9 1980","1980-09-12"
"21, thg 11 2013","2013-11-21"
"NGÀY 14 THÁNG 12 NĂM 2005","2005-12-14"
"Ngày 09 tháng 06 năm 1997","1997-06-09"
"11.07.90","1990-07-11"
"10 THG 7 2017","2017-07-10"
"THÁNG 11 20, 2004","2004-11-20"
"21.06.00","2000-06-21"
"27 thg 9, 1999","1999-09-27"
"21 thg 1 2011","2011-01-21"
"11, thg 5 1991","1991-05-11"
"4 tháng 12 1970","1970-12-04"
"19 thg 7, 1998","1998-07-19"
"THỨ SÁU, NGÀY 23 THÁNG 6 NĂM 2000","2000-06-23"
"27, thg 8 2018","2018-08-27"
"CHỦ NHẬT, NGÀY 16 THÁNG 11 NĂM 2014","2014-11-16"
"THÁNG 2 27 2011","2011-02-27"
"31 tháng 3, 2017","2017-03-31"
"Thứ Tư, ngày 19 tháng 4 năm 1978","1978-04-19"
"21/03/2002","2002-03-21"
"29, thg 11 1995","1995-11-29"
"02.04.15","2015-04-02"
"18 thg 7, 1970","1970-07-18"
"tháng 10 25 2009","2009-10-25"
"5 tháng 7 1998","1998-07-05"
"tháng 2 23 2001","2001-02-23"
"23 tháng 3 1980","1980-03-23"
"01.09.07","2007-09-01"
"23 06 97","1997-06-23"
"Ngày 17 tháng 02 năm 1983","1983-02-17"
"5 tháng 5 2004","2004-05-05"
"Chủ Nhật, ngày 12 tháng 12 năm 2004","2004-12-12"
"12 thg 12, 2005","2005-12-12"
"Thứ Tư, ngày 19 tháng 8 năm 1998","1998-08-19"
"03.12.73","1973-12-03"
"26 THÁNG 2 2011","2011-02-26"
"30, thg 5 1994","1994-05-30"
"24/11/1987","1987-11-24"
"tháng 8 4, 1976","1976-08-04"
"26 thg 7, 1989","1989-07-26"
"tháng 11 10 1977","1977-11-10"
"THÁNG 8 19, 2016","2016-08-19"
"04.05.91","1991-05-04"
"Ngày 29 tháng 09 năm 1985","1985-09-29"
"18 thg 1, 1974","1974-01-18"
"23 tháng 1 2004","2004-01-23"
"3 THG 10, 2017","2017-10-03"
"05, thg 10 1971","1971-10-05"
"22.07.15","2015-07-22"
"1 thg 3 2003","2003-03-01"
"13/03/2017","2017-03-13"
"Thứ Hai, ngày 17 tháng 8 năm 2009","2009-08-17"
"17 tháng 5 1973","1973-05-17"
"27 tháng 8 1972","1972-08-27"
"11 05 00","2000-05-11"
"3 thg 4 2013","2013-04-03"
"tháng 4 2, 1982","1982-04-02"
"23 tháng 9, 1980","1980-09-23"
"22 tháng 1 1996","1996-01-22"
"8 thg 7 2010","2010-07-08"
"THÁNG 6 22, 1993","1993-06-22"
"02, thg 3 1993","1993-03-02"
"thứ hai, ngày 08 tháng 9 năm 1975","1975-09-08"
"25.09.84","1984-09-25"
"24 THG 7 1970","1970-07-24"
"16 tháng 10 1994","1994-10-16"
"02/06/1983","1983-06-02"
"25 tháng 4, 1982","1982-04-25"
"20 thg 1 2005","2005-01-20"
"28 tháng 2 2000","2000-02-28"
"21 tháng 4 1985","1985-04-21"
"7 thg 9, 1978","1978-09-07"
"27 thg 9, 1997","1997-09-27"
"NGÀY 25 THÁNG 11 NĂM 2018","2018-11-25"
"THÁNG 10 11, 2012","2012-10-11"
"13/11/2016","2016-11-13"
"18, thg 8 1983","1983-08-18"
"14 thg 3 1995","1995-03-14"
"25/11/1981","1981-11-25"
"28 THG 7, 2013","2013-07-28"
"11 thg 1, 1999","1999-01-11"
"tháng 1 10 1990","1990-01-10"
"16 THG 5, 1982","1982-05-16"
"tháng 4 8 2004","2004-04-08"
"17 10 97","1997-10-17"
"24/02/2016","2016-02-24"
"23 thg 11 2001","2001-11-23"
"12 THG 3, 2009","2009-03-12"
"17 thg 7, 2001","2001-07-17"
"tháng 10 12, 1981","1981-10-12"
"17 tháng 3, 1978","1978-03-17"
"04/02/1998","1998-02-04"
"tháng 11 17, 2005","2005-11-17"
"11/09/2004","2004-09-11"
"tháng 10 14, 1976","1976-10-14"
"24 thg 3, 2014","2014-03-24"
"14 thg 12 1985","1985-12-14"
"23 tháng 9, 1972","1972-09-23"
"Ngày 19 tháng 01 năm 2012","2012-01-19"
"Thứ Sáu, ngày 30 tháng 8 năm 1996","1996-08-30"
"01 thg 9 1970","1970-09-01"
"ngày 26 tháng 08 năm 1976","1976-08-26"
"THÁNG 11 13 2006","2006-11-13"
"3 tháng 4 1987","1987-04-03"
"24 THG 5, 1974","1974-05-24"
"tháng 4 24 2005","2005-04-24"
"2 THG 2 2017","2017-02-02"
"9 01 72","1972-01-09"
"2 tháng 1 1972","1972-01-02"
"ngày 10 tháng 06 năm 1979","1979-06-10"
"13 12 79","1979-12-13"
"16 THG 9 1975","1975-09-16"
"thứ bảy, ngày 25 tháng 2 năm 2006","2006-02-25"
"17/04/1985","1985-04-17"
"18 thg 1 1977","1977-01-18"
"10 tháng 3 2014","2014-03-10"
"tháng 10 17 1972","1972-10-17"
"28 tháng 5 2004","2004-05-28"
"3 THÁNG 11, 1986","1986-11-03"
"8 tháng 7, 2016","2016-07-08"
"28 tháng 7 2001","2001-07-28"
"15 tháng 3 1971","1971-03-15"
"16 thg 2, 1981","1981-02-16"
"2 tháng 12 2004","2004-12-02"
"21/10/1977","1977-10-21"
"13 thg 5 2000","2000-05-13"
"13 thg 11 2015","2015-11-13"
"tháng 4 17, 2003","2003-04-17"
"5 thg 3, 1974","1974-03-05"
"tháng 4 20 1987","1987-04-20"
"18/03/1977","1977-03-18"
"tháng 7 29, 1979","1979-07-29"
"27 tháng 9 1977","1977-09-27"
"NGÀY 19 THÁNG 10 NĂM 2011","2011-10-19"
"29 thg 6, 1976","1976-06-29"
"thứ bảy, ngày 25 tháng 10 năm 1975","1975-10-25"
"3 THG 4, 1990","1990-04-03"
"24 THÁNG 1, 2011","2011-01-24"
"17 tháng 5 1982","1982-05-17"
"2 thg 8 2007","2007-08-02"
"tháng 7 7 2001","2001-07-07"
"13/09/1977","1977-09-13"
"Chủ Nhật, ngày 17 tháng 1 năm 1982","1982-01-17"
"01 thg 2 1989","1989-02-01"
"tháng 4 21 1991","1991-04-21"
"25 thg 10 1989","1989-10-25"
"22, thg 8 2008","2008-08-22"
"THỨ SÁU, NGÀY 10 THÁNG 11 NĂM 2017","2017-11-10"
"16 thg 1, 1993","1993-01-16"
"tháng 7 17 1993","1993-07-17"
"20 THG 4, 1977","1977-04-20"
"31 thg 12 1982","1982-12-31"
"11, thg 5 1997","1997-05-11"
"Ngày 19 tháng 09 năm 1982","1982-09-19"
"11 thg 8 1994","1994-08-11"
"chủ nhật, ngày 02 tháng 9 năm 2001","2001-09-02"
"tháng 10 20, 1997","1997-10-20"
"11 thg 10 2007","2007-10-11"
"30 THG 10 2000","2000-10-30"
"04, thg 6 1993","1993-06-04"
"18 THG 7 2007","2007-07-18"
"22 tháng 10, 1973","1973-10-22"
"11 thg 12 1989","1989-12-11"
"THỨ NĂM, NGÀY 06 THÁNG 8 NĂM 1987","1987-08-06"
"1 tháng 5 2007","2007-05-01"
"30 THÁNG 6, 1999","1999-06-30"
"16 11 87","1987-11-16"
"01/11/2017","2017-11-01"
"23 tháng 2 1980","1980-02-23"
"tháng 12 16, 2009","2009-12-16"
"tháng 2 14, 1981","1981-02-14"
"02 thg 7 1976","1976-07-02"
"THỨ NĂM, NGÀY 13 THÁNG 7 NĂM 2017","2017-07-13"
"19 11 92","1992-11-19"
"27/11/2002","2002-11-27"
"30.03.89","1989-03-30"
"13 THG 3 2001","2001-03-13"
"6 tháng 12 1991","1991-12-06"
"18 tháng 8, 1981","1981-08-18"
"THỨ TƯ, NGÀY 31 THÁNG 7 NĂM 1985","1985-07-31"
"21 thg 8 1987","1987-08-21"
"1 THG 10, 1979","1979-10-01"
"25 01 89","1989-01-25"
"ngày 15 tháng 06 năm 2017","2017-06-15"
"18 tháng 1, 1992","1992-01-18"
"30 tháng 1 2002","2002-01-30"
"31, thg 8 2004","2004-08-31"
"6 thg 1, 1983","1983-01-06"
"tháng 5 23, 1986","1986-05-23"
"04, thg 10 2008","2008-10-04"
"26 thg 8 1981","1981-08-26"
"9 thg 5, 1975","1975-05-09"
"Ngày 01 tháng 02 năm 2008","2008-02-01"
"30 tháng 5 1977","1977-05-30"
"5 05 82","1982-05-05"
"tháng 1 19, 1982","1982-01-19"
"4 tháng 2 2018","2018-02-04"
"Ngày 08 tháng 04 năm 1989","1989-04-08"
"Ngày 18 tháng 05 năm 1976","1976-05-18"
"tháng 5 29, 2008","2008-05-29"
"10 07 75","1975-07-10"
"Thứ Hai, ngày 26 tháng 7 năm 1993","1993-07-26"
"11/10/2007","2007-10-11"
"THỨ BẢY, NGÀY 21 THÁNG 1 NĂM 1984","1984-01-21"
"19 tháng 10, 1983","1983-10-19"
"24, THG 10 1977","1977-10-24"
"8 thg 4, 1974","1974-04-08"
"15 tháng 6 1977","1977-06-15"
"tháng 11 14 1997","1997-11-14"
"13 THG 2, 1986","1986-02-13"
"22/02/1998","1998-02-22"
"tháng 3 26, 1981","1981-03-26"
"21 tháng 6, 2016","2016-06-21"
"21 THÁNG 12, 1981","1981-12-21"
"12 thg 4, 1972","1972-04-12"
"30 thg 8 2012","2012-08-30"
"27 THÁNG 4 2008","2008-04-27"
"17 thg 1, 2007","2007-01-17"
"4 THÁNG 9 1975","1975-09-04"
"15.07.17","2017-07-15"
"18 thg 11, 1981","1981-11-18"
"Ngày 18 tháng 06 năm 2007","2007-06-18"
"17 11 87","1987-11-17"
"tháng 8 13, 1986","1986-08-13"
"22/11/1972","1972-11-22"
"18 thg 9, 1992","1992-09-18"
"THỨ BẢY, NGÀY 27 THÁNG 8 NĂM 1994","1994-08-27"
"17 thg 8 2012","2012-08-17"
"30 THÁNG 3, 2014","2014-03-30"
"15.06.00","2000-06-15"
"21 THG 4 2007","2007-04-21"
"16 tháng 2, 1991","1991-02-16"
"tháng 5 29 2017","2017-05-29"
"THỨ SÁU, NGÀY 06 THÁNG 12 NĂM 1991","1991-12-06"
"23 tháng 7 1975","1975-07-23"
"tháng 2 9 2017","2017-02-09"
"12 tháng 10, 2002","2002-10-12"
"3 thg 7 1986","1986-07-03"
"19 thg 9, 1984","1984-09-19"
"28 thg 10 2016","2016-10-28"
"6 THÁNG 9 2016","2016-09-06"
"1 tháng 3 1995","1995-03-01"
"THÁNG 10 2, 2012","2012-10-02"
"16 tháng 9 1993","1993-09-16"
"11/02/1979","1979-02-11"
"10 thg 10, 1982","1982-10-10"
"20 05 16","2016-05-20"
"13/04/2014","2014-04-13"
"ngày 07 tháng 03 năm 1980","1980-03-07"
"23 thg 6, 1976","1976-06-23"
"21 10 05","2005-10-21"
"26 thg 6 1997","1997-06-26"
"12.10.85","1985-10-12"
"26 thg 10 2009","2009-10-26"
"20/07/2007","2007-07-20"
"1 09 99","1999-09-01"
"11.09.89","1989-09-11"
"THÁNG 10 11, 2011","2011-10-11"
"3 tháng 7, 2018","2018-07-03"
"2 01 84","1984-01-02"
"4 tháng 10 1992","1992-10-04"
"26 thg 7 1975","1975-07-26"
"14 thg 9 2000","2000-09-14"
"tháng 7 2, 1994","1994-07-02"
"THÁNG 1 25 2010","2010-01-25"
"23 THG 5, 1982","1982-05-23"
"thứ bảy, ngày 18 tháng 11 năm 2006","2006-11-18"
"2 06 10","2010-06-02"
"THỨ SÁU, NGÀY 10 THÁNG 8 NĂM 2018","2018-08-10"
"18 tháng 2 1976","1976-02-18"
"14 03 95","1995-03-14"
"10, thg 2 1991","1991-02-10"
"18 thg 10 1977","1977-10-18"
"31 tháng 12 1972","1972-12-31"
"NGÀY 14 THÁNG 06 NĂM 1975","1975-06-14"
"30 tháng 8, 1975","1975-08-30"
"20 thg 11, 2014","2014-11-20"
"tháng 5 11 2017","2017-05-11"
"tháng 6 5 2015","2015-06-05"
"20/07/1991","1991-07-20"
"29 tháng 9, 2003","2003-09-29"
"30 THÁNG 1 1996","1996-01-30"
"6 thg 9, 1988","1988-09-06"
"14 01 10","2010-01-14"
"18.03.91","1991-03-18"
"26 tháng 8 1992","1992-08-26"
"tháng 1 14, 1973","1973-01-14"
"7 thg 11, 2018","2018-11-07"
"13 thg 12 2012","2012-12-13"
"tháng 6 21, 1979","1979-06-21"
"02.01.85","1985-01-02"
"Ngày 30 tháng 04 năm 2017","2017-04-30"
"tháng 8 6 1995","1995-08-06"
"1 tháng 10 1986","1986-10-01"
"13 tháng 9 1999","1999-09-13"
"4 thg 2, 1995","1995-02-04"
"04 thg 2 1971","1971-02-04"
"2 THÁNG 7 1995","1995-07-02"
"12 THÁNG 11 2002","2002-11-12"
"29 THG 12, 1978","1978-12-29"
"NGÀY 21 THÁNG 04 NĂM 1988","1988-04-21"
"26 tháng 10, 2009","2009-10-26"
"11 thg 11, 2004","2004-11-11"
"Thứ Bảy, ngày 30 tháng 6 năm 2007","2007-06-30"
"03/11/1986","1986-11-03"
"3 THÁNG 12 1987","1987-12-03"
"14 THÁNG 2 1998","1998-02-14"
"22 tháng 7, 2002","2002-07-22"
"26 THÁNG 9 1994","1994-09-26"
"11 03 02","2002-03-11"
"4 thg 3 1991","1991-03-04"
"10, thg 5 2003","2003-05-10"
"4 tháng 3, 2017","2017-03-04"
"tháng 9 28, 1995","1995-09-28"
"18 thg 5 1998","1998-05-18"
"03.04.81","1981-04-03"
"18 tháng 12, 2005","2005-12-18"
"THÁNG 12 7 2009","2009-12-07"
"20 thg 5, 1989","1989-05-20"
"Ngày 26 tháng 07 năm 1973","1973-07-26"
"3 tháng 7, 2003","2003-07-03"
"11 07 98","1998-07-11"
"22 thg 3, 2010","2010-03-22"
"Thứ Tư, ngày 12 tháng 2 năm 1997","1997-02-12"
"05 THG 2 2005","2005-02-05"
"29/03/1998","1998-03-29"
"14 tháng 10 2000","2000-10-14"
"THÁNG 2 7, 1993","1993-02-07"
"19 tháng 3 2016","2016-03-19"
"31 tháng 5 1981","1981-05-31"
"13, thg 11 1976","1976-11-13"
"2 tháng 12 1998","1998-12-02"
"Ngày 30 tháng 11 năm 1981","1981-11-30"
"2 thg 10, 2009","2009-10-02"
"28, thg 3 2003","2003-03-28"
"12 tháng 6, 2001","2001-06-12"
"30.11.18","2018-11-30"
"31 thg 10 1990","1990-10-31"
"ngày 23 tháng 12 năm 1971","1971-12-23"
"tháng 10 14 2005","2005-10-14"
"Ngày 08 tháng 10 năm 2001","2001-10-08"
"20 thg 12 1987","1987-12-20"
"14 11 72","1972-11-14"
"THÁNG 4 28, 2000","2000-04-28"
"28 THÁNG 8, 1989","1989-08-28"
"29/09/1983","1983-09-29"
"16 thg 7, 2006","2006-07-16"
"ngày 29 tháng 07 năm 1970","1970-07-29"
"tháng 8 24 1994","1994-08-24"
"28 tháng 10, 1990","1990-10-28"
"tháng 12 13 1997","1997-12-13"
"04 thg 3 2018","2018-03-04"
"14/12/1975","1975-12-14"
"Thứ Năm, ngày 09 tháng 3 năm 1995","1995-03-09"
"tháng 8 28, 1996","1996-08-28"
"THÁNG 10 30 1985","1985-10-30"
"26 THG 2 1977","1977-02-26"
"19 tháng 5, 1980","1980-05-19"
"13 tháng 3 1998","1998-03-13"
"01, THG 9 1992","1992-09-01"
"tháng 9 30 1989","1989-09-30"
"18 tháng 6 2011","2011-06-18"
"1 thg 3 2006","2006-03-01"
"25 tháng 5 2017","2017-05-25"
"Ngày 06 tháng 06 năm 1987","1987-06-06"
"15.01.89","1989-01-15"
"tháng 6 8, 1978","1978-06-08"
"16.04.99","1999-04-16"
"NGÀY 23 THÁNG 02 NĂM 1980","1980-02-23"
"23 tháng 2, 1999","1999-02-23"
"2 tháng 6 2001","2001-06-02"
"26.07.72","1972-07-26"
"Ngày 15 tháng 07 năm 2004","2004-07-15"
"Thứ Sáu, ngày 26 tháng 3 năm 1976","1976-03-26"
"22 tháng 12 1991","1991-12-22"
"26 07 08","2008-07-26"
"19 thg 1, 1977","1977-01-19"
"29 tháng 3, 1989","1989-03-29"
"23 THÁNG 12 2000","2000-12-23"
"7 04 96","1996-04-07"
"26 tháng 10 1984","1984-10-26"
"29 tháng 7, 2007","2007-07-29"
"tháng 5 28, 1993","1993-05-28"
"28/11/1986","1986-11-28"
"tháng 2 5 1979","1979-02-05"
"tháng 11 6, 1981","1981-11-06"
"29 thg 10 1981","1981-10-29"
"ngày 21 tháng 02 năm 2011","2011-02-21"
"4 THG 12, 2015","2015-12-04"
"29.04.76","1976-04-29"
"1 thg 2 2017","2017-02-01"
"17 tháng 5 1980","1980-05-17"
"12.04.99","1999-04-12"
"27 thg 2 2000","2000-02-27"
"tháng 7 5, 2001","2001-07-05"
"17 thg 5, 2012","2012-05-17"
"5 tháng 6 2004","2004-06-05"
"01 THG 2 1979","1979-02-01"
"10.08.74","1974-08-10"
"16 thg 4, 1995","1995-04-16"
"23, thg 4 2014","2014-04-23"
"4 tháng 12, 2015","2015-12-04"
"16 thg 12, 2010","2010-12-16"
"25 THG 7 2004","2004-07-25"
"20 tháng 9 1989","1989-09-20"
"7 THÁNG 5, 1989","1989-05-07"
"16 thg 5 1988","1988-05-16"
"02 thg 4 1989","1989-04-02"
"25 THÁNG 10 2000","2000-10-25"
"8 tháng 11 1995","1995-11-08"
"tháng 4 5, 1974","1974-04-05"
"6 thg 5 2003","2003-05-06"
"04, thg 5 2001","2001-05-04"
"5 thg 1, 2017","2017-01-05"
"15 06 82","1982-06-15"
"tháng 12 9, 1978","1978-12-09"
"26.06.04","2004-06-26"
"Thứ Năm, ngày 12 tháng 9 năm 1991","1991-09-12"
"23 THG 6 1972","1972-06-23"
"23 THG 5 1994","1994-05-23"
"23 tháng 8 1986","1986-08-23"
"28 tháng 11 2000","2000-11-28"
"4 thg 12, 2014","2014-12-04"
"8 thg 1, 1990","1990-01-08"
"11 tháng 6, 1998","1998-06-11"
"10/09/1979","1979-09-10"
"THỨ NĂM, NGÀY 26 THÁNG 5 NĂM 1977","1977-05-26"
"11 tháng 11 1980","1980-11-11"
"22 thg 1 1977","1977-01-22"
"THÁNG 6 7 2007","2007-06-07"
"1 04 02","2002-04-01"
"THÁNG 5 24 1981","1981-05-24"
"2 06 06","2006-06-02"
"14.02.92","1992-02-14"
"09/06/2010","2010-06-09"
"tháng 11 25, 1984","1984-11-25"
"13 thg 1, 2006","2006-01-13"
"17 tháng 5 2016","2016-05-17"
"28 thg 12 1978","1978-12-28"
"28 tháng 6 1971","1971-06-28"
"30 tháng 1 2014","2014-01-30"
"04.02.18","2018-02-04"
"17 tháng 9 1982","1982-09-17"
"THÁNG 9 29, 1981","1981-09-29"
"20/10/2002","2002-10-20"
"7 thg 8 2009","2009-08-07"
"19 THG 1, 1978","1978-01-19"
"tháng 4 1, 1983","1983-04-01"
"tháng 1 17, 2001","2001-01-17"
"ngày 15 tháng 06 năm 1988","1988-06-15"
"31.05.01","2001-05-31"
"15.03.92","1992-03-15"
"29 thg 3, 2004","2004-03-29"
"15 thg 12 1989","1989-12-15"
"tháng 2 23, 2016","2016-02-23"
"09 THG 11 1979","1979-11-09"
"24, thg 12 2016","2016-12-24"
"03, thg 3 1979","1979-03-03"
"3 thg 3, 2013","2013-03-03"
"1 12 13","2013-12-01"
"17 thg 6, 1999","1999-06-17"
"Ngày 01 tháng 06 năm 1995","1995-06-01"
"9 THÁNG 5, 1981","1981-05-09"
"tháng 1 18, 1989","1989-01-18"
"24 tháng 1 1975","1975-01-24"
"22, thg 11 2007","2007-11-22"
"thứ ba, ngày 03 tháng 5 năm 2016","2016-05-03"
"16 10 11","2011-10-16"
"31 03 80","1980-03-31"
"23, thg 7 2018","2018-07-23"
"13 THÁNG 7, 1972","1972-07-13"
"THÁNG 5 29, 2002","2002-05-29"
"3 thg 12 1991","1991-12-03"
"27 thg 10 2001","2001-10-27"
"03.05.06","2006-05-03"
"27/09/1987","1987-09-27"
"16/10/1972","1972-10-16"
"14 thg 8 1970","1970-08-14"
"22, thg 8 2015","2015-08-22"
"23.11.76","1976-11-23"
"14 thg 12 1999","1999-12-14"
"Thứ Ba, ngày 28 tháng 2 năm 2006","2006-02-28"
"8 THÁNG 11 1986","1986-11-08"
"18 THG 6, 2010","2010-06-18"
"Thứ Năm, ngày 04 tháng 6 năm 1998","1998-06-04"
"25 thg 1, 2003","2003-01-25"
"14/01/1985","1985-01-14"
"Ngày 24 tháng 01 năm 2000","2000-01-24"
"Thứ Bảy, ngày 11 tháng 1 năm 2003","2003-01-11"
"28 tháng 11, 1996","1996-11-28"
"25, THG 6 1999","1999-06-25"
"1 thg 8, 1983","1983-08-01"
"06, thg 8 1973","1973-08-06"
"Thứ Năm, ngày 25 tháng 2 năm 2016","2016-02-25"
"tháng 3 12, 1997","1997-03-12"
"THÁNG 9 29, 2018","2018-09-29"
"1 thg 12, 1982","1982-12-01"
"3 tháng 5, 1987","1987-05-03"
"01, THG 9 2008","2008-09-01"
"6 tháng 9, 1994","1994-09-06"
"18 thg 1, 1991","1991-01-18"
"21/03/2015","2015-03-21"
"13 03 13","2013-03-13"
"11.04.15","2015-04-11"
"tháng 7 25 1980","1980-07-25"
"29 10 90","1990-10-29"
"THÁNG 11 29 1983","1983-11-29"
"29 thg 1, 1990","1990-01-29"
"Thứ Sáu, ngày 15 tháng 8 năm 1980","1980-08-15"
"THÁNG 3 15, 1991","1991-03-15"
"7 thg 11 1977","1977-11-07"
"12 thg 11, 2011","2011-11-12"
"tháng 8 9 1991","1991-08-09"
"tháng 5 23 1996","1996-05-23"
"6 thg 12, 1977","1977-12-06"
"tháng 10 25 2006","2006-10-25"
"22/11/1986","1986-11-22"
"25.05.00","2000-05-25"
"THÁNG 11 21, 2014","2014-11-21"
"23 THÁNG 7 1985","1985-07-23"
"THÁNG 11 10, 1983","1983-11-10"
"NGÀY 09 THÁNG 09 NĂM 1990","1990-09-09"
"THÁNG 12 18, 2006","2006-12-18"
"11.06.87","1987-06-11"
"2 tháng 12 1971","1971-12-02"
"Ngày 10 tháng 09 năm 1986","1986-09-10"
"tháng 4 30, 1974","1974-04-30"
"16 thg 2 2003","2003-02-16"
"7 THG 4 1992","1992-04-07"
"14 thg 10 1988","1988-10-14"
"11 tháng 5 1980","1980-05-11"
"2 tháng 3 1980","1980-03-02"
"Thứ Hai, ngày 19 tháng 9 năm 1983","1983-09-19"
"13/12/1977","1977-12-13"
"20, thg 4 2001","2001-04-20"
"15 thg 7, 2011","2011-07-15"
"27, thg 8 2013","2013-08-27"
"22 THÁNG 4 1990","1990-04-22"
"THÁNG 7 2 1985","1985-07-02"
"Ngày 24 tháng 11 năm 1990","1990-11-24"
"10 THG 3, 1990","1990-03-10"
"tháng 9 29, 2017","2017-09-29"
"02.09.15","2015-09-02"
"THỨ NĂM, NGÀY 15 THÁNG 11 NĂM 2012","2012-11-15"
"THÁNG 1 31, 2005","2005-01-31"
"20, THG 10 2009","2009-10-20"
"26/10/1986","1986-10-26"
"23.12.05","2005-12-23"
"12/02/1974","1974-02-12"
"20 thg 10 1978","1978-10-20"
"29.07.13","2013-07-29"
"26 thg 10 2002","2002-10-26"
"29.10.99","1999-10-29"
"24.12.89","1989-12-24"
"10, thg 11 2015","2015-11-10"
"26.06.14","2014-06-26"
"24 thg 12 2010","2010-12-24"
"29 thg 7, 1992","1992-07-29"
"Thứ Sáu, ngày 17 tháng 1 năm 1997","1997-01-17"
"25.09.15","2015-09-25"
"10 08 15","2015-08-10"
"Ngày 07 tháng 11 năm 2005","2005-11-07"
"THÁNG 7 10 1970","1970-07-10"
"4 THÁNG 10, 1978","1978-10-04"
"29 thg 12, 1992","1992-12-29"
"Thứ Tư, ngày 24 tháng 10 năm 1973","1973-10-24"
"18 tháng 12 2014","2014-12-18"
"10 04 72","1972-04-10"
"3 tháng 11 2004","2004-11-03"
"7 07 98","1998-07-07"
"27 tháng 11, 2008","2008-11-27"
"tháng 4 4, 2015","2015-04-04"
"25 tháng 3, 1997","1997-03-25"
"28 thg 11 1992","1992-11-28"
"3 THÁNG 10 2016","2016-10-03"
"17 11 00","2000-11-17"
"THỨ NĂM, NGÀY 16 THÁNG 3 NĂM 1978","1978-03-16"
"01, thg 7 1972","1972-07-01"
"01.08.73","1973-08-01"
"3 01 88","1988-01-03"
"10 thg 6 2009","2009-06-10"
"10/07/1983","1983-07-10"
"08 thg 6 1987","1987-06-08"
"14.11.74","1974-11-14"
"7 THÁNG 2, 1994","1994-02-07"
"30 THG 1 1971","1971-01-30"
"19 thg 3 2001","2001-03-19"
"5 thg 3 1988","1988-03-05"
"THỨ SÁU, NGÀY 22 THÁNG 4 NĂM 2011","2011-04-22"
"4 tháng 1 2005","2005-01-04"
"11, THG 1 1993","1993-01-11"
"THỨ HAI, NGÀY 10 THÁNG 8 NĂM 1970","1970-08-10"
"9 tháng 6 2017","2017-06-09"
"thứ ba, ngày 06 tháng 10 năm 1981","1981-10-06"
"7 tháng 10 1987","1987-10-07"
"tháng 5 25, 1990","1990-05-25"
"05/05/2003","2003-05-05"
"19 THG 10 1991","1991-10-19"
"THÁNG 2 28, 1978","1978-02-28"
"tháng 9 2 1998","1998-09-02"
"Thứ Hai, ngày 29 tháng 2 năm 1988","1988-02-29"
"07, thg 3 1989","1989-03-07"
"16 01 94","1994-01-16"
"10 12 91","1991-12-10"
"27/08/2004","2004-08-27"
"28 thg 1, 2001","2001-01-28"
"31, thg 5 2012","2012-05-31"
"19 tháng 3 1993","1993-03-19"
"02/10/2007","2007-10-02"
"20 thg 11, 1971","1971-11-20"
"NGÀY 26 THÁNG 08 NĂM 2015","2015-08-26"
"31.07.00","2000-07-31"
"CHỦ NHẬT, NGÀY 18 THÁNG 3 NĂM 1979","1979-03-18"
"11 tháng 9 1976","1976-09-11"
"29/05/2014","2014-05-29"
"11.05.06","2006-05-11"
"07.02.14","2014-02-07"
"25 thg 6, 1974","1974-06-25"
"19 THG 9, 1997","1997-09-19"
"25 thg 10 2014","2014-10-25"
"30 tháng 12, 2016","2016-12-30"
"tháng 5 13 2001","2001-05-13"
"16 thg 6 2014","2014-06-16"
"NGÀY 02 THÁNG 01 NĂM 1989","1989-01-02"
"13 THG 8 1971","1971-08-13"
"25 tháng 3, 1975","1975-03-25"
"11 tháng 10, 1972","1972-10-11"
"tháng 5 3 2009","2009-05-03"
"8 tháng 12 2014","2014-12-08"
"ngày 02 tháng 12 năm 1994","1994-12-02"
"28 tháng 11, 1987","1987-11-28"
"31/05/1991","1991-05-31"
"THÁNG 8 5 1980","1980-08-05"
"28 09 79","1979-09-28"
"thứ hai, ngày 20 tháng 4 năm 1998","1998-04-20"
"24.01.84","1984-01-24"
"21 10 84","1984-10-21"
"14, thg 7 2013","2013-07-14"
"ngày 29 tháng 03 năm 2015","2015-03-29"
"12 tháng 4 1979","1979-04-12"
"17 08 97","1997-08-17"
"chủ nhật, ngày 25 tháng 5 năm 1986","1986-05-25"
"ngày 21 tháng 03 năm 2005","2005-03-21"
"27 thg 6, 1987","1987-06-27"
"tháng 12 14, 1985","1985-12-14"
"Ngày 08 tháng 08 năm 2000","2000-08-08"
"1 thg 5 1995","1995-05-01"
"9 thg 4, 2004","2004-04-09"
"22.09.96","1996-09-22"
"tháng 12 20, 1987","1987-12-20"
"10 THG 12, 1982","1982-12-10"
"29 thg 12, 2008","2008-12-29"
"17 09 78","1978-09-17"
"15 thg 7 1999","1999-07-15"
"10 thg 11, 1985","1985-11-10"
"29 thg 5, 2005","2005-05-29"
"12 tháng 3 1985","1985-03-12"
"ngày 05 tháng 03 năm 1975","1975-03-05"
"Thứ Bảy, ngày 26 tháng 2 năm 2005","2005-02-26"
"9 tháng 3, 1985","1985-03-09"
"24, thg 12 1993","1993-12-24"
"31 thg 5 1971","1971-05-31"
"27 tháng 7, 2006","2006-07-27"
"THÁNG 11 26, 2003","2003-11-26"
"22.01.72","1972-01-22"
"ngày 29 tháng 03 năm 2006","2006-03-29"
"23 thg 11, 2003","2003-11-23"
"13 12 80","1980-12-13"
"03 thg 10 1980","1980-10-03"
"Thứ Sáu, ngày 02 tháng 4 năm 2004","2004-04-02"
"23, thg 5 1998","1998-05-23"
"15, THG 3 2012","2012-03-15"
"25 THG 4, 1984","1984-04-25"
"tháng 7 12 2003","2003-07-12"
"24, thg 2 1982","1982-02-24"
"NGÀY 31 THÁNG 08 NĂM 1986","1986-08-31"
"31 tháng 1 2011","2011-01-31"
"9 tháng 1 2001","2001-01-09"
"tháng 7 27 1975","1975-07-27"
"Ngày 27 tháng 08 năm 2010","2010-08-27"
"3 THÁNG 8 2003","2003-08-03"
"Thứ Tư, ngày 22 tháng 11 năm 1972","1972-11-22"
"16 THÁNG 12 2001","2001-12-16"
"4 thg 3, 2008","2008-03-04"
"9 thg 4 2017","2017-04-09"
"28 THG 9, 2013","2013-09-28"
"4 tháng 12, 1973","1973-12-04"
"24 thg 1, 1992","1992-01-24"
"27 thg 12 2016","2016-12-27"
"13 tháng 9, 1972","1972-09-13"
"THÁNG 10 17 1990","1990-10-17"
"29/03/2006","2006-03-29"
"24 thg 4 2017","2017-04-24"
"14 thg 4, 2013","2013-04-14"
"THỨ BA, NGÀY 15 THÁNG 4 NĂM 2003","2003-04-15"
"30 tháng 5 2002","2002-05-30"
"21 thg 8 1975","1975-08-21"
"9 tháng 9 2006","2006-09-09"
"tháng 6 15 2013","2013-06-15"
"20 thg 8, 1978","1978-08-20"
"11 THÁNG 12 1983","1983-12-11"
"6 thg 8, 1979","1979-08-06"
"14 thg 7, 1975","1975-07-14"
"7 tháng 1, 1984","1984-01-07"
"4 06 12","2012-06-04"
"THỨ TƯ, NGÀY 09 THÁNG 11 NĂM 1977","1977-11-09"
"26 03 92","1992-03-26"
"THÁNG 3 18 1973","1973-03-18"
"1 THG 1 1990","1990-01-01"
"ngày 13 tháng 12 năm 1979","1979-12-13"
"4 10 84","1984-10-04"
"28 thg 10 1986","1986-10-28"
"3 thg 4 2005","2005-04-03"
"10 thg 9, 1979","1979-09-10"
"30, thg 8 2010","2010-08-30"
"THÁNG 4 5, 1987","1987-04-05"
"tháng 8 9 2015","2015-08-09"
"tháng 6 9, 1980","1980-06-09"
"10/10/1976","1976-10-10"
"27 THG 4 1998","1998-04-27"
"4 thg 10, 1978","1978-10-04"
"03/05/1974","1974-05-03"
"28 THÁNG 10 1993","1993-10-28"
"3 12 96","1996-12-03"
"27 thg 3 2017","2017-03-27"
"12 thg 4 2003","2003-04-12"
"tháng 9 5, 1984","1984-09-05"
"12 thg 11, 1980","1980-11-12"
"13 thg 9, 2000","2000-09-13"
"tháng 3 8, 2004","2004-03-08"
"6 THÁNG 1 1984","1984-01-06"
"6 tháng 7 2007","2007-07-06"
"22 thg 1, 1985","1985-01-22"
"THÁNG 5 4 1978","1978-05-04"
"27 tháng 10 2017","2017-10-27"
"08.12.73","1973-12-08"
"4 tháng 11, 1984","1984-11-04"
"THỨ SÁU, NGÀY 07 THÁNG 12 NĂM 1979","1979-12-07"
"THÁNG 5 22, 1991","1991-05-22"
"19 thg 1 1976","1976-01-19"
"10 tháng 2 1996","1996-02-10"
"6 tháng 11 1994","1994-11-06"
"16 04 70","1970-04-16"
"15.03.88","1988-03-15"
"29 THÁNG 9 1997","1997-09-29"
"tháng 4 17, 1991","1991-04-17"
"tháng 1 3, 1985","1985-01-03"
"18 tháng 3, 1998","1998-03-18"
"26 thg 12, 1989","1989-12-26"
"14 tháng 5 2002","2002-05-14"
"10/02/1972","1972-02-10"
"28 04 12","2012-04-28"
"Ngày 31 tháng 12 năm 2013","2013-12-31"
"Ngày 05 tháng 05 năm 1989","1989-05-05"
"13 tháng 11 2006","2006-11-13"
"tháng 6 18, 1974","1974-06-18"
"19, thg 11 2017","2017-11-19"
"19 THÁNG 10 1977","1977-10-19"
"Thứ Năm, ngày 04 tháng 1 năm 1996","1996-01-04"
"THÁNG 9 3, 1995","1995-09-03"
"13/03/1983","1983-03-13"
"Thứ Năm, ngày 23 tháng 4 năm 1987","1987-04-23"
"Chủ Nhật, ngày 22 tháng 2 năm 1976","1976-02-22"
"13, thg 5 1997","1997-05-13"
"tháng 2 19, 1996","1996-02-19"
"THÁNG 12 5, 2012","2012-12-05"
"28 thg 4 2014","2014-04-28"
"28/02/1973","1973-02-28"
"31 01 05","2005-01-31"
"23 thg 9, 1973","1973-09-23"
"1 tháng 5, 1990","1990-05-01"
"CHỦ NHẬT, NGÀY 01 THÁNG 8 NĂM 1999","1999-08-01"
"27 THG 9 2002","2002-09-27"
"THÁNG 11 27, 2009","2009-11-27"
"Ngày 23 tháng 03 năm 2016","2016-03-23"
"12 THÁNG 6 2014","2014-06-12"
"25 THG 4, 1977","1977-04-25"
"2 tháng 2 1974","1974-02-02"
"thứ năm, ngày 19 tháng 10 năm 1972","1972-10-19"
"10 thg 6 2010","2010-06-10"
"tháng 9 9, 1999","1999-09-09"
"21 THG 6 1996","1996-06-21"
"09, thg 10 1992","1992-10-09"
"tháng 8 24, 2017","2017-08-24"
"23 thg 12, 1975","1975-12-23"
"THÁNG 6 13, 2002","2002-06-13"
"14, THG 4 1984","1984-04-14"
"10 THÁNG 7, 2001","2001-07-10"
"26 thg 4, 2016","2016-04-26"
"Chủ Nhật, ngày 24 tháng 8 năm 2003","2003-08-24"
"11.10.17","2017-10-11"
"5 tháng 11, 2010","2010-11-05"
"tháng 12 14 2016","2016-12-14"
"tháng 4 14, 1987","1987-04-14"
"15, THG 6 2004","2004-06-15"
"tháng 9 30, 1988","1988-09-30"
"NGÀY 02 THÁNG 10 NĂM 1978","1978-10-02"
"14 06 16","2016-06-14"
"14 THÁNG 3 1975","1975-03-14"
"14 tháng 10, 1997","1997-10-14"
"24 tháng 12, 2008","2008-12-24"
"22.08.09","2009-08-22"
"18, thg 1 1981","1981-01-18"
"tháng 4 18, 1995","1995-04-18"
"23 tháng 12 2005","2005-12-23"
"THÁNG 9 28 1992","1992-09-28"
"29 tháng 8, 2014","2014-08-29"
"20 THÁNG 11 1982","1982-11-20"
"14.07.83","1983-07-14"
"9 THG 4, 2011","2011-04-09"
"02.06.90","1990-06-02"
"ngày 30 tháng 09 năm 2000","2000-09-30"
"29.12.84","1984-12-29"
"16 THG 6, 2007","2007-06-16"
"28 tháng 3 1995","1995-03-28"
"27 tháng 7 1981","1981-07-27"
"tháng 11 25, 2000","2000-11-25"
"9 THÁNG 3, 1980","1980-03-09"
"02, thg 7 1993","1993-07-02"
"tháng 1 25 2000","2000-01-25"
"06.02.91","1991-02-06"
"20.07.09","2009-07-20"
"14 THG 7, 1997","1997-07-14"
"Ngày 25 tháng 04 năm 1999","1999-04-25"
"NGÀY 23 THÁNG 12 NĂM 1996","1996-12-23"
"14 10 88","1988-10-14"
"30 thg 4, 1982","1982-04-30"
"03, thg 12 2008","2008-12-03"
"1 THG 10 1985","1985-10-01"
"20.11.84","1984-11-20"
"27 thg 7 1977","1977-07-27"
"13/12/2018","2018-12-13"
"02, thg 2 1985","1985-02-02"
"19 tháng 3 1981","1981-03-19"
"08.12.93","1993-12-08"
"15, thg 11 1975","1975-11-15"
"29 tháng 9 2001","2001-09-29"
"Thứ Tư, ngày 29 tháng 7 năm 2009","2009-07-29"
"6 THG 1, 1977","1977-01-06"
"04 thg 3 2006","2006-03-04"
"11.07.82","1982-07-11"
"17 tháng 1 1970","1970-01-17"
"16 02 72","1972-02-16"
"12 09 17","2017-09-12"
"05 thg 6 2016","2016-06-05"
"THÁNG 6 24 1973","1973-06-24"
"28/02/1975","1975-02-28"
"16/11/1994","1994-11-16"
"2 THG 12, 2010","2010-12-02"
"3 thg 5 1973","1973-05-03"
"16 thg 1 1993","1993-01-16"
"10 tháng 11 1988","1988-11-10"
"1 tháng 5 2013","2013-05-01"
"11/05/1976","1976-05-11"
"tháng 6 26, 2001","2001-06-26"
"21 tháng 6 2009","2009-06-21"
"11 tháng 3 1970","1970-03-11"
"tháng 4 12 1986","1986-04-12"
"Ngày 05 tháng 06 năm 2001","2001-06-05"
"15.10.05","2005-10-15"
"5 thg 1, 1996","1996-01-05"
"13 tháng 5, 1977","1977-05-13"
"05/07/2007","2007-07-05"
"12 08 79","1979-08-12"
"10/12/2010","2010-12-10"
"24 tháng 3 1998","1998-03-24"
"23, THG 6 1991","1991-06-23"
"THÁNG 5 4, 1992","1992-05-04"
"17 tháng 6 1972","1972-06-17"
"25 THG 10, 1975","1975-10-25"
"tháng 7 24 2000","2000-07-24"
"tháng 12 23, 1994","1994-12-23"
"16 04 00","2000-04-16"
"23 THÁNG 11 1998","1998-11-23"
"8 thg 7, 1973","1973-07-08"
"25 THÁNG 12 1988","1988-12-25"
"3 thg 5, 1979","1979-05-03"
"18 THG 1 2017","2017-01-18"
"13 thg 4 2008","2008-04-13"
"4 tháng 6, 1996","1996-06-04"
"tháng 10 16 2016","2016-10-16"
"03, thg 7 1972","1972-07-03"
"Thứ Ba, ngày 05 tháng 7 năm 1977","1977-07-05"
"THỨ SÁU, NGÀY 23 THÁNG 9 NĂM 1994","1994-09-23"
"ngày 18 tháng 12 năm 1981","1981-12-18"
"11 01 09","2009-01-11"
"7 THG 12, 2012","2012-12-07"
"24/08/2013","2013-08-24"
"17.05.97","1997-05-17"
"ngày 21 tháng 09 năm 1995","1995-09-21"
"tháng 2 3, 2014","2014-02-03"
"7 tháng 10 2013","2013-10-07"
"THÁNG 11 7 1976","1976-11-07"
"17 tháng 12 1977","1977-12-17"
"27 tháng 1 2000","2000-01-27"
"13 thg 9, 2008","2008-09-13"
"5 tháng 3 2008","2008-03-05"
"14 tháng 11 1972","1972-11-14"
"NGÀY 01 THÁNG 04 NĂM 1995","1995-04-01"
"20 tháng 5 2011","2011-05-20"
"Ngày 18 tháng 08 năm 2016","2016-08-18"
"THÁNG 11 16 1994","1994-11-16"
"2 tháng 2 2016","2016-02-02"
"ngày 26 tháng 07 năm 2002","2002-07-26"
"16 thg 5 2008","2008-05-16"
"20/05/2003","2003-05-20"
"24, thg 9 1996","1996-09-24"
"3 tháng 7 2016","2016-07-03"
"5 10 11","2011-10-05"
"27 tháng 4 1990","1990-04-27"
"12 tháng 1 2013","2013-01-12"
"07, thg 1 1978","1978-01-07"
"1 THG 2, 1993","1993-02-01"
"tháng 4 6 1977","1977-04-06"
"tháng 4 28, 2001","2001-04-28"
"29 thg 9 2006","2006-09-29"
"Thứ Ba, ngày 25 tháng 6 năm 1996","1996-06-25"
"Ngày 23 tháng 08 năm 1973","1973-08-23"
"25 tháng 5 2001","2001-05-25"
"23, thg 8 1985","1985-08-23"
"20/09/1971","1971-09-20"
"Chủ Nhật, ngày 18 tháng 11 năm 1990","1990-11-18"
"14 THÁNG 6 1991","1991-06-14"
"07/10/1978","1978-10-07"
"19 08 75","1975-08-19"
"10 11 70","1970-11-10"
"chủ nhật, ngày 29 tháng 7 năm 2007","2007-07-29"
"29 thg 12, 1986","1986-12-29"
"15 thg 11 2010","2010-11-15"
"06/09/1989","1989-09-06"
"tháng 7 18, 2015","2015-07-18"
"22, thg 9 1998","1998-09-22"
"tháng 10 20 2007","2007-10-20"
"28 06 16","2016-06-28"
"13/03/2006","2006-03-13"
"11 05 90","1990-05-11"
"8 thg 5 1990","1990-05-08"
"01, thg 3 1983","1983-03-01"
"04 thg 6 2017","2017-06-04"
"16.07.79","1979-07-16"
"NGÀY 07 THÁNG 01 NĂM 1981","1981-01-07"
"tháng 3 21, 1973","1973-03-21"
"27 10 91","1991-10-27"
"tháng 5 5 1996","1996-05-05"
"23 THG 2 1984","1984-02-23"
"tháng 9 27, 1975","1975-09-27"
"26, thg 7 1984","1984-07-26"
"12.07.70","1970-07-12"
"14/11/1987","1987-11-14"
"tháng 1 13 2009","2009-01-13"
"22, THG 12 2016","2016-12-22"
"18 tháng 5, 1978","1978-05-18"
"Thứ Bảy, ngày 15 tháng 2 năm 1986","1986-02-15"
"05 thg 7 2002","2002-07-05"
"03/11/2010","2010-11-03"
"31/07/1975","1975-07-31"
"Thứ Sáu, ngày 09 tháng 12 năm 2011","2011-12-09"
"tháng 3 19 2013","2013-03-19"
"27 thg 3 2018","2018-03-27"
"01 THG 10 1979","1979-10-01"
"Ngày 16 tháng 06 năm 1975","1975-06-16"
"tháng 10 29, 1971","1971-10-29"
"15/01/1975","1975-01-15"
"21 10 04","2004-10-21"
"Ngày 09 tháng 06 năm 1986","1986-06-09"
"18 tháng 4, 2006","2006-04-18"
"21 08 73","1973-08-21"
"29 tháng 10 1994","1994-10-29"
"28.05.80","1980-05-28"
"Thứ Hai, ngày 24 tháng 7 năm 1995","1995-07-24"
"9 thg 8, 2007","2007-08-09"
"25, THG 7 1978","1978-07-25"
"THÁNG 9 23 2000","2000-09-23"
"28.08.97","1997-08-28"
"25 04 10","2010-04-25"
"2 07 06","2006-07-02"
"10 tháng 2 1998","1998-02-10"
"tháng 7 22 1990","1990-07-22"
"23 thg 11, 2007","2007-11-23"
"15 tháng 4 2007","2007-04-15"
"tháng 8 29 1982","1982-08-29"
"1 tháng 7 1971","1971-07-01"
"24, thg 12 1975","1975-12-24"
"9 tháng 11, 1996","1996-11-09"
"7 THÁNG 11, 1977","1977-11-07"
"20 tháng 6 2008","2008-06-20"
"Ngày 16 tháng 07 năm 2013","2013-07-16"
"2 thg 4, 2011","2011-04-02"
"21 tháng 8 1975","1975-08-21"
"tháng 6 2, 2005","2005-06-02"
"24 thg 1, 1987","1987-01-24"
"thứ ba, ngày 16 tháng 8 năm 1994","1994-08-16"
"13 thg 11 1989","1989-11-13"
"25 thg 3, 2015","2015-03-25"
"Ngày 06 tháng 04 năm 1988","1988-04-06"
"15 thg 12 1990","1990-12-15"
"8 tháng 12, 1987","1987-12-08"
"THÁNG 6 24 2008","2008-06-24"
"8 THÁNG 11 1992","1992-11-08"
"18 THG 12, 2012","2012-12-18"
"31 05 87","1987-05-31"
"27 thg 4, 2010","2010-04-27"
"28 THG 9 2014","2014-09-28"
"18 thg 12, 1982","1982-12-18"
"4 tháng 11 2017","2017-11-04"
"25 THÁNG 10, 2007","2007-10-25"
"21 03 94","1994-03-21"
"1 tháng 3 1970","1970-03-01"
"22 thg 6, 1996","1996-06-22"
"10 12 00","2000-12-10"
"THÁNG 7 18 1985","1985-07-18"
"THỨ BẢY, NGÀY 19 THÁNG 11 NĂM 1977","1977-11-19"
"24 03 08","2008-03-24"
"30 tháng 11 1992","1992-11-30"
"19, thg 8 2009","2009-08-19"
"24 thg 3, 2015","2015-03-24"
"12 THG 2, 2015","2015-02-12"
"30 thg 12, 1977","1977-12-30"
"24 tháng 11 2001","2001-11-24"
"2 thg 5 1986","1986-05-02"
"NGÀY 02 THÁNG 06 NĂM 1992","1992-06-02"
"27.07.03","2003-07-27"
"09.10.71","1971-10-09"
"24 tháng 8 2007","2007-08-24"
"15 thg 12 1992","1992-12-15"
"23 THG 6 1989","1989-06-23"
"24 thg 5, 2015","2015-05-24"
"01.08.16","2016-08-01"
"24/06/1975","1975-06-24"
"tháng 10 30 2002","2002-10-30"
"22 tháng 12 1978","1978-12-22"
"18 THÁNG 8 1975","1975-08-18"
"02, thg 2 1971","1971-02-02"
"19 tháng 5, 1991","1991-05-19"
"13 tháng 11 1979","1979-11-13"
"09/10/1980","1980-10-09"
"7 thg 11, 2004","2004-11-07"
"6 tháng 3 1985","1985-03-06"
"7 tháng 10, 1995","1995-10-07"
"16.07.93","1993-07-16"
"26 THÁNG 7 1982","1982-07-26"
"08 THG 8 1982","1982-08-08"
"ngày 22 tháng 04 năm 1981","1981-04-22"
"tháng 8 13, 2010","2010-08-13"
"07 THG 1 2004","2004-01-07"
"29.12.97","1997-12-29"
"05.01.93","1993-01-05"
"3 thg 5, 2016","2016-05-03"
"20, thg 6 1991","1991-06-20"
"THÁNG 1 23, 1974","1974-01-23"
"26 THG 10 1976","1976-10-26"
"8 thg 2, 1994","1994-02-08"
"tháng 3 22 1988","1988-03-22"
"20.11.93","1993-11-20"
"5 11 02","2002-11-05"
"5 thg 9, 1989","1989-09-05"
"tháng 11 30 1973","1973-11-30"
"16 thg 6 1985","1985-06-16"
"ngày 13 tháng 06 năm 1986","1986-06-13"
"THỨ SÁU, NGÀY 20 THÁNG 7 NĂM 2018","2018-07-20"
"20 thg 1, 2005","2005-01-20"
"29 tháng 8, 1995","1995-08-29"
"28/10/1977","1977-10-28"
"NGÀY 27 THÁNG 06 NĂM 2010","2010-06-27"
"27.07.86","1986-07-27"
"28 thg 4, 2003","2003-04-28"
"23 thg 10 1997","1997-10-23"
"24.08.71","1971-08-24"
"26 tháng 12, 1975","1975-12-26"
"7 thg 6, 2014","2014-06-07"
"1 tháng 6 2001","2001-06-01"
"11 tháng 1, 2006","2006-01-11"
"Chủ Nhật, ngày 21 tháng 11 năm 1976","1976-11-21"
"8 02 78","1978-02-08"
"26 THG 2 2009","2009-02-26"
"16 tháng 5 2005","2005-05-16"
"Thứ Ba, ngày 20 tháng 10 năm 1987","1987-10-20"
"29 05 05","2005-05-29"
"28, thg 4 2013","2013-04-28"
"tháng 8 16 2010","2010-08-16"
"tháng 7 20 2004","2004-07-20"
"15 THG 4 1981","1981-04-15"
"tháng 2 29, 2004","2004-02-29"
"18 THG 3, 1998","1998-03-18"
"tháng 4 19, 1972","1972-04-19"
"tháng 10 11 1977","1977-10-11"
"THÁNG 4 16 1991","1991-04-16"
"01.06.12","2012-06-01"
"23 thg 9, 1970","1970-09-23"
"13 thg 11 1985","1985-11-13"
"12 tháng 12 1970","1970-12-12"
"20.11.94","1994-11-20"
"Thứ Năm, ngày 03 tháng 10 năm 2013","2013-10-03"
"9 thg 5, 1988","1988-05-09"
"13/02/2014","2014-02-13"
"25 tháng 1 2008","2008-01-25"
"THÁNG 12 28 2016","2016-12-28"
"16 04 87","1987-04-16"
"12.06.93","1993-06-12"
"13.08.18","2018-08-13"
"tháng 8 12, 1980","1980-08-12"
"4 04 95","1995-04-04"
"19/07/2010","2010-07-19"
"16 tháng 9, 2005","2005-09-16"
"NGÀY 22 THÁNG 06 NĂM 2003","2003-06-22"
"12, thg 2 1997","1997-02-12"
"17 thg 11, 2011","2011-11-17"
"THÁNG 10 29, 2016","2016-10-29"
"10 tháng 3, 1991","1991-03-10"
"thứ hai, ngày 07 tháng 5 năm 1973","1973-05-07"
"NGÀY 25 THÁNG 11 NĂM 1990","1990-11-25"
"Ngày 26 tháng 05 năm 1972","1972-05-26"
"29 THÁNG 12, 1987","1987-12-29"
"1 THG 2, 2017","2017-02-01"
"26 tháng 4 1976","1976-04-26"
"9 THG 6 2006","2006-06-09"
"THÁNG 9 27 2001","2001-09-27"
"17 04 11","2011-04-17"
"1 thg 4, 1992","1992-04-01"
"15 THÁNG 7 2010","2010-07-15"
"3 THÁNG 10 1986","1986-10-03"
"11/07/2007","2007-07-11"
"NGÀY 18 THÁNG 03 NĂM 2002","2002-03-18"
"14 thg 3, 1973","1973-03-14"
"11, thg 5 2007","2007-05-11"
"26 02 86","1986-02-26"
"02 thg 5 1999","1999-05-02"
"ngày 12 tháng 07 năm 1974","1974-07-12"
"30 thg 8 2005","2005-08-30"
"26.10.13","2013-10-26"
"tháng 12 9, 1977","1977-12-09"
"04, thg 5 2010","2010-05-04"
"tháng 11 17 1970","1970-11-17"
"30/07/2000","2000-07-30"
"08 thg 3 1998","1998-03-08"
"30 thg 9, 1976","1976-09-30"
"17 THG 3 1992","1992-03-17"
"25 THG 5, 2006","2006-05-25"
"9 THÁNG 10 2017","2017-10-09"
"25 thg 1 1976","1976-01-25"
"6 08 97","1997-08-06"
"18 tháng 3 1982","1982-03-18"
"24 tháng 6 2005","2005-06-24"
"29 tháng 4, 1998","1998-04-29"
"26 tháng 7, 1988","1988-07-26"
"14.08.06","2006-08-14"
"Ngày 04 tháng 07 năm 2007","2007-07-04"
"1 thg 2 2007","2007-02-01"
"29 tháng 7 1977","1977-07-29"
"12 thg 4, 2007","2007-04-12"
"26 thg 9 2012","2012-09-26"
"tháng 12 8 2007","2007-12-08"
"16 thg 1, 2001","2001-01-16"
"22 thg 2 2013","2013-02-22"
"29 04 93","1993-04-29"
"13/05/1978","1978-05-13"
"25.01.98","1998-01-25"
"tháng 7 29, 1987","1987-07-29"
"18 THG 1, 1998","1998-01-18"
"25/03/1996","1996-03-25"
"20/07/1976","1976-07-20"
"18.09.04","2004-09-18"
"17 THG 5 2016","2016-05-17"
"15 tháng 10 2014","2014-10-15"
"20 tháng 6, 1992","1992-06-20"
"10 thg 5 2003","2003-05-10"
"tháng 10 21, 1992","1992-10-21"
"21 thg 12, 1977","1977-12-21"
"10 tháng 4, 2012","2012-04-10"
"21 tháng 2 1980","1980-02-21"
"CHỦ NHẬT, NGÀY 23 THÁNG 11 NĂM 1975","1975-11-23"
"11/06/1977","1977-06-11"
"3 THÁNG 11 2001","2001-11-03"
"18/09/2005","2005-09-18"
"22 tháng 5 1984","1984-05-22"
"Thứ Hai, ngày 05 tháng 10 năm 1998","1998-10-05"
"20/09/1979","1979-09-20"
"28.09.84","1984-09-28"
"tháng 5 15 1991","1991-05-15"
"23 05 80","1980-05-23"
"10.03.86","1986-03-10"
"23 THG 3, 1983","1983-03-23"
"27/01/1992","1992-01-27"
"28 tháng 4 2007","2007-04-28"
"29/05/2014","2014-05-29"
"24 tháng 9, 2014","2014-09-24"
"Ngày 06 tháng 01 năm 1993","1993-01-06"
"Ngày 23 tháng 01 năm 1976","1976-01-23"
"2 thg 2, 1972","1972-02-02"
"22 04 11","2011-04-22"
"18 thg 11, 2006","2006-11-18"
"24 thg 10 2003","2003-10-24"
"24 05 85","1985-05-24"
"NGÀY 24 THÁNG 06 NĂM 1980","1980-06-24"
"10 thg 1, 2017","2017-01-10"
"30 tháng 5 2007","2007-05-30"
"THỨ BẢY, NGÀY 16 THÁNG 3 NĂM 1996","1996-03-16"
"12 thg 2, 1986","1986-02-12"
"tháng 10 21, 1970","1970-10-21"
"Thứ Bảy, ngày 09 tháng 9 năm 2006","2006-09-09"
"Thứ Ba, ngày 27 tháng 5 năm 1986","1986-05-27"
"22, thg 8 2014","2014-08-22"
"19 thg 6, 1978","1978-06-19"
"tháng 5 16, 2001","2001-05-16"
"30 THG 4, 2003","2003-04-30"
"tháng 4 21 1973","1973-04-21"
"ngày 27 tháng 06 năm 2006","2006-06-27"
"21 thg 8 1974","1974-08-21"
"14 tháng 5 2014","2014-05-14"
"ngày 24 tháng 04 năm 1979","1979-04-24"
"16/12/2017","2017-12-16"
"19 THG 5 2007","2007-05-19"
"3 tháng 7, 2012","2012-07-03"
"21 thg 1, 2013","2013-01-21"
"tháng 3 10, 1989","1989-03-10"
"21 tháng 11, 1983","1983-11-21"
"29, thg 10 1995","1995-10-29"
"Thứ Ba, ngày 15 tháng 1 năm 2008","2008-01-15"
"8 thg 6 1974","1974-06-08"
"27, THG 6 1977","1977-06-27"
"8 tháng 2 1977","1977-02-08"
"22/09/1980","1980-09-22"
"18 tháng 4 1972","1972-04-18"
"8 06 99","1999-06-08"
"5 thg 9, 1976","1976-09-05"
"11, thg 5 2000","2000-05-11"
"Chủ Nhật, ngày 09 tháng 3 năm 2003","2003-03-09"
"15, thg 11 2000","2000-11-15"
"Ngày 22 tháng 05 năm 1999","1999-05-22"
"19 thg 5, 1987","1987-05-19"
"15 thg 11 2008","2008-11-15"
"tháng 2 2 1991","1991-02-02"
"09, thg 7 1998","1998-07-09"
"16 thg 7, 2004","2004-07-16"
"8 tháng 4 2018","2018-04-08"
"NGÀY 11 THÁNG 12 NĂM 1994","1994-12-11"
"4 11 03","2003-11-04"
"12 tháng 6 1996","1996-06-12"
"22, thg 11 1996","1996-11-22"
"01 thg 11 2017","2017-11-01"
"06.11.96","1996-11-06"
"05 thg 9 2003","2003-09-05"
"17 THÁNG 8 1994","1994-08-17"
"28 thg 11, 2006","2006-11-28"
"29 thg 3 1977","1977-03-29"
"05/04/1990","1990-04-05"
"17 thg 2 1982","1982-02-17"
"18/12/1981","1981-12-18"
"tháng 6 13 2008","2008-06-13"
"22, thg 3 1992","1992-03-22"
"22 THG 3, 2001","2001-03-22"
"02, THG 3 2012","2012-03-02"
"2 tháng 4, 1989","1989-04-02"
"8 THÁNG 2 2000","2000-02-08"
"24 tháng 8 2011","2011-08-24"
"3 thg 4, 1983","1983-04-03"
"3 tháng 2 1970","1970-02-03"
"THỨ SÁU, NGÀY 10 THÁNG 5 NĂM 2013","2013-05-10"
"28 tháng 2 1978","1978-02-28"
"tháng 10 2 1971","1971-10-02"
"17 thg 4 1970","1970-04-17"
"22 THÁNG 10 1998","1998-10-22"
"5 thg 12, 1970","1970-12-05"
"07, THG 5 2012","2012-05-07"
"12 tháng 8, 1970","1970-08-12"
"29 thg 10 1975","1975-10-29"
"23 tháng 3 1976","1976-03-23"
"17 02 74","1974-02-17"
"3 tháng 6 2011","2011-06-03"
"THÁNG 8 14 1986","1986-08-14"
"31 thg 10, 1987","1987-10-31"
"2 thg 7 2006","2006-07-02"
"25 thg 11, 1987","1987-11-25"
"tháng 1 23 1991","1991-01-23"
"12 thg 8, 2009","2009-08-12"
"tháng 9 7 2009","2009-09-07"
"thứ hai, ngày 23 tháng 6 năm 1975","1975-06-23"
"8 THG 6, 1981","1981-06-08"
"11/07/1978","1978-07-11"
"8 thg 4, 2012","2012-04-08"
"18/09/2012","2012-09-18"
"30 thg 4, 1985","1985-04-30"
"tháng 2 17, 2001","2001-02-17"
"29 08 16","2016-08-29"
"19 thg 9 2014","2014-09-19"
"ngày 14 tháng 11 năm 1984","1984-11-14"
"10 tháng 6 1977","1977-06-10"
"tháng 2 25 1985","1985-02-25"
"22, thg 1 2002","2002-01-22"
"2 tháng 12 2013","2013-12-02"
"tháng 5 24, 1992","1992-05-24"
"Thứ Năm, ngày 25 tháng 8 năm 2011","2011-08-25"
"19 THG 1, 2011","2011-01-19"
"Ngày 31 tháng 03 năm 1993","1993-03-31"
"8 tháng 4 2013","2013-04-08"
"15 THÁNG 4 1983","1983-04-15"
"18 03 94","1994-03-18"
"tháng 5 23 1997","1997-05-23"
"09 thg 4 1971","1971-04-09"
"ngày 13 tháng 07 năm 1977","1977-07-13"
"25/02/1971","1971-02-25"
"03.07.73","1973-07-03"
"NGÀY 05 THÁNG 05 NĂM 2006","2006-05-05"
"30 03 70","1970-03-30"
"Ngày 03 tháng 03 năm 1992","1992-03-03"
"12 thg 3, 1986","1986-03-12"
"CHỦ NHẬT, NGÀY 21 THÁNG 5 NĂM 1995","1995-05-21"
"13 tháng 10 1995","1995-10-13"
"18.07.00","2000-07-18"
"29 tháng 12 1993","1993-12-29"
"Thứ Ba, ngày 11 tháng 9 năm 2012","2012-09-11"
"20/12/2016","2016-12-20"
"tháng 4 22 1989","1989-04-22"
"Thứ Sáu, ngày 17 tháng 3 năm 1995","1995-03-17"
"THỨ SÁU, NGÀY 06 THÁNG 6 NĂM 2008","2008-06-06"
"25 tháng 10 2015","2015-10-25"
"10 thg 5 1974","1974-05-10"
"6 tháng 5 1971","1971-05-06"
"Thứ Năm, ngày 31 tháng 3 năm 1994","1994-03-31"
"11 thg 6 2018","2018-06-11"
"3 thg 3, 1978","1978-03-03"
"15/04/1979","1979-04-15"
"18 thg 9, 2005","2005-09-18"
"18 tháng 1 1984","1984-01-18"
"17 thg 9, 2014","2014-09-17"
"9 thg 1, 2007","2007-01-09"
"Thứ Ba, ngày 05 tháng 11 năm 1991","1991-11-05"
"NGÀY 04 THÁNG 03 NĂM 1970","1970-03-04"
"30.09.80","1980-09-30"
"13 08 80","1980-08-13"
"10 tháng 1, 2010","2010-01-10"
"Ngày 24 tháng 06 năm 1985","1985-06-24"
"15.04.99","1999-04-15"
"30 tháng 9, 1989","1989-09-30"
"9 tháng 5 1991","1991-05-09"
"28.11.90","1990-11-28"
"15/12/1989","1989-12-15"
"15 thg 7 1984","1984-07-15"
"THỨ NĂM, NGÀY 08 THÁNG 12 NĂM 2005","2005-12-08"
"Ngày 31 tháng 12 năm 2008","2008-12-31"
"11 11 02","2002-11-11"
"18 thg 3, 1970","1970-03-18"
"21 thg 2 2011","2011-02-21"
"NGÀY 16 THÁNG 05 NĂM 2007","2007-05-16"
"NGÀY 11 THÁNG 11 NĂM 2011","2011-11-11"
"26.07.83","1983-07-26"
"06 THG 6 2006","2006-06-06"
"5 tháng 12, 2006","2006-12-05"
"tháng 4 11, 2008","2008-04-11"
"07 thg 4 1994","1994-04-07"
"4 THÁNG 11, 2005","2005-11-04"
"Thứ Năm, ngày 20 tháng 9 năm 1990","1990-09-20"
"25 thg 10 1973","1973-10-25"
"tháng 7 24 1996","1996-07-24"
"17 thg 7, 1994","1994-07-17"
"tháng 9 26, 2016","2016-09-26"
"4 THG 12, 1986","1986-12-04"
"20 01 94","1994-01-20"
"21 thg 8 2010","2010-08-21"
"tháng 10 2, 2012","2012-10-02"
"11 thg 11, 2018","2018-11-11"
"6 THÁNG 12, 1982","1982-12-06"
"11 thg 5, 2007","2007-05-11"
"tháng 4 26, 2004","2004-04-26"
"3 05 76","1976-05-03"
"3 thg 2, 1986","1986-02-03"
"22 01 13","2013-01-22"
"tháng 2 7, 1976","1976-02-07"
"09, thg 1 1987","1987-01-09"
"23 tháng 12 1978","1978-12-23"
"Ngày 11 tháng 05 năm 1992","1992-05-11"
"NGÀY 10 THÁNG 07 NĂM 1997","1997-07-10"
"29, thg 1 1986","1986-01-29"
"29, THG 9 2002","2002-09-29"
"30 tháng 8 1983","1983-08-30"
"Thứ Ba, ngày 21 tháng 7 năm 1981","1981-07-21"
"tháng 12 19, 1983","1983-12-19"
"23 thg 4, 1989","1989-04-23"
"2 tháng 11, 1981","1981-11-02"
"20 THG 3, 1977","1977-03-20"
"2 tháng 8 2012","2012-08-02"
"6 thg 3, 1991","1991-03-06"
"10 tháng 11, 1976","1976-11-10"
"18 tháng 11 2009","2009-11-18"
"18 THÁNG 9, 1984","1984-09-18"
"tháng 1 7, 1996","1996-01-07"
"THÁNG 2 25 1989","1989-02-25"
"21.02.70","1970-02-21"
"10 thg 9, 1971","1971-09-10"
"02 thg 6 2000","2000-06-02"
"02 thg 4 2014","2014-04-02"
"8 02 07","2007-02-08"
"13 thg 4 2012","2012-04-13"
"tháng 1 12, 2015","2015-01-12"
"19 thg 12, 1996","1996-12-19"
"19 tháng 6, 1974","1974-06-19"
"28 tháng 8, 1990","1990-08-28"
"11 THÁNG 11 1970","1970-11-11"
"9 thg 9, 2012","2012-09-09"
"12 tháng 5 2011","2011-05-12"
"28 THÁNG 9, 2001","2001-09-28"
"26 05 83","1983-05-26"
"5 THÁNG 11, 2014","2014-11-05"
"7 THÁNG 7 1974","1974-07-07"
"09/10/1981","1981-10-09"
"11, thg 2 1970","1970-02-11"
"13 thg 6, 1987","1987-06-13"
"28.10.01","2001-10-28"
"25 tháng 9 2001","2001-09-25"
"24 07 80","1980-07-24"
"31 05 82","1982-05-31"
"3 thg 10 1993","1993-10-03"
"tháng 12 19, 2001","2001-12-19"
"03, thg 3 1993","1993-03-03"
"21 tháng 9 1990","1990-09-21"
"tháng 12 19 2009","2009-12-19"
"Ngày 22 tháng 07 năm 2001","2001-07-22"
"17.02.13","2013-02-17"
"19, thg 2 1984","1984-02-19"
"30 tháng 7 1999","1999-07-30"
"17, THG 12 1993","1993-12-17"
"17 thg 1, 1977","1977-01-17"
"tháng 7 17, 1994","1994-07-17"
"23 07 85","1985-07-23"
"16 tháng 5 1977","1977-05-16"
"1 thg 4, 2000","2000-04-01"
"5 THG 3, 1990","1990-03-05"
"12 thg 10, 1986","1986-10-12"
"11 thg 7, 1985","1985-07-11"
"Chủ Nhật, ngày 11 tháng 6 năm 1989","1989-06-11"
"23.01.92","1992-01-23"
"4 tháng 2 1982","1982-02-04"
"THÁNG 11 14 1975","1975-11-14"
"20 thg 7 2018","2018-07-20"
"Ngày 26 tháng 08 năm 1974","1974-08-26"
"10 thg 7 1980","1980-07-10"
"04.12.97","1997-12-04"
"9 thg 9, 1978","1978-09-09"
"20 tháng 2, 1993","1993-02-20"
"3 tháng 7 1975","1975-07-03"
"13 thg 4 2000","2000-04-13"
"18, THG 8 2001","2001-08-18"
"26 01 96","1996-01-26"
"17 thg 3, 2013","2013-03-17"
"25 thg 6 2006","2006-06-25"
"THÁNG 12 10 2011","2011-12-10"
"NGÀY 13 THÁNG 03 NĂM 1982","1982-03-13"
"14 thg 10, 2017","2017-10-14"
"26 05 13","2013-05-26"
"21, thg 12 2014","2014-12-21"
"CHỦ NHẬT, NGÀY 28 THÁNG 12 NĂM 2014","2014-12-28"
"8 08 77","1977-08-08"
"Ngày 23 tháng 02 năm 2000","2000-02-23"
"17.06.88","1988-06-17"
"25 thg 10 2016","2016-10-25"
"6 tháng 6, 2017","2017-06-06"
"29 THG 12, 1989","1989-12-29"
"24.09.83","1983-09-24"
"25 thg 7 1987","1987-07-25"
"18 tháng 2 1977","1977-02-18"
"10, THG 1 1973","1973-01-10"
"1 tháng 3 1984","1984-03-01"
"tháng 9 23, 1981","1981-09-23"
"23.05.78","1978-05-23"
"02/12/1994","1994-12-02"
"8 tháng 5 1994","1994-05-08"
"30 tháng 10 1974","1974-10-30"
"29 thg 2 1992","1992-02-29"
"1 tháng 2, 1987","1987-02-01"
"14/08/1991","1991-08-14"
"25 01 79","1979-01-25"
"23 THÁNG 1 2007","2007-01-23"
"01.03.92","1992-03-01"
"17 04 18","2018-04-17"
"10 THÁNG 4, 1972","1972-04-10"
"17 tháng 7, 1991","1991-07-17"
"14 07 14","2014-07-14"
"04/03/2014","2014-03-04"
"13.10.89","1989-10-13"
"Ngày 06 tháng 12 năm 1986","1986-12-06"
"28 THG 4 1988","1988-04-28"
"1 THÁNG 6 1976","1976-06-01"
"25 10 89","1989-10-25"
"9 thg 6 1986","1986-06-09"
"tháng 3 14, 1981","1981-03-14"
"tháng 8 18, 1984","1984-08-18"
"02 thg 11 2012","2012-11-02"
"28 tháng 1, 2002","2002-01-28"
"11 thg 9, 1981","1981-09-11"
"23/09/2006","2006-09-23"
"Thứ Ba, ngày 04 tháng 3 năm 1986","1986-03-04"
"8 THÁNG 5 2015","2015-05-08"
"28 THG 4, 1980","1980-04-28"
"Thứ Sáu, ngày 31 tháng 12 năm 1982","1982-12-31"
"2 THG 5 2014","2014-05-02"
"tháng 11 8, 2008","2008-11-08"
"Ngày 26 tháng 03 năm 2010","2010-03-26"
"26 thg 2 1990","1990-02-26"
"14.11.14","2014-11-14"
"tháng 3 27 2011","2011-03-27"
"1 THG 2, 1995","1995-02-01"
"11 thg 5 1970","1970-05-11"
"16/09/2006","2006-09-16"
"tháng 11 5 1975","1975-11-05"
"NGÀY 07 THÁNG 08 NĂM 1998","1998-08-07"
"NGÀY 06 THÁNG 11 NĂM 1983","1983-11-06"
"thứ năm, ngày 30 tháng 1 năm 1986","1986-01-30"
"8 thg 3 1999","1999-03-08"
"tháng 10 3 1998","1998-10-03"
"02 THG 4 1993","1993-04-02"
"17 tháng 2 1984","1984-02-17"
"tháng 2 11 2005","2005-02-11"
"16 tháng 1 1977","1977-01-16"
"21 thg 12, 1970","1970-12-21"
"10 THÁNG 9 2002","2002-09-10"
"17 thg 5 1981","1981-05-17"
"3 tháng 8 2011","2011-08-03"
"29 thg 12 1974","1974-12-29"
"09 thg 1 1970","1970-01-09"
"17 thg 1, 1987","1987-01-17"
"02 THG 7 2012","2012-07-02"
"7 THÁNG 4, 1975","1975-04-07"
"24 thg 3, 1991","1991-03-24"
"13 thg 6, 2014","2014-06-13"
"18 thg 10 1979","1979-10-18"
"30 tháng 12 1973","1973-12-30"
"Ngày 17 tháng 04 năm 1998","1998-04-17"
"03/08/1994","1994-08-03"
"20, THG 6 1980","1980-06-20"
"tháng 4 21, 2015","2015-04-21"
"20 THG 7 1970","1970-07-20"
"tháng 2 20, 2014","2014-02-20"
"24 03 07","2007-03-24"
"1 thg 3 2011","2011-03-01"
"chủ nhật, ngày 24 tháng 2 năm 1974","1974-02-24"
"19 tháng 4 1990","1990-04-19"
"30 THG 5, 1977","1977-05-30"
"16 thg 2 2003","2003-02-16"
"8 tháng 8 2016","2016-08-08"
"1 thg 2 1999","1999-02-01"
"27.07.15","2015-07-27"
"4 thg 4 2010","2010-04-04"
"4 07 80","1980-07-04"
"THÁNG 3 8, 2014","2014-03-08"
"thứ bảy, ngày 26 tháng 5 năm 1973","1973-05-26"
"25 tháng 2, 2018","2018-02-25"
"18 thg 12, 2009","2009-12-18"
"31 07 76","1976-07-31"
"20.01.95","1995-01-20"
"tháng 7 26 2006","2006-07-26"
"Thứ Năm, ngày 15 tháng 7 năm 1999","1999-07-15"
"26 tháng 1 1998","1998-01-26"
"26 03 94","1994-03-26"
"27 thg 10, 1980","1980-10-27"
"15 thg 2, 1992","1992-02-15"
"24 thg 12, 1990","1990-12-24"
"29 thg 11, 1975","1975-11-29"
"Thứ Ba, ngày 24 tháng 9 năm 1996","1996-09-24"
"chủ nhật, ngày 08 tháng 8 năm 1993","1993-08-08"
"1 THG 8, 2012","2012-08-01"
"03/03/2013","2013-03-03"
"21 THÁNG 3 2011","2011-03-21"
"THÁNG 9 14, 1990","1990-09-14"
"Ngày 23 tháng 03 năm 2017","2017-03-23"
"9 THÁNG 1 2012","2012-01-09"
"17 tháng 6 1974","1974-06-17"
"10 thg 10, 1995","1995-10-10"
"12 thg 11 1994","1994-11-12"
"18 thg 12 2014","2014-12-18"
"22 thg 4 1982","1982-04-22"
"tháng 8 15 2012","2012-08-15"
"18, THG 9 2003","2003-09-18"
"thứ sáu, ngày 11 tháng 3 năm 1983","1983-03-11"
"4 thg 11, 2003","2003-11-04"
"16 thg 2, 1970","1970-02-16"
"30.08.88","1988-08-30"
"18 tháng 9, 1984","1984-09-18"
"22 thg 3, 2012","2012-03-22"
"01 thg 8 2013","2013-08-01"
"19 thg 5 2005","2005-05-19"
"1 tháng 8 1998","1998-08-01"
"tháng 10 13 2016","2016-10-13"
"18, thg 4 1980","1980-04-18"
"16 thg 10 1973","1973-10-16"
"30 tháng 11 2007","2007-11-30"
"26 thg 2, 2001","2001-02-26"
"16 thg 6, 2016","2016-06-16"
"11, thg 6 1970","1970-06-11"
"21 thg 10, 1991","1991-10-21"
"20.10.74","1974-10-20"
"THÁNG 2 19, 2000","2000-02-19"
"3 thg 10, 1994","1994-10-03"
"tháng 12 6 1975","1975-12-06"
"Thứ Bảy, ngày 29 tháng 1 năm 1972","1972-01-29"
"19 thg 2 1976","1976-02-19"
"03/01/1972","1972-01-03"
"tháng 5 30 2012","2012-05-30"
"23 thg 3 1985","1985-03-23"
"27 thg 4, 1986","1986-04-27"
"14, THG 2 2015","2015-02-14"
"03/05/2017","2017-05-03"
"tháng 12 15 2000","2000-12-15"
"Thứ Sáu, ngày 30 tháng 7 năm 2010","2010-07-30"
"19 thg 1 1985","1985-01-19"
"18 thg 12, 2017","2017-12-18"
"25 tháng 8, 2012","2012-08-25"
"12 thg 10, 1993","1993-10-12"
"22/12/1980","1980-12-22"
"Thứ Hai, ngày 02 tháng 12 năm 2002","2002-12-02"
"28 tháng 3 1984","1984-03-28"
"tháng 11 22 1977","1977-11-22"
"12, thg 11 1973","1973-11-12"
"12 thg 12, 1977","1977-12-12"
"22, THG 5 1995","1995-05-22"
"14/09/1993","1993-09-14"
"9 tháng 12 2006","2006-12-09"
"08.05.94","1994-05-08"
"28 tháng 5, 2013","2013-05-28"
"20 thg 7, 1987","1987-07-20"
"04 THG 2 1973","1973-02-04"
"ngày 16 tháng 11 năm 1989","1989-11-16"
"16 thg 3 1986","1986-03-16"
"NGÀY 11 THÁNG 03 NĂM 1989","1989-03-11"
"26, THG 6 1987","1987-06-26"
"tháng 5 27, 2016","2016-05-27"
"ngày 27 tháng 01 năm 1999","1999-01-27"
"13 12 82","1982-12-13"
"4 THÁNG 4, 1994","1994-04-04"
"9 THG 2, 1997","1997-02-09"
"27 tháng 9, 1996","1996-09-27"
"tháng 6 2, 1998","1998-06-02"
"21/04/1982","1982-04-21"
"tháng 12 6 1998","1998-12-06"
"22, thg 1 1993","1993-01-22"
"Ngày 17 tháng 08 năm 1980","1980-08-17"
"28, THG 5 1990","1990-05-28"
"Chủ Nhật, ngày 03 tháng 3 năm 1974","1974-03-03"
"ngày 03 tháng 05 năm 1997","1997-05-03"
"07, thg 7 1977","1977-07-07"
"26 thg 9 2016","2016-09-26"
"THỨ NĂM, NGÀY 16 THÁNG 11 NĂM 2006","2006-11-16"
"31 THG 10 2018","2018-10-31"
"20, THG 11 1980","1980-11-20"
"23 THÁNG 3 1979","1979-03-23"
"27 thg 1, 1985","1985-01-27"
"30 thg 11 1990","1990-11-30"
"thứ năm, ngày 23 tháng 12 năm 1999","1999-12-23"
"tháng 5 17, 2016","2016-05-17"
"15 THG 4 1999","1999-04-15"
"CHỦ NHẬT, NGÀY 22 THÁNG 2 NĂM 2009","2009-02-22"
"3 02 10","2010-02-03"
"tháng 12 29, 1986","1986-12-29"
"29 tháng 12 1972","1972-12-29"
"30, thg 5 2002","2002-05-30"
"11 thg 12, 2018","2018-12-11"
"THỨ NĂM, NGÀY 22 THÁNG 1 NĂM 1998","1998-01-22"
"1 02 17","2017-02-01"
"THỨ SÁU, NGÀY 21 THÁNG 12 NĂM 2001","2001-12-21"
"07, thg 12 1980","1980-12-07"
"27 tháng 7 1982","1982-07-27"
"20 THÁNG 11 1973","1973-11-20"
"19 thg 9, 2016","2016-09-19"
"21, thg 7 1997","1997-07-21"
"Ngày 04 tháng 02 năm 1988","1988-02-04"
"29 tháng 1 1981","1981-01-29"
"Ngày 09 tháng 03 năm 2015","2015-03-09"
"23 tháng 11 2002","2002-11-23"
"20 thg 7 1991","1991-07-20"
"16/01/1995","1995-01-16"
"ngày 06 tháng 02 năm 1987","1987-02-06"
"18 THG 5 1978","1978-05-18"
"13 tháng 10 2018","2018-10-13"
"14 thg 1 1990","1990-01-14"
"Ngày 12 tháng 02 năm 2003","2003-02-12"
"21 04 71","1971-04-21"
"04/12/1996","1996-12-04"
"Thứ Tư, ngày 04 tháng 5 năm 2011","2011-05-04"
"29 thg 5 1994","1994-05-29"
"Ngày 16 tháng 05 năm 1978","1978-05-16"
"8 thg 8 2014","2014-08-08"
"24 THG 9 1994","1994-09-24"
"12 tháng 2 1993","1993-02-12"
"8 thg 11 2003","2003-11-08"
"16, THG 11 2002","2002-11-16"
"24 tháng 5, 1980","1980-05-24"
"tháng 11 29, 2011","2011-11-29"
"28 THÁNG 10 2002","2002-10-28"
"4 tháng 1 1982","1982-01-04"
"29 thg 8 1993","1993-08-29"
"24 THÁNG 2, 2002","2002-02-24"
"21.10.17","2017-10-21"
"chủ nhật, ngày 06 tháng 1 năm 1980","1980-01-06"
"17.12.72","1972-12-17"
"tháng 3 6 1988","1988-03-06"
"15 THÁNG 12, 1972","1972-12-15"
"3 tháng 3 1978","1978-03-03"
"THỨ BẢY, NGÀY 24 THÁNG 6 NĂM 2017","2017-06-24"
"tháng 1 3 2000","2000-01-03"
"thứ ba, ngày 26 tháng 2 năm 1980","1980-02-26"
"19/02/1988","1988-02-19"
"Ngày 02 tháng 11 năm 2016","2016-11-02"
"THỨ BA, NGÀY 21 THÁNG 11 NĂM 1995","1995-11-21"
"tháng 12 14, 1977","1977-12-14"
"Thứ Năm, ngày 23 tháng 7 năm 2009","2009-07-23"
"01/11/2013","2013-11-01"
"11.10.03","2003-10-11"
"5 tháng 12 1999","1999-12-05"
"11 THÁNG 4 2005","2005-04-11"
"20 thg 9, 1977","1977-09-20"
"tháng 6 16, 1990","1990-06-16"
"26 THG 3 2003","2003-03-26"
"26, THG 12 1989","1989-12-26"
"18 thg 5, 1990","1990-05-18"
"tháng 6 8 1980","1980-06-08"
"tháng 1 10, 2006","2006-01-10"
"tháng 3 10, 1981","1981-03-10"
"17 tháng 11, 1971","1971-11-17"
"06, thg 6 1977","1977-06-06"
"tháng 2 9 2007","2007-02-09"
"22/06/1989","1989-06-22"
"17.01.96","1996-01-17"
"12 THG 7 2011","2011-07-12"
"22 thg 1, 1999","1999-01-22"
"2 tháng 9 1991","1991-09-02"
"NGÀY 30 THÁNG 07 NĂM 1995","1995-07-30"
"Thứ Ba, ngày 10 tháng 7 năm 2001","2001-07-10"
"20, thg 2 1999","1999-02-20"
"tháng 1 21 1989","1989-01-21"
"Ngày 07 tháng 04 năm 2012","2012-04-07"
"5 tháng 4, 1974","1974-04-05"
"29.03.76","1976-03-29"
"13 tháng 8, 2000","2000-08-13"
"23 tháng 5, 1970","1970-05-23"
"15 01 96","1996-01-15"
"20, thg 8 1984","1984-08-20"
"18 10 97","1997-10-18"
"30/01/1979","1979-01-30"
"31 tháng 7 2017","2017-07-31"
"7 thg 3 1989","1989-03-07"
"tháng 2 16 1990","1990-02-16"
"08, thg 6 1993","1993-06-08"
"15 thg 12, 1995","1995-12-15"
"9 THÁNG 2 1981","1981-02-09"
"21.01.80","1980-01-21"
"21 thg 9, 2017","2017-09-21"
"07.02.79","1979-02-07"
"1 THÁNG 8 1999","1999-08-01"
"THỨ HAI, NGÀY 07 THÁNG 11 NĂM 1983","1983-11-07"
"21 tháng 12 2001","2001-12-21"
"tháng 4 27, 2010","2010-04-27"
"7 THG 6, 2008","2008-06-07"
"tháng 12 10, 1979","1979-12-10"
"8 THÁNG 2 1988","1988-02-08"
"07 THG 2 2006","2006-02-07"
"23, thg 4 1987","1987-04-23"
"ngày 03 tháng 11 năm 1987","1987-11-03"
"21 thg 4, 1997","1997-04-21"
"Ngày 27 tháng 03 năm 1970","1970-03-27"
"Thứ Sáu, ngày 03 tháng 4 năm 2015","2015-04-03"
"23/04/2012","2012-04-23"
"tháng 6 6 1972","1972-06-06"
"Thứ Bảy, ngày 23 tháng 10 năm 1971","1971-10-23"
"Ngày 31 tháng 03 năm 2014","2014-03-31"
"11 THG 5 2015","2015-05-11"
"13/06/1975","1975-06-13"
"1 tháng 11 2013","2013-11-01"
"22.01.78","1978-01-22"
"11.03.71","1971-03-11"
"2 thg 3 2017","2017-03-02"
"25/03/1979","1979-03-25"
"tháng 12 25 1995","1995-12-25"
"07, THG 6 1994","1994-06-07"
"25/08/1978","1978-08-25"
"tháng 6 14, 2013","2013-06-14"
"21 03 99","1999-03-21"
"3 tháng 8 1982","1982-08-03"
"24 thg 3 1986","1986-03-24"
"2 thg 10, 1986","1986-10-02"
"22/06/1979","1979-06-22"
"4 thg 9 1987","1987-09-04"
"tháng 12 21 1976","1976-12-21"
"Thứ Năm, ngày 16 tháng 6 năm 2011","2011-06-16"
"4 thg 12, 1986","1986-12-04"
"30 tháng 4 1998","1998-04-30"
"17 THG 10, 1999","1999-10-17"
"30 THÁNG 8 1994","1994-08-30"
"30 thg 4, 1977","1977-04-30"
"Thứ Ba, ngày 21 tháng 10 năm 1997","1997-10-21"
"tháng 10 5, 2013","2013-10-05"
"12, thg 5 1984","1984-05-12"
"27 thg 10 2013","2013-10-27"
"16 thg 12 1983","1983-12-16"
"NGÀY 30 THÁNG 07 NĂM 1977","1977-07-30"
"thứ sáu, ngày 25 tháng 12 năm 1992","1992-12-25"
"Thứ Sáu, ngày 10 tháng 4 năm 2009","2009-04-10"
"21 THG 8 1971","1971-08-21"
"NGÀY 10 THÁNG 08 NĂM 2010","2010-08-10"
"20.06.00","2000-06-20"
"28 tháng 4, 1976","1976-04-28"
"10 thg 4 1974","1974-04-10"
"22 thg 2 1985","1985-02-22"
"26 thg 2 1992","1992-02-26"
"2 thg 12, 1976","1976-12-02"
"16 THG 12, 1997","1997-12-16"
"08.05.84","1984-05-08"
"25 THG 8 2017","2017-08-25"
"8 THÁNG 5 2008","2008-05-08"
"8 THG 11, 1976","1976-11-08"
"THỨ SÁU, NGÀY 12 THÁNG 5 NĂM 1972","1972-05-12"
"02.01.86","1986-01-02"
"THỨ NĂM, NGÀY 17 THÁNG 10 NĂM 2013","2013-10-17"
"tháng 3 24 2006","2006-03-24"
"5 tháng 6 2012","2012-06-05"
"20 THG 3, 1997","1997-03-20"
"30, thg 8 2013","2013-08-30"
"29.09.15","2015-09-29"
"13 THÁNG 6 1971","1971-06-13"
"tháng 10 28 1999","1999-10-28"
"1 tháng 6 1998","1998-06-01"
"11 THG 3, 1988","1988-03-11"
"21, THG 11 1996","1996-11-21"
"23 thg 5 1988","1988-05-23"
"16 thg 4, 1985","1985-04-16"
"7 09 85","1985-09-07"
"18 tháng 11 2016","2016-11-18"
"24 tháng 1, 1986","1986-01-24"
"8 thg 12, 1975","1975-12-08"
"Ngày 15 tháng 10 năm 2007","2007-10-15"
"08/08/2006","2006-08-08"
"27 thg 6, 1984","1984-06-27"
"28 THG 1 1997","1997-01-28"
"9 tháng 9 2010","2010-09-09"
"20 THÁNG 1 1982","1982-01-20"
"ngày 13 tháng 03 năm 1992","1992-03-13"
"22/11/1992","1992-11-22"
"29 THÁNG 12, 2005","2005-12-29"
"tháng 5 5 2018","2018-05-05"
"24/02/2014","2014-02-24"
"24 thg 6 1980","1980-06-24"
"1 01 05","2005-01-01"
"13 thg 7, 1974","1974-07-13"
"28 tháng 4 2002","2002-04-28"
"26 thg 4, 2017","2017-04-26"
"30 tháng 1 1990","1990-01-30"
"21/04/1998","1998-04-21"
"13 thg 2, 1988","1988-02-13"
"4 THG 11, 1994","1994-11-04"
"tháng 11 5, 1993","1993-11-05"
"chủ nhật, ngày 27 tháng 5 năm 1990","1990-05-27"
"02 THG 4 2018","2018-04-02"
"Thứ Sáu, ngày 23 tháng 3 năm 1990","1990-03-23"
"13 thg 6, 1975","1975-06-13"
"Ngày 10 tháng 04 năm 2014","2014-04-10"
"10.04.09","2009-04-10"
"19, thg 4 1981","1981-04-19"
"Thứ Sáu, ngày 06 tháng 11 năm 1981","1981-11-06"
"02/12/1970","1970-12-02"
"9 thg 11, 1974","1974-11-09"
"03, thg 9 2007","2007-09-03"
"tháng 6 7 2014","2014-06-07"
"tháng 5 13 2013","2013-05-13"
"16, thg 3 2005","2005-03-16"
"18 thg 5, 1992","1992-05-18"
"17 thg 5 1989","1989-05-17"
"17/06/2018","2018-06-17"
"tháng 11 20, 1980","1980-11-20"
"14 tháng 6, 1970","1970-06-14"
"29 THÁNG 3 2010","2010-03-29"
"24 THG 11 2000","2000-11-24"
"06.10.95","1995-10-06"
"9 tháng 5, 1987","1987-05-09"
"25 tháng 7 1976","1976-07-25"
"tháng 10 8 2003","2003-10-08"
"29 09 17","2017-09-29"
"16 tháng 11 1987","1987-11-16"
"24 thg 9 1988","1988-09-24"
"23 thg 5, 2006","2006-05-23"
"17 thg 6 1975","1975-06-17"
"6 THÁNG 10, 1998","1998-10-06"
"thứ sáu, ngày 26 tháng 4 năm 1996","1996-04-26"
"28 thg 11 1986","1986-11-28"
"18 THÁNG 3 2011","2011-03-18"
"tháng 12 20, 2005","2005-12-20"
"28 tháng 2 1985","1985-02-28"
"8 thg 1 1973","1973-01-08"
"24 THÁNG 3 2006","2006-03-24"
"08, THG 4 1996","1996-04-08"
"1 thg 11, 1986","1986-11-01"
"27 thg 9 1982","1982-09-27"
"16 thg 1 1972","1972-01-16"
"12, thg 11 1990","1990-11-12"
"4 thg 11, 1988","1988-11-04"
"02 thg 12 1993","1993-12-02"
"30 thg 11 2006","2006-11-30"
"23, thg 7 1984","1984-07-23"
"5 thg 2 1992","1992-02-05"
"08.03.16","2016-03-08"
"tháng 3 9, 1975","1975-03-09"
"20 07 98","1998-07-20"
"12 tháng 7, 1985","1985-07-12"
"22 THG 9, 1980","1980-09-22"
"1 thg 3, 2018","2018-03-01"
"23 thg 1 1995","1995-01-23"
"tháng 6 30 1981","1981-06-30"
"tháng 10 19 2018","2018-10-19"
"tháng 5 14 2010","2010-05-14"
"13 thg 3 1980","1980-03-13"
"THÁNG 12 12 1983","1983-12-12"
"2 03 94","1994-03-02"
"27 tháng 11 2012","2012-11-27"
"20 THÁNG 6 1995","1995-06-20"
"20 tháng 12 2016","2016-12-20"
"05/08/2002","2002-08-05"
"THÁNG 2 18 2017","2017-02-18"
"tháng 6 4, 1980","1980-06-04"
"4 11 14","2014-11-04"
"07 thg 6 2010","2010-06-07"
"21.01.84","1984-01-21"
"01.09.95","1995-09-01"
"NGÀY 10 THÁNG 11 NĂM 2000","2000-11-10"
"20 thg 7 1982","1982-07-20"
"5 thg 2 1985","1985-02-05"
"03.05.74","1974-05-03"
"26 tháng 1 2006","2006-01-26"
"2 THG 12, 2013","2013-12-02"
"17 tháng 4 1982","1982-04-17"
"tháng 5 10 2012","2012-05-10"
"15 THÁNG 8, 1979","1979-08-15"
"tháng 3 12 2016","2016-03-12"
"27 thg 1, 1997","1997-01-27"
"16 06 77","1977-06-16"
"chủ nhật, ngày 11 tháng 3 năm 2018","2018-03-11"
"23, thg 2 2002","2002-02-23"
"24, thg 6 1994","1994-06-24"
"THÁNG 8 27, 2006","2006-08-27"
"thứ ba, ngày 06 tháng 12 năm 1988","1988-12-06"
"tháng 5 21, 1990","1990-05-21"
"23 tháng 1 1992","1992-01-23"
"22 thg 7, 1991","1991-07-22"
"17 thg 8 2014","2014-08-17"
"18, thg 7 1987","1987-07-18"
"29 tháng 6, 1991","1991-06-29"
"thứ năm, ngày 12 tháng 6 năm 1997","1997-06-12"
"24.02.02","2002-02-24"
"14/02/2002","2002-02-14"
"THÁNG 3 24 1981","1981-03-24"
"19/03/1986","1986-03-19"
"Ngày 23 tháng 03 năm 1997","1997-03-23"
"15/06/2010","2010-06-15"
"31 THÁNG 1 1972","1972-01-31"
"THÁNG 12 11, 1994","1994-12-11"
"4 04 79","1979-04-04"
"23 06 18","2018-06-23"
"12 THÁNG 1 1976","1976-01-12"
"22 thg 9, 2013","2013-09-22"
"30 THG 5, 1995","1995-05-30"
"tháng 11 13, 1988","1988-11-13"
"12 tháng 11, 2016","2016-11-12"
"16 thg 6 2001","2001-06-16"
"01/08/1987","1987-08-01"
"21 tháng 7, 1978","1978-07-21"
"22 THG 12 1988","1988-12-22"
"29/09/2016","2016-09-29"
"10 thg 10 1982","1982-10-10"
"23 thg 10 2009","2009-10-23"
"Thứ Bảy, ngày 01 tháng 9 năm 1990","1990-09-01"
"ngày 06 tháng 06 năm 1998","1998-06-06"
"21 tháng 10 2015","2015-10-21"
"12 thg 10, 2007","2007-10-12"
"tháng 5 18 1985","1985-05-18"
"8 tháng 7, 1994","1994-07-08"
"tháng 7 29, 2006","2006-07-29"
"18 THG 9, 1999","1999-09-18"
"12 thg 3, 1995","1995-03-12"
"26 thg 5 1986","1986-05-26"
"6 tháng 8 2005","2005-08-06"
"Ngày 08 tháng 03 năm 2006","2006-03-08"
"20/02/1991","1991-02-20"
"Ngày 16 tháng 08 năm 1971","1971-08-16"
"tháng 12 17 1994","1994-12-17"
"20 THG 1 1995","1995-01-20"
"28 tháng 1 1991","1991-01-28"
"13 thg 11 1981","1981-11-13"
"10 thg 9 1977","1977-09-10"
"11 thg 2, 2010","2010-02-11"
"THỨ HAI, NGÀY 16 THÁNG 5 NĂM 1977","1977-05-16"
"29 thg 5 1996","1996-05-29"
"13 THÁNG 4 2002","2002-04-13"
"19/10/2000","2000-10-19"
"12 THG 9, 2018","2018-09-12"
"22 tháng 1 1999","1999-01-22"
"24 tháng 3, 1987","1987-03-24"
"16 tháng 11, 1995","1995-11-16"
"13 thg 12 1976","1976-12-13"
"20 12 77","1977-12-20"
"14 tháng 3 1970","1970-03-14"
"15.07.97","1997-07-15"
"Ngày 04 tháng 09 năm 2006","2006-09-04"
"tháng 1 17, 1974","1974-01-17"
"tháng 2 9 2017","2017-02-09"
"THÁNG 6 6 1972","1972-06-06"
"21, thg 11 1989","1989-11-21"
"20/03/2011","2011-03-20"
"18 thg 10 2013","2013-10-18"
"18/04/1998","1998-04-18"
"16 tháng 10 2012","2012-10-16"
"13 THG 3 2015","2015-03-13"
"Ngày 04 tháng 12 năm 1979","1979-12-04"
"23 thg 7, 2001","2001-07-23"
"28 tháng 8 1972","1972-08-28"
"24, THG 8 1984","1984-08-24"
"6 thg 10, 1980","1980-10-06"
"11 thg 3 2002","2002-03-11"
"Thứ Sáu, ngày 10 tháng 11 năm 1995","1995-11-10"
"tháng 6 29, 1975","1975-06-29"
"10 thg 7 2018","2018-07-10"
"tháng 2 22, 1988","1988-02-22"
"16/04/1999","1999-04-16"
"23 01 82","1982-01-23"
"23 thg 4 1977","1977-04-23"
"13/05/2007","2007-05-13"
"25 thg 2 2012","2012-02-25"
"24 thg 9, 1980","1980-09-24"
"Chủ Nhật, ngày 15 tháng 3 năm 1970","1970-03-15"
"23, thg 6 1975","1975-06-23"
"8 thg 8, 1992","1992-08-08"
"06 thg 4 2017","2017-04-06"
"tháng 3 24 2011","2011-03-24"
"30.10.10","2010-10-30"
"23 thg 1 2008","2008-01-23"
"22 thg 6, 1990","1990-06-22"
"tháng 4 15, 1981","1981-04-15"
"13.03.72","1972-03-13"
"25 THÁNG 2 1992","1992-02-25"
"8 thg 5, 1993","1993-05-08"
"tháng 7 25 2003","2003-07-25"
"17/03/2004","2004-03-17"
"Chủ Nhật, ngày 02 tháng 4 năm 1989","1989-04-02"
"20 THÁNG 5 1999","1999-05-20"
"12 THG 11, 1992","1992-11-12"
"14 tháng 2, 1979","1979-02-14"
"20/12/2001","2001-12-20"
"21 tháng 6, 1978","1978-06-21"
"5 THG 2 1979","1979-02-05"
"03 THG 10 1983","1983-10-03"
"9 02 74","1974-02-09"
"9 THG 4, 1990","1990-04-09"
"09.01.75","1975-01-09"
"23 thg 3 1996","1996-03-23"
"21 THG 11 1981","1981-11-21"
"ngày 11 tháng 05 năm 2000","2000-05-11"
"21/12/1998","1998-12-21"
"2 THÁNG 1 2013","2013-01-02"
"23 tháng 3, 1987","1987-03-23"
"27 THÁNG 6 1975","1975-06-27"
"7 tháng 8 1990","1990-08-07"
"30 tháng 9 1980","1980-09-30"
"06.09.84","1984-09-06"
"Thứ Năm, ngày 02 tháng 4 năm 1970","1970-04-02"
"5 11 99","1999-11-05"
"26 tháng 4 1981","1981-04-26"
"CHỦ NHẬT, NGÀY 29 THÁNG 3 NĂM 2009","2009-03-29"
"8 thg 6, 2006","2006-06-08"
"tháng 10 3, 2001","2001-10-03"
"17 thg 9, 1979","1979-09-17"
"tháng 5 28, 1970","1970-05-28"
"27 thg 1, 2017","2017-01-27"
"03/07/2005","2005-07-03"
"THÁNG 9 14, 1971","1971-09-14"
"08 THG 3 2002","2002-03-08"
"23 03 03","2003-03-23"
"ngày 18 tháng 08 năm 1981","1981-08-18"
"THÁNG 11 4 1997","1997-11-04"
"1 01 84","1984-01-01"
"tháng 11 27 2013","2013-11-27"
"13 tháng 8 2001","2001-08-13"
"27/10/2000","2000-10-27"
"24 tháng 11 2005","2005-11-24"
"Ngày 09 tháng 10 năm 2006","2006-10-09"
"13/08/1976","1976-08-13"
"23, thg 9 2014","2014-09-23"
"tháng 7 6 1990","1990-07-06"
"tháng 1 10, 1988","1988-01-10"
"2 thg 10, 1986","1986-10-02"
"01 thg 7 2008","2008-07-01"
"tháng 4 25, 2009","2009-04-25"
"26 THÁNG 9 1983","1983-09-26"
"30 thg 4, 2014","2014-04-30"
"04, thg 10 2018","2018-10-04"
"Ngày 03 tháng 07 năm 1992","1992-07-03"
"3 tháng 6 2002","2002-06-03"
"22 thg 6, 2018","2018-06-22"
"22 10 86","1986-10-22"
"11 THG 3 2017","2017-03-11"
"tháng 12 14, 1990","1990-12-14"
"11.01.14","2014-01-11"
"THỨ HAI, NGÀY 02 THÁNG 10 NĂM 2000","2000-10-02"
"Ngày 02 tháng 10 năm 1985","1985-10-02"
"27, thg 2 2000","2000-02-27"
"tháng 10 9, 2008","2008-10-09"
"14 THÁNG 9 1972","1972-09-14"
"10 08 76","1976-08-10"
"27 thg 7 1983","1983-07-27"
"thứ bảy, ngày 10 tháng 10 năm 1998","1998-10-10"
"Thứ Bảy, ngày 04 tháng 8 năm 1990","1990-08-04"
"13 thg 8, 2007","2007-08-13"
"2 THÁNG 6, 2004","2004-06-02"
"20 tháng 1, 1986","1986-01-20"
"Ngày 11 tháng 06 năm 2008","2008-06-11"
"22 thg 5 1986","1986-05-22"
"24 thg 2, 1998","1998-02-24"
"31 thg 5, 2009","2009-05-31"
"NGÀY 13 THÁNG 06 NĂM 2017","2017-06-13"
"THÁNG 12 5, 1999","1999-12-05"
"20 tháng 7, 1976","1976-07-20"
"tháng 11 27 2013","2013-11-27"
"12 THÁNG 9 1990","1990-09-12"
"tháng 7 21, 1981","1981-07-21"
"1 tháng 4, 2010","2010-04-01"
"25, thg 1 2013","2013-01-25"
"31.05.01","2001-05-31"
"9 THG 3, 1977","1977-03-09"
"tháng 6 16, 2015","2015-06-16"
"29 thg 5 1999","1999-05-29"
"THÁNG 1 4, 1985","1985-01-04"
"28 thg 9, 2004","2004-09-28"
"THÁNG 3 20 2017","2017-03-20"
"2 11 74","1974-11-02"
"18 THÁNG 6 1995","1995-06-18"
"21, thg 6 1993","1993-06-21"
"11 tháng 8, 2008","2008-08-11"
"THỨ HAI, NGÀY 31 THÁNG 1 NĂM 1972","1972-01-31"
"26 tháng 10, 2016","2016-10-26"
"23/01/1996","1996-01-23"
"15 08 80","1980-08-15"
"7 tháng 7, 1979","1979-07-07"
"06 thg 9 1974","1974-09-06"
"7 THG 1, 1977","1977-01-07"
"tháng 11 3 1999","1999-11-03"
"07/02/1973","1973-02-07"
"2 thg 12 2015","2015-12-02"
"THÁNG 7 26 2008","2008-07-26"
"16 11 12","2012-11-16"
"12 tháng 10 2003","2003-10-12"
"17/10/1981","1981-10-17"
"31 tháng 3, 1983","1983-03-31"
"24 THG 1 1982","1982-01-24"
"2 tháng 4 2001","2001-04-02"
"20 tháng 1 2005","2005-01-20"
"31 THG 1, 1986","1986-01-31"
"18 thg 6, 2009","2009-06-18"
"23 tháng 5 1999","1999-05-23"
"30 11 79","1979-11-30"
"19 03 97","1997-03-19"
"27 tháng 3 2001","2001-03-27"
"14, thg 8 2015","2015-08-14"
"13 tháng 8 2010","2010-08-13"
"16 THG 8 1997","1997-08-16"
"tháng 8 10, 1982","1982-08-10"
"THÁNG 9 28 1994","1994-09-28"
"20 thg 2 1997","1997-02-20"
"08, thg 10 1994","1994-10-08"
"7 tháng 3 2015","2015-03-07"
"21 tháng 7, 1970","1970-07-21"
"16 tháng 2 2010","2010-02-16"
"THÁNG 6 18, 2003","2003-06-18"
"24/10/1997","1997-10-24"
"tháng 9 12 2006","2006-09-12"
"17 THG 3, 2004","2004-03-17"
"27, THG 7 2015","2015-07-27"
"01.07.82","1982-07-01"
"Ngày 12 tháng 10 năm 1980","1980-10-12"
"8 tháng 4 1974","1974-04-08"
"30 tháng 4 1976","1976-04-30"
"9 thg 1, 1981","1981-01-09"
"tháng 11 5, 1971","1971-11-05"
"29 tháng 4, 1979","1979-04-29"
"12 thg 10 1970","1970-10-12"
"6 06 06","2006-06-06"
"06.05.07","2007-05-06"
"13 10 97","1997-10-13"
"tháng 5 13, 2011","2011-05-13"
"23 10 84","1984-10-23"
"16 thg 6 1971","1971-06-16"
"10 09 96","1996-09-10"
"19 tháng 2 2011","2011-02-19"
"21 thg 9, 1995","1995-09-21"
"16/07/2004","2004-07-16"
"19 thg 5 2003","2003-05-19"
"18, thg 8 1984","1984-08-18"
"THÁNG 3 18, 2017","2017-03-18"
"12 thg 3 2014","2014-03-12"
"Ngày 07 tháng 08 năm 1980","1980-08-07"
"tháng 3 26 2015","2015-03-26"
"29 thg 1, 2005","2005-01-29"
"03/09/1996","1996-09-03"
"8 thg 11, 2004","2004-11-08"
"tháng 2 3 1983","1983-02-03"
"Ngày 26 tháng 02 năm 1979","1979-02-26"
"5 THÁNG 11, 1972","1972-11-05"
"20 THÁNG 3, 1976","1976-03-20"
"12, thg 3 1988","1988-03-12"
"14/12/1971","1971-12-14"
"19 THG 6, 1985","1985-06-19"
"THÁNG 10 13 1970","1970-10-13"
"4 THG 3, 2013","2013-03-04"
"21 thg 8, 1999","1999-08-21"
"27 07 14","2014-07-27"
"2 THÁNG 3, 2009","2009-03-02"
"30 05 15","2015-05-30"
"THÁNG 8 25, 1984","1984-08-25"
"04 THG 12 1983","1983-12-04"
"2 thg 5, 2014","2014-05-02"
"18 THÁNG 1 1978","1978-01-18"
"8 tháng 9, 2013","2013-09-08"
"15, thg 10 2002","2002-10-15"
"1 THÁNG 5 2011","2011-05-01"
"2 tháng 9 2008","2008-09-02"
"19 tháng 11, 2015","2015-11-19"
"6 tháng 2, 1999","1999-02-06"
"17 tháng 1 1995","1995-01-17"
"THỨ BA, NGÀY 20 THÁNG 1 NĂM 1981","1981-01-20"
"15/08/1971","1971-08-15"
"10 tháng 6 1994","1994-06-10"
"13 tháng 10 1982","1982-10-13"
"30, thg 10 1974","1974-10-30"
"14 tháng 3 2007","2007-03-14"
"Thứ Bảy, ngày 21 tháng 12 năm 2002","2002-12-21"
"06/01/1996","1996-01-06"
"tháng 7 18, 2004","2004-07-18"
"10/12/1993","1993-12-10"
"tháng 1 6, 1995","1995-01-06"
"18 tháng 3 2003","2003-03-18"
"2 THÁNG 2 2010","2010-02-02"
"Ngày 25 tháng 09 năm 1973","1973-09-25"
"2 tháng 4, 1972","1972-04-02"
"21 thg 6, 1996","1996-06-21"
"16 thg 2 2000","2000-02-16"
"NGÀY 18 THÁNG 01 NĂM 2012","2012-01-18"
"20.04.95","1995-04-20"
"18 thg 4 1976","1976-04-18"
"16 tháng 7, 2010","2010-07-16"
"14 THÁNG 3 2013","2013-03-14"
"tháng 2 17 1973","1973-02-17"
"tháng 2 14, 2003","2003-02-14"
"17 tháng 12, 1993","1993-12-17"
"11 thg 3 1998","1998-03-11"
"tháng 2 5 2000","2000-02-05"
"2 thg 12, 1986","1986-12-02"
"31 12 97","1997-12-31"
"27/11/1985","1985-11-27"
"11.02.72","1972-02-11"
"2 THG 6 1989","1989-06-02"
"4 04 89","1989-04-04"
"1 thg 9, 1985","1985-09-01"
"20 tháng 3, 2012","2012-03-20"
"THÁNG 8 16 1993","1993-08-16"
"17 thg 5 2014","2014-05-17"
"24 thg 5 2016","2016-05-24"
"24 THG 5 2003","2003-05-24"
"Chủ Nhật, ngày 01 tháng 12 năm 2013","2013-12-01"
"16 THG 5, 1991","1991-05-16"
"11 THÁNG 12 1997","1997-12-11"
"2 12 70","1970-12-02"
"THÁNG 2 28, 2014","2014-02-28"
"tháng 8 2 1993","1993-08-02"
"01 thg 6 1992","1992-06-01"
"28 tháng 12, 1982","1982-12-28"
"14 thg 6 1982","1982-06-14"
"27 thg 11 1985","1985-11-27"
"THÁNG 6 17, 2001","2001-06-17"
"01, THG 8 2017","2017-08-01"
"11 tháng 6 1990","1990-06-11"
"26 THÁNG 7 2018","2018-07-26"
"04 thg 10 1998","1998-10-04"
"02/05/1992","1992-05-02"
"chủ nhật, ngày 03 tháng 2 năm 1985","1985-02-03"
"THÁNG 4 19, 2008","2008-04-19"
"20 06 88","1988-06-20"
"tháng 1 12, 1994","1994-01-12"
"NGÀY 25 THÁNG 09 NĂM 2007","2007-09-25"
"ngày 14 tháng 05 năm 1999","1999-05-14"
"30/06/1971","1971-06-30"
"tháng 8 24 1977","1977-08-24"
"09, THG 9 1978","1978-09-09"
"26 thg 12, 1989","1989-12-26"
"17/04/1983","1983-04-17"
"24 thg 10, 2008","2008-10-24"
"24.08.73","1973-08-24"
"12 THÁNG 2, 2008","2008-02-12"
"18 THÁNG 5 1973","1973-05-18"
"13 THG 5 1999","1999-05-13"
"THÁNG 12 24, 2001","2001-12-24"
"tháng 3 10, 1975","1975-03-10"
"1 thg 6, 1989","1989-06-01"
"9 THÁNG 11 1992","1992-11-09"
"27 tháng 9 1981","1981-09-27"
"Thứ Bảy, ngày 06 tháng 9 năm 1980","1980-09-06"
"20 tháng 12 2012","2012-12-20"
"11 tháng 4 2016","2016-04-11"
"15 08 75","1975-08-15"
"tháng 6 12, 1983","1983-06-12"
"Thứ Năm, ngày 12 tháng 6 năm 2003","2003-06-12"
"13 thg 1, 1977","1977-01-13"
"17 tháng 12 1990","1990-12-17"
"tháng 8 25 2002","2002-08-25"
"1 thg 9, 2007","2007-09-01"
"19/04/2013","2013-04-19"
"23 THG 1 1998","1998-01-23"
"20/09/1983","1983-09-20"
"17 thg 11 2015","2015-11-17"
"THÁNG 10 24 1979","1979-10-24"
"09.09.97","1997-09-09"
"14 tháng 12 1997","1997-12-14"
"tháng 6 18, 2016","2016-06-18"
"31, thg 12 1990","1990-12-31"
"THÁNG 6 21 2007","2007-06-21"
"19/06/1993","1993-06-19"
"6 thg 7, 2010","2010-07-06"
"22 tháng 9 1989","1989-09-22"
"THÁNG 8 28 2014","2014-08-28"
"14.10.72","1972-10-14"
"05, thg 10 1990","1990-10-05"
"28 tháng 9 1970","1970-09-28"
"26, thg 3 2004","2004-03-26"
"30, thg 12 1975","1975-12-30"
"19 THÁNG 1 1993","1993-01-19"
"Ngày 10 tháng 09 năm 2009","2009-09-10"
"30 tháng 3 2008","2008-03-30"
"Thứ Bảy, ngày 04 tháng 8 năm 2018","2018-08-04"
"26 tháng 12 1981","1981-12-26"
"15 THG 7 1979","1979-07-15"
"25.08.99","1999-08-25"
"03/07/1979","1979-07-03"
"07.02.87","1987-02-07"
"24 tháng 5, 1997","1997-05-24"
"ngày 16 tháng 02 năm 1974","1974-02-16"
"THÁNG 2 13 2014","2014-02-13"
"13 tháng 6 2010","2010-06-13"
"tháng 7 8, 2005","2005-07-08"
"tháng 6 12, 1987","1987-06-12"
"4 tháng 5, 2011","2011-05-04"
"tháng 12 11, 1970","1970-12-11"
"Ngày 24 tháng 10 năm 1971","1971-10-24"
"19 09 16","2016-09-19"
"Thứ Năm, ngày 10 tháng 11 năm 2005","2005-11-10"
"Thứ Ba, ngày 10 tháng 8 năm 1976","1976-08-10"
"25, thg 11 1979","1979-11-25"
"22 tháng 9, 2015","2015-09-22"
"tháng 10 21 1988","1988-10-21"
"25, thg 1 1998","1998-01-25"
"ngày 04 tháng 11 năm 2018","2018-11-04"
"tháng 4 8 1985","1985-04-08"
"11 10 08","2008-10-11"
"3 tháng 6 1972","1972-06-03"
"tháng 12 17 1973","1973-12-17"
"tháng 2 13, 1997","1997-02-13"
"20 THÁNG 6 1974","1974-06-20"
"14 tháng 11 2015","2015-11-14"
"8 THG 10, 2000","2000-10-08"
"Ngày 11 tháng 02 năm 2006","2006-02-11"
"9 thg 2, 2012","2012-02-09"
"tháng 3 5 1991","1991-03-05"
"24 THG 12, 2017","2017-12-24"
"tháng 6 4, 2014","2014-06-04"
"Ngày 17 tháng 01 năm 1998","1998-01-17"
"NGÀY 22 THÁNG 09 NĂM 2014","2014-09-22"
"10 tháng 7 1986","1986-07-10"
"30 thg 10, 1970","1970-10-30"
"Thứ Hai, ngày 16 tháng 3 năm 1981","1981-03-16"
"2 THG 5, 2000","2000-05-02"
"14 thg 12, 1988","1988-12-14"
"tháng 3 24 1984","1984-03-24"
"Ngày 30 tháng 01 năm 2002","2002-01-30"
"23 THÁNG 10 2017","2017-10-23"
"16 thg 8, 2010","2010-08-16"
"14 THG 10 2000","2000-10-14"
"25 tháng 6 2008","2008-06-25"
"29 THG 6, 1986","1986-06-29"
"02 thg 11 1988","1988-11-02"
"tháng 1 28, 2002","2002-01-28"
"21, THG 5 1987","1987-05-21"
"31 THG 12, 1994","1994-12-31"
"14 thg 8 1991","1991-08-14"
"13.02.96","1996-02-13"
"8 thg 1 2013","2013-01-08"
"30 tháng 7 1981","1981-07-30"
"23 tháng 1 1982","1982-01-23"
"tháng 11 12, 1988","1988-11-12"
"07 thg 12 1971","1971-12-07"
"Chủ Nhật, ngày 21 tháng 1 năm 2018","2018-01-21"
"16 thg 10, 1970","1970-10-16"
"10 06 08","2008-06-10"
"Thứ Bảy, ngày 24 tháng 5 năm 1997","1997-05-24"
"14 thg 7, 2018","2018-07-14"
"14, thg 8 1993","1993-08-14"
"10 THG 1 2017","2017-01-10"
"23.09.70","1970-09-23"
"ngày 01 tháng 08 năm 1990","1990-08-01"
"29.04.74","1974-04-29"
"02/10/1998","1998-10-02"
"Ngày 29 tháng 05 năm 1983","1983-05-29"
"tháng 12 8 2006","2006-12-08"
"25/05/1994","1994-05-25"
"11 tháng 6, 2012","2012-06-11"
"tháng 1 5, 2004","2004-01-05"
"THÁNG 11 19 1971","1971-11-19"
"5 thg 3 1993","1993-03-05"
"ngày 26 tháng 12 năm 2004","2004-12-26"
"29 thg 11, 2005","2005-11-29"
"tháng 10 31, 2007","2007-10-31"
"17 thg 12, 1975","1975-12-17"
"THỨ BA, NGÀY 26 THÁNG 10 NĂM 1982","1982-10-26"
"NGÀY 22 THÁNG 09 NĂM 1997","1997-09-22"
"ngày 27 tháng 05 năm 1977","1977-05-27"
"19 06 97","1997-06-19"
"THỨ NĂM, NGÀY 19 THÁNG 1 NĂM 2012","2012-01-19"
"14 THÁNG 6, 1992","1992-06-14"
"26 thg 3 2002","2002-03-26"
"10 THG 8 2017","2017-08-10"
"13 09 14","2014-09-13"
"THÁNG 12 30 2008","2008-12-30"
"31.12.82","1982-12-31"
"tháng 8 22 1987","1987-08-22"
"6 tháng 10, 1991","1991-10-06"
"30 thg 10 2012","2012-10-30"
"7 thg 7, 1981","1981-07-07"
"28 09 81","1981-09-28"
"21 tháng 8 2014","2014-08-21"
"18 thg 11, 1976","1976-11-18"
"24 thg 11, 2018","2018-11-24"
"02/06/1974","1974-06-02"
"tháng 10 14, 1988","1988-10-14"
"8 THG 5 1975","1975-05-08"
"4 12 85","1985-12-04"
"2 thg 11 2013","2013-11-02"
"22/03/2001","2001-03-22"
"2 12 74","1974-12-02"
"11 tháng 6, 2011","2011-06-11"
"30 tháng 5 1986","1986-05-30"
"28 tháng 3 1986","1986-03-28"
"21 tháng 5 2018","2018-05-21"
"17 THÁNG 6, 1980","1980-06-17"
"NGÀY 08 THÁNG 09 NĂM 2006","2006-09-08"
"THỨ NĂM, NGÀY 08 THÁNG 11 NĂM 2007","2007-11-08"
"6 thg 2, 2013","2013-02-06"
"17 thg 6, 1971","1971-06-17"
"12 thg 10 2007","2007-10-12"
"14/10/1982","1982-10-14"
"17 tháng 8 2016","2016-08-17"
"20 THÁNG 10 1996","1996-10-20"
"11 10 13","2013-10-11"
"22/12/1972","1972-12-22"
"16 thg 9, 1996","1996-09-16"
"29/04/1991","1991-04-29"
"11/03/2015","2015-03-11"
"17 THG 7 2009","2009-07-17"
"30 tháng 9 1995","1995-09-30"
"09, thg 11 1977","1977-11-09"
"22 thg 1 1990","1990-01-22"
"Thứ Tư, ngày 30 tháng 7 năm 2014","2014-07-30"
"20 THÁNG 12 1982","1982-12-20"
"5 thg 10 1991","1991-10-05"
"16/05/2000","2000-05-16"
"ngày 24 tháng 07 năm 2009","2009-07-24"
"19, thg 6 1971","1971-06-19"
"22.01.70","1970-01-22"
"Ngày 10 tháng 02 năm 1981","1981-02-10"
"14, thg 10 1970","1970-10-14"
"Ngày 27 tháng 08 năm 2006","2006-08-27"
"13 THÁNG 2, 1992","1992-02-13"
"10 tháng 2 1995","1995-02-10"
"14.09.81","1981-09-14"
"tháng 4 6 2009","2009-04-06"
"Ngày 25 tháng 01 năm 1980","1980-01-25"
"Thứ Năm, ngày 21 tháng 5 năm 1998","1998-05-21"
"14 thg 8 1994","1994-08-14"
"24/03/2013","2013-03-24"
"tháng 11 26 1970","1970-11-26"
"14 THG 6, 1991","1991-06-14"
"THÁNG 11 12, 1988","1988-11-12"
"17 THG 7 2006","2006-07-17"
"4 thg 4, 1975","1975-04-04"
"22 thg 1 1995","1995-01-22"
"tháng 4 4, 2014","2014-04-04"
"Ngày 10 tháng 07 năm 1982","1982-07-10"
"15/03/1982","1982-03-15"
"12 THÁNG 3, 1996","1996-03-12"
"3 thg 2, 1972","1972-02-03"
"27.02.08","2008-02-27"
"07 thg 12 1987","1987-12-07"
"27 tháng 3, 1981","1981-03-27"
"27 thg 4, 2010","2010-04-27"
"15 THG 8 1983","1983-08-15"
"10 THÁNG 5, 1978","1978-05-10"
"2 THG 7 1982","1982-07-02"
"10 THÁNG 2 1998","1998-02-10"
"07/07/1988","1988-07-07"
"22/04/2006","2006-04-22"
"6 tháng 1 1982","1982-01-06"
"24 tháng 7 2000","2000-07-24"
"7 tháng 1, 1979","1979-01-07"
"26 THÁNG 4, 1987","1987-04-26"
"31 07 01","2001-07-31"
"21 tháng 3, 1992","1992-03-21"
"15 thg 7 1972","1972-07-15"
"THÁNG 8 7, 2008","2008-08-07"
"20, THG 1 1988","1988-01-20"
"13.06.89","1989-06-13"
"28 03 77","1977-03-28"
"04.04.81","1981-04-04"
"15 thg 12, 1991","1991-12-15"
"Thứ Sáu, ngày 17 tháng 5 năm 2013","2013-05-17"
"23 06 06","2006-06-23"
"tháng 1 23 2016","2016-01-23"
"11.09.78","1978-09-11"
"THỨ TƯ, NGÀY 01 THÁNG 1 NĂM 1986","1986-01-01"
"3 thg 11, 2008","2008-11-03"
"27 thg 2, 2011","2011-02-27"
"11 02 06","2006-02-11"
"21 THÁNG 7 2016","2016-07-21"
"09/05/2016","2016-05-09"
"10 THÁNG 3, 1975","1975-03-10"
"2 thg 1, 1972","1972-01-02"
"20 THÁNG 9, 1989","1989-09-20"
"25 01 87","1987-01-25"
"22.07.82","1982-07-22"
"THÁNG 1 21, 1980","1980-01-21"
"19.03.17","2017-03-19"
"NGÀY 26 THÁNG 07 NĂM 1982","1982-07-26"
"31 03 75","1975-03-31"
"tháng 12 28 2017","2017-12-28"
"27 thg 1, 2000","2000-01-27"
"tháng 10 28, 1973","1973-10-28"
"ngày 17 tháng 06 năm 2004","2004-06-17"
"22 THG 9 1971","1971-09-22"
"22/08/2015","2015-08-22"
"tháng 9 27 2004","2004-09-27"
"tháng 4 17 2014","2014-04-17"
"15 thg 2 1997","1997-02-15"
"NGÀY 09 THÁNG 02 NĂM 1971","1971-02-09"
"Chủ Nhật, ngày 10 tháng 6 năm 1979","1979-06-10"
"30.12.14","2014-12-30"
"9 tháng 9 2000","2000-09-09"
"15 tháng 4, 1988","1988-04-15"
"tháng 8 28 2012","2012-08-28"
"1 thg 12, 2007","2007-12-01"
"10 thg 2, 1990","1990-02-10"
"31 thg 7, 1999","1999-07-31"
"12 thg 10 2009","2009-10-12"
"4 tháng 10 1970","1970-10-04"
"THÁNG 11 11 1991","1991-11-11"
"12, thg 1 1999","1999-01-12"
"THỨ BẢY, NGÀY 29 THÁNG 11 NĂM 1997","1997-11-29"
"12 thg 3, 2011","2011-03-12"
"07/08/1981","1981-08-07"
"tháng 6 11, 1981","1981-06-11"
"13 THG 3, 1984","1984-03-13"
"1 thg 11, 1984","1984-11-01"
"NGÀY 12 THÁNG 04 NĂM 1981","1981-04-12"
"30 10 15","2015-10-30"
"THÁNG 2 11, 2009","2009-02-11"
"26.05.07","2007-05-26"
"11 THG 2 1984","1984-02-11"
"tháng 5 2, 1990","1990-05-02"
"20, thg 10 2007","2007-10-20"
"30 THG 6 2008","2008-06-30"
"14, THG 12 1984","1984-12-14"
"ngày 01 tháng 07 năm 2010","2010-07-01"
"2 04 07","2007-04-02"
"Ngày 07 tháng 07 năm 2016","2016-07-07"
"tháng 2 10, 2007","2007-02-10"
"Thứ Ba, ngày 28 tháng 6 năm 1988","1988-06-28"
"Ngày 06 tháng 08 năm 1986","1986-08-06"
"tháng 12 30, 2006","2006-12-30"
"21 thg 8, 2013","2013-08-21"
"tháng 1 11, 1979","1979-01-11"
"5 tháng 11, 1980","1980-11-05"
"20, thg 1 2014","2014-01-20"
"14, thg 10 1974","1974-10-14"
"10.05.91","1991-05-10"
"18 tháng 9 2001","2001-09-18"
"09.10.12","2012-10-09"
"16 04 75","1975-04-16"
"6 THÁNG 12 2018","2018-12-06"
"16 tháng 11 1986","1986-11-16"
"tháng 1 19 1982","1982-01-19"
"tháng 2 17, 1974","1974-02-17"
"14 THG 4 1988","1988-04-14"
"15 THG 1, 2000","2000-01-15"
"16/09/1993","1993-09-16"
"17 thg 1 2003","2003-01-17"
"28 thg 11, 2017","2017-11-28"
"5 THG 3 1997","1997-03-05"
"2 THG 8, 2005","2005-08-02"
"21 thg 2, 1999","1999-02-21"
"8 tháng 11 2007","2007-11-08"
"ngày 31 tháng 12 năm 1988","1988-12-31"
"6 tháng 10, 2009","2009-10-06"
"08.01.78","1978-01-08"
"29, thg 2 1972","1972-02-29"
"tháng 5 18, 1981","1981-05-18"
"14.08.75","1975-08-14"
"13 09 02","2002-09-13"
"24 thg 7, 2003","2003-07-24"
"14/09/2017","2017-09-14"
"tháng 5 3 2018","2018-05-03"
"9 tháng 7 2017","2017-07-09"
"8 THÁNG 5 1980","1980-05-08"
"12 tháng 1, 2018","2018-01-12"
"2 thg 10, 1978","1978-10-02"
"1 thg 10, 1978","1978-10-01"
"Thứ Năm, ngày 21 tháng 8 năm 1975","1975-08-21"
"16.09.80","1980-09-16"
"19.07.81","1981-07-19"
"27 tháng 10, 1988","1988-10-27"
"10/01/2017","2017-01-10"
"19 tháng 9 2015","2015-09-19"
"22 tháng 7, 2014","2014-07-22"
"14 07 96","1996-07-14"
"ngày 20 tháng 02 năm 2001","2001-02-20"
"tháng 7 20, 2011","2011-07-20"
"29 thg 8, 1975","1975-08-29"
"14.01.06","2006-01-14"
"28, thg 10 1979","1979-10-28"
"22/01/2018","2018-01-22"
"18 11 92","1992-11-18"
"tháng 2 25 1971","1971-02-25"
"12 11 93","1993-11-12"
"30 tháng 3 2003","2003-03-30"
"CHỦ NHẬT, NGÀY 28 THÁNG 9 NĂM 1986","1986-09-28"
"31 tháng 3 1975","1975-03-31"
"10 thg 10, 1982","1982-10-10"
"14 THÁNG 10 1970","1970-10-14"
"21, thg 11 1975","1975-11-21"
"02, thg 12 1992","1992-12-02"
"02, thg 7 2005","2005-07-02"
"08/07/1999","1999-07-08"
"9 thg 6, 1977","1977-06-09"
"24, thg 1 2015","2015-01-24"
"THÁNG 1 19, 1992","1992-01-19"
"02.08.92","1992-08-02"
"tháng 12 27 2001","2001-12-27"
"ngày 10 tháng 12 năm 1985","1985-12-10"
"15 THÁNG 5 2009","2009-05-15"
"5 tháng 12 2009","2009-12-05"
"4 thg 6 1998","1998-06-04"
"6 tháng 7 2014","2014-07-06"
"Ngày 31 tháng 12 năm 2000","2000-12-31"
"17 thg 1, 1988","1988-01-17"
"9 THG 5, 2012","2012-05-09"
"17, thg 7 2017","2017-07-17"
"20 THG 9 1988","1988-09-20"
"THÁNG 5 1, 2007","2007-05-01"
"4 tháng 8, 2014","2014-08-04"
"18 THÁNG 5 1991","1991-05-18"
"11 tháng 12 1983","1983-12-11"
"1 tháng 5, 2018","2018-05-01"
"thứ tư, ngày 12 tháng 5 năm 1993","1993-05-12"
"tháng 5 8, 1998","1998-05-08"
"09.03.71","1971-03-09"
"15 thg 1, 1970","1970-01-15"
"6 thg 10 1975","1975-10-06"
"NGÀY 26 THÁNG 12 NĂM 1992","1992-12-26"
"07.02.72","1972-02-07"
"24 thg 6, 1985","1985-06-24"
"tháng 3 21 1995","1995-03-21"
"tháng 10 31 2008","2008-10-31"
"19 THG 5 1993","1993-05-19"
"27/10/2009","2009-10-27"
"28, thg 8 2014","2014-08-28"
"22 08 07","2007-08-22"
"Ngày 30 tháng 11 năm 1981","1981-11-30"
"14 thg 5, 2004","2004-05-14"
"25 THG 1, 1984","1984-01-25"
"19 thg 11, 1989","1989-11-19"
"4 THG 3 1986","1986-03-04"
"16 tháng 9, 2012","2012-09-16"
"4 tháng 5, 1991","1991-05-04"
"24 THÁNG 3 1994","1994-03-24"
"10 thg 11, 2012","2012-11-10"
"7 thg 10, 1984","1984-10-07"
"06 thg 11 1972","1972-11-06"
"20 tháng 11 1997","1997-11-20"
"7 tháng 2, 1996","1996-02-07"
"tháng 9 8 2011","2011-09-08"
"tháng 12 7, 2015","2015-12-07"
"ngày 03 tháng 04 năm 2007","2007-04-03"
"1 tháng 4 1987","1987-04-01"
"30 thg 10 1978","1978-10-30"
"NGÀY 18 THÁNG 06 NĂM 2015","2015-06-18"
"21 tháng 9 1978","1978-09-21"
"4 thg 12, 2007","2007-12-04"
"31 THÁNG 5 1976","1976-05-31"
"24 thg 6 1983","1983-06-24"
"30 12 83","1983-12-30"
"Thứ Ba, ngày 02 tháng 2 năm 1993","1993-02-02"
"tháng 4 8, 2001","2001-04-08"
"10 THG 9, 1989","1989-09-10"
"28 09 03","2003-09-28"
"THỨ NĂM, NGÀY 17 THÁNG 11 NĂM 1983","1983-11-17"
"22 tháng 7 1994","1994-07-22"
"26 thg 10, 2008","2008-10-26"
"12 tháng 4 1975","1975-04-12"
"Ngày 10 tháng 09 năm 1970","1970-09-10"
"THÁNG 9 26 1973","1973-09-26"
"03.12.99","1999-12-03"
"THÁNG 12 10 1984","1984-12-10"
"22/02/1994","1994-02-22"
"25 tháng 2 2013","2013-02-25"
"tháng 1 25, 1981","1981-01-25"
"9 thg 9, 1989","1989-09-09"
"15 thg 1, 2007","2007-01-15"
"thứ tư, ngày 22 tháng 4 năm 1992","1992-04-22"
"08/02/2016","2016-02-08"
"tháng 2 21, 2003","2003-02-21"
"THÁNG 4 30 1974","1974-04-30"
"21 thg 9, 2009","2009-09-21"
"14 tháng 10 2016","2016-10-14"
"ngày 15 tháng 03 năm 1991","1991-03-15"
"13 08 88","1988-08-13"
"3 02 05","2005-02-03"
"29, thg 4 1981","1981-04-29"
"21 tháng 12, 1978","1978-12-21"
"3 06 00","2000-06-03"
"27, thg 10 1972","1972-10-27"
"Chủ Nhật, ngày 31 tháng 12 năm 1989","1989-12-31"
"21 tháng 10, 1984","1984-10-21"
"23.01.76","1976-01-23"
"Chủ Nhật, ngày 21 tháng 5 năm 1995","1995-05-21"
"19 tháng 5 2010","2010-05-19"
"31, THG 3 1990","1990-03-31"
"13, thg 7 2013","2013-07-13"
"25 thg 1 1988","1988-01-25"
"3 thg 5 2013","2013-05-03"
"THÁNG 4 26, 2001","2001-04-26"
"21 tháng 6 1974","1974-06-21"
"15 THG 6, 2000","2000-06-15"
"28/10/2000","2000-10-28"
"2 09 99","1999-09-02"
"21 thg 8, 1996","1996-08-21"
"Thứ Sáu, ngày 08 tháng 3 năm 1985","1985-03-08"
"09, thg 11 1996","1996-11-09"
"THÁNG 12 5, 1995","1995-12-05"
"25 thg 1 2006","2006-01-25"
"14 THG 9, 1992","1992-09-14"
"06 thg 9 2004","2004-09-06"
"18.10.95","1995-10-18"
"9 07 82","1982-07-09"
"tháng 10 8 1977","1977-10-08"
"29/12/1982","1982-12-29"
"29.07.78","1978-07-29"
"26 tháng 11, 2006","2006-11-26"
"1 thg 11, 1990","1990-11-01"
"31/01/1988","1988-01-31"
"07, thg 10 2015","2015-10-07"
"24.05.91","1991-05-24"
"23, thg 7 1992","1992-07-23"
"Ngày 13 tháng 02 năm 2016","2016-02-13"
"Thứ Hai, ngày 30 tháng 3 năm 1987","1987-03-30"
"NGÀY 01 THÁNG 11 NĂM 1972","1972-11-01"
"6 THG 8, 1997","1997-08-06"
"9 THÁNG 8 1981","1981-08-09"
"24 04 91","1991-04-24"
"16 thg 4, 1977","1977-04-16"
"28 tháng 4, 1993","1993-04-28"
"21 tháng 9 1973","1973-09-21"
"16 tháng 3 2001","2001-03-16"
"01 thg 11 2007","2007-11-01"
"29, thg 5 1970","1970-05-29"
"Thứ Năm, ngày 02 tháng 4 năm 1987","1987-04-02"
"10.08.03","2003-08-10"
"16 tháng 6, 2003","2003-06-16"
"Ngày 12 tháng 05 năm 2004","2004-05-12"
"2 07 82","1982-07-02"
"16, thg 9 1999","1999-09-16"
"1 tháng 5, 1990","1990-05-01"
"2 08 99","1999-08-02"
"tháng 1 20, 1989","1989-01-20"
"22 thg 3, 2010","2010-03-22"
"1 09 82","1982-09-01"
"Thứ Bảy, ngày 23 tháng 7 năm 2005","2005-07-23"
"6 thg 1, 2001","2001-01-06"
"05 thg 12 1994","1994-12-05"
"29 THG 8 2015","2015-08-29"
"04.11.13","2013-11-04"
"28/07/2006","2006-07-28"
"THÁNG 4 16, 1979","1979-04-16"
"21 thg 10 1985","1985-10-21"
"19, THG 8 1974","1974-08-19"
"1 THÁNG 4 2003","2003-04-01"
"26 THÁNG 5 2018","2018-05-26"
"30.03.09","2009-03-30"
"THÁNG 7 22 2013","2013-07-22"
"26 thg 4, 2003","2003-04-26"
"20 thg 4, 1996","1996-04-20"
"tháng 4 19, 1996","1996-04-19"
"15 thg 12 2001","2001-12-15"
"THÁNG 9 27, 2005","2005-09-27"
"31/01/1974","1974-01-31"
"21/01/1972","1972-01-21"
"18 thg 10 1994","1994-10-18"
"23 tháng 3 1998","1998-03-23"
"2 tháng 1 2016","2016-01-02"
"31 thg 12 1977","1977-12-31"
"19 THG 12 1976","1976-12-19"
"16 THÁNG 6 2007","2007-06-16"
"24 tháng 8, 2017","2017-08-24"
"07/04/1975","1975-04-07"
"28, thg 2 1995","1995-02-28"
"13 thg 8, 1984","1984-08-13"
"NGÀY 23 THÁNG 09 NĂM 2009","2009-09-23"
"tháng 2 13 1991","1991-02-13"
"tháng 12 20 1997","1997-12-20"
"27, THG 5 2009","2009-05-27"
"tháng 12 1, 1988","1988-12-01"
"THÁNG 10 6, 1998","1998-10-06"
"30 THG 1 2018","2018-01-30"
"2 tháng 10 2006","2006-10-02"
"20, thg 2 2016","2016-02-20"
"03.07.90","1990-07-03"
"11 thg 10 2018","2018-10-11"
"Thứ Ba, ngày 06 tháng 2 năm 2001","2001-02-06"
"2 tháng 4 2003","2003-04-02"
"22 09 04","2004-09-22"
"13 tháng 6 1995","1995-06-13"
"Ngày 27 tháng 09 năm 2012","2012-09-27"
"31.10.04","2004-10-31"
"19 tháng 1 1979","1979-01-19"
"03.05.95","1995-05-03"
"04, thg 2 1999","1999-02-04"
"15 tháng 1 2000","2000-01-15"
"26, thg 10 2016","2016-10-26"
"01, THG 6 2011","2011-06-01"
"15 THG 3, 2017","2017-03-15"
"tháng 3 1, 2008","2008-03-01"
"22 tháng 8 1986","1986-08-22"
"tháng 7 2, 1994","1994-07-02"
"THỨ NĂM, NGÀY 18 THÁNG 8 NĂM 2016","2016-08-18"
"tháng 11 13 1998","1998-11-13"
"18/01/1998","1998-01-18"
"28.05.07","2007-05-28"
"19, thg 11 2015","2015-11-19"
"tháng 8 25, 1979","1979-08-25"
"31/05/1977","1977-05-31"
"3 thg 5 2012","2012-05-03"
"11.12.94","1994-12-11"
"16 tháng 5 1993","1993-05-16"
"15 tháng 6 1994","1994-06-15"
"22 THG 2, 2007","2007-02-22"
"7 thg 9, 1985","1985-09-07"
"28 thg 4 1997","1997-04-28"
"NGÀY 20 THÁNG 06 NĂM 2011","2011-06-20"
"tháng 4 11, 1974","1974-04-11"
"27 THG 2 2001","2001-02-27"
"NGÀY 18 THÁNG 05 NĂM 2002","2002-05-18"
"13 tháng 7 1979","1979-07-13"
"31 05 14","2014-05-31"
"Ngày 15 tháng 04 năm 2016","2016-04-15"
"22 tháng 7, 1990","1990-07-22"
"09, thg 10 1984","1984-10-09"
"24 tháng 6 1976","1976-06-24"
"29 tháng 7 2011","2011-07-29"
"27 tháng 7 2000","2000-07-27"
"Thứ Tư, ngày 17 tháng 7 năm 1996","1996-07-17"
"24 thg 3 2017","2017-03-24"
"24 tháng 3 1975","1975-03-24"
"Ngày 15 tháng 11 năm 2002","2002-11-15"
"22 THG 6 1981","1981-06-22"
"1 thg 5 2017","2017-05-01"
"Ngày 24 tháng 04 năm 1989","1989-04-24"
"23 thg 3, 1989","1989-03-23"
"24 thg 8, 2017","2017-08-24"
"21 thg 7 1977","1977-07-21"
"24/09/1986","1986-09-24"
"16/10/1991","1991-10-16"
"05.07.10","2010-07-05"
"THÁNG 1 17, 1990","1990-01-17"
"tháng 11 5 1971","1971-11-05"
"24 THG 5 2011","2011-05-24"
"6 tháng 7 2010","2010-07-06"
"01.12.18","2018-12-01"
"24 THÁNG 9 1988","1988-09-24"
"21 THG 11 2008","2008-11-21"
"Thứ Bảy, ngày 16 tháng 6 năm 2018","2018-06-16"
"19 THÁNG 2 2012","2012-02-19"
"Thứ Tư, ngày 13 tháng 4 năm 1983","1983-04-13"
"25 08 17","2017-08-25"
"9 THG 5, 1978","1978-05-09"
"2 thg 12, 1973","1973-12-02"
"thứ bảy, ngày 29 tháng 5 năm 1982","1982-05-29"
"tháng 3 23 1974","1974-03-23"
"10 11 01","2001-11-10"
"11.07.92","1992-07-11"
"22 tháng 2 2005","2005-02-22"
"28 tháng 3 1994","1994-03-28"
"21 thg 1 1975","1975-01-21"
"Chủ Nhật, ngày 11 tháng 12 năm 1983","1983-12-11"
"28 tháng 10 1986","1986-10-28"
"22 thg 5 1979","1979-05-22"
"26 03 88","1988-03-26"
"13 tháng 10, 1984","1984-10-13"
"21 tháng 1, 1988","1988-01-21"
"tháng 7 28, 1989","1989-07-28"
"30/03/1988","1988-03-30"
"6 01 91","1991-01-06"
"ngày 07 tháng 10 năm 2010","2010-10-07"
"26 tháng 9 1991","1991-09-26"
"14 thg 1, 1976","1976-01-14"
"3 THG 8 1987","1987-08-03"
"2 tháng 11 1995","1995-11-02"
"24 tháng 10, 2005","2005-10-24"
"9 02 08","2008-02-09"
"9 thg 12 2001","2001-12-09"
"25 thg 9 2007","2007-09-25"
"tháng 3 5 2006","2006-03-05"
"tháng 9 1 1971","1971-09-01"
"31, thg 12 1972","1972-12-31"
"08/09/1996","1996-09-08"
"15 thg 11 1978","1978-11-15"
"16/04/2012","2012-04-16"
"7 tháng 11, 1980","1980-11-07"
"11/06/1977","1977-06-11"
"16 THG 2, 2003","2003-02-16"
"tháng 7 4 1973","1973-07-04"
"NGÀY 30 THÁNG 11 NĂM 1980","1980-11-30"
"11, thg 1 1975","1975-01-11"
"28 04 78","1978-04-28"
"16.01.09","2009-01-16"
"24, thg 5 2014","2014-05-24"
"17/10/2016","2016-10-17"
"28 thg 5, 2004","2004-05-28"
"8 09 16","2016-09-08"
"2 tháng 7, 1978","1978-07-02"
"12 tháng 5 1983","1983-05-12"
"thứ bảy, ngày 25 tháng 12 năm 1993","1993-12-25"
"06.11.94","1994-11-06"
"02/12/1984","1984-12-02"
"10, thg 5 2016","2016-05-10"
"17 thg 2 1991","1991-02-17"
"tháng 9 8 2005","2005-09-08"
"20 thg 9, 2007","2007-09-20"
"THÁNG 2 15 1970","1970-02-15"
"tháng 8 24 2013","2013-08-24"
"THÁNG 3 5, 2009","2009-03-05"
"10 thg 2, 1986","1986-02-10"
"12 thg 3, 1991","1991-03-12"
"18/12/1986","1986-12-18"
"01, thg 6 1992","1992-06-01"
"21 tháng 6, 1976","1976-06-21"
"6 tháng 11, 1981","1981-11-06"
"29/12/1981","1981-12-29"
"14 tháng 7 2005","2005-07-14"
"25 THÁNG 8 1997","1997-08-25"
"ngày 05 tháng 03 năm 1998","1998-03-05"
"30.07.05","2005-07-30"
"20 tháng 7 2010","2010-07-20"
"Thứ Tư, ngày 15 tháng 6 năm 2016","2016-06-15"
"thứ sáu, ngày 20 tháng 9 năm 1985","1985-09-20"
"tháng 3 7 1987","1987-03-07"
"10 05 70","1970-05-10"
"17 tháng 4 1972","1972-04-17"
"15 tháng 10 1996","1996-10-15"
"3 tháng 7 2018","2018-07-03"
"31.03.03","2003-03-31"
"2 thg 8, 2000","2000-08-02"
"21, thg 11 1973","1973-11-21"
"26 thg 3 2011","2011-03-26"
"1 11 08","2008-11-01"
"24.04.94","1994-04-24"
"21 tháng 7, 2002","2002-07-21"
"5 thg 5, 1974","1974-05-05"
"THỨ BẢY, NGÀY 26 THÁNG 4 NĂM 1975","1975-04-26"
"22 thg 5 2009","2009-05-22"
"27/09/2004","2004-09-27"
"27/09/2015","2015-09-27"
"19 thg 3, 1973","1973-03-19"
"10 03 06","2006-03-10"
"Thứ Tư, ngày 03 tháng 5 năm 2006","2006-05-03"
"tháng 2 23 1991","1991-02-23"
"21, THG 6 1978","1978-06-21"
"14 THG 7 2010","2010-07-14"
"ngày 09 tháng 08 năm 2016","2016-08-09"
"04 thg 7 1999","1999-07-04"
"18 06 72","1972-06-18"
"14 thg 1, 1972","1972-01-14"
"23, thg 9 1986","1986-09-23"
"10.04.89","1989-04-10"
"tháng 10 11, 1996","1996-10-11"
"24 tháng 8, 2009","2009-08-24"
"24 THÁNG 12 2018","2018-12-24"
"16 tháng 1, 1996","1996-01-16"
"THÁNG 4 17, 2003","2003-04-17"
"tháng 5 29, 1987","1987-05-29"
"tháng 8 1, 2014","2014-08-01"
"13.07.76","1976-07-13"
"21, THG 7 2014","2014-07-21"
"02/05/2000","2000-05-02"
"tháng 12 12, 1999","1999-12-12"
"20.07.98","1998-07-20"
"28 thg 3, 2001","2001-03-28"
"THÁNG 3 16, 1988","1988-03-16"
"13/01/2004","2004-01-13"
"24 THÁNG 3 2005","2005-03-24"
"ngày 02 tháng 03 năm 1985","1985-03-02"
"05.07.74","1974-07-05"
"13 07 17","2017-07-13"
"4 11 94","1994-11-04"
"THÁNG 8 26, 1994","1994-08-26"
"chủ nhật, ngày 25 tháng 6 năm 1972","1972-06-25"
"ngày 22 tháng 06 năm 1985","1985-06-22"
"17 thg 5 1995","1995-05-17"
"Ngày 09 tháng 02 năm 2015","2015-02-09"
"14 thg 4 1978","1978-04-14"
"17, thg 4 1977","1977-04-17"
"23 08 92","1992-08-23"
"Ngày 11 tháng 10 năm 1995","1995-10-11"
"Thứ Hai, ngày 21 tháng 7 năm 1975","1975-07-21"
"05 thg 10 1998","1998-10-05"
"Ngày 20 tháng 12 năm 2010","2010-12-20"
"THỨ TƯ, NGÀY 26 THÁNG 3 NĂM 2008","2008-03-26"
"Ngày 30 tháng 03 năm 2011","2011-03-30"
"19 thg 10 2004","2004-10-19"
"1 tháng 11 1995","1995-11-01"
"26 THG 5, 2012","2012-05-26"
"5 thg 2 2007","2007-02-05"
"07, thg 7 1987","1987-07-07"
"Chủ Nhật, ngày 06 tháng 3 năm 2016","2016-03-06"
"tháng 8 13 1983","1983-08-13"
"7 thg 1, 1995","1995-01-07"
"02.04.09","2009-04-02"
"tháng 5 9, 2007","2007-05-09"
"23 tháng 11, 2006","2006-11-23"
"24 03 79","1979-03-24"
"THÁNG 6 11 2012","2012-06-11"
"17 thg 2, 1992","1992-02-17"
"chủ nhật, ngày 30 tháng 10 năm 2016","2016-10-30"
"2 thg 6, 2006","2006-06-02"
"21, thg 9 1990","1990-09-21"
"13.08.10","2010-08-13"
"08.12.90","1990-12-08"
"tháng 6 30 2012","2012-06-30"
"04 THG 8 1993","1993-08-04"
"tháng 3 25 1973","1973-03-25"
"11.06.74","1974-06-11"
"7 thg 3 2014","2014-03-07"
"25.07.90","1990-07-25"
"5 thg 7, 2017","2017-07-05"
"14 thg 4 1977","1977-04-14"
"19 tháng 2 2014","2014-02-19"
"tháng 12 6 2007","2007-12-06"
"05 thg 11 1982","1982-11-05"
"12 thg 11, 1989","1989-11-12"
"29.09.16","2016-09-29"
"tháng 8 24 1989","1989-08-24"
"10 tháng 1, 2017","2017-01-10"
"thứ năm, ngày 25 tháng 11 năm 1999","1999-11-25"
"thứ sáu, ngày 27 tháng 4 năm 2012","2012-04-27"
"tháng 12 14, 2016","2016-12-14"
"tháng 11 2, 2015","2015-11-02"
"3 thg 8, 1995","1995-08-03"
"ngày 16 tháng 03 năm 1974","1974-03-16"
"27 thg 6, 1996","1996-06-27"
"02/12/1982","1982-12-02"
"22 THG 12, 1988","1988-12-22"
"tháng 8 27, 2007","2007-08-27"
"NGÀY 25 THÁNG 11 NĂM 1970","1970-11-25"
"16 09 90","1990-09-16"
"6 08 90","1990-08-06"
"11 thg 12 1970","1970-12-11"
"25 thg 12, 2012","2012-12-25"
"13, thg 9 1990","1990-09-13"
"tháng 2 1 1986","1986-02-01"
"06/11/1988","1988-11-06"
"22 tháng 5 2012","2012-05-22"
"tháng 12 14 1973","1973-12-14"
"ngày 11 tháng 01 năm 2014","2014-01-11"
"2 11 83","1983-11-02"
"6 thg 3 1992","1992-03-06"
"2 THÁNG 5 1979","1979-05-02"
"10 tháng 1 1998","1998-01-10"
"tháng 7 21, 1996","1996-07-21"
"13 tháng 6, 1990","1990-06-13"
"23/01/1975","1975-01-23"
"NGÀY 06 THÁNG 08 NĂM 1976","1976-08-06"
"27 thg 3 2003","2003-03-27"
"25 12 81","1981-12-25"
"30 thg 4 1995","1995-04-30"
"17 tháng 1 1999","1999-01-17"
"tháng 5 25, 2009","2009-05-25"
"Thứ Sáu, ngày 25 tháng 9 năm 2015","2015-09-25"
"02/02/2018","2018-02-02"
"6 thg 10, 1981","1981-10-06"
"06/11/1975","1975-11-06"
"THÁNG 12 2 1991","1991-12-02"
"1 tháng 11, 2009","2009-11-01"
"ngày 03 tháng 06 năm 1988","1988-06-03"
"27.08.99","1999-08-27"
"Thứ Bảy, ngày 16 tháng 3 năm 1991","1991-03-16"
"27.07.73","1973-07-27"
"1 08 84","1984-08-01"
"20 tháng 2 1971","1971-02-20"
"30 THG 10, 1989","1989-10-30"
"11 THÁNG 7, 1970","1970-07-11"
"9 thg 10 1993","1993-10-09"
"27 tháng 12, 1980","1980-12-27"
"7 tháng 8, 2000","2000-08-07"
"11, thg 3 2011","2011-03-11"
"4 tháng 6, 1976","1976-06-04"
"26 THG 12, 2002","2002-12-26"
"26 thg 4 1999","1999-04-26"
"13 THG 1 2009","2009-01-13"
"6 tháng 7 2005","2005-07-06"
"tháng 9 12, 1979","1979-09-12"
"05/08/2003","2003-08-05"
"30 tháng 7 2017","2017-07-30"
"11 tháng 1 1975","1975-01-11"
"Ngày 12 tháng 07 năm 1982","1982-07-12"
"Thứ Bảy, ngày 30 tháng 9 năm 1978","1978-09-30"
"09/12/1982","1982-12-09"
"Ngày 22 tháng 08 năm 1986","1986-08-22"
"20 02 87","1987-02-20"
"20/12/1982","1982-12-20"
"5 tháng 11, 2013","2013-11-05"
"14 thg 11, 1983","1983-11-14"
"4 tháng 9, 2002","2002-09-04"
"10/01/1994","1994-01-10"
"25/10/2003","2003-10-25"
"24, thg 5 2001","2001-05-24"
"Ngày 12 tháng 01 năm 1975","1975-01-12"
"Ngày 09 tháng 03 năm 1993","1993-03-09"
"2 02 84","1984-02-02"
"THỨ SÁU, NGÀY 07 THÁNG 12 NĂM 1984","1984-12-07"
"24 07 02","2002-07-24"
"19 thg 3, 1992","1992-03-19"
"17 10 97","1997-10-17"
"8 THG 5 1985","1985-05-08"
"04, THG 1 2005","2005-01-04"
"05.05.83","1983-05-05"
"21, thg 5 1974","1974-05-21"
"4 tháng 7 1970","1970-07-04"
"THỨ BA, NGÀY 21 THÁNG 2 NĂM 2017","2017-02-21"
"07 THG 7 2005","2005-07-07"
"18 thg 9, 2006","2006-09-18"
"21 thg 9, 2017","2017-09-21"
"29 tháng 5, 1981","1981-05-29"
"ngày 30 tháng 08 năm 1995","1995-08-30"
"23/02/2000","2000-02-23"
"27 THG 11, 2008","2008-11-27"
"24 THG 6 1973","1973-06-24"
"THÁNG 3 17, 2006","2006-03-17"
"tháng 4 22, 2010","2010-04-22"
"tháng 10 6, 1999","1999-10-06"
"tháng 10 15, 1997","1997-10-15"
"10 THG 4, 1977","1977-04-10"
"13 thg 1, 1992","1992-01-13"
"tháng 7 26 1981","1981-07-26"
"tháng 4 19, 2007","2007-04-19"
"THÁNG 7 7, 2009","2009-07-07"
"25 tháng 6 2013","2013-06-25"
"THÁNG 3 30 2006","2006-03-30"
"20/04/2000","2000-04-20"
"Ngày 03 tháng 03 năm 2005","2005-03-03"
"tháng 5 9 1986","1986-05-09"
"21, THG 6 2016","2016-06-21"
"13 05 03","2003-05-13"
"tháng 4 14, 2005","2005-04-14"
"22.01.84","1984-01-22"
"6 tháng 7 1971","1971-07-06"
"27.02.00","2000-02-27"
"11.02.72","1972-02-11"
"ngày 19 tháng 09 năm 2003","2003-09-19"
"06/05/1981","1981-05-06"
"26 tháng 10, 1987","1987-10-26"
"12 02 10","2010-02-12"
"13/04/1976","1976-04-13"
"30 thg 12, 1998","1998-12-30"
"01/04/1992","1992-04-01"
"07.08.15","2015-08-07"
"13 thg 6 2007","2007-06-13"
"THÁNG 3 24, 1978","1978-03-24"
"21 tháng 12, 1992","1992-12-21"
"tháng 10 6, 2018","2018-10-06"
"Thứ Sáu, ngày 15 tháng 2 năm 1980","1980-02-15"
"tháng 4 1, 1987","1987-04-01"
"Ngày 15 tháng 09 năm 2010","2010-09-15"
"tháng 4 29 1987","1987-04-29"
"10 tháng 4, 2010","2010-04-10"
"7 tháng 2 1973","1973-02-07"
"24, thg 9 1984","1984-09-24"
"THÁNG 12 25, 2007","2007-12-25"
"11 06 84","1984-06-11"
"Ngày 23 tháng 08 năm 1972","1972-08-23"
"tháng 12 24, 1978","1978-12-24"
"22, thg 6 1988","1988-06-22"
"tháng 12 6, 1998","1998-12-06"
"tháng 10 11, 1987","1987-10-11"
"6 thg 5, 1988","1988-05-06"
"16 tháng 7 1979","1979-07-16"
"7 thg 2, 1991","1991-02-07"
"4 thg 1 2015","2015-01-04"
"8 tháng 7, 1990","1990-07-08"
"tháng 4 25 1992","1992-04-25"
"17 THG 1 2004","2004-01-17"
"09/08/1990","1990-08-09"
"03 thg 7 1996","1996-07-03"
"01/02/1987","1987-02-01"
"11 thg 6 2004","2004-06-11"
"8 tháng 9 1983","1983-09-08"
"28/01/1996","1996-01-28"
"06/12/1989","1989-12-06"
"04/11/1974","1974-11-04"
"Ngày 24 tháng 10 năm 2017","2017-10-24"
"NGÀY 03 THÁNG 12 NĂM 1976","1976-12-03"
"tháng 7 9, 1990","1990-07-09"
"01 thg 5 1971","1971-05-01"
"31 tháng 10, 1996","1996-10-31"
"Chủ Nhật, ngày 23 tháng 8 năm 1981","1981-08-23"
"tháng 5 27, 1973","1973-05-27"
"12 tháng 11 1988","1988-11-12"
"18 tháng 8 1987","1987-08-18"
"02 thg 2 2006","2006-02-02"
"11 tháng 11 2009","2009-11-11"
"tháng 6 1 2008","2008-06-01"
"24 thg 1, 1981","1981-01-24"
"Thứ Năm, ngày 19 tháng 12 năm 1996","1996-12-19"
"22, thg 3 2011","2011-03-22"
"19, thg 9 1981","1981-09-19"
"10 THG 8 1990","1990-08-10"
"23/08/1980","1980-08-23"
"8 thg 6 2014","2014-06-08"
"3 tháng 9 2010","2010-09-03"
"ngày 27 tháng 08 năm 2004","2004-08-27"
"30 04 74","1974-04-30"
"20/10/2015","2015-10-20"
"tháng 10 17, 2000","2000-10-17"
"29/03/1996","1996-03-29"
"thứ năm, ngày 14 tháng 5 năm 2015","2015-05-14"
"tháng 9 2 2001","2001-09-02"
"05, THG 2 2002","2002-02-05"
"8 THÁNG 1 2013","2013-01-08"
"ngày 16 tháng 02 năm 2018","2018-02-16"
"11 THÁNG 5, 1977","1977-05-11"
"19 THG 12, 2007","2007-12-19"
"28/02/1993","1993-02-28"
"8 12 79","1979-12-08"
"13.02.94","1994-02-13"
"1 THG 10 1973","1973-10-01"
"11 tháng 2 1993","1993-02-11"
"30 thg 1 2001","2001-01-30"
"19 thg 9, 1981","1981-09-19"
"11 thg 9 2006","2006-09-11"
"19, thg 12 1995","1995-12-19"
"4 THG 12 1993","1993-12-04"
"ngày 18 tháng 11 năm 1976","1976-11-18"
"23 tháng 6 1974","1974-06-23"
"25 thg 9, 1981","1981-09-25"
"22 thg 9 2012","2012-09-22"
"tháng 8 20, 1980","1980-08-20"
"26 THÁNG 12 2001","2001-12-26"
"6 07 91","1991-07-06"
"THỨ TƯ, NGÀY 12 THÁNG 3 NĂM 2003","2003-03-12"
"4 THG 10, 2002","2002-10-04"
"07.04.88","1988-04-07"
"29, thg 8 2017","2017-08-29"
"11 tháng 7, 1985","1985-07-11"
"02.05.00","2000-05-02"
"NGÀY 15 THÁNG 01 NĂM 1983","1983-01-15"
"ngày 26 tháng 09 năm 1995","1995-09-26"
"31.10.97","1997-10-31"
"tháng 8 12 1990","1990-08-12"
"25 tháng 11 2016","2016-11-25"
"19 thg 9 1992","1992-09-19"
"16, thg 4 1998","1998-04-16"
"THÁNG 5 31 2005","2005-05-31"
"23.09.84","1984-09-23"
"26 thg 2, 1983","1983-02-26"
"NGÀY 04 THÁNG 04 NĂM 2009","2009-04-04"
"22, thg 11 1983","1983-11-22"
"NGÀY 12 THÁNG 07 NĂM 1993","1993-07-12"
"17 THG 3, 2016","2016-03-17"
"30 thg 3, 1993","1993-03-30"
"10/12/1998","1998-12-10"
"4 03 73","1973-03-04"
"THỨ BẢY, NGÀY 10 THÁNG 6 NĂM 1978","1978-06-10"
"tháng 7 18, 1980","1980-07-18"
"19/07/2011","2011-07-19"
"Ngày 19 tháng 07 năm 2001","2001-07-19"
"21/11/1992","1992-11-21"
"29 thg 3 2005","2005-03-29"
"20 thg 9, 1998","1998-09-20"
"08.10.14","2014-10-08"
"thứ sáu, ngày 09 tháng 2 năm 1990","1990-02-09"
"4 THÁNG 6 1997","1997-06-04"
"1 THG 1, 1975","1975-01-01"
"10 THÁNG 12 2002","2002-12-10"
"22 tháng 3 2011","2011-03-22"
"03 thg 2 1977","1977-02-03"
"20 thg 5, 2003","2003-05-20"
"tháng 5 16 2011","2011-05-16"
"20 thg 6, 1991","1991-06-20"
"25.05.90","1990-05-25"
"25.01.05","2005-01-25"
"18 THÁNG 5, 1996","1996-05-18"
"Ngày 27 tháng 10 năm 1985","1985-10-27"
"19 thg 8, 2003","2003-08-19"
"16 tháng 4 1998","1998-04-16"
"ngày 24 tháng 06 năm 2011","2011-06-24"
"05/11/1980","1980-11-05"
"21.09.97","1997-09-21"
"Thứ Tư, ngày 01 tháng 8 năm 2007","2007-08-01"
"25 thg 3, 1970","1970-03-25"
"6 THÁNG 10, 1978","1978-10-06"
"8 THÁNG 6 2006","2006-06-08"
"30 thg 7 2008","2008-07-30"
"ngày 27 tháng 02 năm 1976","1976-02-27"
"tháng 11 11 2017","2017-11-11"
"2 tháng 11, 1995","1995-11-02"
"tháng 8 31 1980","1980-08-31"
"Thứ Bảy, ngày 14 tháng 8 năm 1976","1976-08-14"
"21/09/2000","2000-09-21"
"7 THG 11, 1996","1996-11-07"
"12 thg 5, 2003","2003-05-12"
"21 thg 8, 2016","2016-08-21"
"20 tháng 7, 1983","1983-07-20"
"2 thg 7, 2012","2012-07-02"
"9 THÁNG 9 2016","2016-09-09"
"02/11/1984","1984-11-02"
"4 10 79","1979-10-04"
"THỨ SÁU, NGÀY 12 THÁNG 9 NĂM 2008","2008-09-12"
"13 thg 3, 2018","2018-03-13"
"ngày 15 tháng 05 năm 1987","1987-05-15"
"Ngày 07 tháng 10 năm 2011","2011-10-07"
"NGÀY 26 THÁNG 01 NĂM 1989","1989-01-26"
"29/08/1994","1994-08-29"
"ngày 09 tháng 12 năm 2009","2009-12-09"
"18.05.04","2004-05-18"
"21 tháng 6 1988","1988-06-21"
"22 tháng 6 1979","1979-06-22"
"tháng 5 8, 2001","2001-05-08"
"22 thg 6, 2011","2011-06-22"
"Thứ Sáu, ngày 19 tháng 10 năm 2012","2012-10-19"
"19 THG 9, 1995","1995-09-19"
"8 THÁNG 7 1987","1987-07-08"
"6 tháng 6 2000","2000-06-06"
"07, thg 10 1993","1993-10-07"
"27 THÁNG 1, 1995","1995-01-27"
"23 thg 2, 1974","1974-02-23"
"9 08 95","1995-08-09"
"15 thg 12 2013","2013-12-15"
"25.07.88","1988-07-25"
"9 03 86","1986-03-09"
"20 01 10","2010-01-20"
"Ngày 07 tháng 12 năm 1973","1973-12-07"
"6 THG 2, 1980","1980-02-06"
"20 08 05","2005-08-20"
"19.03.09","2009-03-19"
"Ngày 31 tháng 01 năm 1972","1972-01-31"
"25 07 04","2004-07-25"
"Ngày 17 tháng 05 năm 2016","2016-05-17"
"28 thg 8 2018","2018-08-28"
"13 tháng 5 1989","1989-05-13"
"19 tháng 3 1988","1988-03-19"
"THÁNG 2 20 2011","2011-02-20"
"29 tháng 8 1975","1975-08-29"
"6 THG 5, 1977","1977-05-06"
"9 tháng 7, 1987","1987-07-09"
"23 tháng 1 2018","2018-01-23"
"2 THG 8 2001","2001-08-02"
"13, thg 8 1989","1989-08-13"
"19 THG 7, 2006","2006-07-19"
"ngày 19 tháng 03 năm 1996","1996-03-19"
"28 THG 7, 2009","2009-07-28"
"12 03 05","2005-03-12"
"Ngày 16 tháng 11 năm 2007","2007-11-16"
"tháng 12 13 1991","1991-12-13"
"8 THÁNG 9 1996","1996-09-08"
"17 10 84","1984-10-17"
"04/10/2007","2007-10-04"
"thứ bảy, ngày 03 tháng 1 năm 1998","1998-01-03"
"thứ ba, ngày 01 tháng 9 năm 2015","2015-09-01"
"10 tháng 7 2011","2011-07-10"
"16/03/1988","1988-03-16"
"17 tháng 7, 2015","2015-07-17"
"tháng 8 31, 1987","1987-08-31"
"22 tháng 11, 1998","1998-11-22"
"20.06.16","2016-06-20"
"30.09.15","2015-09-30"
"01.06.08","2008-06-01"
"Thứ Ba, ngày 16 tháng 3 năm 1993","1993-03-16"
"THÁNG 8 8, 1986","1986-08-08"
"tháng 4 4, 2010","2010-04-04"
"16 THG 1 2006","2006-01-16"
"10 thg 12 1973","1973-12-10"
"12 07 89","1989-07-12"
"7 tháng 12 2015","2015-12-07"
"4 THÁNG 9, 2018","2018-09-04"
"28 thg 9 2016","2016-09-28"
"thứ bảy, ngày 22 tháng 12 năm 2018","2018-12-22"
"1 03 87","1987-03-01"
"21 thg 8, 1988","1988-08-21"
"Thứ Ba, ngày 05 tháng 2 năm 1991","1991-02-05"
"3 thg 9 1973","1973-09-03"
"14 08 70","1970-08-14"
"22, thg 11 2004","2004-11-22"
"7 thg 9, 1998","1998-09-07"
"27 THÁNG 9, 1973","1973-09-27"
"9 thg 9, 1987","1987-09-09"
"23 THÁNG 10 1986","1986-10-23"
"16 THG 1 1979","1979-01-16"
"Ngày 28 tháng 10 năm 1975","1975-10-28"
"tháng 10 27, 1987","1987-10-27"
"THỨ BẢY, NGÀY 23 THÁNG 8 NĂM 1986","1986-08-23"
"27 THG 4, 1970","1970-04-27"
"THỨ SÁU, NGÀY 22 THÁNG 11 NĂM 1985","1985-11-22"
"14 11 06","2006-11-14"
"20 thg 1, 2004","2004-01-20"
"1 thg 10, 1993","1993-10-01"
"17 thg 11, 1977","1977-11-17"
"6 thg 2, 1979","1979-02-06"
"11 THG 11 1993","1993-11-11"
"15 THG 1, 1998","1998-01-15"
"12.04.83","1983-04-12"
"30 thg 11, 2010","2010-11-30"
"23 05 00","2000-05-23"
"ngày 22 tháng 05 năm 1971","1971-05-22"
"22, thg 4 1987","1987-04-22"
"ngày 18 tháng 06 năm 1994","1994-06-18"
"Ngày 04 tháng 01 năm 1998","1998-01-04"
"17, thg 8 2003","2003-08-17"
"3 thg 5 1979","1979-05-03"
"07.04.91","1991-04-07"
"24 tháng 7 1996","1996-07-24"
"8 THÁNG 10 1976","1976-10-08"
"ngày 30 tháng 10 năm 2017","2017-10-30"
"Chủ Nhật, ngày 13 tháng 1 năm 1980","1980-01-13"
"tháng 5 13, 2014","2014-05-13"
"22, thg 10 1976","1976-10-22"
"9 tháng 4 2009","2009-04-09"
"20 02 76","1976-02-20"
"tháng 7 7, 1975","1975-07-07"
"2 tháng 2, 2016","2016-02-02"
"21/02/1991","1991-02-21"
"30 THG 9 1991","1991-09-30"
"tháng 4 13, 2002","2002-04-13"
"tháng 9 29, 1971","1971-09-29"
"11 THG 6 2015","2015-06-11"
"27.05.13","2013-05-27"
"7 thg 7 2010","2010-07-07"
"12/09/1993","1993-09-12"
"15 thg 8 1994","1994-08-15"
"12, thg 12 1995","1995-12-12"
"17 tháng 2, 1977","1977-02-17"
"26 thg 4 1975","1975-04-26"
"THÁNG 3 6, 2003","2003-03-06"
"5 tháng 1, 2003","2003-01-05"
"19 THÁNG 10, 2013","2013-10-19"
"18, THG 4 1993","1993-04-18"
"18.06.17","2017-06-18"
"14 tháng 9 1995","1995-09-14"
"thứ sáu, ngày 28 tháng 4 năm 1989","1989-04-28"
"17 THG 7, 1977","1977-07-17"
"22/06/1999","1999-06-22"
"9 10 06","2006-10-09"
"tháng 1 25, 1999","1999-01-25"
"8 tháng 5 1973","1973-05-08"
"08/05/1983","1983-05-08"
"4 thg 11, 1973","1973-11-04"
"03, thg 7 2014","2014-07-03"
"tháng 4 12, 1978","1978-04-12"
"03, thg 9 1987","1987-09-03"
"30.11.81","1981-11-30"
"19/05/1971","1971-05-19"
"29 thg 10, 2009","2009-10-29"
"1 THÁNG 3, 2002","2002-03-01"
"23 tháng 11 1984","1984-11-23"
"27 THG 1, 1994","1994-01-27"
"tháng 3 5 1990","1990-03-05"
"19 THÁNG 3 1995","1995-03-19"
"2 THÁNG 1 2011","2011-01-02"
"9 thg 11, 2015","2015-11-09"
"Ngày 03 tháng 03 năm 1977","1977-03-03"
"Chủ Nhật, ngày 12 tháng 4 năm 1992","1992-04-12"
"23 THÁNG 8, 1998","1998-08-23"
"25 THG 5, 1977","1977-05-25"
"27 THÁNG 4, 2008","2008-04-27"
"5 thg 9 1999","1999-09-05"
"tháng 9 3, 2003","2003-09-03"
"21 THÁNG 4 1993","1993-04-21"
"24 thg 12 1992","1992-12-24"
"tháng 10 22 1985","1985-10-22"
"6 08 74","1974-08-06"
"15 THÁNG 1 1989","1989-01-15"
"21 09 89","1989-09-21"
"tháng 12 21, 1970","1970-12-21"
"13 THG 12 1988","1988-12-13"
"5 tháng 3 2013","2013-03-05"
"26 10 98","1998-10-26"
"30/11/1994","1994-11-30"
"THÁNG 11 26, 1984","1984-11-26"
"24 THÁNG 9, 2005","2005-09-24"
"09, thg 3 2011","2011-03-09"
"18 09 11","2011-09-18"
"22 tháng 5 1974","1974-05-22"
"NGÀY 20 THÁNG 07 NĂM 2006","2006-07-20"
"Thứ Bảy, ngày 22 tháng 5 năm 1999","1999-05-22"
"21 01 11","2011-01-21"
"7 THG 9 1997","1997-09-07"
"27 thg 12 2007","2007-12-27"
"10 tháng 9 1980","1980-09-10"
"21.08.83","1983-08-21"
"24 thg 9, 1987","1987-09-24"
"07 thg 12 2002","2002-12-07"
"01/03/2000","2000-03-01"
"tháng 11 8, 1991","1991-11-08"
"5 tháng 8 2010","2010-08-05"
"ngày 15 tháng 03 năm 1975","1975-03-15"
"15 thg 10 1994","1994-10-15"
"11 thg 2, 1994","1994-02-11"
"18 thg 10 1992","1992-10-18"
"23 02 10","2010-02-23"
"29/11/1973","1973-11-29"
"tháng 8 20 2002","2002-08-20"
"tháng 5 23 1980","1980-05-23"
"02.01.84","1984-01-02"
"Ngày 08 tháng 12 năm 2013","2013-12-08"
"27 03 97","1997-03-27"
"10 THG 4, 1978","1978-04-10"
"22 THÁNG 11, 1978","1978-11-22"
"10 06 74","1974-06-10"
"17 06 80","1980-06-17"
"tháng 4 8 2014","2014-04-08"
"20 THG 2 1990","1990-02-20"
"4 thg 4, 1981","1981-04-04"
"30/06/2000","2000-06-30"
"31 THÁNG 5 2012","2012-05-31"
"Chủ Nhật, ngày 18 tháng 7 năm 1976","1976-07-18"
"21 tháng 11 1997","1997-11-21"
"4 06 93","1993-06-04"
"2 THG 6, 2010","2010-06-02"
"7 tháng 12 2014","2014-12-07"
"14 10 13","2013-10-14"
"13 thg 7 2000","2000-07-13"
"tháng 12 21, 1990","1990-12-21"
"21 thg 5, 2010","2010-05-21"
"25 THÁNG 6 2007","2007-06-25"
"27 THÁNG 8, 1975","1975-08-27"
"19 thg 8 2001","2001-08-19"
"6 tháng 2 2008","2008-02-06"
"tháng 11 28 1978","1978-11-28"
"11 tháng 6 1989","1989-06-11"
"tháng 8 20 1991","1991-08-20"
"ngày 25 tháng 03 năm 2013","2013-03-25"
"08.12.89","1989-12-08"
"13 thg 6 1998","1998-06-13"
"10.07.77","1977-07-10"
"30 THG 11, 2010","2010-11-30"
"21, thg 7 1989","1989-07-21"
"Chủ Nhật, ngày 19 tháng 9 năm 2004","2004-09-19"
"Ngày 23 tháng 01 năm 1970","1970-01-23"
"18 THÁNG 5, 2012","2012-05-18"
"24 THG 8 1998","1998-08-24"
"tháng 6 14 1993","1993-06-14"
"THÁNG 11 10, 1971","1971-11-10"
"tháng 5 19 2000","2000-05-19"
"2 thg 12, 1995","1995-12-02"
"24 tháng 4 1983","1983-04-24"
"tháng 7 15 2011","2011-07-15"
"NGÀY 20 THÁNG 09 NĂM 1971","1971-09-20"
"Thứ Hai, ngày 02 tháng 4 năm 1990","1990-04-02"
"26/11/1976","1976-11-26"
"tháng 4 29 2011","2011-04-29"
"29 tháng 6 1996","1996-06-29"
"Ngày 11 tháng 07 năm 2000","2000-07-11"
"29.04.10","2010-04-29"
"29 tháng 1 1997","1997-01-29"
"11, THG 12 1986","1986-12-11"
"30 thg 6, 1981","1981-06-30"
"26 tháng 6, 1996","1996-06-26"
"22 tháng 8 1973","1973-08-22"
"21 tháng 12 2016","2016-12-21"
"29 THG 4 2004","2004-04-29"
"18.11.86","1986-11-18"
"7 12 18","2018-12-07"
"7 thg 11, 1982","1982-11-07"
"THÁNG 1 12, 1998","1998-01-12"
"31 THÁNG 7, 1974","1974-07-31"
"26.10.78","1978-10-26"
"THÁNG 11 10 2006","2006-11-10"
"THÁNG 4 4, 1977","1977-04-04"
"16 THÁNG 2 2008","2008-02-16"
"21, thg 5 1977","1977-05-21"
"21 tháng 6, 1998","1998-06-21"
"ngày 04 tháng 05 năm 1997","1997-05-04"
"14 thg 7 1980","1980-07-14"
"13 thg 3, 1973","1973-03-13"
"19 THG 6 2006","2006-06-19"
"22 THÁNG 11, 1983","1983-11-22"
"4 THÁNG 7 2015","2015-07-04"
"13 THG 3 1972","1972-03-13"
"20 thg 12, 2012","2012-12-20"
"14 thg 8, 1979","1979-08-14"
"18 THÁNG 2 2016","2016-02-18"
"8 thg 3, 2008","2008-03-08"
"1 thg 9, 2008","2008-09-01"
"16 tháng 6 2012","2012-06-16"
"14 tháng 8 1984","1984-08-14"
"03 THG 3 1984","1984-03-03"
"07/12/2002","2002-12-07"
"24 05 86","1986-05-24"
"12.06.88","1988-06-12"
"27/09/1981","1981-09-27"
"14, thg 2 1979","1979-02-14"
"28 THG 8 1989","1989-08-28"
"19, thg 12 2014","2014-12-19"
"tháng 5 23 1995","1995-05-23"
"26 THÁNG 8, 1987","1987-08-26"
"04 thg 9 1994","1994-09-04"
"26 tháng 4, 2018","2018-04-26"
"01, thg 1 1984","1984-01-01"
"20 thg 11, 1977","1977-11-20"
"6 THÁNG 12, 2002","2002-12-06"
"06/07/1998","1998-07-06"
"01/04/1994","1994-04-01"
"12 tháng 12 2016","2016-12-12"
"09, thg 11 1970","1970-11-09"
"Ngày 21 tháng 09 năm 2018","2018-09-21"
"31.07.77","1977-07-31"
"31 THÁNG 12 1991","1991-12-31"
"tháng 9 16 2010","2010-09-16"
"26 THÁNG 7, 2005","2005-07-26"
"6 tháng 8 2000","2000-08-06"
"13 THG 5, 1990","1990-05-13"
"10 06 03","2003-06-10"
"13 thg 3 1979","1979-03-13"
"tháng 4 23, 1999","1999-04-23"
"17 01 84","1984-01-17"
"07, thg 11 2007","2007-11-07"
"03 thg 8 1998","1998-08-03"
"13.08.81","1981-08-13"
"26, thg 8 1997","1997-08-26"
"Ngày 29 tháng 10 năm 1977","1977-10-29"
"29 tháng 12 1970","1970-12-29"
"20, thg 9 1984","1984-09-20"
"17 tháng 1 2012","2012-01-17"
"tháng 11 20 1972","1972-11-20"
"10 tháng 9 2002","2002-09-10"
"5 thg 7 1977","1977-07-05"
"3 thg 6 2004","2004-06-03"
"20 thg 3 2011","2011-03-20"
"Ngày 15 tháng 05 năm 2016","2016-05-15"
"Ngày 24 tháng 01 năm 1975","1975-01-24"
"Chủ Nhật, ngày 13 tháng 1 năm 1985","1985-01-13"
"22 thg 5, 2000","2000-05-22"
"17 tháng 5 1978","1978-05-17"
"tháng 3 17, 1989","1989-03-17"
"6 tháng 9 1978","1978-09-06"
"16, THG 2 1991","1991-02-16"
"14 thg 8 1983","1983-08-14"
"15 thg 12, 1976","1976-12-15"
"5 thg 9, 2000","2000-09-05"
"tháng 9 14 1982","1982-09-14"
"04/03/1974","1974-03-04"
"13/07/1979","1979-07-13"
"thứ tư, ngày 30 tháng 7 năm 2008","2008-07-30"
"29 thg 6, 2014","2014-06-29"
"tháng 11 8, 1982","1982-11-08"
"09/04/1984","1984-04-09"
"24 thg 8, 1997","1997-08-24"
"30 thg 3 2004","2004-03-30"
"tháng 11 28 2013","2013-11-28"
"26, thg 7 2011","2011-07-26"
"17 06 11","2011-06-17"
"THÁNG 11 29, 1975","1975-11-29"
"Ngày 29 tháng 06 năm 1998","1998-06-29"
"15 thg 1, 1992","1992-01-15"
"ngày 07 tháng 04 năm 1970","1970-04-07"
"5 thg 7 2016","2016-07-05"
"THÁNG 12 22 1981","1981-12-22"
"17 09 14","2014-09-17"
"tháng 6 15 1994","1994-06-15"
"5 THG 1, 1998","1998-01-05"
"6 tháng 1 2002","2002-01-06"
"Thứ Năm, ngày 05 tháng 4 năm 1973","1973-04-05"
"THÁNG 10 24 1973","1973-10-24"
"15 05 74","1974-05-15"
"tháng 8 29, 1976","1976-08-29"
"10 tháng 12, 1981","1981-12-10"
"Ngày 13 tháng 02 năm 1993","1993-02-13"
"10 thg 7 2001","2001-07-10"
"20/11/1980","1980-11-20"
"30/04/2015","2015-04-30"
"8 03 99","1999-03-08"
"06 thg 3 1970","1970-03-06"
"03.06.87","1987-06-03"
"26/11/1979","1979-11-26"
"30 thg 8, 1990","1990-08-30"
"9 THG 3, 1995","1995-03-09"
"1 thg 12, 1988","1988-12-01"
"04, THG 7 1974","1974-07-04"
"16 THG 2 1976","1976-02-16"
"17 THG 7, 1978","1978-07-17"
"NGÀY 08 THÁNG 11 NĂM 1989","1989-11-08"
"THỨ SÁU, NGÀY 15 THÁNG 7 NĂM 2005","2005-07-15"
"NGÀY 28 THÁNG 12 NĂM 2007","2007-12-28"
"22 THÁNG 6 2009","2009-06-22"
"11 THG 1 1976","1976-01-11"
"31, thg 1 1976","1976-01-31"
"tháng 8 1 1992","1992-08-01"
"1 thg 1, 2003","2003-01-01"
"3 thg 11 2007","2007-11-03"
"tháng 4 12 2000","2000-04-12"
"THÁNG 5 30, 2003","2003-05-30"
"thứ sáu, ngày 30 tháng 10 năm 2015","2015-10-30"
"Ngày 03 tháng 04 năm 2008","2008-04-03"
"10/04/2000","2000-04-10"
"01/08/1974","1974-08-01"
"4 tháng 4 2003","2003-04-04"
"23, thg 9 1973","1973-09-23"
"12 thg 4, 2004","2004-04-12"
"THÁNG 2 28, 2018","2018-02-28"
"28 tháng 11 2014","2014-11-28"
"20 thg 9, 1972","1972-09-20"
"tháng 9 15 1989","1989-09-15"
"14 tháng 8, 1994","1994-08-14"
"THÁNG 12 16 1971","1971-12-16"
"tháng 4 29 2005","2005-04-29"
"17.10.92","1992-10-17"
"Chủ Nhật, ngày 15 tháng 2 năm 2004","2004-02-15"
"Ngày 26 tháng 07 năm 2000","2000-07-26"
"1 thg 5, 1991","1991-05-01"
"Ngày 27 tháng 04 năm 2001","2001-04-27"
"1 03 06","2006-03-01"
"24 THG 3 1973","1973-03-24"
"14 tháng 4 2012","2012-04-14"
"05, thg 7 1983","1983-07-05"
"Chủ Nhật, ngày 21 tháng 8 năm 1988","1988-08-21"
"27.10.00","2000-10-27"
"14 tháng 3 1974","1974-03-14"
"9 06 80","1980-06-09"
"14 THÁNG 1 1983","1983-01-14"
"THỨ NĂM, NGÀY 24 THÁNG 7 NĂM 1986","1986-07-24"
"Thứ Hai, ngày 13 tháng 7 năm 1998","1998-07-13"
"11.07.94","1994-07-11"
"16.09.11","2011-09-16"
"18/03/2009","2009-03-18"
"23 THG 8 1993","1993-08-23"
"9 thg 9, 1972","1972-09-09"
"31.10.84","1984-10-31"
"Thứ Sáu, ngày 14 tháng 5 năm 2010","2010-05-14"
"16 tháng 2 1982","1982-02-16"
"tháng 3 3, 2009","2009-03-03"
"30 THÁNG 5, 1973","1973-05-30"
"5 tháng 8 2017","2017-08-05"
"7 tháng 11 1980","1980-11-07"
"31 THG 12, 1977","1977-12-31"
"26, THG 1 1978","1978-01-26"
"23 thg 1, 1994","1994-01-23"
"08.06.07","2007-06-08"
"thứ ba, ngày 13 tháng 11 năm 1990","1990-11-13"
"16 tháng 2 2012","2012-02-16"
"3 tháng 11, 1996","1996-11-03"
"2 12 08","2008-12-02"
"06.12.83","1983-12-06"
"ngày 21 tháng 06 năm 1971","1971-06-21"
"18 THG 6, 2008","2008-06-18"
"17/09/1991","1991-09-17"
"THÁNG 10 28 1987","1987-10-28"
"10 thg 7 2015","2015-07-10"
"24 THG 3 2016","2016-03-24"
"11, THG 8 2000","2000-08-11"
"chủ nhật, ngày 27 tháng 4 năm 1997","1997-04-27"
"tháng 12 21, 1999","1999-12-21"
"16 THG 11 1981","1981-11-16"
"thứ bảy, ngày 14 tháng 3 năm 1987","1987-03-14"
"26 THÁNG 4 2008","2008-04-26"
"29 tháng 4 2010","2010-04-29"
"28 04 02","2002-04-28"
"08, thg 9 1988","1988-09-08"
"16 01 11","2011-01-16"
"17 tháng 6 1985","1985-06-17"
"6 tháng 11 2016","2016-11-06"
"13 tháng 1 2012","2012-01-13"
"8 thg 4 1996","1996-04-08"
"9 THÁNG 8 2011","2011-08-09"
"tháng 10 30, 2010","2010-10-30"
"13 THÁNG 5, 2011","2011-05-13"
"29 tháng 6, 2011","2011-06-29"
"22 11 73","1973-11-22"
"20, thg 4 2007","2007-04-20"
"17, thg 4 1995","1995-04-17"
"22 tháng 8 2007","2007-08-22"
"15 thg 11 1993","1993-11-15"
"22, THG 1 1992","1992-01-22"
"16 THG 12, 1984","1984-12-16"
"10.01.74","1974-01-10"
"tháng 11 14 2000","2000-11-14"
"4 thg 2 1997","1997-02-04"
"6 tháng 4 1976","1976-04-06"
"THÁNG 6 19, 2008","2008-06-19"
"THỨ BA, NGÀY 23 THÁNG 7 NĂM 2002","2002-07-23"
"29 THÁNG 5 1995","1995-05-29"
"tháng 12 3 1972","1972-12-03"
"11/09/1975","1975-09-11"
"5 thg 3 1992","1992-03-05"
"15 thg 8, 1978","1978-08-15"
"tháng 6 20 1971","1971-06-20"
"Thứ Ba, ngày 25 tháng 12 năm 2018","2018-12-25"
"16 THÁNG 4 2016","2016-04-16"
"15 tháng 9, 1976","1976-09-15"
"NGÀY 25 THÁNG 02 NĂM 1972","1972-02-25"
"26 thg 10, 1978","1978-10-26"
"tháng 3 17, 2006","2006-03-17"
"2 THG 9 1986","1986-09-02"
"Ngày 10 tháng 02 năm 2017","2017-02-10"
"13 thg 9, 1997","1997-09-13"
"21 thg 4, 2010","2010-04-21"
"7 tháng 3 1993","1993-03-07"
"NGÀY 27 THÁNG 11 NĂM 2012","2012-11-27"
"13 tháng 5 1972","1972-05-13"
"ngày 12 tháng 04 năm 1983","1983-04-12"
"29, thg 9 2007","2007-09-29"
"5 thg 5, 1979","1979-05-05"
"23 THÁNG 8, 2015","2015-08-23"
"05/03/2007","2007-03-05"
"16 thg 12 2003","2003-12-16"
"25 THÁNG 8, 1974","1974-08-25"
"14 thg 7 1973","1973-07-14"
"NGÀY 23 THÁNG 11 NĂM 1992","1992-11-23"
"THÁNG 9 19, 2004","2004-09-19"
"30 05 81","1981-05-30"
"ngày 07 tháng 07 năm 1983","1983-07-07"
"07.04.83","1983-04-07"
"21 THÁNG 9, 1972","1972-09-21"
"31 THÁNG 12 2017","2017-12-31"
"25 THÁNG 12 1992","1992-12-25"
"7 thg 7, 1996","1996-07-07"
"31 tháng 3 1993","1993-03-31"
"27 thg 2, 1980","1980-02-27"
"17 thg 7, 1972","1972-07-17"
"14 thg 10, 2016","2016-10-14"
"6 thg 5, 1997","1997-05-06"
"07/09/2002","2002-09-07"
"tháng 10 14 1987","1987-10-14"
"thứ bảy, ngày 11 tháng 2 năm 1989","1989-02-11"
"tháng 2 28 2006","2006-02-28"
"THÁNG 7 18 1970","1970-07-18"
"27, thg 2 2010","2010-02-27"
"18 THÁNG 1 2008","2008-01-18"
"17 thg 3, 2005","2005-03-17"
"08, THG 10 1986","1986-10-08"
"26/11/1990","1990-11-26"
"29.06.70","1970-06-29"
"11.10.18","2018-10-11"
"THÁNG 7 4 1995","1995-07-04"
"6 thg 10, 1975","1975-10-06"
"Thứ Bảy, ngày 05 tháng 11 năm 1994","1994-11-05"
"4 08 73","1973-08-04"
"29.12.94","1994-12-29"
"9 tháng 6 2008","2008-06-09"
"27.01.04","2004-01-27"
"16 thg 12, 1992","1992-12-16"
"24 08 73","1973-08-24"
"15 tháng 7, 1975","1975-07-15"
"19/09/2006","2006-09-19"
"7 THÁNG 8 1979","1979-08-07"
"10 thg 12, 2012","2012-12-10"
"21 tháng 2 2002","2002-02-21"
"15/03/1989","1989-03-15"
"28.12.08","2008-12-28"
"Thứ Bảy, ngày 14 tháng 5 năm 2016","2016-05-14"
"28 tháng 11 2017","2017-11-28"
"tháng 12 24, 2006","2006-12-24"
"28 thg 11, 2016","2016-11-28"
"17 THÁNG 4, 1992","1992-04-17"
"02.11.83","1983-11-02"
"tháng 8 13 1993","1993-08-13"
"3 tháng 11 1983","1983-11-03"
"9 tháng 12 2003","2003-12-09"
"11 thg 7, 1985","1985-07-11"
"08 thg 9 1988","1988-09-08"
"Ngày 18 tháng 12 năm 1985","1985-12-18"
"ngày 16 tháng 06 năm 2005","2005-06-16"
"8 11 17","2017-11-08"
"04 thg 3 2006","2006-03-04"
"20 thg 6 1999","1999-06-20"
"02 thg 9 2010","2010-09-02"
"01, thg 3 1995","1995-03-01"
"17 THÁNG 4, 2008","2008-04-17"
"9 tháng 12, 2014","2014-12-09"
"10, thg 11 2018","2018-11-10"
"22.09.11","2011-09-22"
"1 tháng 12 1993","1993-12-01"
"4 thg 5, 1997","1997-05-04"
"02 thg 6 1985","1985-06-02"
"19 tháng 11 2000","2000-11-19"
"11 04 81","1981-04-11"
"22 thg 9 1986","1986-09-22"
"9 thg 1, 1972","1972-01-09"
"5 tháng 10 1991","1991-10-05"
"THỨ SÁU, NGÀY 15 THÁNG 8 NĂM 1975","1975-08-15"
"25.02.89","1989-02-25"
"12 07 11","2011-07-12"
"11 THÁNG 10 2001","2001-10-11"
"tháng 12 8 2001","2001-12-08"
"11 tháng 9, 2018","2018-09-11"
"15 THÁNG 3 2002","2002-03-15"
"22.05.83","1983-05-22"
"07/01/2008","2008-01-07"
"16 tháng 7, 1979","1979-07-16"
"tháng 6 9, 2003","2003-06-09"
"tháng 1 9 1970","1970-01-09"
"THỨ BA, NGÀY 06 THÁNG 8 NĂM 1991","1991-08-06"
"13 thg 1, 2005","2005-01-13"
"18 tháng 3 1997","1997-03-18"
"tháng 2 23 2015","2015-02-23"
"tháng 1 3, 1977","1977-01-03"
"thứ bảy, ngày 28 tháng 12 năm 1974","1974-12-28"
"tháng 9 8 1989","1989-09-08"
"17 tháng 8 2003","2003-08-17"
"26/03/1994","1994-03-26"
"16 thg 10, 2011","2011-10-16"
"22/03/1976","1976-03-22"
"9 thg 9, 2008","2008-09-09"
"12 thg 8 2006","2006-08-12"
"27 thg 3 1986","1986-03-27"
"30, thg 5 1982","1982-05-30"
"13 tháng 2, 2012","2012-02-13"
"28 THÁNG 12 2016","2016-12-28"
"Ngày 02 tháng 12 năm 1992","1992-12-02"
"tháng 1 16 1998","1998-01-16"
"21 tháng 8 1991","1991-08-21"
"28 THÁNG 8 1988","1988-08-28"
"thứ năm, ngày 17 tháng 12 năm 2009","2009-12-17"
"THÁNG 5 23, 1995","1995-05-23"
"Thứ Ba, ngày 03 tháng 11 năm 2015","2015-11-03"
"24/04/1978","1978-04-24"
"tháng 4 1 2009","2009-04-01"
"14.11.98","1998-11-14"
"23.04.80","1980-04-23"
"09, thg 10 1976","1976-10-09"
"21 THG 4, 2012","2012-04-21"
"22 tháng 8 1999","1999-08-22"
"26 thg 2, 1983","1983-02-26"
"24 tháng 9, 2018","2018-09-24"
"10 THG 9, 2001","2001-09-10"
"THỨ HAI, NGÀY 14 THÁNG 4 NĂM 1986","1986-04-14"
"thứ tư, ngày 22 tháng 11 năm 1995","1995-11-22"
"24/11/2004","2004-11-24"
"31/07/2000","2000-07-31"
"24 10 71","1971-10-24"
"tháng 5 30 1974","1974-05-30"
"03/12/1987","1987-12-03"
"6 12 13","2013-12-06"
"THÁNG 9 14 2015","2015-09-14"
"26 thg 5, 1994","1994-05-26"
"08, THG 6 1973","1973-06-08"
"tháng 5 8 2006","2006-05-08"
"Thứ Bảy, ngày 16 tháng 7 năm 2011","2011-07-16"
"11 THG 4 1995","1995-04-11"
"ngày 12 tháng 08 năm 2013","2013-08-12"
"20 THG 12, 1974","1974-12-20"
"19, thg 9 2010","2010-09-19"
"31 thg 1, 1994","1994-01-31"
"28 thg 7 2010","2010-07-28"
"23 THÁNG 7 1997","1997-07-23"
"29/08/1982","1982-08-29"
"Ngày 14 tháng 08 năm 2018","2018-08-14"
"25 THG 10 1999","1999-10-25"
"22 thg 3 2009","2009-03-22"
"09 THG 2 1988","1988-02-09"
"1 tháng 12 1975","1975-12-01"
"08/01/2012","2012-01-08"
"14 tháng 9 1991","1991-09-14"
"5 thg 7, 2007","2007-07-05"
"Ngày 03 tháng 04 năm 1972","1972-04-03"
"10/04/2008","2008-04-10"
"27 07 75","1975-07-27"
"24 tháng 2, 1992","1992-02-24"
"Ngày 09 tháng 05 năm 2002","2002-05-09"
"tháng 1 27, 2017","2017-01-27"
"25.03.87","1987-03-25"
"Ngày 29 tháng 03 năm 1978","1978-03-29"
"6 thg 4, 1989","1989-04-06"
"tháng 8 2, 2006","2006-08-02"
"21 thg 11 2014","2014-11-21"
"24/10/1980","1980-10-24"
"6 tháng 7 1983","1983-07-06"
"16 tháng 9, 2014","2014-09-16"
"27 tháng 11 1988","1988-11-27"
"29 12 05","2005-12-29"
"4 tháng 12, 2013","2013-12-04"
"Ngày 05 tháng 01 năm 2000","2000-01-05"
"13 thg 9, 1980","1980-09-13"
"Thứ Sáu, ngày 11 tháng 11 năm 1988","1988-11-11"
"THÁNG 10 25 2010","2010-10-25"
"22 thg 12, 2007","2007-12-22"
"15 07 18","2018-07-15"
"13 thg 12 1982","1982-12-13"
"9 thg 6, 2017","2017-06-09"
"THỨ NĂM, NGÀY 13 THÁNG 4 NĂM 1995","1995-04-13"
"THÁNG 11 23, 1972","1972-11-23"
"28 tháng 4, 2012","2012-04-28"
"12 tháng 9 2009","2009-09-12"
"13 thg 12, 2012","2012-12-13"
"07/06/1980","1980-06-07"
"NGÀY 11 THÁNG 02 NĂM 1971","1971-02-11"
"tháng 8 11, 1978","1978-08-11"
"19 tháng 4 1987","1987-04-19"
"tháng 5 4, 2010","2010-05-04"
"tháng 6 2, 2005","2005-06-02"
"THÁNG 2 1 1995","1995-02-01"
"10 thg 5, 1974","1974-05-10"
"18 THÁNG 1 2007","2007-01-18"
"14 thg 1 1985","1985-01-14"
"tháng 6 10, 2000","2000-06-10"
"THỨ SÁU, NGÀY 26 THÁNG 6 NĂM 2009","2009-06-26"
"21 tháng 11 1999","1999-11-21"
"25 thg 12 1996","1996-12-25"
"24 03 02","2002-03-24"
"28 THÁNG 7 1982","1982-07-28"
"THÁNG 4 28, 2004","2004-04-28"
"THÁNG 3 26, 2000","2000-03-26"
"THÁNG 4 22 1990","1990-04-22"
"30 tháng 1, 1996","1996-01-30"
"11, thg 3 2009","2009-03-11"
"tháng 3 27, 1981","1981-03-27"
"27, thg 7 1992","1992-07-27"
"14 tháng 4 1972","1972-04-14"
"01, thg 6 1979","1979-06-01"
"19 02 07","2007-02-19"
"THÁNG 4 22 1994","1994-04-22"
"9 tháng 2, 2013","2013-02-09"
"NGÀY 21 THÁNG 04 NĂM 1990","1990-04-21"
"06.11.91","1991-11-06"
"11 tháng 12 1971","1971-12-11"
"13 thg 5, 1971","1971-05-13"
"30 THG 5 2009","2009-05-30"
"THỨ SÁU, NGÀY 11 THÁNG 4 NĂM 2003","2003-04-11"
"21 02 96","1996-02-21"
"14 tháng 7 1987","1987-07-14"
"15 thg 7, 2001","2001-07-15"
"11 tháng 2 1978","1978-02-11"
"13 thg 8 2004","2004-08-13"
"23 thg 6 2017","2017-06-23"
"29 tháng 7 2013","2013-07-29"
"tháng 9 15 1977","1977-09-15"
"5 08 92","1992-08-05"
"THỨ HAI, NGÀY 21 THÁNG 1 NĂM 2013","2013-01-21"
"02.08.78","1978-08-02"
"5 THG 12 1977","1977-12-05"
"20, thg 6 2000","2000-06-20"
"ngày 10 tháng 09 năm 1997","1997-09-10"
"17 11 74","1974-11-17"
"7 tháng 10 2001","2001-10-07"
"13 08 79","1979-08-13"
"27 THÁNG 9, 2003","2003-09-27"
"tháng 2 9, 1978","1978-02-09"
"20, thg 11 1991","1991-11-20"
"27 thg 5, 2007","2007-05-27"
"21 02 99","1999-02-21"
"20 tháng 10 1981","1981-10-20"
"tháng 3 14, 1990","1990-03-14"
"29 tháng 4, 1980","1980-04-29"
"2 thg 4, 1985","1985-04-02"
"12 03 85","1985-03-12"
"Thứ Tư, ngày 15 tháng 5 năm 1991","1991-05-15"
"6 thg 11 1982","1982-11-06"
"05/04/1999","1999-04-05"
"THÁNG 11 16 2017","2017-11-16"
"21 THÁNG 1 1981","1981-01-21"
"21 tháng 4 2001","2001-04-21"
"27 thg 11, 1970","1970-11-27"
"THÁNG 6 29 1970","1970-06-29"
"13 tháng 10 1976","1976-10-13"
"30 THG 12 1978","1978-12-30"
"05/09/1980","1980-09-05"
"Thứ Sáu, ngày 26 tháng 4 năm 1991","1991-04-26"
"03.12.96","1996-12-03"
"THỨ BA, NGÀY 08 THÁNG 4 NĂM 2008","2008-04-08"
"11 THG 11 1987","1987-11-11"
"10 THÁNG 11, 1975","1975-11-10"
"13 THG 5 2014","2014-05-13"
"THỨ NĂM, NGÀY 31 THÁNG 1 NĂM 2008","2008-01-31"
"28 tháng 9 1976","1976-09-28"
"tháng 5 3, 2011","2011-05-03"
"13 THG 5 1992","1992-05-13"
"NGÀY 22 THÁNG 05 NĂM 1974","1974-05-22"
"THÁNG 3 15, 1982","1982-03-15"
"Thứ Năm, ngày 21 tháng 2 năm 1974","1974-02-21"
"tháng 4 27, 2013","2013-04-27"
"tháng 1 21, 1992","1992-01-21"
"26/03/1992","1992-03-26"
"25 thg 7 2004","2004-07-25"
"9 01 89","1989-01-09"
"tháng 12 30 1990","1990-12-30"
"thứ ba, ngày 14 tháng 4 năm 1998","1998-04-14"
"14 THG 1 2011","2011-01-14"
"Ngày 25 tháng 03 năm 2012","2012-03-25"
"THỨ SÁU, NGÀY 24 THÁNG 10 NĂM 2014","2014-10-24"
"04.09.93","1993-09-04"
"02, THG 5 1972","1972-05-02"
"10/06/1986","1986-06-10"
"19 thg 6, 1972","1972-06-19"
"13 tháng 12 1985","1985-12-13"
"14 THÁNG 11 2004","2004-11-14"
"14 thg 5 2003","2003-05-14"
"24/03/1991","1991-03-24"
"23.01.78","1978-01-23"
"thứ tư, ngày 21 tháng 6 năm 1978","1978-06-21"
"03.01.89","1989-01-03"
"17 09 85","1985-09-17"
"12 tháng 2, 1996","1996-02-12"
"5 thg 1, 1998","1998-01-05"
"7 thg 1, 1990","1990-01-07"
"17 tháng 6 1974","1974-06-17"
"18 thg 7, 1976","1976-07-18"
"27 thg 6, 1999","1999-06-27"
"tháng 5 16, 1973","1973-05-16"
"12 thg 5 1971","1971-05-12"
"tháng 11 19, 2006","2006-11-19"
"12 tháng 1 2011","2011-01-12"
"17 05 87","1987-05-17"
"19.07.86","1986-07-19"
"tháng 5 23 1997","1997-05-23"
"5 THÁNG 8 2010","2010-08-05"
"ngày 09 tháng 10 năm 1988","1988-10-09"
"29 thg 5 1993","1993-05-29"
"07.10.09","2009-10-07"
"31 THG 3 1982","1982-03-31"
"13, THG 12 1986","1986-12-13"
"26, thg 3 1979","1979-03-26"
"2 THÁNG 1 2003","2003-01-02"
"ngày 10 tháng 06 năm 2009","2009-06-10"
"31 tháng 5 1990","1990-05-31"
"6 THÁNG 10, 2003","2003-10-06"
"6 thg 8, 2003","2003-08-06"
"THÁNG 11 13 2010","2010-11-13"
"12 thg 4 2001","2001-04-12"
"11 thg 11, 1972","1972-11-11"
"25 THG 12, 2008","2008-12-25"
"tháng 2 9, 2010","2010-02-09"
"21 tháng 9, 2010","2010-09-21"
"8 THÁNG 9 2015","2015-09-08"
"ngày 15 tháng 07 năm 1990","1990-07-15"
"2 THÁNG 6, 2018","2018-06-02"
"8 tháng 4, 1976","1976-04-08"
"tháng 6 4, 1972","1972-06-04"
"tháng 6 17 2005","2005-06-17"
"19 thg 1, 2012","2012-01-19"
"tháng 11 26, 2010","2010-11-26"
"07.09.79","1979-09-07"
"THỨ HAI, NGÀY 25 THÁNG 8 NĂM 2003","2003-08-25"
"24 THÁNG 8 1976","1976-08-24"
"Ngày 10 tháng 10 năm 1987","1987-10-10"
"2 10 92","1992-10-02"
"5 tháng 4 1986","1986-04-05"
"THỨ TƯ, NGÀY 08 THÁNG 2 NĂM 2017","2017-02-08"
"tháng 9 29 1989","1989-09-29"
"THÁNG 2 13 1993","1993-02-13"
"27 thg 1 1984","1984-01-27"
"23.08.91","1991-08-23"
"28 THG 1 2016","2016-01-28"
"tháng 4 25 2004","2004-04-25"
"tháng 7 21 1980","1980-07-21"
"30 THÁNG 9 2001","2001-09-30"
"04 thg 11 2001","2001-11-04"
"5 thg 2 1976","1976-02-05"
"28.07.89","1989-07-28"
"23 thg 10, 1985","1985-10-23"
"4 tháng 1, 1976","1976-01-04"
"13 thg 2, 1992","1992-02-13"
"29 tháng 4 1979","1979-04-29"
"THÁNG 8 28, 2006","2006-08-28"
"19 12 86","1986-12-19"
"10 thg 4 2001","2001-04-10"
"thứ ba, ngày 20 tháng 5 năm 2014","2014-05-20"
"6 12 10","2010-12-06"
"THÁNG 12 5 2008","2008-12-05"
"2 thg 7, 2008","2008-07-02"
"27.08.83","1983-08-27"
"19 tháng 7 1994","1994-07-19"
"20, thg 6 1998","1998-06-20"
"07 THG 7 2007","2007-07-07"
"25, thg 6 1973","1973-06-25"
"11, THG 7 2002","2002-07-11"
"22 THG 3 1976","1976-03-22"
"23 thg 4, 1980","1980-04-23"
"23 12 12","2012-12-23"
"tháng 10 30 2001","2001-10-30"
"15 tháng 12 2013","2013-12-15"
"11 tháng 11, 1978","1978-11-11"
"Ngày 16 tháng 02 năm 1991","1991-02-16"
"NGÀY 29 THÁNG 12 NĂM 2004","2004-12-29"
"14 tháng 1 2009","2009-01-14"
"30 THG 5 2015","2015-05-30"
"tháng 2 28, 1983","1983-02-28"
"12, THG 9 1972","1972-09-12"
"18 01 78","1978-01-18"
"23 THG 6 2009","2009-06-23"
"13 tháng 4 2001","2001-04-13"
"16 tháng 3 1998","1998-03-16"
"30 THÁNG 4 1975","1975-04-30"
"5 tháng 8 1985","1985-08-05"
"3 tháng 7, 1984","1984-07-03"
"04 thg 10 2011","2011-10-04"
"Ngày 10 tháng 06 năm 1972","1972-06-10"
"23 tháng 7 1978","1978-07-23"
"10.04.04","2004-04-10"
"28 04 16","2016-04-28"
"Thứ Ba, ngày 08 tháng 2 năm 1977","1977-02-08"
"14 THÁNG 3 1985","1985-03-14"
"4 thg 4 2011","2011-04-04"
"16 THG 5 2005","2005-05-16"
"13.11.81","1981-11-13"
"24 tháng 6 2002","2002-06-24"
"23 tháng 4, 1985","1985-04-23"
"tháng 8 4, 1993","1993-08-04"
"THÁNG 8 1, 1991","1991-08-01"
"11 tháng 6 1976","1976-06-11"
"6 tháng 10 2016","2016-10-06"
"06/08/1995","1995-08-06"
"tháng 9 26, 1975","1975-09-26"
"Ngày 24 tháng 09 năm 2012","2012-09-24"
"9 thg 1, 2016","2016-01-09"
"23.01.72","1972-01-23"
"09.10.01","2001-10-09"
"20 thg 7 2001","2001-07-20"
"Thứ Năm, ngày 14 tháng 1 năm 1993","1993-01-14"
"01, thg 12 1994","1994-12-01"
"5 05 98","1998-05-05"
"28 thg 9 2000","2000-09-28"
"7 thg 1, 2011","2011-01-07"
"26 thg 5 1986","1986-05-26"
"2 thg 8, 1991","1991-08-02"
"22 tháng 12 2016","2016-12-22"
"tháng 1 10, 1988","1988-01-10"
"4 10 70","1970-10-04"
"15/04/1999","1999-04-15"
"2 thg 11, 1971","1971-11-02"
"02.12.15","2015-12-02"
"THÁNG 5 12, 2002","2002-05-12"
"25, thg 12 1976","1976-12-25"
"tháng 6 10, 1988","1988-06-10"
"10/08/1990","1990-08-10"
"thứ bảy, ngày 24 tháng 1 năm 1976","1976-01-24"
"14 THÁNG 6 1991","1991-06-14"
"19 thg 4, 1981","1981-04-19"
"19/02/2012","2012-02-19"
"19/12/1980","1980-12-19"
"03/11/1982","1982-11-03"
"31 thg 1, 1999","1999-01-31"
"NGÀY 23 THÁNG 12 NĂM 1985","1985-12-23"
"29.05.91","1991-05-29"
"Ngày 21 tháng 04 năm 2015","2015-04-21"
"6 thg 6, 2002","2002-06-06"
"16 thg 9, 2015","2015-09-16"
"Ngày 24 tháng 02 năm 1974","1974-02-24"
"16 tháng 9 1979","1979-09-16"
"15 tháng 7 2004","2004-07-15"
"08/09/1999","1999-09-08"
"16 thg 2, 2014","2014-02-16"
"4 thg 3, 2004","2004-03-04"
"11.07.88","1988-07-11"
"24 thg 8 2011","2011-08-24"
"22, thg 12 2016","2016-12-22"
"20/10/1999","1999-10-20"
"13 thg 7, 1975","1975-07-13"
"12/02/1978","1978-02-12"
"28 THG 2, 2012","2012-02-28"
"15 thg 8 1986","1986-08-15"
"27 thg 11, 1994","1994-11-27"
"27 thg 3 1992","1992-03-27"
"30 THÁNG 4, 1978","1978-04-30"
"19 THG 1 1975","1975-01-19"
"21 tháng 8 1988","1988-08-21"
"Ngày 04 tháng 01 năm 1987","1987-01-04"
"THÁNG 11 22 2007","2007-11-22"
"10 08 84","1984-08-10"
"26 tháng 10 1982","1982-10-26"
"22 THG 2 1981","1981-02-22"
"15 thg 11 2004","2004-11-15"
"tháng 3 11 1981","1981-03-11"
"22 THÁNG 2 2003","2003-02-22"
"22/11/1999","1999-11-22"
"24 tháng 8 1985","1985-08-24"
"09.05.09","2009-05-09"
"27 tháng 4, 1984","1984-04-27"
"3 THG 2, 2001","2001-02-03"
"Ngày 13 tháng 09 năm 1978","1978-09-13"
"19 tháng 9 2016","2016-09-19"
"Ngày 02 tháng 01 năm 1988","1988-01-02"
"22 thg 3 2015","2015-03-22"
"13 thg 9 2018","2018-09-13"
"Thứ Ba, ngày 30 tháng 5 năm 1989","1989-05-30"
"21/10/2005","2005-10-21"
"3 thg 6 1991","1991-06-03"
"21 tháng 5, 1982","1982-05-21"
"24, thg 9 1991","1991-09-24"
"Thứ Hai, ngày 21 tháng 8 năm 1972","1972-08-21"
"28, thg 6 2003","2003-06-28"
"3 thg 6 2015","2015-06-03"
"2 THG 1 2004","2004-01-02"
"8 THÁNG 8, 1988","1988-08-08"
"28.05.96","1996-05-28"
"thứ năm, ngày 02 tháng 7 năm 1981","1981-07-02"
"19 tháng 8 1987","1987-08-19"
"21 11 00","2000-11-21"
"6 THG 9, 1983","1983-09-06"
"3 THG 6 1975","1975-06-03"
"Thứ Hai, ngày 12 tháng 2 năm 1990","1990-02-12"
"Ngày 03 tháng 07 năm 2014","2014-07-03"
"20 THÁNG 11, 1989","1989-11-20"
"18, thg 7 1992","1992-07-18"
"20 07 11","2011-07-20"
"29 THÁNG 11 1973","1973-11-29"
"7 thg 3 2010","2010-03-07"
"19 tháng 2 2006","2006-02-19"
"29 tháng 5, 2013","2013-05-29"
"30 tháng 6 1978","1978-06-30"
"16 THÁNG 5 1983","1983-05-16"
"17 tháng 12 2010","2010-12-17"
"tháng 5 4, 1988","1988-05-04"
"THÁNG 11 30, 2004","2004-11-30"
"tháng 8 11, 2005","2005-08-11"
"1 tháng 10, 1982","1982-10-01"
"4 thg 6, 2016","2016-06-04"
"27 THÁNG 5 2003","2003-05-27"
"29 thg 12 1998","1998-12-29"
"24 THÁNG 10 1992","1992-10-24"
"03, THG 12 1978","1978-12-03"
"25, thg 11 1975","1975-11-25"
"chủ nhật, ngày 17 tháng 9 năm 2000","2000-09-17"
"23 tháng 11, 2000","2000-11-23"
"23 thg 4 1987","1987-04-23"
"27.08.10","2010-08-27"
"tháng 10 26 1986","1986-10-26"
"tháng 1 7, 2010","2010-01-07"
"NGÀY 08 THÁNG 11 NĂM 1971","1971-11-08"
"9 tháng 11 1978","1978-11-09"
"Thứ Hai, ngày 14 tháng 11 năm 2016","2016-11-14"
"13 thg 5 2001","2001-05-13"
"31 THÁNG 5 2001","2001-05-31"
"4 thg 7, 2012","2012-07-04"
"20 thg 1, 1983","1983-01-20"
"22 tháng 12 1997","1997-12-22"
"tháng 6 10 1995","1995-06-10"
"03, thg 4 1971","1971-04-03"
"15/04/2000","2000-04-15"
"THÁNG 9 29, 1972","1972-09-29"
"16 thg 2 2014","2014-02-16"
"13/01/1977","1977-01-13"
"03/04/2016","2016-04-03"
"17 tháng 3 2012","2012-03-17"
"24 THG 7, 2008","2008-07-24"
"2 tháng 12 1997","1997-12-02"
"18/07/1993","1993-07-18"
"ngày 19 tháng 09 năm 2003","2003-09-19"
"20, thg 4 1979","1979-04-20"
"17, thg 11 1992","1992-11-17"
"28 tháng 3 1994","1994-03-28"
"tháng 2 26, 1979","1979-02-26"
"Ngày 14 tháng 01 năm 2008","2008-01-14"
"7 tháng 5 1980","1980-05-07"
"30 thg 4 1978","1978-04-30"
"28 THG 9, 2002","2002-09-28"
"ngày 06 tháng 02 năm 2012","2012-02-06"
"tháng 9 9 2002","2002-09-09"
"12 thg 3 2006","2006-03-12"
"07/03/1976","1976-03-07"
"21 thg 2, 2016","2016-02-21"
"22 THG 1 1993","1993-01-22"
"31 07 06","2006-07-31"
"tháng 9 4, 1978","1978-09-04"
"tháng 12 3, 2018","2018-12-03"
"tháng 3 28 2007","2007-03-28"
"7 THG 8 1990","1990-08-07"
"Chủ Nhật, ngày 24 tháng 8 năm 1980","1980-08-24"
"tháng 5 30, 2011","2011-05-30"
"24 09 92","1992-09-24"
"06 THG 6 2014","2014-06-06"
"26 tháng 10 1998","1998-10-26"
"22 08 75","1975-08-22"
"Ngày 11 tháng 01 năm 2003","2003-01-11"
"12 thg 7 1975","1975-07-12"
"13 12 07","2007-12-13"
"22.07.09","2009-07-22"
"11 tháng 3, 2016","2016-03-11"
"11.09.80","1980-09-11"
"tháng 1 6, 1983","1983-01-06"
"19 tháng 10 1990","1990-10-19"
"26 tháng 12 1977","1977-12-26"
"tháng 8 15 1983","1983-08-15"
"tháng 3 19 2004","2004-03-19"
"11 thg 8, 2007","2007-08-11"
"22.07.15","2015-07-22"
"25.11.73","1973-11-25"
"03/09/1982","1982-09-03"
"2 THÁNG 9, 2011","2011-09-02"
"5 THÁNG 11 2016","2016-11-05"
"4 THÁNG 3 1972","1972-03-04"
"31 thg 7, 1985","1985-07-31"
"16 THÁNG 5, 2016","2016-05-16"
"17 tháng 8, 1998","1998-08-17"
"THỨ NĂM, NGÀY 10 THÁNG 12 NĂM 1970","1970-12-10"
"14 THÁNG 11 1978","1978-11-14"
"tháng 7 13 2002","2002-07-13"
"26, THG 9 1993","1993-09-26"
"06/11/1982","1982-11-06"
"11 THÁNG 3, 1998","1998-03-11"
"8 thg 5 1981","1981-05-08"
"18 tháng 9, 1980","1980-09-18"
"tháng 7 2, 2016","2016-07-02"
"26 THG 7 2010","2010-07-26"
"24 THG 6, 1999","1999-06-24"
"6 thg 5, 1990","1990-05-06"
"22 tháng 6 2013","2013-06-22"
"11, thg 8 2017","2017-08-11"
"ngày 17 tháng 12 năm 1995","1995-12-17"
"17 tháng 5 2008","2008-05-17"
"NGÀY 02 THÁNG 07 NĂM 2008","2008-07-02"
"11 tháng 6, 1997","1997-06-11"
"28 thg 12 2015","2015-12-28"
"3 thg 3 2006","2006-03-03"
"25 THG 2, 1979","1979-02-25"
"Ngày 26 tháng 04 năm 1996","1996-04-26"
"10 thg 2 2014","2014-02-10"
"15 thg 7, 1992","1992-07-15"
"11, THG 1 1982","1982-01-11"
"1 tháng 7 1987","1987-07-01"
"7 THÁNG 8, 2018","2018-08-07"
"NGÀY 29 THÁNG 06 NĂM 2017","2017-06-29"
"25 tháng 5, 1992","1992-05-25"
"Ngày 17 tháng 08 năm 2013","2013-08-17"
"tháng 2 15, 2008","2008-02-15"
"14 tháng 3 1971","1971-03-14"
"7 02 73","1973-02-07"
"tháng 8 26 1973","1973-08-26"
"24.07.04","2004-07-24"
"19 THÁNG 7 1975","1975-07-19"
"25 thg 4 2001","2001-04-25"
"30 THG 12, 2011","2011-12-30"
"tháng 7 29, 2005","2005-07-29"
"tháng 1 6 2009","2009-01-06"
"18 THÁNG 6, 1984","1984-06-18"
"20 tháng 5, 1992","1992-05-20"
"26.06.18","2018-06-26"
"Chủ Nhật, ngày 06 tháng 9 năm 1987","1987-09-06"
"NGÀY 02 THÁNG 12 NĂM 2000","2000-12-02"
"27 THÁNG 2 1990","1990-02-27"
"29 tháng 5 1982","1982-05-29"
"NGÀY 22 THÁNG 12 NĂM 1989","1989-12-22"
"8 thg 12, 2013","2013-12-08"
"thứ hai, ngày 15 tháng 12 năm 2014","2014-12-15"
"NGÀY 15 THÁNG 05 NĂM 2010","2010-05-15"
"2 tháng 2 1976","1976-02-02"
"27 10 74","1974-10-27"
"Thứ Hai, ngày 12 tháng 3 năm 1979","1979-03-12"
"15 tháng 1 1979","1979-01-15"
"24 THG 8 2006","2006-08-24"
"8 thg 12 2010","2010-12-08"
"31 THG 12 2007","2007-12-31"
"17 THÁNG 5, 1985","1985-05-17"
"24.07.13","2013-07-24"
"5 10 79","1979-10-05"
"01 THG 7 1981","1981-07-01"
"7 tháng 6, 2002","2002-06-07"
"7 thg 8, 1986","1986-08-07"
"2 THG 11, 1985","1985-11-02"
"8 thg 1, 2016","2016-01-08"
"9 tháng 12 2013","2013-12-09"
"19 tháng 9 1991","1991-09-19"
"11 thg 1 1983","1983-01-11"
"10, thg 2 2015","2015-02-10"
"4 thg 2, 1974","1974-02-04"
"21 THÁNG 10 1995","1995-10-21"
"02, thg 11 2014","2014-11-02"
"thứ năm, ngày 15 tháng 10 năm 1987","1987-10-15"
"30 thg 9, 2000","2000-09-30"
"15 01 82","1982-01-15"
"22, thg 11 1976","1976-11-22"
"12 thg 7, 2011","2011-07-12"
"1 tháng 7 1985","1985-07-01"
"29 thg 11, 1987","1987-11-29"
"tháng 4 26 2008","2008-04-26"
"08.03.12","2012-03-08"
"28 thg 3, 2016","2016-03-28"
"11 03 06","2006-03-11"
"05 thg 2 2000","2000-02-05"
"Thứ Năm, ngày 19 tháng 1 năm 2017","2017-01-19"
"10 tháng 4 2009","2009-04-10"
"05.03.71","1971-03-05"
"THỨ BA, NGÀY 22 THÁNG 1 NĂM 1974","1974-01-22"
"27 12 83","1983-12-27"
"01.05.18","2018-05-01"
"12 tháng 4 1986","1986-04-12"
"23/10/2016","2016-10-23"
"22 tháng 9, 1970","1970-09-22"
"2 thg 9 2017","2017-09-02"
"08.07.74","1974-07-08"
"27 thg 3 1984","1984-03-27"
"18, thg 3 2002","2002-03-18"
"17 thg 6 2012","2012-06-17"
"Ngày 15 tháng 06 năm 1989","1989-06-15"
"15 10 74","1974-10-15"
"20/10/1971","1971-10-20"
"25 thg 10, 1982","1982-10-25"
"8 thg 2 1972","1972-02-08"
"1 tháng 9, 1992","1992-09-01"
"17 thg 2 2017","2017-02-17"
"17 thg 3, 1972","1972-03-17"
"8 THÁNG 3 2000","2000-03-08"
"19 08 80","1980-08-19"
"THÁNG 4 30 1993","1993-04-30"
"14 thg 11, 2010","2010-11-14"
"8 02 94","1994-02-08"
"26 01 05","2005-01-26"
"20 thg 6, 2011","2011-06-20"
"15 thg 12 1970","1970-12-15"
"23 thg 8 1998","1998-08-23"
"20 tháng 7 1984","1984-07-20"
"22 tháng 8 2016","2016-08-22"
"31 THG 12, 2009","2009-12-31"
"19 tháng 5, 1982","1982-05-19"
"tháng 7 28 1998","1998-07-28"
"17 thg 12, 1984","1984-12-17"
"tháng 1 15 1970","1970-01-15"
"16, thg 3 1971","1971-03-16"
"29 THÁNG 9 1984","1984-09-29"
"thứ hai, ngày 11 tháng 12 năm 2000","2000-12-11"
"12 thg 10, 1988","1988-10-12"
"THÁNG 3 11 1972","1972-03-11"
"25 tháng 3 2016","2016-03-25"
"tháng 11 25 2001","2001-11-25"
"18 thg 11, 1978","1978-11-18"
"28 thg 8, 2013","2013-08-28"
"08.09.85","1985-09-08"
"THÁNG 5 15, 2015","2015-05-15"
"THỨ BA, NGÀY 02 THÁNG 7 NĂM 2013","2013-07-02"
"29 thg 1 2000","2000-01-29"
"26.05.82","1982-05-26"
"16 THG 10 2018","2018-10-16"
"Thứ Sáu, ngày 21 tháng 1 năm 1972","1972-01-21"
"30, thg 1 2003","2003-01-30"
"16.11.13","2013-11-16"
"23 THG 10, 1992","1992-10-23"
"18/03/1998","1998-03-18"
"Ngày 25 tháng 03 năm 1995","1995-03-25"
"THÁNG 1 5 2011","2011-01-05"
"14 tháng 11, 2013","2013-11-14"
"3 THÁNG 7 1988","1988-07-03"
"16, THG 3 1991","1991-03-16"
"18 tháng 6 2001","2001-06-18"
"24 thg 9 1987","1987-09-24"
"29, THG 12 1994","1994-12-29"
"13 THÁNG 8 1976","1976-08-13"
"03 thg 10 2001","2001-10-03"
"28 tháng 10 1974","1974-10-28"
"NGÀY 25 THÁNG 08 NĂM 1998","1998-08-25"
"5 tháng 12, 1970","1970-12-05"
"09/06/1996","1996-06-09"
"tháng 4 22, 2012","2012-04-22"
"05, thg 10 2001","2001-10-05"
"28 tháng 6, 2004","2004-06-28"
"16 tháng 10 2011","2011-10-16"
"11 tháng 3 2002","2002-03-11"
"28, thg 6 1989","1989-06-28"
"05 thg 12 2005","2005-12-05"
"5 07 88","1988-07-05"
"6 tháng 8 2009","2009-08-06"
"28/03/2006","2006-03-28"
"24 tháng 5 1985","1985-05-24"
"22.03.70","1970-03-22"
"30/11/1975","1975-11-30"
"25 tháng 2 1974","1974-02-25"
"thứ ba, ngày 13 tháng 2 năm 1990","1990-02-13"
"Ngày 20 tháng 06 năm 1978","1978-06-20"
"6 tháng 3 2005","2005-03-06"
"THÁNG 5 23 1971","1971-05-23"
"04 THG 10 1998","1998-10-04"
"20/04/1996","1996-04-20"
"16 tháng 7 1971","1971-07-16"
"10 tháng 9, 2004","2004-09-10"
"2 THÁNG 2, 1995","1995-02-02"
"15/02/2010","2010-02-15"
"03/10/1975","1975-10-03"
"3 thg 2 1981","1981-02-03"
"tháng 1 12, 1970","1970-01-12"
"THÁNG 1 28, 1972","1972-01-28"
"30 tháng 9 1984","1984-09-30"
"THÁNG 12 9 2010","2010-12-09"
"22 tháng 1 1976","1976-01-22"
"26 thg 5, 1973","1973-05-26"
"Thứ Năm, ngày 28 tháng 10 năm 2010","2010-10-28"
"17 tháng 2, 1996","1996-02-17"
"21 thg 2, 2010","2010-02-21"
"6 thg 8, 2006","2006-08-06"
"THÁNG 4 22 1991","1991-04-22"
"17 THÁNG 5, 2016","2016-05-17"
"09, thg 8 2009","2009-08-09"
"tháng 7 1 1989","1989-07-01"
"16 thg 12, 1979","1979-12-16"
"3 thg 11, 2004","2004-11-03"
"tháng 5 13 1998","1998-05-13"
"tháng 7 27, 2016","2016-07-27"
"19 thg 6, 2006","2006-06-19"
"Ngày 15 tháng 05 năm 2005","2005-05-15"
"1 thg 10 1974","1974-10-01"
"5 tháng 7 2018","2018-07-05"
"02.01.16","2016-01-02"
"6 thg 9, 2008","2008-09-06"
"9 tháng 3, 1988","1988-03-09"
"01.03.93","1993-03-01"
"29 tháng 10, 1998","1998-10-29"
"19 THG 1, 2006","2006-01-19"
"29.12.72","1972-12-29"
"05.06.71","1971-06-05"
"07, thg 10 2006","2006-10-07"
"11 thg 7 1992","1992-07-11"
"6 thg 10, 1976","1976-10-06"
"NGÀY 29 THÁNG 08 NĂM 1997","1997-08-29"
"22.03.96","1996-03-22"
"23 03 84","1984-03-23"
"tháng 1 30, 1980","1980-01-30"
"21 THG 4 2005","2005-04-21"
"17, thg 7 1987","1987-07-17"
"06/01/1996","1996-01-06"
"05/10/2012","2012-10-05"
"25/08/2006","2006-08-25"
"tháng 11 23 1992","1992-11-23"
"14/01/2008","2008-01-14"
"tháng 6 12 1972","1972-06-12"
"THÁNG 10 15 1977","1977-10-15"
"16 thg 2, 2010","2010-02-16"
"16 thg 11 1982","1982-11-16"
"3 thg 6, 1988","1988-06-03"
"10/01/1981","1981-01-10"
"tháng 2 27 1973","1973-02-27"
"15 tháng 5, 1987","1987-05-15"
"2 thg 9 1988","1988-09-02"
"11 tháng 9 1982","1982-09-11"
"30 thg 7, 2007","2007-07-30"
"4 tháng 5, 1995","1995-05-04"
"3 THÁNG 9, 1995","1995-09-03"
"2 tháng 12, 2000","2000-12-02"
"tháng 11 9 1999","1999-11-09"
"THỨ HAI, NGÀY 17 THÁNG 8 NĂM 1992","1992-08-17"
"19 thg 7, 1984","1984-07-19"
"Ngày 27 tháng 08 năm 1990","1990-08-27"
"20 thg 9 2013","2013-09-20"
"29 tháng 4, 1974","1974-04-29"
"THÁNG 9 13 1977","1977-09-13"
"13 thg 1 1971","1971-01-13"
"14 tháng 11 2011","2011-11-14"
"13 THÁNG 9 2009","2009-09-13"
"29/12/1980","1980-12-29"
"29 tháng 7, 2015","2015-07-29"
"ngày 24 tháng 03 năm 1975","1975-03-24"
"8 04 11","2011-04-08"
"ngày 28 tháng 02 năm 2008","2008-02-28"
"THÁNG 11 16, 1998","1998-11-16"
"tháng 6 27 2017","2017-06-27"
"18 tháng 7 2015","2015-07-18"
"12 thg 8 1986","1986-08-12"
"thứ bảy, ngày 25 tháng 9 năm 1993","1993-09-25"
"2 thg 2, 1990","1990-02-02"
"tháng 12 25, 1991","1991-12-25"
"11 thg 1, 2000","2000-01-11"
"5 THÁNG 3 1993","1993-03-05"
"19 THG 11, 2015","2015-11-19"
"6 thg 9 1983","1983-09-06"
"7 10 09","2009-10-07"
"27 thg 4 1995","1995-04-27"
"chủ nhật, ngày 15 tháng 4 năm 2018","2018-04-15"
"15 thg 5, 1977","1977-05-15"
"18 thg 4, 2017","2017-04-18"
"26 tháng 7, 1982","1982-07-26"
"17/06/1979","1979-06-17"
"18 thg 7, 2003","2003-07-18"
"22 tháng 5, 2017","2017-05-22"
"tháng 4 4 1976","1976-04-04"
"24 10 17","2017-10-24"
"4 THG 6, 1989","1989-06-04"
"27, thg 5 1976","1976-05-27"
"30 thg 9 2015","2015-09-30"
"08/09/1972","1972-09-08"
"tháng 10 18 1986","1986-10-18"
"Thứ Sáu, ngày 31 tháng 12 năm 1982","1982-12-31"
"01/09/1978","1978-09-01"
"07/06/1978","1978-06-07"
"3 thg 4, 1986","1986-04-03"
"05, thg 3 1978","1978-03-05"
"18 11 98","1998-11-18"
"03/06/1984","1984-06-03"
"tháng 9 7, 1985","1985-09-07"
"thứ tư, ngày 02 tháng 2 năm 2000","2000-02-02"
"28 THÁNG 5 1974","1974-05-28"
"23 tháng 6 1990","1990-06-23"
"25, thg 11 1976","1976-11-25"
"15 thg 6, 1991","1991-06-15"
"24 THG 7, 1973","1973-07-24"
"09, THG 11 2010","2010-11-09"
"14 tháng 9 2001","2001-09-14"
"05.12.90","1990-12-05"
"29 01 90","1990-01-29"
"8 THÁNG 11, 1991","1991-11-08"
"tháng 10 1, 1996","1996-10-01"
"29 thg 12, 1995","1995-12-29"
"Ngày 04 tháng 02 năm 1994","1994-02-04"
"11 thg 9, 2009","2009-09-11"
"14 tháng 6 2017","2017-06-14"
"28/07/1976","1976-07-28"
"2 THÁNG 12 1975","1975-12-02"
"27 thg 3, 1998","1998-03-27"
"17 thg 1 1982","1982-01-17"
"24 08 78","1978-08-24"
"5 06 97","1997-06-05"
"THÁNG 6 25, 2009","2009-06-25"
"30 thg 7, 2000","2000-07-30"
"1 tháng 3 1985","1985-03-01"
"11 tháng 11 2007","2007-11-11"
"13 thg 5, 2014","2014-05-13"
"6 tháng 9 1995","1995-09-06"
"05.07.78","1978-07-05"
"13 thg 12 1992","1992-12-13"
"thứ hai, ngày 07 tháng 5 năm 1984","1984-05-07"
"tháng 6 18, 2000","2000-06-18"
"6 THG 7 2008","2008-07-06"
"12 thg 1 2012","2012-01-12"
"thứ năm, ngày 01 tháng 12 năm 2016","2016-12-01"
"07/09/2013","2013-09-07"
"10 tháng 6 1970","1970-06-10"
"27, THG 12 2010","2010-12-27"
"28 THÁNG 2 1987","1987-02-28"
"17 THÁNG 7, 2000","2000-07-17"
"20 THG 12 1976","1976-12-20"
"31 tháng 12 1999","1999-12-31"
"tháng 11 11, 1970","1970-11-11"
"3 thg 1, 1984","1984-01-03"
"20 thg 8 2011","2011-08-20"
"10 thg 10 2011","2011-10-10"
"26/02/2015","2015-02-26"
"26 thg 2 1997","1997-02-26"
"tháng 1 11, 1992","1992-01-11"
"Thứ Bảy, ngày 30 tháng 9 năm 2000","2000-09-30"
"8 thg 12, 2014","2014-12-08"
"Ngày 02 tháng 08 năm 2010","2010-08-02"
"8 THG 2, 1976","1976-02-08"
"14/10/1983","1983-10-14"
"16.06.92","1992-06-16"
"Ngày 26 tháng 07 năm 2009","2009-07-26"
"tháng 12 24 2000","2000-12-24"
"Thứ Bảy, ngày 14 tháng 11 năm 1992","1992-11-14"
"24 thg 2, 2017","2017-02-24"
"3 02 90","1990-02-03"
"11 01 70","1970-01-11"
"24 THÁNG 10, 2014","2014-10-24"
"15, THG 4 1985","1985-04-15"
"30 thg 4, 1970","1970-04-30"
"2 tháng 4 2012","2012-04-02"
"11.03.77","1977-03-11"
"25 tháng 5, 1991","1991-05-25"
"29/03/2008","2008-03-29"
"22 tháng 8 2018","2018-08-22"
"18 11 93","1993-11-18"
"01, thg 5 1985","1985-05-01"
"29 06 11","2011-06-29"
"14 thg 6 2014","2014-06-14"
"21 thg 3 1984","1984-03-21"
"20 tháng 1 1977","1977-01-20"
"tháng 1 2 1992","1992-01-02"
"09, thg 10 1985","1985-10-09"
"02/05/1990","1990-05-02"
"tháng 11 18 2006","2006-11-18"
"01.05.94","1994-05-01"
"16 THG 11, 1983","1983-11-16"
"29, thg 4 1994","1994-04-29"
"8 thg 4, 2006","2006-04-08"
"23/10/1989","1989-10-23"
"22, thg 6 1995","1995-06-22"
"tháng 10 9 1986","1986-10-09"
"8 thg 4 2007","2007-04-08"
"24/09/2011","2011-09-24"
"tháng 8 29 1979","1979-08-29"
"22/07/1984","1984-07-22"
"Thứ Sáu, ngày 06 tháng 7 năm 2001","2001-07-06"
"THÁNG 7 7, 1983","1983-07-07"
"25.10.89","1989-10-25"
"Chủ Nhật, ngày 30 tháng 7 năm 2006","2006-07-30"
"12 tháng 6 2014","2014-06-12"
"24 thg 12 1985","1985-12-24"
"22 tháng 12 1970","1970-12-22"
"Ngày 19 tháng 12 năm 2000","2000-12-19"
"6 thg 6 1976","1976-06-06"
"8 THG 7, 2005","2005-07-08"
"11 tháng 4 2008","2008-04-11"
"13.07.13","2013-07-13"
"02.06.80","1980-06-02"
"08, thg 11 1992","1992-11-08"
"27.10.90","1990-10-27"
"30 tháng 11 1991","1991-11-30"
"30 thg 4, 2013","2013-04-30"
"26 THG 2, 1972","1972-02-26"
"2 thg 1 1973","1973-01-02"
"6 thg 7 1972","1972-07-06"
"tháng 6 28 2012","2012-06-28"
"08.01.98","1998-01-08"
"THÁNG 4 2, 2004","2004-04-02"
"18 tháng 11 2004","2004-11-18"
"27/11/1973","1973-11-27"
"tháng 8 17 1985","1985-08-17"
"28 tháng 1 1982","1982-01-28"
"THÁNG 7 9 2004","2004-07-09"
"09 THG 10 1982","1982-10-09"
"Thứ Tư, ngày 06 tháng 8 năm 1975","1975-08-06"
"30 thg 12 2000","2000-12-30"
"23, thg 6 2002","2002-06-23"
"08/04/1996","1996-04-08"
"26 08 05","2005-08-26"
"29 THÁNG 6, 1992","1992-06-29"
"Ngày 23 tháng 02 năm 2015","2015-02-23"
"13 11 83","1983-11-13"
"tháng 9 23 1980","1980-09-23"
"18 thg 10, 2008","2008-10-18"
"Ngày 21 tháng 04 năm 1998","1998-04-21"
"THÁNG 11 9, 2009","2009-11-09"
"17 thg 3 2008","2008-03-17"
"18 12 10","2010-12-18"
"5 09 91","1991-09-05"
"22 02 00","2000-02-22"
"03/10/2005","2005-10-03"
"14/09/1997","1997-09-14"
"tháng 3 10, 2005","2005-03-10"
"8 tháng 10 1991","1991-10-08"
"31 thg 12 1982","1982-12-31"
"THÁNG 6 4 1988","1988-06-04"
"tháng 10 11 1997","1997-10-11"
"4 thg 11, 1989","1989-11-04"
"6 tháng 10 1978","1978-10-06"
"09/12/2006","2006-12-09"
"28 thg 1, 1985","1985-01-28"
"ngày 20 tháng 11 năm 2011","2011-11-20"
"11/11/2005","2005-11-11"
"14 THÁNG 1 2012","2012-01-14"
"tháng 10 14, 1992","1992-10-14"
"tháng 9 20, 1976","1976-09-20"
"Ngày 18 tháng 03 năm 1971","1971-03-18"
"7 thg 2 1995","1995-02-07"
"28 THG 7, 2006","2006-07-28"
"tháng 4 1, 2014","2014-04-01"
"16 tháng 4, 2012","2012-04-16"
"16 thg 2 1982","1982-02-16"
"07 thg 12 1979","1979-12-07"
"16 tháng 12, 2016","2016-12-16"
"16 tháng 10 2007","2007-10-16"
"tháng 12 21, 1973","1973-12-21"
"11 THÁNG 7, 1982","1982-07-11"
"tháng 11 11 2011","2011-11-11"
"09 thg 2 1985","1985-02-09"
"THÁNG 2 9, 1995","1995-02-09"
"22 thg 12, 1988","1988-12-22"
"17 THÁNG 2 2016","2016-02-17"
"29/07/1971","1971-07-29"
"1 tháng 3 1981","1981-03-01"
"14 thg 7, 2007","2007-07-14"
"2 tháng 2, 2015","2015-02-02"
"10 thg 8, 2005","2005-08-10"
"30 thg 7, 1981","1981-07-30"
"Thứ Ba, ngày 15 tháng 1 năm 1980","1980-01-15"
"NGÀY 18 THÁNG 10 NĂM 2015","2015-10-18"
"2 THG 10, 1975","1975-10-02"
"22 08 02","2002-08-22"
"31 thg 3 1983","1983-03-31"
"2 tháng 12, 2003","2003-12-02"
"23 01 16","2016-01-23"
"16, thg 2 2017","2017-02-16"
"tháng 10 9 2011","2011-10-09"
"1 thg 4, 1995","1995-04-01"
"21 THÁNG 8, 1980","1980-08-21"
"26 05 82","1982-05-26"
"13 thg 6, 2014","2014-06-13"
"chủ nhật, ngày 07 tháng 9 năm 1986","1986-09-07"
"thứ ba, ngày 29 tháng 12 năm 2009","2009-12-29"
"14 THÁNG 10, 1979","1979-10-14"
"tháng 3 23 2003","2003-03-23"
"21 08 16","2016-08-21"
"13 tháng 8, 1986","1986-08-13"
"05 THG 6 1982","1982-06-05"
"8 thg 12, 2015","2015-12-08"
"1 thg 11 2007","2007-11-01"
"12.07.86","1986-07-12"
"13 thg 7 2001","2001-07-13"
"8 thg 5, 1991","1991-05-08"
"26.04.94","1994-04-26"
"17 thg 11, 1971","1971-11-17"
"04/06/2012","2012-06-04"
"25 THG 3 2015","2015-03-25"
"17 thg 12 1982","1982-12-17"
"12 thg 3 1988","1988-03-12"
"02.03.07","2007-03-02"
"tháng 7 17 1990","1990-07-17"
"14.08.91","1991-08-14"
"13 thg 9, 1975","1975-09-13"
"7 THÁNG 4 2004","2004-04-07"
"THÁNG 3 11 1999","1999-03-11"
"THỨ SÁU, NGÀY 21 THÁNG 3 NĂM 2008","2008-03-21"
"Thứ Bảy, ngày 05 tháng 7 năm 1975","1975-07-05"
"22 tháng 7 2015","2015-07-22"
"04 thg 12 2010","2010-12-04"
"20 thg 3 2015","2015-03-20"
"27 05 05","2005-05-27"
"8 THÁNG 5 1998","1998-05-08"
"26 tháng 8, 1981","1981-08-26"
"28.12.73","1973-12-28"
"1 04 85","1985-04-01"
"12 thg 4 1983","1983-04-12"
"13 tháng 12 2016","2016-12-13"
"tháng 7 11 2008","2008-07-11"
"tháng 11 20, 1982","1982-11-20"
"20 tháng 12 1970","1970-12-20"
"6 thg 1 2011","2011-01-06"
"23/08/2007","2007-08-23"
"20 tháng 3 2001","2001-03-20"
"14.01.99","1999-01-14"
"16 04 17","2017-04-16"
"Ngày 10 tháng 09 năm 1994","1994-09-10"
"THÁNG 9 29, 1974","1974-09-29"
"05, thg 6 2018","2018-06-05"
"07.05.88","1988-05-07"
"8 02 02","2002-02-08"
"16 tháng 8, 1998","1998-08-16"
"24 thg 5, 1980","1980-05-24"
"23, thg 7 1982","1982-07-23"
"25, thg 1 1991","1991-01-25"
"THÁNG 10 14 1998","1998-10-14"
"7 THÁNG 12 1992","1992-12-07"
"15 thg 9, 1985","1985-09-15"
"10 04 88","1988-04-10"
"10 THG 8 2017","2017-08-10"
"11 thg 5, 1983","1983-05-11"
"Ngày 30 tháng 10 năm 2017","2017-10-30"
"04 thg 12 2004","2004-12-04"
"2 thg 8, 2009","2009-08-02"
"21 tháng 6, 1981","1981-06-21"
"18 tháng 9 2001","2001-09-18"
"08 thg 9 2003","2003-09-08"
"23 thg 5, 1974","1974-05-23"
"2 tháng 11 2013","2013-11-02"
"6 08 01","2001-08-06"
"Ngày 07 tháng 05 năm 1983","1983-05-07"
"15 thg 8 1981","1981-08-15"
"8 thg 4, 1984","1984-04-08"
"17 thg 6, 1991","1991-06-17"
"13 07 02","2002-07-13"
"29/08/1988","1988-08-29"
"15.02.00","2000-02-15"
"13 03 81","1981-03-13"
"NGÀY 06 THÁNG 10 NĂM 2017","2017-10-06"
"1 04 77","1977-04-01"
"24 thg 3, 2008","2008-03-24"
"20 thg 10, 1970","1970-10-20"
"3 thg 8 1989","1989-08-03"
"15 tháng 12 1998","1998-12-15"
"20, THG 8 1986","1986-08-20"
"Ngày 20 tháng 01 năm 1973","1973-01-20"
"9 tháng 11 1974","1974-11-09"
"15.11.92","1992-11-15"
"tháng 4 7 1977","1977-04-07"
"20 tháng 8 1979","1979-08-20"
"02, thg 1 1970","1970-01-02"
"25.06.99","1999-06-25"
"30 THG 8, 1975","1975-08-30"
"22 09 83","1983-09-22"
"2 01 16","2016-01-02"
"Thứ Tư, ngày 28 tháng 4 năm 1982","1982-04-28"
"tháng 6 17, 1987","1987-06-17"
"26 tháng 12 1979","1979-12-26"
"12.08.97","1997-08-12"
"THỨ SÁU, NGÀY 20 THÁNG 6 NĂM 1986","1986-06-20"
"2 THÁNG 7, 1994","1994-07-02"
"27 tháng 6 1991","1991-06-27"
"24 05 08","2008-05-24"
"THỨ BA, NGÀY 01 THÁNG 7 NĂM 1997","1997-07-01"
"20 tháng 5 1991","1991-05-20"
"06 thg 1 1992","1992-01-06"
"24.04.77","1977-04-24"
"3 thg 5, 1980","1980-05-03"
"21 thg 5, 1979","1979-05-21"
"thứ sáu, ngày 08 tháng 5 năm 1987","1987-05-08"
"thứ hai, ngày 07 tháng 5 năm 1973","1973-05-07"
"tháng 10 12 1997","1997-10-12"
"13 THÁNG 11 1976","1976-11-13"
"24/10/1980","1980-10-24"
"5 tháng 8 1993","1993-08-05"
"31 THÁNG 1 1973","1973-01-31"
"02, thg 7 2011","2011-07-02"
"11 tháng 4 1996","1996-04-11"
"15 tháng 10, 1970","1970-10-15"
"28, thg 1 1982","1982-01-28"
"21, thg 2 1994","1994-02-21"
"19 THÁNG 2, 1983","1983-02-19"
"10, thg 1 2003","2003-01-10"
"14/01/2018","2018-01-14"
"thứ ba, ngày 15 tháng 4 năm 1980","1980-04-15"
"28/04/1999","1999-04-28"
"16 thg 5 2014","2014-05-16"
"15 tháng 11 2013","2013-11-15"
"30 THG 1 1991","1991-01-30"
"30 thg 7 2006","2006-07-30"
"20 thg 1 2007","2007-01-20"
"THÁNG 7 15 1973","1973-07-15"
"26 thg 10, 1998","1998-10-26"
"7 12 87","1987-12-07"
"24 tháng 10 2012","2012-10-24"
"06, thg 12 1973","1973-12-06"
"23 THG 6, 2017","2017-06-23"
"10, thg 8 1999","1999-08-10"
"7 thg 6 2004","2004-06-07"
"22 thg 10 2010","2010-10-22"
"09, thg 4 2013","2013-04-09"
"28 thg 4, 2002","2002-04-28"
"19 THG 1, 1979","1979-01-19"
"12 thg 2 1977","1977-02-12"
"26/03/1974","1974-03-26"
"THÁNG 4 7, 1983","1983-04-07"
"5 tháng 3 1974","1974-03-05"
"25 THG 2, 1975","1975-02-25"
"Ngày 06 tháng 10 năm 2000","2000-10-06"
"29, thg 7 1971","1971-07-29"
"thứ ba, ngày 28 tháng 2 năm 2012","2012-02-28"
"26, thg 8 1986","1986-08-26"
"3 tháng 12, 1977","1977-12-03"
"4 tháng 1 1973","1973-01-04"
"07.04.84","1984-04-07"
"tháng 2 25 1983","1983-02-25"
"7 thg 8 1983","1983-08-07"
"THÁNG 1 16 1987","1987-01-16"
"THÁNG 1 5 1978","1978-01-05"
"NGÀY 01 THÁNG 10 NĂM 2018","2018-10-01"
"15 thg 11, 1979","1979-11-15"
"02, thg 7 2003","2003-07-02"
"tháng 10 13, 1972","1972-10-13"
"01 THG 6 1998","1998-06-01"
"THÁNG 5 29 1986","1986-05-29"
"28, thg 2 1971","1971-02-28"
"15 thg 7, 1981","1981-07-15"
"12, thg 12 1970","1970-12-12"
"15.08.12","2012-08-15"
"7 THG 9, 1977","1977-09-07"
"6 tháng 10 1978","1978-10-06"
"12.02.70","1970-02-12"
"4 09 88","1988-09-04"
"31 THÁNG 10 1978","1978-10-31"
"Thứ Ba, ngày 27 tháng 1 năm 1998","1998-01-27"
"30, thg 4 1983","1983-04-30"
"23 tháng 12 2009","2009-12-23"
"27, thg 9 1981","1981-09-27"
"Ngày 10 tháng 09 năm 1971","1971-09-10"
"01, thg 9 1989","1989-09-01"
"16 THÁNG 7 2003","2003-07-16"
"14 thg 11 1994","1994-11-14"
"tháng 6 18 1971","1971-06-18"
"31/08/2010","2010-08-31"
"8 THÁNG 10 2015","2015-10-08"
"Ngày 12 tháng 04 năm 1972","1972-04-12"
"12.12.15","2015-12-12"
"tháng 3 3, 1978","1978-03-03"
"7 tháng 9 2012","2012-09-07"
"ngày 04 tháng 11 năm 1972","1972-11-04"
"25 tháng 1, 1983","1983-01-25"
"tháng 8 1, 1997","1997-08-01"
"6 tháng 6 1996","1996-06-06"
"6 thg 1, 2003","2003-01-06"
"12 thg 9 1981","1981-09-12"
"6 07 15","2015-07-06"
"tháng 7 30 2004","2004-07-30"
"THỨ BA, NGÀY 22 THÁNG 4 NĂM 1980","1980-04-22"
"24 tháng 5, 1970","1970-05-24"
"tháng 2 1, 1978","1978-02-01"
"2 08 76","1976-08-02"
"NGÀY 23 THÁNG 12 NĂM 1982","1982-12-23"
"19 12 11","2011-12-19"
"25/10/1984","1984-10-25"
"thứ bảy, ngày 01 tháng 5 năm 1993","1993-05-01"
"04 thg 3 1993","1993-03-04"
"22 tháng 3, 1975","1975-03-22"
"16.09.80","1980-09-16"
"10 tháng 4 1992","1992-04-10"
"11 THG 1, 1998","1998-01-11"
"29 thg 4, 1990","1990-04-29"
"THỨ TƯ, NGÀY 10 THÁNG 7 NĂM 2002","2002-07-10"
"22 thg 8 1977","1977-08-22"
"09/11/1972","1972-11-09"
"Thứ Sáu, ngày 31 tháng 7 năm 1970","1970-07-31"
"26 thg 4 1983","1983-04-26"
"06 THG 9 2002","2002-09-06"
"7 thg 4, 2006","2006-04-07"
"12 thg 10, 2006","2006-10-12"
"Thứ Ba, ngày 08 tháng 8 năm 1978","1978-08-08"
"23 THÁNG 11 1980","1980-11-23"
"THÁNG 2 6, 2014","2014-02-06"
"22.05.15","2015-05-22"
"19/06/2007","2007-06-19"
"15 THÁNG 1, 1981","1981-01-15"
"19 THÁNG 6 2007","2007-06-19"
"tháng 2 24 2009","2009-02-24"
"20 THÁNG 5 2016","2016-05-20"
"NGÀY 06 THÁNG 03 NĂM 2018","2018-03-06"
"15 tháng 9 2010","2010-09-15"
"29 tháng 3 1991","1991-03-29"
"09 THG 8 1999","1999-08-09"
"20, thg 4 2008","2008-04-20"
"25 THÁNG 12 2009","2009-12-25"
"19 thg 4 2003","2003-04-19"
"thứ bảy, ngày 02 tháng 5 năm 1970","1970-05-02"
"21 tháng 8 1998","1998-08-21"
"20 07 86","1986-07-20"
"tháng 6 15, 1970","1970-06-15"
"29 tháng 5 2006","2006-05-29"
"THÁNG 6 21 1991","1991-06-21"
"02.01.97","1997-01-02"
"27 THÁNG 9, 1989","1989-09-27"
"7 tháng 11, 2005","2005-11-07"
"15 thg 1 2006","2006-01-15"
"tháng 10 21, 1996","1996-10-21"
"4 12 95","1995-12-04"
"08, thg 10 1973","1973-10-08"
"thứ tư, ngày 26 tháng 7 năm 1995","1995-07-26"
"17 THG 3, 1990","1990-03-17"
"15 thg 12, 2005","2005-12-15"
"11 THÁNG 5 2018","2018-05-11"
"11 05 71","1971-05-11"
"14 THG 6, 1985","1985-06-14"
"27 THG 1 1998","1998-01-27"
"17 thg 5, 2012","2012-05-17"
"10/09/2003","2003-09-10"
"tháng 9 16 2013","2013-09-16"
"tháng 12 21 2003","2003-12-21"
"9 tháng 1 1998","1998-01-09"
"tháng 7 27 1970","1970-07-27"
"30 05 83","1983-05-30"
"25 thg 12, 1978","1978-12-25"
"28 tháng 10, 1982","1982-10-28"
"22 tháng 4, 2018","2018-04-22"
"5 10 84","1984-10-05"
"14 tháng 7 1970","1970-07-14"
"8 tháng 10 1979","1979-10-08"
"12 THG 4, 2001","2001-04-12"
"15/05/1970","1970-05-15"
"THÁNG 5 23 1994","1994-05-23"
"22, thg 12 1988","1988-12-22"
"29 tháng 4 2010","2010-04-29"
"24 thg 9, 1989","1989-09-24"
"12 thg 3, 1981","1981-03-12"
"Ngày 07 tháng 07 năm 1991","1991-07-07"
"17 tháng 5 1999","1999-05-17"
"4 tháng 4 2005","2005-04-04"
"11 thg 1, 2013","2013-01-11"
"Thứ Ba, ngày 31 tháng 1 năm 1984","1984-01-31"
"31.05.77","1977-05-31"
"29 THÁNG 6 1989","1989-06-29"
"tháng 12 16 1973","1973-12-16"
"19 thg 9 2001","2001-09-19"
"9 THG 1, 2005","2005-01-09"
"15 thg 12 2008","2008-12-15"
"17 THG 10, 1995","1995-10-17"
"tháng 5 14, 2018","2018-05-14"
"01.07.88","1988-07-01"
"tháng 1 4 1988","1988-01-04"
"04/07/1976","1976-07-04"
"19 tháng 3 2008","2008-03-19"
"4 tháng 6, 1979","1979-06-04"
"20 tháng 9, 1993","1993-09-20"
"THỨ HAI, NGÀY 19 THÁNG 4 NĂM 2004","2004-04-19"
"18 THG 4 2000","2000-04-18"
"THÁNG 1 2, 2006","2006-01-02"
"21 thg 9 1984","1984-09-21"
"14 tháng 10 2016","2016-10-14"
"8 thg 2, 1988","1988-02-08"
"09 thg 2 2001","2001-02-09"
"28 THÁNG 12, 1971","1971-12-28"
"3 tháng 8 2004","2004-08-03"
"NGÀY 09 THÁNG 03 NĂM 1988","1988-03-09"
"3 thg 6, 1983","1983-06-03"
"22, thg 5 1970","1970-05-22"
"6 THÁNG 1, 1988","1988-01-06"
"6 thg 9 1982","1982-09-06"
"THÁNG 5 9 1996","1996-05-09"
"tháng 7 14, 2017","2017-07-14"
"NGÀY 01 THÁNG 04 NĂM 2016","2016-04-01"
"29 thg 4, 1973","1973-04-29"
"21 tháng 12, 1989","1989-12-21"
"09/03/2000","2000-03-09"
"THÁNG 12 17, 1976","1976-12-17"
"20 thg 6, 1985","1985-06-20"
"8 01 92","1992-01-08"
"19 tháng 9, 1978","1978-09-19"
"Ngày 20 tháng 04 năm 2016","2016-04-20"
"tháng 10 24, 1981","1981-10-24"
"25 tháng 7 1988","1988-07-25"
"9 01 72","1972-01-09"
"28 04 87","1987-04-28"
"Thứ Hai, ngày 19 tháng 1 năm 1970","1970-01-19"
"19 tháng 12 1976","1976-12-19"
"07.03.09","2009-03-07"
"THÁNG 3 31 1984","1984-03-31"
"tháng 11 4, 2004","2004-11-04"
"tháng 6 23, 2012","2012-06-23"
"1 thg 8, 2003","2003-08-01"
"24 thg 6 1978","1978-06-24"
"3 THÁNG 10 2016","2016-10-03"
"24 THG 12, 1982","1982-12-24"
"20 thg 8 1977","1977-08-20"
"25 thg 3 1972","1972-03-25"
"21 tháng 7 2015","2015-07-21"
"15 08 11","2011-08-15"
"Thứ Bảy, ngày 16 tháng 2 năm 2008","2008-02-16"
"Ngày 08 tháng 02 năm 1972","1972-02-08"
"02, thg 7 2014","2014-07-02"
"4 thg 6 1980","1980-06-04"
"29, THG 12 1978","1978-12-29"
"tháng 6 30 2013","2013-06-30"
"12 THÁNG 11, 2001","2001-11-12"
"THÁNG 4 24, 2018","2018-04-24"
"14 thg 7 2006","2006-07-14"
"10 tháng 5, 2006","2006-05-10"
"14 thg 7 2012","2012-07-14"
"20, thg 12 1971","1971-12-20"
"20 thg 6, 1993","1993-06-20"
"tháng 5 14, 1973","1973-05-14"
"25 thg 9 1983","1983-09-25"
"6 tháng 5 2016","2016-05-06"
"11.04.92","1992-04-11"
"15 thg 4, 1989","1989-04-15"
"19 THG 1 1981","1981-01-19"
"5 THG 12, 1986","1986-12-05"
"14.01.08","2008-01-14"
"05/11/1972","1972-11-05"
"ngày 07 tháng 02 năm 2013","2013-02-07"
"21/05/1996","1996-05-21"
"13 tháng 5 1977","1977-05-13"
"24 thg 4, 1979","1979-04-24"
"23/07/2014","2014-07-23"
"23 thg 12, 1981","1981-12-23"
"05, thg 4 1980","1980-04-05"
"ngày 15 tháng 09 năm 1995","1995-09-15"
"04.09.83","1983-09-04"
"11 thg 10, 2010","2010-10-11"
"17.02.78","1978-02-17"
"tháng 4 14, 2003","2003-04-14"
"22 02 00","2000-02-22"
"tháng 3 20 2001","2001-03-20"
"07 thg 2 2015","2015-02-07"
"24 02 77","1977-02-24"
"26/09/2000","2000-09-26"
"17, thg 10 1997","1997-10-17"
"4 THÁNG 10, 2000","2000-10-04"
"ngày 24 tháng 01 năm 1984","1984-01-24"
"tháng 1 7, 2005","2005-01-07"
"12 tháng 2, 2014","2014-02-12"
"24 thg 2 1985","1985-02-24"
"24 10 99","1999-10-24"
"06, THG 12 1986","1986-12-06"
"2 thg 2, 1977","1977-02-02"
"22 THÁNG 1 1971","1971-01-22"
"24 thg 3 2013","2013-03-24"
"17, thg 3 1981","1981-03-17"
"8 thg 3 1994","1994-03-08"
"14 tháng 12, 1979","1979-12-14"
"9 tháng 6 1979","1979-06-09"
"15 06 83","1983-06-15"
"18.03.86","1986-03-18"
"27.02.87","1987-02-27"
"15/01/2018","2018-01-15"
"12 tháng 1 1976","1976-01-12"
"14/02/2000","2000-02-14"
"12 tháng 8 2000","2000-08-12"
"Thứ Năm, ngày 26 tháng 4 năm 2007","2007-04-26"
"17 thg 10, 1981","1981-10-17"
"28 thg 6 2014","2014-06-28"
"18 thg 7, 2004","2004-07-18"
"11 tháng 6 2017","2017-06-11"
"17 THÁNG 6 1975","1975-06-17"
"THÁNG 5 3, 1991","1991-05-03"
"tháng 1 20, 1993","1993-01-20"
"03/03/1974","1974-03-03"
"27 thg 8 2012","2012-08-27"
"THÁNG 6 26 2013","2013-06-26"
"4 THG 7, 1979","1979-07-04"
"27 tháng 2 1976","1976-02-27"
"12 THG 7, 2011","2011-07-12"
"27, thg 8 2010","2010-08-27"
"THÁNG 6 5 1990","1990-06-05"
"tháng 3 29 1974","1974-03-29"
"04/12/2016","2016-12-04"
"tháng 9 2 2010","2010-09-02"
"17 THÁNG 2 1993","1993-02-17"
"24 THÁNG 9 2002","2002-09-24"
"30.09.18","2018-09-30"
"NGÀY 04 THÁNG 03 NĂM 2000","2000-03-04"
"08.08.87","1987-08-08"
"19/09/2009","2009-09-19"
"12/11/1982","1982-11-12"
"30 thg 7, 2015","2015-07-30"
"tháng 8 27, 1983","1983-08-27"
"1 thg 11 2005","2005-11-01"
"thứ ba, ngày 24 tháng 4 năm 2007","2007-04-24"
"29 thg 6, 2008","2008-06-29"
"11.08.11","2011-08-11"
"05.03.72","1972-03-05"
"tháng 9 5 2015","2015-09-05"
"18 THÁNG 2, 1989","1989-02-18"
"Thứ Ba, ngày 01 tháng 12 năm 1970","1970-12-01"
"6 tháng 7 1992","1992-07-06"
"tháng 5 12, 1970","1970-05-12"
"14, thg 12 1977","1977-12-14"
"31.12.85","1985-12-31"
"30 tháng 12, 1989","1989-12-30"
"22 thg 4, 1994","1994-04-22"
"09 thg 5 1985","1985-05-09"
"6 thg 1, 2007","2007-01-06"
"20 tháng 5, 1994","1994-05-20"
"29, thg 12 1981","1981-12-29"
"ngày 09 tháng 05 năm 2017","2017-05-09"
"03 THG 4 1998","1998-04-03"
"7 tháng 5 1970","1970-05-07"
"4 tháng 2 1975","1975-02-04"
"25 02 03","2003-02-25"
"Ngày 31 tháng 08 năm 2016","2016-08-31"
"2 tháng 7, 2015","2015-07-02"
"31 THÁNG 3 1985","1985-03-31"
"12 THÁNG 1 1994","1994-01-12"
"21 12 98","1998-12-21"
"tháng 4 8 2000","2000-04-08"
"10 tháng 10 2001","2001-10-10"
"19 thg 8, 1994","1994-08-19"
"tháng 12 26 1982","1982-12-26"
"11 THÁNG 3 1986","1986-03-11"
"10 thg 8 1971","1971-08-10"
"22.12.70","1970-12-22"
"Ngày 09 tháng 04 năm 1979","1979-04-09"
"18 THÁNG 8 2008","2008-08-18"
"tháng 3 4 1982","1982-03-04"
"27 thg 10 2014","2014-10-27"
"24 thg 8, 1985","1985-08-24"
"10, thg 4 2011","2011-04-10"
"24 thg 11, 1981","1981-11-24"
"23 tháng 3 2006","2006-03-23"
"16 thg 12 2017","2017-12-16"
"18 tháng 3, 2017","2017-03-18"
"31.12.12","2012-12-31"
"10 tháng 11, 1979","1979-11-10"
"20 tháng 2, 1982","1982-02-20"
"14/06/2016","2016-06-14"
"31.07.81","1981-07-31"
"24 thg 10 1989","1989-10-24"
"08, thg 9 2003","2003-09-08"
"20 tháng 6 1978","1978-06-20"
"27 06 02","2002-06-27"
"THÁNG 4 13 1998","1998-04-13"
"20 THÁNG 9 2009","2009-09-20"
"13 thg 8 2005","2005-08-13"
"7 tháng 3, 1988","1988-03-07"
"25 thg 6 2007","2007-06-25"
"30, thg 1 2017","2017-01-30"
"19 THÁNG 8, 1992","1992-08-19"
"11.04.88","1988-04-11"
"8 tháng 1, 1977","1977-01-08"
"1 THG 9 1997","1997-09-01"
"Thứ Sáu, ngày 17 tháng 2 năm 2006","2006-02-17"
"22 thg 9 1981","1981-09-22"
"13 THG 7 2017","2017-07-13"
"THÁNG 4 19 1991","1991-04-19"
"19 12 11","2011-12-19"
"tháng 3 26, 2012","2012-03-26"
"Thứ Năm, ngày 21 tháng 4 năm 2011","2011-04-21"
"26 THÁNG 9 2005","2005-09-26"
"16 THÁNG 1, 1984","1984-01-16"
"23 tháng 7, 1989","1989-07-23"
"30 03 09","2009-03-30"
"ngày 17 tháng 10 năm 2012","2012-10-17"
"18 thg 7 1978","1978-07-18"
"tháng 2 24, 1990","1990-02-24"
"19 thg 7, 1989","1989-07-19"
"THỨ NĂM, NGÀY 03 THÁNG 11 NĂM 1988","1988-11-03"
"10 tháng 2 1993","1993-02-10"
"1 THÁNG 12 2014","2014-12-01"
"13 THÁNG 3 2013","2013-03-13"
"6 thg 10, 1999","1999-10-06"
"02, thg 12 1995","1995-12-02"
"12 thg 4 2003","2003-04-12"
"25.08.80","1980-08-25"
"18.11.90","1990-11-18"
"31/07/2013","2013-07-31"
"Thứ Bảy, ngày 05 tháng 1 năm 2008","2008-01-05"
"28, THG 4 2003","2003-04-28"
"29 tháng 9, 2016","2016-09-29"
"ngày 16 tháng 07 năm 1979","1979-07-16"
"1 07 14","2014-07-01"
"tháng 4 21, 1983","1983-04-21"
"22 thg 3 1996","1996-03-22"
"17 thg 11 2014","2014-11-17"
"11 THG 8, 1991","1991-08-11"
"tháng 3 16 1988","1988-03-16"
"12/11/1990","1990-11-12"
"27 02 94","1994-02-27"
"08 thg 3 2006","2006-03-08"
"9 tháng 10, 2000","2000-10-09"
"30 06 11","2011-06-30"
"19 tháng 1 1971","1971-01-19"
"09/08/1999","1999-08-09"
"THÁNG 10 8, 1983","1983-10-08"
"THÁNG 9 2, 2015","2015-09-02"
"10, thg 9 2012","2012-09-10"
"28 THG 4, 1977","1977-04-28"
"tháng 2 26, 2015","2015-02-26"
"25 tháng 1 1995","1995-01-25"
"06/09/2008","2008-09-06"
"22 THG 1 1994","1994-01-22"
"25 thg 6 2003","2003-06-25"
"THỨ TƯ, NGÀY 14 THÁNG 5 NĂM 1986","1986-05-14"
"ngày 08 tháng 08 năm 1976","1976-08-08"
"18 THÁNG 10 1999","1999-10-18"
"10 thg 3, 2015","2015-03-10"
"28 tháng 1 1986","1986-01-28"
"14 tháng 10 1991","1991-10-14"
"29 tháng 4 2003","2003-04-29"
"Ngày 20 tháng 07 năm 1997","1997-07-20"
"24 tháng 11 1988","1988-11-24"
"31 thg 8 1987","1987-08-31"
"Thứ Hai, ngày 27 tháng 3 năm 1972","1972-03-27"
"18 thg 2, 1971","1971-02-18"
"NGÀY 05 THÁNG 03 NĂM 1975","1975-03-05"
"10 thg 12 1996","1996-12-10"
"THỨ TƯ, NGÀY 10 THÁNG 7 NĂM 1996","1996-07-10"
"Ngày 18 tháng 04 năm 1980","1980-04-18"
"16 thg 4, 1974","1974-04-16"
"08, THG 10 2000","2000-10-08"
"07/03/1998","1998-03-07"
"15 thg 9, 1988","1988-09-15"
"30, thg 3 2005","2005-03-30"
"04, thg 10 2012","2012-10-04"
"15 05 09","2009-05-15"
"Ngày 07 tháng 01 năm 1971","1971-01-07"
"Chủ Nhật, ngày 08 tháng 9 năm 2013","2013-09-08"
"3 THÁNG 7, 2006","2006-07-03"
"20.02.83","1983-02-20"
"tháng 1 5, 1984","1984-01-05"
"Ngày 19 tháng 04 năm 2005","2005-04-19"
"15.12.81","1981-12-15"
"22, thg 1 2014","2014-01-22"
"13/09/1986","1986-09-13"
"7 tháng 4 1979","1979-04-07"
"29 THG 11, 2016","2016-11-29"
"16 THÁNG 8, 1986","1986-08-16"
"THỨ HAI, NGÀY 10 THÁNG 4 NĂM 2000","2000-04-10"
"24 tháng 5, 2010","2010-05-24"
"25 tháng 12 1989","1989-12-25"
"Thứ Ba, ngày 08 tháng 2 năm 2011","2011-02-08"
"19 thg 2, 1988","1988-02-19"
"Thứ Ba, ngày 26 tháng 2 năm 1974","1974-02-26"
"THỨ SÁU, NGÀY 13 THÁNG 1 NĂM 1978","1978-01-13"
"tháng 1 14 2014","2014-01-14"
"Thứ Bảy, ngày 27 tháng 7 năm 2002","2002-07-27"
"28/09/1994","1994-09-28"
"17 tháng 1 1984","1984-01-17"
"21 THÁNG 12, 1981","1981-12-21"
"23 thg 4, 1986","1986-04-23"
"Ngày 02 tháng 03 năm 1998","1998-03-02"
"tháng 3 6, 1987","1987-03-06"
"THÁNG 1 24 2005","2005-01-24"
"16 tháng 3 1976","1976-03-16"
"05.03.80","1980-03-05"
"THÁNG 11 13 2016","2016-11-13"
"tháng 4 15 2003","2003-04-15"
"24 tháng 5 1979","1979-05-24"
"13/04/2008","2008-04-13"
"30, thg 6 2007","2007-06-30"
"6 thg 12, 1992","1992-12-06"
"Thứ Sáu, ngày 12 tháng 10 năm 2012","2012-10-12"
"tháng 2 9 1986","1986-02-09"
"NGÀY 13 THÁNG 05 NĂM 1988","1988-05-13"
"27 01 86","1986-01-27"
"12 02 78","1978-02-12"
"17 thg 5 2013","2013-05-17"
"28 thg 3, 1974","1974-03-28"
"5 01 03","2003-01-05"
"4 tháng 8, 1991","1991-08-04"
"THÁNG 2 24, 2003","2003-02-24"
"04 thg 7 2012","2012-07-04"
"THÁNG 7 19, 2014","2014-07-19"
"tháng 6 21 1976","1976-06-21"
"25 thg 8 2010","2010-08-25"
"28 THG 8, 2011","2011-08-28"
"20 THG 11 1975","1975-11-20"
"Ngày 15 tháng 12 năm 2010","2010-12-15"
"26, THG 6 2013","2013-06-26"
"tháng 4 18 2016","2016-04-18"
"17 tháng 7, 1975","1975-07-17"
"NGÀY 19 THÁNG 09 NĂM 2014","2014-09-19"
"20 THG 10, 1975","1975-10-20"
"16 THÁNG 4 2014","2014-04-16"
"tháng 6 24, 2010","2010-06-24"
"23 THÁNG 6 2017","2017-06-23"
"18 thg 2 1974","1974-02-18"
"ngày 24 tháng 05 năm 2012","2012-05-24"
"08 thg 6 1970","1970-06-08"
"19, thg 10 1976","1976-10-19"
"06 THG 9 1990","1990-09-06"
"THÁNG 2 11 1973","1973-02-11"
"tháng 11 10 1993","1993-11-10"
"26 THÁNG 3 1987","1987-03-26"
"Thứ Năm, ngày 01 tháng 10 năm 2015","2015-10-01"
"23/01/1970","1970-01-23"
"01.12.88","1988-12-01"
"08.05.80","1980-05-08"
"28, thg 11 2012","2012-11-28"
"THÁNG 4 16 1975","1975-04-16"
"Chủ Nhật, ngày 28 tháng 1 năm 2007","2007-01-28"
"24 THG 10 1994","1994-10-24"
"07, thg 1 1977","1977-01-07"
"Ngày 22 tháng 03 năm 2014","2014-03-22"
"2 thg 8 1999","1999-08-02"
"18 tháng 5, 1977","1977-05-18"
